"UserId","Review Text","Rating","Time","Reviews Count","Followers Count","Photos Count"
"637429","Cafe De Loco is not just a Cafe; its a Huge relief for pet-parents who have little choice but to leave/keep their pets in a closed flat or room, most of the days. Hats off to Hemant and Roochira for coming up with this concept of providing not just an ideal play-space for our pets but also give a lot of love and care for those using the pet-daycare facility. Yes, you heard it right; they have a pet-daycare facility from 9AM to 5PM (Mgmt please correct me if I am wrong) and at around 300/400 per day, its a Great facility to have for those who want to leave their pets in an loving and affectionate place while away for a few hours. My puppy always enjoys the place to the fullest and has learned a lot to socialize with other dogs only because of this place. Hemant, Roochira and the rest of their staff treat each pet as their own. They also keep a lot of rescued puppies and try their best to give them a new lease of life by hosting adoption drives, all at their own cost. Very few human beings care so much about abandoned pups, these days. Its a treat to go there and play with the cuties all day long; I wish I had enough space in my house to adopt them all.As far as food is concerned, I have tried very few of the dishes but the Cappuccino deserves special mention. Roochira makes a killer Cappuccino; its one of the best I have ever had; although I usually don't like milk in my coffee. Their sandwiches are pretty good. Only item on my checklist, is to try their BBQ, some day, as it takes some pre-planning and advance notice for preparation.Overall, a boon for pet-owners and pet-lovers and I request all pet-owners to patronize this place as much as possible to keep the good work going!",5,"2018-03-27 18:47:12",20,118,0
"15562307","Probably the only truly ""Pet-friendly"" place in Hyderabad. Good food , good vibes and a great place for your pets. People handing the place are doing a great job",5,"2018-03-24 16:10:36",25,59,0
"146810","Awesome place. Ruchira is extremely meticulous and her perfection for details is commendable. Don't miss this place. One of those places which Hyderabad always needed.",5,"2018-03-08 18:48:26",2,1,0
"29271517","One of the best place in hyderabad to hangout if u a dog lover ❤❤
Food Is good bt the main intention of visiting the place is only for dogs
I appreciate their love over dogs❤❤",4,"2018-03-08 14:02:55",16,121,0
"49606313","This place is a treat not only to you but to your pet also.. Yes this place is for dogs and dog owners who can find time to take their dogs out for some evening snacks.. to celebrate their birthdays .. Yes you heard it right!! This place is a restaurant for your pet.. those daily boring pedigree and drools with not so tasty raw meat or egg,, this place will turn on the taste buds of your pet dog..
Located in the hidden land near royal enfield service station on gachibowlii road..this place doesn't look like a restaurant from outside.. with its sign board you would still not be sure that it's a dog restautant..
It's a treat for dog lovers as you can play and hang around with some lovely pet dogs and talk to their owners.. simultaneously you can grab something quick..
Food is ok.. as it seems a little pricey when we look at the quantity but yes they have limited tables and limited people with some good shacks and playful noises of dogs.. they have a cover charge of 200 rupees per person which you can redeem on food but still have to shell out some more money if you decide to fill your stomach!!
They have variety of food for your pets as well which you can buy and feed your pet if you don't want to buy for yourself..
Service is a little slow as they have only two people working in Kitchen ... But they are very friendly and good to talk to..
It's a go to place to have some tea and coffee and chit chat with your loved ones or friend who are dog lovers...",3.5,"2018-03-05 04:31:15",13,267,0
"507433","3 Points only for making an exceptional effort to make a cafe for furry friends. I am a regular on weekends and will be. A great place to meet other Dog parents and socialise and My Gabbar just loves it here as he can explore, wander, play at his own pace. I am not very big fan of the food as it can be improved for the price but ready to let it go cause of the ambience. They also have some cover charges per person so you have to eat no matter what. Its a crime if you have a pet and don’t go to this place (LOL).",3,"2018-02-21 13:54:13",92,349,0
"32024214","One of the best places to visit in Hyderabad, if you're a dog lover. Spacious for dogs to play, humans can live too 😂
They have a wide variety of snacks available, freshly prepared and very hygienic. The kitchen is open. Hosts are lovely people (Mr Hemant, Ms Ruchira and the helper Ms Lavanya).. they will make you feel at home. They have their own dogs and few on board ones.. all of them so friendly 😀
The take away point: definitely visit the place feel relaxed. They have free WiFi 😃😃",5,"2018-02-14 19:16:49",36,27,0
"35643086","Amazing place with great vegan food. My dog had a great day socialising and have food from the pets menu. Would recommend everyone to go to this place.",5,"2018-02-14 14:56:59",3,40,0
"32331267","This is a half review as I haven't tried anything in the menu coz the sole purpose was to attend the pet adoption drive and I loved the place.
There were around 6 to 7 pets in this place and they were friendly.i had a great time with them.The place is like a hut kind embience and there is a board with colour mark of pet feet (adopted) with their name and surname. That was really sweet. One can adopt a pet with few paper works.
I wish I could go again to adopt one of the little bundle of love😊",4,"2017-12-03 21:46:40",174,1283,3
"8004431","had great time! i'm sure anyone who steps in goes back making good friends, experiencing amazing coffee and food. A gobackto  place. Check it out. Here are some pics of friends i made :D .",4.5,"2017-12-03 19:04:56",1,90,2
"36114682","We had a great time at this place. Our dogs especially loved it here. The hosts were wonderful!! They have a special menu for dogs, big area for the dogs to explore and have kept in mind small details like having fresh water available for the dogs. They also have many paw prints of all the visiting dogs which is really cute. For the humans, there's a relaxing chilled out atmosphere, with picnic benches ,large screen TV, good food and the hosts are very friendly and welcoming!! Great place for a relaxed evening out with your four legged companions. 👩🐶🐾",4.5,"2017-09-24 01:18:14",3,3,2
"114263","Truly a paradise for both pets and their owners. Place is brilliantly set up with such heart warming concept. Loved the aura and its amazing hosts. A Must visit for all pet lovers.",5,"2017-09-23 15:52:07",5,88,0
"45650719","Great food awesome view and environment. Incredible hospitality by Hemant and Roochira..she is a benevolent and a wonderful chef. I recommend veg club sandwich from first hand experience.",5,"2017-09-18 13:29:45",6,1,0
"1311848","A cafe where pets can hang out and they definitely seem to be having the time of their lives! Spotlessly clean, extremely safe, yummy food for the pets and owners alike, this charming cafe is perfect if you want an evening out with your pet. Even if you are a pet lover, you will love spending time here.
We can let our dogs off the leash and let them play with other people and dogs, without a worry in the world. 
The cafe owners are a warm and friendly couple, and the last time we went there for coffee, we ended up eating dinner there!
The place is thoughtfully designed to be so pet-friendly, and the vibe is just right for a relaxed evening out. The best part is that your pet is not left alone at home while you are out, and they will surely enjoy themselves more than you!",5,"2017-09-09 23:49:57",1,6,0
"45628633","Couldn't help but fall in love with this place, and I'm sure I wouldn't be lying when I say my doggo felt the same. We took our pug Guppy there for dinner, and him being a big foody devoured everything we ordered for him off the special paws menu. Although he doesn't usually eat vegetables, he licked his bowl clean, cabbage and all. The ambience of the place is very low-key, comfortable, and not to mention clean. Guppy was able to roam around and explore, with a lot of place to run around. The food is great - even for homo sapiens :') - and the hosts are extremely friendly. I would definitely recommend checking the place out, even if you don't have a pet. Love the concept! Keep it up :)",5,"2017-09-09 11:55:02",6,9,0
"1601925","This is an awesome place...first of its kind....a pet friendly place to walk in and have a beautiful cup of coffee. The space is so nice for the pets to roam around ",5,"2017-08-10 22:13:13",2,90,0
"44797884","Great place!!! Great hosts!!! Finally an interesting hang out in Hyderabad. Open air, non-fussy, chilled out place to unwind. Not a typical restaurant. Run by a couple who freely mingle with the guests and entertain you with interesting conversation. Food is delicious too. Not the regular oily stuff. So that was a relief.
We don't own a pet. Landed at the cafe out of curiosity. It was nice to see pets enjoying their strolls and actually socialising with each other. 
Cool place. Will definitely visit again.",4.5,"2017-08-10 21:56:42",1,3,0
"44732302","One of the best places for the Pets.. Don't know if heaven exists for the Pets after death.. but it's a paradise for pets on the earth.. believe me!",5,"2017-08-08 22:38:52",1,32,0
"1262807","A great place to visit with your pet. They really serve all the great food as per your n your pets choice. The only pet Restuarant. We celebrate the birthday of our pet here. And also human food is also prepared very yummy.",4,"2017-08-07 17:16:26",13,7,1
"44613066","We had been to Cafe de Loco this evening with Bruno ahead of his 1st Birthday and we thoroughly enjoyed. The entire theme has been thoughtfully laid out. Gives an opportunity to unleash our pets and let them be at ease. Food was awesome too. Extremely friendly hosts too
Would love to visit more often. Strongly recommend.",5,"2017-08-05 21:32:18",1,4,0
"994850","No words required. A blessing to society + absolutely phenomenal food! The simple yet fun vibe this place gives you is something you need to experience! Don't wait up. Experience the Cafe de Loco feeling NOW! ",5,"2017-08-01 01:33:12",4,294,0
"546515","Nice place to hang out. I think the only place in Hyderabad where your pooch is welcomed more than you and the joy it results in is unparalleled. These guys have made it a task to stick to the roots and keep this place as natural as possible. You don't feel you are in a cafe or a restaurant.. you just feel that you are at your friends farm house relaxing and playing with your pet while ordering food. This is a must go to place and a regular hangout spot for all the dog lovers of Hyderabad. Special mention of Hemant who has a keen taste of old style which led to gather everything from yesteryears!! 
In short awesome place and do visit once..  You will become a regular. That's a promise!!!",5,"2017-07-30 01:59:07",1,47,0
"27134632","This is a lovely place and an absolute haven for pet lovers. The owners are very welcoming and one of the best factors of this cafe experience. The food is made by Roochira herself and is amazing in its simplicity and quality. Can't wait to take our doggies to the weekend barbeque. Definitely our family's go to place now 😁",5,"2017-07-25 00:38:31",2,1,0
"43442321","I loved the whole idea of a cafe made for pets. A beautiful place, with an open ground for the dogs to run about. Before leaving, they take a paw print of all dogs who visit the place. And our puppy loved the food that he was served (Chicken Lentil Soup). He licked every last drop of it! Definitely a must visit for every pet owner.",5,"2017-07-07 18:40:14",2,6,1
"184844","A place to be for all dog, nature & food lovers. The unique natural ambience stays cool even in the hottest summer days. We often come here for a perfect evening with our pouch. Yes! She gets a warm welcome, lots of space to run around & her favorite food! I love the refreshing juices & yummy pasta they serve. We also enjoy TV and live screening in the cosy open air environment. A must visit place for all dog loving families 😊",5,"2017-06-05 09:12:54",17,93,3
"32733031","Awesome cafe with good theme of huts and with the concept of village. This cafe has an especially different idea, which is really very thoughtful. People who are dog lovers do not feel like leaving their 'son' or 'daughter' at home! So this is the place where you can take your babies and they can roam freely. They have a special different menu known as 'Menu for pets'. Sherlock had boiled chicken and he enjoyed thoroughly! We had chocolate shake, green tea, watermelon juice, chicken and veg sandwiches. The sandwiches were yummy and the stuffings was really nice. ",4,"2017-05-14 20:16:09",62,199,0
