"UserId","Review Text","Rating","Time","Reviews Count","Followers Count","Photos Count"
"42939500","I've been to this cafe yesterday, this place is only and only for pet lovers it's a great hangout spot the food was ok. Kudos to the management team for managing evrything so well. ❤️",4,"2019-05-17 13:34:37",1,1,0
"37248917","I saw this place long back in the news paper and today made it here
the directions were like a puzzle,
We entered and i had doggs all over me ( I love dogs) so the excitement was real this place has such a beautiful (doggy menu) the dogs are friendly we ordered for bruschetta and lemon chilli potato the presentation was nice although I wish the bruschetta had more flavor all I tasted was cheese it was like a garlic bread there wasn't any sauce to it the potato was decent.... I'd love to visit for the doggies esp muffin",3,"2019-05-02 04:49:57",63,144,1
"30770089","Love their brownies and iced tea here. I visit this place mostly for the ambience and the great atmosphere. They always have so many activities lined up for the dogs. It's a great location to bring out your pet for activities as well. ",5,"2019-04-27 17:33:55",344,975,0
"2011754","Finally after planning for months I visited this place! This place is a gem for pet lovers. The owners of this place are very good. They gave the instructions and made sure that we feel comfortable there (as I went there with my 1.3 year old niece who loves dog). There are variety of food for dogs and trust me if you want to take your dog somewhere then this is the place to be! Also, they keep dogs for adoption..so if you are interested in adopting a dog please contact the owner. ",5,"2019-04-11 07:40:51",5,1,0
"36723204","Went there for pet adoption drive on Sunday. There was only one pup for adoption so we thought we will come back next week. But for the 5 mins spent on the property the owner asked 3 of us to pay cover charge of 600 total. We said ok, let's buy something using Zomato gold. Even there he denied Zomato gold. Tried to reason with him but to be honest his attitude ensured that our experience was not good. And the food that came after all this hoopla, was really not tasty at all. Without doubt this will be our last visit to Cafe de loco. There was no option of zero star, hence giving it one star",1,"2019-04-10 10:42:02",1,75,0
"39908199","Owners of this place have a mad dog who attacks people and other fellow dogs. If you love your dog never take him/her to this place. Moreover owners are not even apologetic. I had to rush to hospital for me and my dog. Highly not recommendable",1,"2019-03-23 21:39:38",4,19,0
"31733673","Lovely place for a nice evening with pets. 3 star for the place. The food sucks. Do not go here to eat! 
And Zomato Gold was not accepted today, I was told there is a Karaoke event and Zomato gold will not be applied when there is an event (Disappointed). 
All em dogs are fun to play. They are friendly. But food! Uuffff no. Don’t ask :( 
But yes, will come back for sure. Love the place though! Apoorva Ganapathi ",3,"2019-03-23 20:46:00",234,688,7
"37347809","Highly rated and the pet friendly cafe which made me to choose this place on a Saturday eve for my Chiko.
First of all the path way and the ambiance is not welcoming and top of that we need to pay the cover charge of 200/- per person which can be redeemable against food. Note: Zomato will not covered within cover charge.
Being a dog lover i felt this ‘Pet Cafe’ is not fit for those who wanted to leave their dogs freely. ( Better to choose GHMC Dog Park at Gachibowli) During our 1.5 hr time mostly we spend time to safeguard our pet from their guard dogs. But this is an ideal place for the dog lovers alone, without their pets.
Zomato menu is not updated one; refer Dineout menu for accuracy.
Its a self service cafe, we ordered ‘Loco Delight - Chicken’ 210/-and ‘Baked Loco Biscuits’ 150/- for our pet and find difficult to arrange the place to avoid their house dogs. Unfortunately he dint ate and they arranged the parcel for 10/- Extra.
We got Masala Fries-Indian herbs with packet sauce 150/-  tastes medium and Bread Pakoda with podina chutney 150/- can give a try for the spices.
They have different calculation on tax and arent willing to provide the bill. Even i dint demand the bill and verge of leaving the place as early as possible. ",1,"2019-03-09 23:08:28",6,5,0
"36972654","One can enjoy the food and spent house with the in house pets and can bring pets of our own and spent time ....can play the board games ...best place for pet loveers ",4,"2019-03-06 11:35:41",22,4,1
"46107281","Best place for pet lovers, #Ruchira is doing a great job. Kudos to her efforts towards this initiative. Love showers drizzle here
Food- is a feast,
Ambeince- I believe little lawn would make this place even better,
Service-self
Trust me, u ll love this place if you are a pet lover",5,"2019-02-22 15:50:20",10,10,0
"3232413","A paradise for dog lovers !!
First of all I am crazy about dogs so ambience and food was secondary for me, the thing that hit me was presence of these happy souls around you.
The owner has two babies Lara(indian breed girl) and Pluto(Lhasa apso guard dog), and Pluto apprently is the boss, they have also kept some rescued pups for adoption which happens every Sunday + there is a day boarding facility for all the working people who are unable to take their pets to work.The guest can bring their pets to play around while the parent chill and relax in the ambience that they have created. They let dogs play and roam around, pet owners must visit this place.
All in all its a very comfy and cozy place to be, for pet as well as the owner.
Coming to the food, so they have a very basic menu nothing so complicated that can make u think if u should try or not. We ordered -
#garlic bread- 5/5 soft beard with freshly chopped garlic
#Cheese chili toast- 4/5 taste was good I just felt quantity of cheese on the toast was bit less
#masala chai- 4.5/5 good taste but since I like more milk in my tea , this tea wasn't that Milky
Not to mention they also have a separate menu for your furry friend. So Go get em all.
Highly recommended if u are a pet owner or a dog lover ",5,"2019-02-13 15:58:46",12,13,1
"29667098","First time been to a pet friendly place...!
Neat ambience and playful environment.
Dint feel like leaving this place...!
I am generally very scared of dogs but these pets are so friendly and warm to play with..
Food is too good...never had this proper pasta anywhere...
Takes time for food.
But you wouldn't know when you play with those pets around...
Would love to visit again 😊😊😊
Happy birthday auro...! ",5,"2019-02-08 14:42:17",13,22,0
"51224217","They have an entry free which is 200 per person and is pretty expensive. When we went, there were no dogs and I didn't find the experience worth it. The food was average, could have been better.",3,"2019-01-26 18:39:10",10,16,0
"14190611","Great food made with care and love.. amazing team of people run the place and best of all mans best friend to lift your spirits
If your lucky Luna will make a appearance ",5,"2019-01-20 19:39:10",3,1,0
"35265709","It was one of the most beautiful place I have been in long time! Loved the concept! The cafe was so out of the box, even with the decor. There are books, games and oh my God, the most adorable dogs! Food was some what 3/5 but everything else there makes it up for it. The owners were really nice and friendly. There is a cover entry charges :)",4,"2019-01-06 16:13:06",14,12,2
"38049215","The food is overall good.
Bread pakora is a must try, awesome.
Masala tea is good too.
Burger was decent, could have been better and fuller for the price.
However, the exp at the place is awesome, especially if you are a pet lover.",4,"2019-01-01 19:36:11",34,233,0
"52077480","Perfect place of you love pets. There are puppies, dogs in the cafe. You can bring your own pet also. There are balls and toys for them to play. Your pet will also love this place",5,"2018-12-22 23:23:03",35,26,1
"1849334","An outdoor cafe populated with dogs, this served some really good food. Albeit, a bit slow. The dogs running amok were a delight. Don't be surprised if they climb on top of the table or your lap to try and get some food. 
There's a cover charge of ₹200 per person which is completely redeemable at the counter. I suggest visiting the place on a cool day as even with fans it can get quite warm. ",4,"2018-12-12 09:32:48",38,109,5
"75954751","Entry fees to the place charged me 200 per pax.Ambiance of pets depends on the visitors as the pets been there are mainly of visitor's .when i visited the place there are few dogs whos presence was like no pets zone.you can find more in streets or parks and though it was Sunday 5 pm .I got disappointed mainly when they refused to reedem two of my zomato gold coupon, which I unlocked .I could have used it for my dinner which I paid fully.After billing they gave me this choice that for 6 people I need to buy atleast 1200 then I can reedem zomato gold ,I did but even after the discount using zomato gold was of the lowest amount (coffee).i tried but failed and gave him whatever money he asked for ,without bill(1900) * .If you are thinking of food using zomato gold then you shouldn't go.And I request zomato to please let us know the details what deal we need to face before booking.And the main point is that they are not providing bills ,as I payed the money they gave me the bank receipt no bills were attached to it.",2,"2018-12-10 04:04:49",13,5,1
"72548095","Not getting biased to anyone, it was a Very bad experience. Very less pets. Taking 200 entry fees per person doesn't justify. Zomato gold can be used but they will play tricks while taking money and charge u more. Food is also not so good specially drinks.Visit on your own preference.",1,"2018-12-09 19:56:18",2,3,0
"2319082","Based on zomato reviews I had visited this place. Firstly, point to be noted this place is a cafe for pets.   Its not a regular cafe, with service and ambience.
I had visited this place at 8pm it was quite empty. 
Its a self service place.
* They charged a min of 200 per person.
* I ordered barbecue sandwich and coffee, was good.
* As this cafe is for pets, the ambience is quite different.
* Cleanliness can be improved. Found a bit of dust on tables and chairs.
* Mosquitoes:(
* The Lady was polite in taking the order and advised us to apply mosquito repellent. 
* Dont expect great food here.
I would say this place is unique, Service and Cleanliness can be improved. Albeit you could take your pet here and spend your evening. ",3,"2018-11-17 19:19:57",12,2,0
"31705472","This place has disappointed us in every possible way, I won’t say that our timing was wrong as not everything can go wrong with wrong timing.
Starting with the food we ordered spinach chicken sandwich, mixed sauce pasta and masala tea.
Sandwich was a home made white bread extra hard chicken stuffed sandwich.
Pasta tasted more like some indian masala mix pasta with lot of chilli flakes added on top.
And lastly the masala tea was something i would never like to try again.
Now looking at the ratings of this place, i would say all pet lovers like me would have visited & rated this so high looking at the dogs here. Otherwise I don’t see anything to be rated this high.
This place is a self service place and I appreciate that, but a self service place should also provide bills after payment, i was expecting a bill as what I ordered was suggested by the staff and was not on the menu, waited for the bill expecting it to be given with our food but it wasn’t given.
Excuses like i have just shut down the system and I won’t be able to provide the bill now are not acceptable, we even left our email and mobile number to get back with the bill.
Lastly, this restaurant had a condition on using Zomato gold membership, which was the bill should be above 400 and I don’t know how the bill got upto  700+ and on that i got a discount and the bill was 621. Not sure how as i am still waiting for the bill.
All in all I won’t recommend this place, first coz of the food quality and second for their unprofessional behaviour.",1,"2018-11-16 17:55:44",100,275,8
"2850992","This is definitely a heaven for dog lovers. They have a big space for dogs to play around. The vibe of the place is so chill, you could really spend hours here. We went there on a weekday so there was nobody else around except a couple who had their own three dogs. They also a room full of papers covered with dog paw impressions with their name which was literally so cute. We didn't get the chance to experiment much with the food as we only ordered a cold coffee, some fries and nuggets. But I can't wait to be back here, hopefully when more people (and definitely their pets) are around ",4,"2018-11-15 23:14:52",23,10,0
"34164997","Ooh such a lovely place to spend my time with my babies... Came here on a Sunday evening and oh boy how the time passed by!! Dnt realise we spent gud 2hrs here..A beautiful heaven for pets, tucked away in a quite place yet within the city... My babies enjoyed the whole time, off the leash,roaming free, doing wat they are best at.. Being themselves and being cute😍😍awesome food both for babies and humans as well, under the stars with my family, warm humans who made this place and take care of it, prepare food with love and apt music to go with the ambience.. What more can one ask for?? Totally in love with this place.. I'm still here as I write this review.. If u are a pet parent, wanting to spend time with ur kid/kids, u shud visit this place one😊",5,"2018-11-11 21:12:20",14,52,4
"63853845","This is a great place for pet lovers and pet owners alike. It has a cosy environment and the dogs have their own space to play. Good food . We ordered mojito which was great . Such a nice concept should be encouraged and it's definitely worth a visit. ",4,"2018-10-10 22:04:17",23,25,0
"16142730","Went there on a Sunday evening. They had two dogs Oscar and Abby and there were guests with their different dogs as well. The place is set up in Gachibowli in a plot giving a good space for dogs to play.
Oscar was my favorite and i had a great time with him. Coming to the food i had white sauce pasta which was quite dry but they ordered broccoli and vegetables i like, so i was really happy. Then i had Nutella Crepe. Frankly, it was the best crepe i ever had. It was simply amazing ❤️
Looking forward to visit the place again and spend an amazing time with the dog and the owner again. ",4,"2018-10-08 21:11:56",166,977,0
"9188691","Oh for the love of doggos, please visit. I have been there twice already, and i love the rustic feel of the place. It's right beside Al Saba in Gachibowli. You might have a little trouble finding the place, but nothing that should put you off.
The hooman food is good. I loved the Kolkata special roll - reminded me of home. Prices are a little steep, but i didn't mind much. I was too enthralled by the doggos just being themselves in the campus.
P.s. the pets roam free and might come down to say hello. And the place usually has an adoption drive every Sunday.
I loved the concept, hopefully, so will you! ",5,"2018-09-23 20:43:23",22,158,0
"30870099","So I basically love pets so I was like I must try this place out!
I went alone was greeted by three handsome and beautiful dogs Luna, choco and abby(she's the naughtiest)
The owners(Roochira and Hemant) are a breath of fresh air to talk to and be around. They tell me how their dishes can be eaten by the pets as well.(awesomeness) It was amazing. I had ordered a Frappuccino and a bong wrap. It was really delicious. I spent most of my time playing with the pets people brought here.
The photo I am posting is of one of the Persian cats I met there (honey and bunny).
It made my day. Everyone is so friendly. This place is a must must visit for pet lovers! ",5,"2018-09-23 12:43:11",48,160,0
"36835796","The best place for dog owners and dog lovers, the owners are so friendly... This place has a positive vibe around!! One of the must visit place on weekends to get releaxed n to play with dogs!! PS. It has a cover charge of 200 rupees
Food : 4/5
Ambience :5/5
Value for money : 100%",5,"2018-09-17 15:53:41",18,67,0
"32378132","A nice place to get away from the busy city life but right in the middle of the city.. A must visiy place for dog lovers and you can buy some nice cookies and cake for your loved ones. The place and how it all started.. U get to hear from the owner of this place.. ",5,"2018-09-14 21:37:10",2,54,0
"27369166","Lovely place to spend your evening.. but only if you are a dog lover!!! Just sit, relax, sip coffee, munch the yummy options available and see the playful pets play.. it's a treat to see them play with their friends and enjoy their happy faces!! PS: 200 per head is like an entry fee to the cafe but reedemable with the food/drinks you order!!! Cheers!! 💖",5,"2018-09-08 23:15:41",12,94,0
"2649120","Amazing place for dog lovers and for the ones who have a pet dog. My dog loves their chicken biryani for dogs which is made up of so much love. I also love their Nutella crepe, chicken nuggets, cappucino and their omelettes ",5,"2018-09-03 16:32:20",44,212,0
"1272358","Amazing place for pets. The dogs there were really friendly and we enjoyed the conversations with the owners. Such a paradise of a place in the middle of the noisy Gachibolwi area..Will definitely come back again.. ",5,"2018-09-02 00:41:57",9,187,0
"27969346","Awesome place if you want to spend time with dogs. 😍 You can sit back and enjoy with the dogs they have. Friendly owners. You will feel like you belong with them . They had rakhi special.. you can make your rakhi for the pets and get a cookie for free 😍😍 For humans😝, we had pasta and coffee which was good. ",5,"2018-08-25 21:59:40",4,3,0
"4290791","I don't usually write reviews on zomato but I couldn't resist myself from writing this one. A paradise for dog lovers. This place has a very chilled out vibe. Music playing in back ground, open area to sit and adorable dogs running around you. Don't think twice before visiting this place, best time to spend your weekend. Food was good and the cover charge is reasonable. Hosts are very friendly, they make sure you're having a great time. Their efforts to all this is truly commendable. Definitely visiting again! :)",5,"2018-08-20 11:01:09",2,55,1
"2190258","Would love to go again. You could just get you pupper along.. set him free with his new friends and just watch him play .... food was amazing. Never had a Maggie so tasty with a cold coffee combination. Well.. dog-lovers, this is just the place we have been wanting to be at.",5,"2018-08-04 07:19:40",7,48,1
"49570639","Its not cappuccino, it just tasted like normal filter coffee. May be due to delivery.",3,"2018-07-12 19:28:42",3,1,0
"30362677","We went to Cafe de Loco on the recommendation of friends and were not disappointed!
I’d say you’d like the cafe a lot more if you are a dog lover. While the food is good too, the highlight of the cafe is the dogs that inhabit it. And such well behaved ones, at that!
Coming to the food, we ordered the bread pakoda (5/5), mushroom cheese sandwich (5/5), BBQ grilled sandwich (3/5 - a little too salty), pink sauce pasta (4/5 - again, too much salt) and the cold coffee (5/5 yum!!). 
Do visit if you wish to unwind, spend some time with amazing dogs and equally amazing hosts :) they have a separate menu for your pets too! p.s., fyi, there’s a cover charge of 200 per person, which is redeemable with food. Also, they conduct dog adoption drives on Sunday from 12pm-4pm, so please check them out if you or your friends are interested.",5,"2018-07-08 19:09:03",5,9,1
"34324451","Great place , friendly ppl , and if u have pets a must visit.. it will help your pet socialise ,a great place to spend time ,, loved it .. I wish I could stay here forever ",5,"2018-07-07 20:18:53",10,29,0
"39759273","Truly a paradise for all dog lovers! It's a place where humans and dogs coexist and dogs get to socialise with not just humans but other dogs. Priority of this place being dogs. They have events specifically designed for dogs! One of a kind experience and a must visit place for every dog lover! The owners make you feel comfortable and at home. ",4,"2018-06-09 18:02:10",6,41,0
"2403666","Paradise for people who love dogs and coffee! The hosts are one of the friendliest lots you'd ever meet. Pasta and wedges for good too. Their mojito is very refreshing. ",4,"2018-05-25 14:12:28",38,106,2
"213321","Some places have a personality of their own. This gorgeous Pet friendly cafe tucked in a corner near the Gachibowli flyover is one of those. 
The place is all things Pets. If you have a pet pooch or are a meagre pet lover like me, this place should definitely be on your Sunday to do list. 
The place welcomes you to a very rustic style ground surrounded by small brick shed cubes to seat yourself and your pet. A few basins and sanitizer  scattered across the place ensure hygiene. 
It is an experience on its own and if you are a dog lover, you will surely be delighted. Their in-house baby Pluto is quite the eye-candy. 
While as far as the food is concerned, I have only tried their Cold coffee with ice-cream, which is simple and summery. I am surely coming back to try more of their menu. There are ample treats for pets too. ",4,"2018-05-21 00:55:36",96,1068,1
"615948","Got a sandwich delivered and it’s not extraordinary or anything. It tasted just like a regular sandwich but the presentation was good. I’ll give it a try again.
Taste: 3/5
Value for money: 2/5
Presentation: 4/5
I’d suggest the place for sandwiches but have a check on your expectations.",3,"2018-05-14 10:51:51",159,650,0
"615948","Got a sandwich delivered and it isn’t extraordinary. Liked the presentation.",3,"2018-05-14 00:08:07",159,650,0
"49462468","A heaven for dog lovers, this place is a must go-to! The food is awesome! The owners are so cool & friendly! A place to relax for you and your pets. ",5,"2018-05-03 18:43:01",111,1009,0
"32262756","This place is not just a cafe but a place where you can relieve stress. Thumbs up for the idea. Amazing ambience and lovely people. Loads of love for the pups here",5,"2018-04-29 12:46:31",3,36,0
"53529113","Whose food ever in Zomato that I ordered. Macaroni was just rubbish. 350/- is a complete waste. Spoiled my entire appetite",1,"2018-04-25 13:31:53",6,2,0
"1982182","Cafe De Loco, this wonderful cafe is located in the tiny lane adjacent to AL Saba restaurant . you might feel that you have come to the wrong location untill you actually hit the dead end of the road and see the board to your right .
If you are afraid of dogs , I would suggest you enter with a friend who isn't, because the moment you enter , you will be greeted by a few furry angels . If you are fond of dogs , then get ready to be overwhelmed with the sheer cuteness you will face .
Anyway , let's get to the food . I just ordered a cafe Mocha and mushroom omlette
Coffee : The coffee was good . it comes with a cookie too. It wasn't really hot but it was just about warm enough . no complains . however , if you are someone whomlikes their hot beverage boiling hot , then probably you may have an issue. The taste is really good though . 3.5/5
Omlette : i ordered a mushroom omelette which comes with 2 slices of bread . The omlette was like something your mother would make for you. It's comfort food . nothing fancy, but simple and good . worth repeating . 4/5
Let's talk about the people
everyone there is really friendly . it's almost as if you have come to a a friends place . From what I could observe , it's a family run place . right from the person who takes your order at the counter to the people who are cooking , all give you a very positive vibe . the furry companions there will just melt your heart .
You will run out of hugs and cuddles to give . You can enter the cafe with a bad mood , but you will definitely Leave with a smile on your face
Humans and Furry friends at the cafe 5/5
This place is definitely worth visiting and repeating .",4,"2018-04-07 23:13:30",7,19,3
