"UserId","Review Text","Rating","Time","Reviews Count","Followers Count","Photos Count"
"3072279","The staff is not at all friendly As we entered we asked for place and no one even responded to us order was taken after almost an hour and the straight no answer it’s very rude added they don’t have half of the things in menu available. Place being popular amongst the crowd even on weekdays must ensure to meet the menu mentioned food items and sometimes we specially come to try those food items and also serving cold food is a big disappointment 
So I think if the place gets the humbleness and little more friendly it would add on.",2,"2019-02-20 21:13:04",29,169,0
"2996310","This place is in the SLN terminus mall...it's a huge place with young IT crowd of hitec city pouring in...very good place, nice ambience and setting, food is good and the party scene is electrifying",5,"2019-02-20 20:15:56",35,72,0
"39297414","I am thinking where to start, there were so many bad experiences at this place in just 2-3 hours of time we spent there. We were a group of 8, we decided upon this place after looking at the reviews and on recommendation of someone who had visited a few months before us.
To start with, the place does not have well groomed and professional staff, they hardly understand what you speak.
The first bad experience was when we entered and got ourselves seated on a large table meant for 10, we were 6 at that time and 2 more expected to join us. As soon as we got seated, a waiter came to us and asked us to take a smaller table as this one is meant for 10 people, we told him that we are expecting 2 more to join shortly, but he insisted we take a smaller table as crowd would start coming, it was not even 6 PM then and there was hardly anyone at that time other than the 6 of us. We told him that incase more crowd comes we will move.
Secondly, we ordered for drinks and those were served in plastic glasses, when we asked for glass ones the waiter they don't have any. We had to literally fight for glass tumblers and they did it very reluctantly.
The service was slow, we had to keep looking for waiters.
We were there during happy hours and were told it ends at 7 PM, but the waiters stopped taking orders at 6.50 PM saying by they serve it would cross 7 PM. Doesn't that sound ridiculous?
Again they started serving in plastic glasses and we were demanding the glass ones, when the argument was not stopping I suggested my friends that we should go to 10D, to which the waiter present said we should go to 10D they use glass tumblers, after he said that we demanded meeting the Manager.
The Manager came and he was a nightmare, he did not have the courtesy to apologize on behalf of the waiter and started arguing with us, when we said we will give bad rating/ review the Manager said ""Ok Sir, we are also dangerous people"" we were shocked at this.
Our evening was spoilt already, so we decided to move out of there and go elsewhere.
This place is not at all professional, the staff and their business ethics are horrible, will never visit ever.",1,"2019-02-19 15:59:42",24,43,0
"41414839","Greetings. The ambience is good ( okayish! ) with artificial plants towards the gallery area. Too dark for a pub. Sitting is good. Dedicated Dance floor with good Hindi new and old songs to garnish upon. Too loud though. Don’t have draught beer. Have pint prices slightly towards higher side. Crispy corn made the day ( night! ). Do try! ",3,"2019-02-17 20:19:47",10,11,0
"5859781","this place freakin crazy lil fuzzy over crowded but crazy mood changer enterin it changes all ur mood
food 4/5
service 4/5
ambience 4/5
musix 4/5
visitin is repeated for me",4,"2019-02-15 18:59:09",122,1201,0
"54021126","Rocking club....
But where is my Bro....DJ ASIF IQBAL
WE WANT ASIF
WE WANT ASIF
WE WANT ASIF
WE WANT ASIF
WE WANT ASIF
What a music
What a class Man...",3,"2019-02-15 15:57:08",2,1,0
"87756818","Hello...
The ambience is amazing..and the food is awesome...
But this friday i literally came for Dj Asif Iqbal...
But it was an utter disappointment...he was Not there...some other dj was there..To be rather frank..i come to this club coz of Asif's music.It is so mesmerising...We missed him..
What a talent..
He is a rockstar
Where is ASIF IQBAL..
Hoping to see him this coming Friday...",4,"2019-02-15 15:39:16",1,0,0
"43012455","Worst place in Hyderabad. Staff has no etiquette’s to talk to customers. No idea about what is available and what is not in their drinks menu. Takes more than 30 minutes to get your order. Horrible experience ",1,"2019-02-13 20:07:20",5,1,0
"33794579","Ambiance is good. There is a dance floor with a good DJ. Food and drinks quality is good and price is ok! But service is very bad, stuffs are not at all polite and not cooperative. Even they force to pay tips and use to bargain for the tips which is very unprofessional. We did not find any manager as well..",2,"2019-02-13 09:40:15",17,68,0
"35316677","My friend gave his birthday treat here! We opted for the buffet going on there. Buffet was not that great! Buffet had one chicken starter one vegetarian starter one main course (we opted for non vegetarian option) choice of roti  biryani and Gilab jamun. 
The ambiance was great. We clicked alot of pictures there! It was fun overall.",3,"2019-02-11 02:37:26",21,51,0
"31923087","Very unprofessional and rude staffs. If you order 2 beers, they will insist for a bucket and if you do not order a bucket, they will take half an hour to bring your order. The place is overcrowded during weekends and there is no proper crowd management of any sort. Then the waiters say that because it is overcrowded, orders can't be processed properly. Despite all that inconvenience and bad service, they force you for paying the tip and even argue over how much you want to pay. Crowd is very indecent and sometimes vulgar and there is no provision for crowd control given that the place is overcrowded. Music and DJ is good with cheap food and drinks, which is a crowd puller. One can have a really nice time if you can bear all these and if crowd is what attracts you.",1,"2019-02-10 13:24:08",3,2,0
"787705","Very unprofessional and arrogant staff.
It takes 30mins to take order 🙄
Staff is so careless towards customer. Ambience also not that much great. It's a chillar pub. Not recommend for couples.
Crowd is tooomuch because it's they allow stags aswell if you show your office id.
It's a budget friendly.",1,"2019-02-10 05:34:50",60,260,0
"3029315","Well the service needs to be a bit organised. The staff is polite. But it's overcrowded place at weekends. Otherwise the pricing and ambience is quite good enough.
Cheers",3,"2019-02-09 17:24:24",38,172,0
"32223247","An amazing place to let loose and free yourself of an entire day's/ week's slog.
Food : decently priced, huge helpings. One dish likely to suffice for two. Unless, of course... ;)
Drinks : large+ rum and hot water punched with lemon and spice for under 200. What else could one ask for? Unless, one finds better pleasure in other drinks... ;) Beer bucket prices ~900. So... Yeah good place to get the buzz.
Dance : the heart and soul of the place. DJs do a great job, generally. It's EDM untill 10pm-ish, and right mix of Punjabi, Bollywood and popular English. If you come here 2-3 days you'll figure out the pattern of songs the DJ plays. But every other day, he/she does surprise you.
Fridays and Saturdays are jam packed on the dance floor. Couples are better off dancing on the sidelines or near their table... (Just saying)
Closing line... Best hangout place in Gachibowli area.",5,"2019-02-09 17:02:57",3,88,0
"32997706","A great place to hang out with your friends . One of the best pubs in the city . It’s a little highly priced but overall the ambience, music and food matches the bar. Great food and great music . Courteous staff and great service. ",5,"2019-02-07 13:28:04",14,3,0
"39817973","Ambience - 4/5
Food - 3.5/5
Service - 4/5
Hop on it's a nice place to hang on for some lazy lunch over and above they do run corporate offers very often which will save our pockets .",5,"2019-02-07 02:22:30",16,27,0
"42821145","This is the worst place i have ever been too.
Such a illiterate crowd and the management is too fucked up and i'll never visit this place and never suggest this place to anyone.",1,"2019-02-05 23:35:37",2,1,0
"2562074","We were there in a group of 9, for drinks last weekend. And we had the most horrible experience ever. Happy hours were till 7, but they were very reluctant to take any orders in the last 30min.We had to call them repeatedly, and then they came dragging their feet. When we were placing orders at 6:50pm, they said, it wasn't counted under happy hours. No explanation given. Shady ambience and very diluted drinks Food was OK. The worst part is that they were serving the drinks in plastic glasses, real shabby ones. We asked for proper glasses and they told us to go to 10D.. I mean.. Really?? Asking 9 customers to get lost?? We were unhappy with the server's response, and wanted to talk to the manager, who was even worse. He outrightly threatened us saying they were dangerous people and it would not be safe for us.. Really!?! LIKE REALLY???
Anyways we got the hell out of there and went somewhere else.. But it was a very unpleasant experience. Club rogue indeed has rogues running it. Would advise everyone to stay away. ",1,"2019-02-04 21:25:44",66,192,0
"3032462","The non veg starter items (specially chicken) comes on good quantity and are tasty too. The ambience is little shady. The service is satisfactory.",3,"2019-01-31 23:48:46",146,332,0
"50967531","The place was amazing! People there were really polite
It was crowded af which was good.
The music could be better but it was a great night.",5,"2019-01-31 23:00:59",1,1,0
"34613611","Awesome place with excellent ambience and pocket friendly prices , entry is restricted to couples and corporates on Saturday and Sunday during night.",4,"2019-01-31 22:51:22",6,25,0
"30689529","The ambience of the club is really nice. The staff are friendly and the best thing about Club rouge is the pricing, it is budget friendly for food and liquor.",4,"2019-01-31 19:07:37",9,79,0
"12730731","The music here is too loud even for a club. You can't hear what other person is saying even if they are speaking in your ear. Ambience is cool. Food is okay. I think the good thing about this place is that price is a bit low compared to similar places. And because of ladies night almost every day of week, you will never find the place dull and empty even on weekdays. Also I feel the dance floor lighting is bit too bright for my liking.",3,"2019-01-29 19:49:50",18,99,0
"90794043","It is one of the best places we have to visit in Hyderabad!
The food was amaaazzinnng....nd ambience was really cozy and great!!!and there's nothing negative about it it was a FABULOUS visit...",5,"2019-01-27 22:23:07",3,0,3
"15598907","The worst place in the city, I was here for a few drinks with my friends and it was during the happy hours (which is till 6pm) and they were so adamant in taking our order at 5.50 stating happy hours were closed, we had to literally tell them that we were still in happy hours to ask for that price, surprisingly they didn't like it and the drinks were diluted. What surprised me the most was that they were serving everything in plastic glasses? Like seriously? Serve drinks in a plastic glass? When speaking to the waiter he said - go to 10D they serve drinks in glasses and not plastic, it was so rude for him to say that. I asked him to call his manager and told him the story to which he says his boss asked to serve in plastic glasses and kept explaining that it was his boss's order, he was just not able to understand what I was explaining to him - I bigger issue was about the way the waiter had spoken to me and when even after sometime I realised he was not interested in what I was saying, I was furious and used F word to which he said you can use F word but we are also very dangerous people? Like what dangerous? He was absolutely okay with me writing this review as they felt they didn't have any obligation towards customer service. It was not something they were giving me for free and to compensate he was willing to give me discount and also call the waiter to apologies to me - I didn't need someone's apology - what matters the most is their service and looks like it does not appear anywhere on their list of how to sustain in the business. Disappointed! ",1,"2019-01-27 19:44:44",5,141,0
"70563909","The place is not soo good. Staff is very arogant and doesnt care abt custor service. Initially they served drinks in plastic glasses and doesnt even have normal glasses to serve drinks. Manager is using abusive language when requested for normal glasses.. ",1,"2019-01-27 19:36:05",1,1,0
"31405699","Not a regular to pub. We went with 4-5 colleagues on Friday evening. We landed around 7 and within an hour, crowd started flowing in...
Prices were reasonable and ambience was good. Service was good enough till it didn't get crowded. Had to get hold of staff member within this crowd.
Music was good.
Not much space left with so much crowd inside to dance....
A good place to try as its inside SLN Terminus and stores around for shopping...",4,"2019-01-26 16:36:48",5,3,0
"16154647","I have been here last night and for sure this is one of best places to hangout in the City. Have been to many Bars and have never seen prices like this . They are very moderate and Ambiance is very good.
Over crowded for sure . May be this would a big issue here.
Food is nice , DJ is good and with a dance floor this place rocks if you want to go mad and forget yourself dancing . 
Sound system would be very loud and prepare for that if you want to visit.",4,"2019-01-24 12:49:46",41,94,0
"37149501","visited this place recently... its a good place.. the food tastes good and service is good, friendly staff.. mocktails didnt taste good but over all the place can be visited again 😅",4,"2019-01-24 12:35:03",2,10,0
"7173161","Waaw, have been there almost every fortnight but aura remains same, pure 5 star pub within its locality. Food,music, crowd this would definitly meet with your expectations.",5,"2019-01-23 13:28:04",2,25,0
"34795161","Good place to hang out and relief from your stress. 
Good Music, excellent Dj. 
Please try: Crispy Corn, chicken tikka kabab 
Best of luck guys.",4,"2019-01-23 12:49:04",8,72,0
"44680942","It was absolute fun here. Really loved the ambience and atmosphere.. service and people working here are awesome. Location is ideal for a chill out.",5,"2019-01-22 21:34:28",1,27,1
"57442090","great ambience...dj is superb..food and service good..pocket friendly club to go ..convenient location.. have tried a few items, i think their crispy corns is really good..great place to hang out with friends..must try for everyone",5,"2019-01-21 11:37:55",2,6,0
"6647561","Worst experience ever. We were three girls and waiters were rude as much as possible. They even denied to accept orders and it was just our second order.
Never seen such a pub run by rude and unprofessional people.",1,"2019-01-19 22:33:58",4,4,0
"1322766","It's a pocket friendly but not a customer friendly club. Have been here with my friend and I see the staff was busy with own works rather than offering a menu card. When the same was raised with the manager, he was very arrogant asking us it can't be changed.
The place is a definitely a crowd puller but they should remember that even the best clubs go down the pecking order as the time goes.
Never going to visit this place again.",1,"2019-01-19 01:10:37",9,90,0
"32913130","Ambience was good but when we were drunk , the waiter has charged extra 100 on our bill. Please ask the management not to misuse the customers ",3,"2019-01-18 22:51:36",33,52,0
"37064909","Place was pretty good.We went on thursday nite and it was almost full .Dance floor is quite good as compared to other places and nice place to party .We loved the food here, not over priced and taste wise it was great. Somehow i didn’t like the person serving us there, while billing he was forcing to add tip for 300-400 atleast and was not getting concinced in small amount . Managers should take a control over that.
Otherwise a must visit place :)",4,"2019-01-18 17:52:42",2,21,0
"49841072","Amazing place.. If you visit at day then this place has an entire romantic environment and if visit at night then this place gonna rock your night!!! Service is good... Music has a standard... Foods are okay. Dance floor is nice too.. Best is architecture of the pub !!!! However the staffs are insisting for 5% tips, which I didn’t like..!! Otherwise good... Hence 4 star otherwise it deserve 5 star..!!",4,"2019-01-17 02:41:20",9,8,0
"257990","This place has a great ambience and beautiful views inside. I visited this place with a group of friends.It is a bigger and spacious place. It's indeed great a place to hang out with friends. This pub has dedicated dance floor and entry was allowed inside after 7Pm only. The DJ starts playing after 10PM. They have tried to create an ambiance of a night club but there is no specific dance floor. So the place doesn't really serve any specific purpose. Also the service isn't very prompt and you will have to chase the staff to get your order. And towards the end of the night, the food quality degrades.Food and drinks with reasonable prices but they lack in service it has to be improved . Nice reasonable place, everything is fine except the one thing that Waiter asks for tips ridiculously and are very adamant on that. This is pretty unacceptable. Authority es like management any one comes across this review, my suggestion is, please provide proper training on professional mannerisms and customer management. Otherwise I would definitely give 5 stars.
Food: 3/5
Ambiance: 3/5
Music: 2/5
Service: 2/5
Value for money: 2/5sharmadipali.com",3,"2019-01-17 00:00:51",112,1566,1
"29078254","one of the best places to chill out,we were there on a staurday afternoon luckily less crowded,good food and the prices were also reasonable.",4,"2019-01-14 17:07:12",13,20,0
"1262558","We happened to hop this place on a saturday night n trust me cudnt find a place to tap my feet fr the music as well! The place was too crowded n people dancing on the waterfall place too! Although not fault of the club its the music that lured so much crowd! However the service was okay! Food was average but the best was crispy corn n nachos! Chicken chilli cud hv bn a lil btr n soft! A 3 from my side! ",3,"2019-01-13 02:49:29",51,230,3
"48372980","Very much pocket friendly club it is. The food and ambience is also nice. Just need to improve services. You need to book tables prior your visit because of the rush. I have visited this place many times but got tables only twice. The best part is food here.
Food - 4.5 /5
Ambience - 4/5
Service - 3.5/5",4,"2019-01-11 23:39:55",90,148,0
