"UserId","Review Text","Rating","Time","Reviews Count","Followers Count","Photos Count"
"72752308","You like crowd?!like really big crowd ?! Then this is the place you should go!! Also drinks are so cheap here!
Service was okay for me, nothing worth mentioning!
Music wasn’t that good! Just loud!
Not so great food! 
You got the good and bad about this place!! 
you decide whether to go or not :)",3,"2019-05-18 23:29:07",9,8,0
"1256527","Great place to hangout.
Good food + Good drinks + Great DJ + Nice ambience sums up my experience.
Very few of the clubs which plays Bollywood songs . Would love to visit the place again.",4,"2019-05-18 16:40:43",19,99,0
"71683","Too crowded all the time. The crowd management is not that great. Coming here with girls to party sometimes become a risk, especially on the dance floor. Otherwise it is a good place to hang around if you like loud music. I wouldn’t recommend this place for a girls group to go to.",2,"2019-05-11 16:36:00",47,117,0
"39637542","Food -5/5
Ambience-4/5
Service-4/5
Drinks-3/5
Must try in this place are
Kung pao fish 
Schezwan chicken 
Garlic chicken 
Bhutan chicken 
Pepper fish",4,"2019-05-09 07:44:01",41,555,0
"42531990","The music was unbearably loud. The food was good but the place was overcrowded and the service was bad. Overall, not so welcoming for a comeback.",2,"2019-05-04 20:41:15",16,1184,0
"35376281","The ambience was decent, but we went for a ladies night and it was a tad bit crowded (understandable!). The music was good, the only downside to the whole thing was that the person giving out drinks at the counter was downright ignoring us. We actually became a little uncomfortable after that, because we were right in front of him, waving hands (not drunk at all, because we were asking for out first drink of the night), and he was handing out drinks to everyone else except us. Looks like he had something againts us! ;)",3,"2019-05-04 10:16:17",3,8,0
"38194701","Overcrowded is the first thing that comes to my mind. They have a really big place but I guess not well managed, it’s like open for all, people smoking everywhere. DJ was below average and the sound systems can improve. 
Overall 3/5
Ambience 2/5
Food 4/5",3,"2019-05-03 09:04:19",20,10,0
"33539505","Good place, good vibe! Their Bollywood music could get better but currently it's the best available in this area of the city. The food's good too. ",4,"2019-05-02 06:50:22",62,96,0
"37510784","Good place to enjoy the music with food and decent drinks.It's a bit crowded but what's fun without the crowd :D Been here many times never disappoints me except for the fact that they keep asking for my ID .Place where you don't need a plus one in Hyderabad especially.",5,"2019-04-29 12:53:31",5,2,0
"375566","Cheap n Crowded even on weekdays
Ladies night all weekday (mon-thu)
Excellent place to get drunk n dance like crazy
Music was loud n awkward - all hindi songs that too many unknowns
Dj was below average - seems like youtube videos autoplay was playing
Great for people who want some fun on weekdays",3,"2019-04-28 20:30:46",23,108,0
"1186474","We went there around 8.30 for having a fun night. But the place turned out to be a cheap place where people are allowed to smoke everywhere. We cant even breathe properly.Then we order vodka..it was like water and when we questioned them he smiled and kind of agreed.Then we ordered Long island Tea and asked him to make it a good one but it was even worse. Even their virgin mohito was not gud.Then the food was also okish.Staff were also not courteous.I find the place was overcrowded. It seemed they have allowed stag entries and they were passing cheap comment on us.I will never recommend anyone here.",1,"2019-04-27 16:08:12",1,9,0
"31788945","Okay ! This place seems okay not so great. Tables are too small in which we cannot put more than three food items. And it was saturday night the DJ supposed to start at 8pm we were waiting for the songs to be played till 9:30pm yet no music nothing. And we left the place. ",3,"2019-04-26 17:57:54",2,16,2
"43902665","One the best places to hangout specially when you don't want to spend much . The food is great and going in the group would be best . The music and ambience is actually worth it. But please book a table before 8 on weekends as it gets much crowded. Recommended places to go . ",5,"2019-04-21 20:03:15",1,31,0
"34637683","Club Rogue is a nice place to hangout with friends and have a laid back beer on a weekday as well. The service is excellent. The menu has lots of options in veg as well as non veg. The DJ was excellent and we had the time of our lives dancing. The crowd was amazing. There are lots of options in drinks as well. Must visit.",4,"2019-04-21 13:07:21",4,40,0
"36263035","Club rogue ... located in Gachibowli is a good place party and dance if you have gone out with your friends on weekends. The place is usually full and suggestion would be to go in early and get yourself a table. Here you can have some drinks and then dance and yes the food is also quite good. Only issues .... the tables are small, and hence not much can be placed on the table. Saw lots of bottles fall and break. But regardless, this is a good place if you really wanna party hard.",4,"2019-04-21 08:49:02",59,182,0
"32744176","Whole club is a friendly place for smokers which becomes a problem for people who don't smoke.
I went to this club with my friends around 8. It was fine then but slowly the suffocation started. There is no proper ventilation, guessing based on the experience I had. Whichever club, I have been to, there is a separate outdoor place dedicated for smoking. The restaurant or a pub or a club will have outdoor dinning area to address this issue. But here at this place, i couldn't see an open window. It was all dark! I think they really took ""Rogue"" word to another level.
I couldn't enjoy at all, came from there when it was too much for me, now i have got this itching in my throat and cold just because of all that cigarette smoke.
I would really want Club Rogue to address this issue, it was very depressing for me and I think the same was felt by so many people over there.",1,"2019-04-21 01:18:54",1,0,0
"36365149","Ambience sucks... Worst service.... They don't book tables and when I asked a waiter for a table for 4, he just ignores and stares away... When we managed to make a waiter arrange a table for us, he just keeps a table in the middle of the way and asks us to stand throughout our course for the evening... Well we finally made to a normal table by waiting for others to vacate.... I highly recommend not to go to this place.... Just sitting outside the building and talking to my friends was lot better than ruining our evening by going to this shitty place...",1,"2019-04-21 00:23:56",2,1,0
"48550298","Awesome place one of the best places in hyderabar... Girish was awesome he made sure we had great time....the dj was the best ive seen in hderabad",5,"2019-04-18 23:59:48",1,1,0
"1471870","Been to Club Rogue last Saturday I.e. 13th April 2019. We chose this place as it was a Bollywood night. Lot of things to get told about this place.
First, coming to the ambience. It's a nice big place. The pricing is reasonable. We were given a place of our liking after a little followup.
Now coming to the attitude & rules of the club. The entrance has a prominent display which says, only couple allowed in after 7pm. Easily 10 bounces at the entrance, but inside- NIL! In spite of the display board saying only couples, they have allowed stags in. The dance floor was unchecked. Anyone could dance, feel you or ogle at you and not one single staff to monitor anything.
The Bollywood songs started at 11.10pm! I don't know what were they waiting for till so late to start playing Bollywood music.
Overall, a nice place but definitely enter this place with caution & at your risk & evaluate your need to visit this place.
Service was good. We were attended to well, by our server Mr. Kunal. ",2,"2019-04-17 14:02:13",25,73,0
"86031911","Manager was so cheap n attitude showing ego to the guest ..we visited thrice this time .. management pliz take serious action to the manager or else he vil let the business down..",1,"2019-04-17 01:27:19",1,0,0
"38338461","Recently been to this place. Good food and economically priced. Service was also good.
Most disappointing part is their crowd management. When they have a board outside only couples after 7.00p.m and then u see 60 percent dance floor is full with stags. No bouncers to check what is going on floor. Stags misbehaving with girls, trying to feel them, smoking on floor, no one is there to look around. Just for their business they r letting everyone in.
I will never visit this place with my wife/lady friend. As there is no security for them. One should enjoy the party but with some limits.
The management should look into this aspect and try to sort it out or else the place will become like its name a Rouge place. Lot of cheap crowd on Saturday night better to avoid.",2,"2019-04-15 13:47:59",1,22,0
"30865940","I am at this place @1:38 Friday 12th. My girlfriend ordered Mango Blossom, this bar tender here adds chat masala in store bought mango juice.
How does the word blossom relate to chat masala.
Disgusting treatment here at club rogue",1,"2019-04-12 13:42:19",8,3,0
"2372532","Cheap place. 
Really bad service.
This place has a quiet weird rule. If you show your office ID card they’ll not be charging a cover amount. Else you’ll have to pay a cover charge. 
The bar attenders are so ill mannered, I was almost about to slap one.
If you can’t talk to a customer politely, then maybe you should not work at a bar! 
I’ve asked for a Budweiser but he gave me a kingfisher and then insisted that I ordered kingfisher. (I’m okay with the argument part but he said drink it or get out which made me furious).
Food was average and served medium hot (I think I was served someone else’s cancelled order item)
Music was terrible! There was some desi dj who was playing songs out of YouTube and there was no quality mixing. 
Ambience: 3
Service: 0 
Management: 0
Will I visit this place: NEVER
Will I recommend this place: HELL NO! ",1,"2019-04-12 03:08:55",42,93,0
"42661799","One of d best place. Esp for North Indian ! Good music happening place. Get damn crowded on weekend.so beware 😊 food was ok ok ! Drinks are not so costly. Good place for ppl wd dancing shoes and ready to burn calories. Get ur gang here.",4,"2019-04-11 22:39:33",3,1,0
"49462468","The food and drinks are good.
The ambience is great too.
But the place feels too crowded and the dance floor sucks.
The DJ music is alright.
The staff is not good and need to be given proper training.
The way they rush guests out after 12 is too bad. ",2,"2019-04-05 08:12:51",111,1009,0
"2649988","This place is usual hangout place for guys as it allows to enter if you have a corporate ID.Also this place is packed almost everyday.You get to hear all types of music in one night so yeah it is worth going here to dance and habe fun.Getting a table here is bit difficult due to the crowd.Food and Drinks are cheap here.One thing I dont like here is people who dont know how to behave on dance floor with girls.That annoys me a lot.But that is not a frequent thing and can be fixed by bouncers being more proactive.Thanks",4,"2019-04-02 15:23:13",122,1642,2
"1030257","Thrice I visited this place thinking it might change my opinion but as always it was a disappointment. The staff and the manager extremely rude the service really bad. Looks like the place does not need customers at all coz I haven’t come across any waiter who would refuse to serve. Complained to the manger who was equally rude ! 
Food and drinks are alright but I got wine served in a plastic foggy glass 😓 I go out for the experience when I spend money 💰. I’m not sure about the others but I had a horrible experience.",2,"2019-04-01 16:07:15",14,2,0
"39118650","Read mixed reviews about this place. But the only thing which dragged us here is that the DJ here plays Bollywood songs and we were satisfied with the DJ and the dance floor. The place is also very beautiful. But the service here sucks, the waiters are rude. We couldn't order food as the waiters weren't responding properly. Even for drinks (tired of waiting for them to take order) we went to the bar and ordered.
So if you you to enjoy only the dance floor, only them I would recommend this place. ",3,"2019-03-27 00:07:13",50,69,0
"41498297","The manager named Siddarth was treating us very badly. We went with a few girls. The other guys around were teasing our friends. When we asked him he said he can't do anything. He does not have minimum courtesy to talk politely with the customers. The staff lack basic professionalism. One of my worst experiences.",1,"2019-03-25 16:47:21",2,87,0
"102497204","I went to club rouge since the day it started,I have been to this place more than 150 times.It was like a hangout place for us to always go.It was beautiful in the starting,less crowd and only couples were allowed to dance floors and people dint stand on tables and all that time to dance.Bouncers were pretty good at that time and the manager at that time was also very nice and polite.In the past few months since the manager changed,his name is siddharth the club rougue we knew was no more there.This angry little manager is the worst human u could ecer talk to.Single girls beware to go to this place.They allow cheap bastards into the club who doesn't drink and doesn't even have a table,they keep roaming all around the club to find girls and talk with them or make em uncomfy by staring at them and not moving from there table.I even saw a guy putting a tablet into some girls drink.Coming to my incident,Yesterday i went to this place to watch afternoon ipl match which was at 4.We went there at 5 and it was happy hours,which we don know or never cared about happy hours in clubs.We started watching match and at 6 a waiter comes saying pls pay bill since happy hours is ended.We said okay and we paid.Now the waiter says please leave, we were like wtf we came to watch the match and we will leave only after it's done.Then he calls the manager.His name is SIDDHARTH.This guy is one horrible crap who thinks since he is the manager of the club he's an avenger superhero.He came to us and said which a very tone u people have to leave,I told that's not happening we are hyderabadi's and it's srh match and we will leave only when it's done and he started shouting and telling no with so much attitude.Later he said 30mins and left.He wasn't coming when I was calling him also.He comes after 30mins and says go,When we told we will not leave until the match is done he told he will call bouncers and make us leave,We were so frustrated and angry we told call them and let them decide who's wrong here.Then he told that club rougue owner(MD) is NARSINGH RAO and he is a big local goon and he threatened us that once u leave this place some unknown people will come and hit and break our bones if we say anything to SIDDHARTH (the manager).People go to clubbing to have fun and in the end all we got was a life threat.And moreover this place became a sick place,it stinks and waiters will force u to give more tip saying 2 ppl served u and all.And the cheap guy stags who come inside with influence and think they are hottest models 😂.Sorry for the long review but i think they deserve it.The manager SIDDHARTH.SIDDHARTH.SIDDHARTH Thanks for making me realize that i should never come back to club rougue and make bills around 20k each time I visit the club.And thanks for making me realize that I should not suggest this place to anyone.His name is SIDDHARTH and the he is HERO of club rougue.",1,"2019-03-25 16:33:24",1,35,0
"60773357","great place with great vibes. I can give thumbs up to service and food. The only drawback of this pub is the DJ. Over all great experience and fun.",4,"2019-03-25 12:29:52",3,1,0
"77271933","Bad reception and unprofessional staff,do not visit this place they are unfriendly they just loot your money and the prices are also very High",1,"2019-03-24 19:28:16",1,0,0
"58497644","the manager was unprofessional and asked us to leave abruptly. And called bouncers upon us coz We justed wanted to see the match. The reception is bad. No ethics at all",1,"2019-03-24 19:26:12",1,13,0
"36682409","The manager was unprofessional and asked us to leave abruptly and called bouncers upon us. The ethics, courtesy and reception were very bad. ",1,"2019-03-24 19:20:32",1,1,0
"47892427","Went to this place to watch ipl match which was at 4pm and once happy hours ended they told us to leave.There were more 10 overs left and  they told us to leave.Then manager came and he shouted at us and he din tell his name also.We told we will leave after match he called 6 bouncers to send us out.He was shouting as hell and abused us.I have been to many clubs but this kind of attitude that too in a cheap place like club rougue is lame af.Please ignore this club if u wanna have a good time",1,"2019-03-24 19:17:13",1,1,0
"29890348","Me and boys went to watch match here, we are regular customers here. But manager asked us to leave abruptly in between the match. He called bouncers upon us which was totally unnecessary. Can't have a good time here. Won't recommend this place.",1,"2019-03-24 19:12:15",13,62,0
"42340746","Too crowded.. Don’t even have place to dance. Music is good but since it’s too crowded you won’t be able to dance.. They should manage the crowd to make it good",2,"2019-03-24 12:54:50",6,4,0
"51436418","So this is not the review for good music/ambience/food/drink. 
This is for the manager who was outside at the gate. 23rd March, 2019. We were three friends, and the bouncer at the gate asked for company ID, as we were stags. One of my friend called another, who was on the way, whether he was carrying his ID proof. 
In the mean time that Manager appeared at the gate. 
We went to the gate and showed the ID, but he looked at us head to toe, and made a disgusting face and asked for 2k cover charge. Without any reason. 
Some other stag groups were entering; just showing company ID. 
But this manager asked 2k cover charge from us, and we saw, he did same with another three guys group. 
We didn’t make any nuisance there, and silently left the place. 
So , tell me Club Rogue why this discrimination? 
Is this the way your managers handle clients?",1,"2019-03-24 12:25:34",1,1,0
"32327643","This is otherwise a good place, but all the waiters just always try to steal money by overcharging you for the items that you did not buy. This happened with me couple of times, they charge you for things you did not order, don't return the money and then argue with you.
I have seen this happen to others. Just be careful with the waiters and bartenders on this one, they seem to be bunch of thieves. This place is otherwise a good and joyful.",1,"2019-03-24 00:26:17",1,47,0
"2702578","I was here with my friends ... ystrday was my 4th time .. every time we visited we had the best memories to take back.. the music and the dance floor are their plus point .. and the service too... the food here is reasonable 
Best place to hangout🔥",5,"2019-03-20 11:45:06",2,2,0
"36859934","Over all good experience but
Cons: Entry ONLY for ppl who show corporate ID is kinda too much. And also rude behaviour of bouncers. Instead of making us feel safe, they themselves scares the customers.
Pros: Price for alcohol and food is at its best and the inside ambience is amazing. The way DJ plays music is awesome, He makes even non-dancers to dance till their body aches and also crowd is amazing",4,"2019-03-17 13:04:43",3,2,0
"689832","1. Bollywood music starts only after 10.30 pm. Dont fall for the incorrect timings posted here. Before that, its routine boring music which is unnecessary loud and you cant converse
2. Theres no outdoor or smoking zone, so be ready for a lot of passive smoking
3. DJ is okay (we went there on a Saturday) not many latest songs in the list. If you're' a bit away from the dance floor, you wont hear the music properly.
4. Food & ambience & service is fine.
5. Drinks are below average. LIIT was okay.
I asked for fresh lime soda with salt only and even after returning once, i got it mixed with sugar syrup and without fresh lemon.
6. They serve wine and cocktails in cheap dirty plastic glasses. It totally put me off",1,"2019-03-17 12:47:21",12,104,0
"15659312","Good place to hangout on weekends..nice crowd..good music. The ambience is really good and also the service was quick. Just a suggestion if anyone else going here do book a table before hand or else with this crowd it’s impossible to stand as well",4,"2019-03-17 12:20:09",13,86,0
"30171042","Good crowd and ambiance. Pre booking of table is highly recommended if you don't have plans of just drinking and dancing. The floor is big enough though the crowd outnumbers the capacity of it. Great place for a crazy weekend party! ",4,"2019-03-10 21:36:58",96,350,0
"3116730","One of the best places to hangout with friends. Ambience was good and cozy. Food was good. Service was appropriate. One of the happening place during weekends. ",4,"2019-03-08 21:12:11",28,325,2
"32862289","I am very regular at this place. Infact this is the best clubbing experience I have. Though I tried other pubs but m so much attached to the ambiance, people and crowd. Every Sunday to Thursday free drinks for ladies. The food is amazing. Someone should definately try chicken drumsticks here. They are yum. I am in love with this place.",5,"2019-03-07 11:53:54",5,14,0
"40482887","One of the best looking places to hangout for an bar and the dance floor is quite decent, the ambience is so nice and should defiantly have a visit,
The food is decent and the set menu they serve for lunch is good, dont expect much from service",4,"2019-03-06 16:40:33",96,144,2
"34668949","Staff was very rude. Confused the order and asked our group to leave. Worst service staff I've seen so far in Hyderabad. STRICTLY DO NOT RECOMMEND.",1,"2019-03-03 21:53:45",1,96,0
"35673715","A good place to spend an evening with your gang of friends or your partner. Has good ambience, great food and drinks.
Few negatives about this place includes not being listed on zomato gold and sometimes it gets a little difficult to get a reservation specially during weekends. But overall a good place to hangout.",4,"2019-03-03 17:51:08",9,10,0
"551489","This place is awesome compare to the nearby restaurants in gachibowli Ambiance is 5/5.. must go place best time to enter is after 21:30 ....",5,"2019-02-27 19:08:37",8,22,0
"55220976","We were there on a Saturday night and the place was crowded as obvious, the DJ played decent tracks and kept the crowd on the edge of their seats. We had a good time with the booze and the food. Be there on weekdays if you are looking to spend time with the friends. Wanna go crazy weekends should be your choice",5,"2019-02-27 00:47:33",10,2,0
"1098687","Everytime I go to this place, I’ve experienced different experience. The staff is fine but I didn’t like the DJ. Only once I have enjoyed a lot with good music out of 5 times. A heart cup is far better than this. ",3,"2019-02-26 05:16:43",1,56,0
"49172581","Great food, awesome music!! Service is very fast and portions are apt considering the price. Staff demanded for tips, that was the only bit that was annoying. But rest was an amazing experience!!",4,"2019-02-23 23:14:43",1,2,0
"52357596","The DJ that came on around 11 PM yesterday night (some lady) was a terrific disimprovement over the guy who was playing right before she. Killed the buzz for us entirely (and for many others, too, visibly). Liked the ambience, though. Would want to visit again iff the same DJ never presents themselves again. ",1,"2019-02-23 14:38:45",5,0,0
"44316923","So unprofessional place being a girl I felt the staff was inappropriate on behaviour and I love the Dj anyways over there but the staff is making the place worst so freaking rude ",1,"2019-02-22 21:48:22",5,9,0
"39566698","They serve you wine in plastic glasses. Staff is very rude and unprofessional and they literally force you to pay exorbitant tips at the end. Was a loyal customer earlier, never coming back here ever again. Try 10D or the lal street instead (in the same building). ",1,"2019-02-22 11:54:46",5,1,0
"40383879","I guess have been here for almost 10 times. Every week when Friday comes I really miss club rogue. It has become like my permanent place for freaking out!! Everything is awesome here you just name it weather it be food, Serivice , ambience anything picture perfect. ",5,"2019-02-21 19:45:00",5,50,0
"29190173","Visited the place on a weekday but it was jam packed with people. The music was too loud to the point that we would not able to discuss on what to order across the table. I have been to many places but never had such loud music. My ears were ringing after coming out. 
The service was the worst.. All of my friends went to the dance floor and I was stopped by the staff who asked not to leave the table and asked me to deposit my id card. This was pretty humiliating. This place probably sees too many dine & dash incidents given the kind of crowd it caters to. 
The food was average at best. 
They entered ₹200 as tip on the pos machine trying us to pay that for this s***ty service. 
The valet meddled with my car's infotainment system. 
I will avoid this place from now on and stick to more classy places. ",1,"2019-02-20 22:56:41",4,27,0
