"UserId","Review Text","Rating","Time","Reviews Count","Followers Count","Photos Count"
"48019984","Must try for a mallu to get a flavor your shakes back at home. Expect a bit of waiting time during peak hours. It's best with quality and price.",4,"2019-05-18 13:40:47",5,0,0
"40984746","An excellent little place. Reasonable prices. Especially the cold beverages and faludas are must try. You can feel that the burgers, sandwiches and other snacks are made with lot of sincerity. ",5,"2019-05-03 14:52:07",12,2,0
"39611297","De Bohemian Cafe...
This new tiny little place with a quirky vibe to it...
The food served was fresh and delicious.
The sandwiches were perfectly grilled ... Not too grilled and hard nor too little to be soft ... It had the perfect crisp to the bread🍞 and the filling was flavorful and fresh.. I had the grilled chicken sandwich and the chicken sausage sandwich both of them were a delight to eat...
After a long draining day at work if tea☕ is what you go back for then definitely grab a cup of this refreshing sulaimani tea which is basically an elaichi flavored black tea... It is has a frangrant and refreshing flavor which could just fix anything 😇...
It is a very pocket friendly, warm and welcoming place.",4,"2019-04-04 19:46:05",22,92,2
"52169296","The ultimate student cafe it is. A very Pocket friendly cafe serving quality food. You should try the avil milk, Sulaimani chai, and all the types of Faludas, these are just awesome. ",4,"2019-04-01 01:07:52",108,241,0
"45688758","Amazing place with dedicated workforce. Got a nice ambience and a cool get to to it. Amazing quality and quantity at affordable rates. Only drawback is the place is a bit too cramped. Believe me guys they gotta expand because it's gonna get crowded in few months. It's a Hit for sure....keep up with the good work",5,"2019-03-30 20:09:59",29,15,0
"4965301","One amazing place in lingampally.. really a heaven for University students as it's as very near to back gate and serves awesome drinks and yummiest sandwiches and burger.. just give it a try and you'll never stop visiting this place",5,"2019-03-27 01:22:06",22,89,2
"2317944","This place HAUNTS you to visit again.
Food is made with so much love here and you can make it out.
🏠Ambience is good and they have made an effort to turn this space into as boho as they can. Perfect Adda for college students or for others who want to have some lipsmacking food.
🥪 Sandwiches were Divine! Where can you experience divinity for forty bucks🤩? Bread slices are grilled gently as not to hurt them much and this kept the bread fresh and moist.
Grilled Egg Sandwich had a perfectly cooked plain omelette inside topped with fresh and raw veggies making every bite very delightful.
Grilled Paneer Sandwich had overflowing amounts of paneer and sauce. Soft Bread slices with soft,mushy and creamy paneer inside was really a treat to have. Oh! They have taken care of your dietary fibre intake also by adding lots of spinach to it.
🍹Lemon and mint juice was a great refresher with exact amount of sugar and mint leaves.
This place has an elaborate menu ranging from rolls to faludas at pocket friendly prices. Service was prompt and you will be informed of your wait time if there is any delay.
HCU's back gate is slowly becoming an hub for affordable, tasty and quality food.",4,"2019-03-19 23:15:42",81,869,1
