"UserId","Review Text","Rating","Time","Reviews Count","Followers Count","Photos Count"
"16589305","Rating: 4.5/5
The good old Shanghai Chef 2 has now merged with Kobe Sizzlers to provide you with a varied range of sizzlers and some other dishes.
The ambience now is a mixed up combo of chinese ambience along with the touch of Kobe's global ambience here and there. The place is located in the hustling street of Indira Nagar (Gachibowli) on the first floor.
The disappointment initially was they didn't have the signature French onion soup. So for starter we ordered the Singapore Chilly Paneer. The dish was a slight spin off to the regular Chilly Paneer, because of the tinge of Singapore sauce. The taste was a perfect balance between sweet spicy and tanginess, however it was slightly bland but I would recommend it.
Next up was the Kobe Special Sizzler priced at Rs.529 was a bit pricy. The quantity is sufficient just for a person or at max two, it has 250 grams of paneer, 250g of veggies and another quarter kg of rice/noodles. The sizzler is served with both noodles and rice along with some spinach, veggies and a minute quantity of fries. Before coming to the taste I would suggest ask to make the sizzler bit more saucy as the paneer otherwise would be bland and ask for some more fries or mashed potatoes instead. They offer quite a few sauce dips like garlic sauce which helped us enhance the flavor of the sizzler. The paneer was extremely tender and rice and noodles perfectly blending with the saucy paneer. The taste was decent and became good after the addition of garlic sauce.
Next up from the Chinese kitchen was the Schezwan Pan Fried Noodles, this was truly one of the best pan fried noodles I have had in town. The noodles were perfectly fied and the sauce was having just the right amount of veggies and thickness. The taste was adjusted to our pallete by reducing the spice a bit. The quantity of noodles is again just right for one hungry person. This is truly recommended.
A special mention to Suhail who came to us in rescue and suggested the perfect dishes to order and made sure that the visit was worthwhile.
To all those reading so far make sure you reach this place before February ends so that you can use up the Dineout coupons.
Taste: 5/5
Service: 4/5 ( bit slow)
VFM: 3.5/5 (slightly expensive)",4,"2019-02-01 22:07:24",57,446,2
"70509437","Sohail has been such a great host. Great ambience, and super delicious food. One of the best, finest sizzlers I have ever had in Hyderabad and it's totally worth it. And very patient and pleasing staff. ",5,"2019-01-31 21:20:59",1,0,0
