"UserId","Review Text","Rating","Time","Reviews Count","Followers Count","Photos Count"
"37165508","Good food and great service! Suhail was super helpful in helping us figure out what to order. The sizzlers were great and the drinks were good too. ",5,"2019-05-12 23:09:45",6,8,0
"131848","A good variety of menu especially for vegetarians. The wide variety confuses what to choose, but Suhail just makes it easy. He understands the taste the customer wants and suggests the dishes. The recommendation by him was Vegetable sizzler and a Mushroom and Cheese sizzler. The mushrooms were really seasoned well and had a great after taste. Highly recommended for Mushroom lovers!!. My friend and I are really happy and satisfied with the food and service. Kindly do come to this place. Best place to have sizzlers in Hyderabad. And when in doubt, always ask Suhail. ",5,"2019-05-12 22:03:32",3,2,0
"1308988","This place is co-existing with Shanghai Chef another chinese chain..its nothing like,if you been to any other Kobe chain . sizzler is overpriced for ambience. Restaurant is under staffed effecting service. Two franchisee in same retaurant dilutes brand of each.
Only good part is food taste, lives up to Kobe standard. Vegeterian ok. ",2,"2019-05-12 02:39:07",69,66,0
"2985206","Its the fame of Film Nagar Kobe sizzlers that bought me here. This is a little confusing place to begin with as they share the space with Shanghai Chef. As a result, it is crowded and a good ambience is out of the window. Be very mindful about the parking limitations as the street where the restaurant is located is very narrow and crowded at night.
The food was rather not up to mark. We ordered two sizzlers and neither matched our expectations. Add that to the relatively slow (not unbearable) service. In short, not that great of an experience. Sorry to say, but not coming back here. ",3,"2019-05-11 23:09:10",14,5,1
"69354023","The Veg Sizzler here is just above average. Didn’t really like the noodles in the sizzler, rice option is still better. Don’t really know about the non-veg options.",3,"2019-05-11 22:15:06",2,1,0
"659713","I just loved the food here. We were a group of 8, is I almost tasted most of the sizzlers and trust me all of them are unique and good. Every one of us liked the food. But the ambience is something which is not good. It is in the Shanghai Chef restuarant itself and due to low maintenance the place looks very very average. Would be better if they improve it. ",4,"2019-05-11 13:44:48",56,317,0
"34814235","It is worst in handling the payment modes, every time I visit this restaurant making issue in payment. Before coming here check with paymodes with staff and visti",1,"2019-05-10 13:49:42",2,3,0
"35331964","The starters are too good.Being vegetetian, I found lot of options for veg food. I tried starters like Singapore paneer,crispy corn,honey chilli potato.sizzlers are not one of the best but worth a try. Overall very good tasty food outlet for sizzler and Chinese food.",5,"2019-04-23 22:45:03",1,1,0
"10415171","The ambience is normal dine in. Not much great ambience. It is pocket friendly place and the Chinese is good. the sizzler tastes not that great. Also the rice was over cooked.",2,"2019-04-22 12:41:39",18,22,0
"52977930","Loved this place. Tasty food and awesome sizzlers..Ambience is very good. I would like to thank owner Cum chef Suhail for his suggestions on must try dishes at Kobe...",5,"2019-04-18 23:32:22",2,1,1
"30771454","The restaurant is located in a busy place Vinayak Nagar , Gachibowli.
They have collaborated with Shanghai chef recently.
The place is small with limited seating so it's better to reserve a table in weekends before a visit. The ambience is okayish.
We ordered Toridiango and Hokkaido chicken sizzler with noodles.
Even though the preparation of the patty, french fries and veggies were good in sizzlers, the noodles was very bland spoiling the taste of the whole sizzler. Both the sizzlers needed seasoning.
However kobe sizzler is well famous. Would maybe try with rice next time but they need to improve with their sizzler preparation with noodles.",3,"2019-04-15 00:54:25",29,72,1
"32509115","And Finally, Kobe Sizzler is here in Cyberabad.
I had been dying for a good Sizzler place to open up in this part of the city.
Kobe Sizzler is as good as it gets here in the city.
Being a national brand, they do maintain good standards.
I tried their crab meat soup, the Kobe Special Chicken Sizzler, Lamb Shashlik sizzler and a Veg sizzler.
The soup and both the Non-veg Sizzlers very quite good.
The shashlik was perfect. The lamb meat balls were divine.
My vegetarian friends however were not very impressed. So, maybe they can improve on their Vegetarian menu.
But, I personally had a very good experience, eating at Kobe.",5,"2019-04-12 12:33:10",117,980,3
"33851177","Overall nice experience. Not the best sizzler that I have had but decent enough. Well priced.. daarsan was a new thing for me and i liked it well. Courteous staff. Good decor. ",4,"2019-04-11 14:24:34",74,63,2
"34691479","Just awesome.. Sizzlers have the same taste as of Film Nagar branch and simply loved it.. Due to some service issue, the owner Mr. Suhail came to our seat and made sure we are served properly. Kudos to Kobe Sizzlers!!",4,"2019-04-07 20:05:09",88,187,0
"29973853","Sizzlers were pretty good. However, the paneer starter we ordered wasn't up to the mark. Will have to raise the bar a bit if it has to come at the top sizzler serving restaurants.",4,"2019-04-06 18:10:48",25,5,0
"16100018","I went in with 10 of my friends and had a blast. The Sizzler's were amazing! The hospitality was great. Suhail was a great host and personally looked after our requests.
And To be honest after ordering mindlessly, we had a lavish dinner under budget. Totally worth it.
They can probably improve on the Ambience!
Other than that, a really good place.",5,"2019-04-06 13:25:50",78,510,0
"16012287","I have tried Kobe's sizzled previously at Bangalore, and this was my first visit to Hyderabad branch.
Although I ordered veg sizzler(Never my first choice though in sizzler) and Honey chilli potato, however, I must commend the chef, as my taste buds were satisfied.
Good service ( though it could have been faster therefore only 4 stars).
Plus point for IPL fans, they are streaming the matches also on a big projector.
Enjoy...",4,"2019-04-05 21:46:15",19,83,0
"29821442","Kobe sizzler isn't new to me! But it's new in hyderabad. Good interior, quick service.. Decent price! Sizzlers were tasty. But I wouldn't say best sizzler I have ever tasted. It could have been better. Daarshan was good though.. Overall, nice experience! ",4,"2019-04-05 13:42:43",187,2858,4
"125714","Sizzler, originally from Japan is teppanyaki styles dish which rose to popularity in 1950’s. It’s essentially a meat based dish that is seared at a high-temperature to a crispy texture outside and is left moist from inside. With the growing demand among patrons, it is customised and made with Vegetables and Paneer as well. Served with steamed vegetables, a side of French fries/Potato wedges, choice of Rice/Noodles it forms a meal in itself. 
A dish which is supposed to be enjoyed at leisure as the contents are served in a hot iron plate encased in a wooden frame. If the wiki has to believed, Sizzler was first introduced by Mr. Firzon Erani in his restaurant “The Sizzler” and was soon inspired by other outlets such as Kobe who is now branched out to International locations as well.
The second branch of Kobe in Hyderabad is managed by the same enterprising and humble personality Mr. Suhail. While eating Sizzlers is an gastronomical experience, meeting SuhRac (as he is fondly called) is another who is a benchmark of great hospitality. His generosity and modest attitude of receiving guests and strangers with a warmth would definitely make you to come back for more.
I was here with my Team of 35 members to feast on Sizzlers and though it took a bit longer time to serve each of them but the entire Lunch turned out to be a great affair at the end. 
We vegetarians tried their Signature and Paneer Steak versions. Signature true to its name was more enjoyable due to large chunks of grilled paneer nicely roasted to a crusty base but still soft from within nestled with vegetables resting on a mount of rice and side of Potato Wedges finished off with sauce. For someone who enjoy a bit of more flavor, ask for extra quantity of garlic sauce as I found it to be insufficient. Few of my team members, trying for the first time were fascinated to the smell and sound of the sauces dribbling on the hot iron plate as it reached their tables.
Before the Mains, our taste-buds were welcomed by Mongolian Soup, a thin broth perfumed with flavours and abundant with fresh veggies. Chilly baby corn was equally delicious with those quintessential curry flavours and crunch of fritters. 
For few of them who were not very comfortable with the idea of eating those grilled and steamed stuff from the hot iron plate, were pampered with multiple versions of Fried Rice and Noodles. 
The eggless Brownie, so rich and decadent, with pleasantly bitter after-taste have my heart. I was surprised at the taste and texture as its quite rare to find such well made brownies.
The ambience is nothing fancy but comfortable to enjoy Lunch and Dinners. The quality and quantity coupled with ongoing Zomato Gold makes it a stellar option for someone who wants to try a different cuisine out of their comfort zone.",4,"2019-04-03 14:39:29",149,1676,3
"194818","Visited this place for the second time last Saturday. The first time I visited this place was disappointing. Second visit was a pleasant one.
The mutton soup was tasty.
The Lamb Shashlik was tender and juicy.
Nasi Goreng was overstuffed with rice but the flavour was good.
Szechuan and Chilly chicken sizzlers were good.
The mocktails were just okay. Fruit punch was probably the best one.
Overall a worth visiting place for sizzler lovers.",4,"2019-04-02 18:29:31",5,2,0
"2707270","Slight confusion on whether it's the right restaurant or not as soon as you enter cause it's clubbed with Shanghai chef.
Sizzlers are super healthy. Had paneer, chicken and the fish sizzler. Keep your tummy light if you wanna have the whole one. Taste wise 5stars but ambience is confusing hence overall 4 stars
Cheers",4,"2019-04-02 17:16:51",15,20,0
"8891851","This place is surely a delight to all the people who love the sizzlers! The lamb sizzlers are exotic indeed. We had the red chilly Lamb sizzler, Hokkaido chicken sizzler, chicken sizzler with garlic sauce and the Kobe signature sizzler. They have a option of rice or noodles to go with the sizzlers and I personally would opt for the rice. The veg starters were also good. It is a nice little cosy place with really good food. A must go place for sure!!",5,"2019-04-02 10:36:03",8,111,1
"2200258","Stopped by Kobe Sizzler on the way to Gachibowli. I have had Kobe Sizzlers in Mumbai before and the ones here did not disappoint. We tried the fish sizzler (sole fish) and sizzling chicken in garlic sauce. The sizzlers were portioned well and the sauces were delicious. Overall for the food 5/5. Quick and attentive service. ",5,"2019-04-02 00:28:24",29,259,2
"47725510","Great place and awesome food. Ordered Sizzling Chicken with szechuan sauce, Exotic veg and fruit punch. Honestly, sizzlers are the best in town here. All credit goes to the polite and humble owner Mr. Sohail. It was very nice meeting you sir. Keep up the great work. All the best. Will visit again and recommend it to everyone.",5,"2019-03-31 22:51:14",1,0,0
"38781414","So glad we found this amazing Chinese place. We didn't try any of their sizzlers but me and my friend loved the mei food noodles which was glass noodles with stir fried veggies and burnt garlic chicken! The food was not overwhelming neither was it underwhelming. It was a pleasing meal altogether. ",4,"2019-03-30 22:37:42",8,13,0
"36174068","Decent food..friendly staff..meat was a bit raw cooked.......thanks to zomato gold saved some money with bill...i am satisfied with what i ordered..",4,"2019-03-30 10:57:22",10,5,1
"37307462","Went this place to try soup. Serving was fast, nice ambience. Taste was good, staff was supportive. They only suggested the soup varities...",5,"2019-03-24 15:51:33",25,6,0
"2517906","Really loved Sizzlers. Prawns and Fish sizzlers plates were too good. Best place to Hang out with friends for having experience of sizzlers .",5,"2019-03-23 21:04:27",3,1,0
"33283450","Great place and delicious food.
We ordered one Kobe Signature veg and Kobe Signature non-veg.
Importantly, Sohail, the host of the place was very warm.",5,"2019-03-20 23:17:16",1,46,0
"4588001","This place is merged with shanghai chef and I came here for my team dinner. The food is delicious especially lamb shashilik sizzler and chicken man how soup. Even the veg dishes are good here.  ",4,"2019-03-18 21:05:19",33,54,2
"38578201","Kobe sizzler is one of the place which is known for its best sizzlers. Been to Gachibowli branch and had ordered Prawn sizzler and Kobe special veg sizzler.  Taste - 4
Service - 5 (special thanks to Suhail for the suggestions)
Ambience - 3.5 
Overall good experience ... ",4,"2019-03-18 18:52:15",8,8,1
"37744069","Been here for dinner last night,
Food was very average, we've ordered two sizzlers veg and non veg, both are kobe signature dishes. Unhappy with taste and slow service.",3,"2019-03-18 08:01:00",16,5,1
"1128445","Love the sizzzzzler....ordered kobe's signature Sizzler as suggested by Suhail and it turned out to be good...so hot and yummy...Definitely one should try Kobe ...love it!!!",5,"2019-03-17 23:00:52",4,68,1
"578289","This place has AMAZING sizzlers - probably the best one I've had in a really long time, and definitely the best sizzler in Hyderabad. Suhail, who served us, recommended the Kobe signature and Roasted chili lamb sizzlers. Both were out-of-the-world yummy! It's a small and cozy place that shares the seating area with Shanghai Chef. I'd love to go back and explore their menu further. ",5,"2019-03-17 22:21:30",29,131,2
"51999296","I was at Kobe Gachibowli last evening to enjoy sizzler. We were a group of 12 and we thoroughly enjoyed the food. Suhail demonstrated great customer obsession right from helping us park the cars to the time we said bye. I have like Sizzlers and I have been to Kobe at BLR Brigade. However, Gachibowli being at stone throw away distance, it is a treat. We loved the food, kids loved starters and sizzlers were great, of course followed by Sizzler Brownie. The only things Suhail may want to work on in near future is to give his place a bit more fancy look. Cheers. Thanks to Suhail again. ",5,"2019-03-17 10:08:24",2,1,0
"54532340","Have been there. Ambience is good.
Food that we ordered were veg burger, veg sizzler and fries.It was enough for 2 people. Veg burger was good. Sizzler turned out to be very ok ok. It was too great to be there again.
Staff was polite and courteous. ",4,"2019-03-17 02:54:19",22,12,0
"16284586","The first time when I had a visit to Kobe's was when I was in Kochi. So when Kobe's opened in Hyderabad ( Film Nagar), we had to visit and indeed it was amazing.
Since I stay near Gachibowli area, I was really hoping for a branch near Gachibowli and it did happen.
On Valentine's Day when we were searching for places, I stumbled upon Zomato's newly opened list and seeing Kobe's in Gachibowli was a huge surprise.
We had called and booked the table but when we reached there, it was so crowded and they did not have proper reservation mechanisms and people were just jumping on to the chairs that just got emptied. We were disappointed. After waiting for almost 40 minutes we got a seat and the food took another 30 minutes.
The food nonetheless was amazing that day.
So this was like my 4th visit after that day and it was never crowded since then.
The sizzlers they offer are the best I had in Hyderabad. Even comparing to the Film Nagar branch.
We ordered :
1. Kobe Signature Veg sizzler - A speciality of this sizzler is that you get both rice and noodles with this and it has a tangy tomato flavour to it - 4/5
2. Chicken Satellite sizzler - As mushroom sauce is one of my favorite choices, this is my favorite sizzler from the menu - it has mushroom sauce along with cheese and cream, which makes it so mouth watering - 4/5
3. Vegetable Spring Roll - Even though am not a fan of veg starters or bites, these got my attention. They were nicely flavoured and had an amazing filling - 4/5
4. Grass Hopper - Drink - I actually like the grass Hopper at their film Nagar branch better - 3.5/5
Overall -4/5
Definitely a must try if you are a fan of sizzlers. ♥️",4,"2019-03-16 14:17:30",22,90,2
"49630916","With the name Kobe ,gets back the memories of Kobe Mumbai’s sizzlers And that’s what attracted wandering palate to Kobe’s . 
Though this one is merged with Shanghai chef restaurant which has a average ambience . 
Suhail is a great host with extremely fair  knowledge of the food and well versed with the presentation functioning around the restaurant . 
However V were not very happy with the sizzler as I ended up comparing to Kobe’s other Branches outside hyderabad . I felt the garlic sauce lacked the authenticity the punch and the portion size was very very less  . 
Thou the nasi goreng turned out above average . 
https://www.facebook.com/wanderingpalate/",3,"2019-03-15 22:26:56",29,80,2
"35253167","Delicious sizzlers. Kobe is always my favorite place to have sizzlers at. Have been to film nagar one a lot many times. Thought of trying the newly opened branch in Gachibowli and like every time, satisfied my taste buds.
Veg sizzler for me and Chilly Prawns sizzler for him. And not to forget a gracious host, Mr. SuhRac. ",5,"2019-03-13 23:25:04",3,22,1
"15812947","I go to a restaurant for good food and good service. I visited the place twice and had a great time.The sizzlers were amazing, the owner couple run the place and are great hosts. I was a complete stranger to the owner couple and they not only helped me select the right sizzler for my kids but also customized it our taste. Overall it was a great dining experience.",5,"2019-03-13 08:43:16",4,0,0
"34823516","Had been here on a Sunday night for dinner. Not only were the sizzlers amazing but the mock-tails too were lip-smacking. Had a great time there. The service was upto the mark, the only minus point i felt that the ambiance was too loud as compared to the jubliee hills outlet.",5,"2019-03-11 15:09:03",8,39,0
"60763533","THE best place for Sizzlers in Hybd.. i loved it. My only complain was strater which we order Fish and chips could hav been better..salt was less in Fish",4,"2019-03-10 22:48:42",13,10,0
"1265234","Been to this place for dinner once and was disappointed with the food. A forgetful experience to say the least.
We had ordered a soup, a starter, and of course Sizzlers as our main course. The place has no ambiance, the music was decent, the food was blah!
The soup (Tom yum goong, I am unsure of the name) was amazing, which was a good start. But things very slowly (much like their Pace of service) went downhill with the starter. We'd ordered Classic fish and chips, to say the very least it was bland (no salt or any other condiments were added to it) and the fish stank.
Sizzlers - we had ordered 2 of them, the prawn one and the fish one. Sadly enough both tasted pretty much the same, forgetful.
Food - 2/5 (just because the soup was amazeballs)
Ambiance - N/A
Service - 2/5
P.S. - Not recommended.",2,"2019-03-10 18:25:07",54,91,1
"285441","Had a very forgetful experience at Kobe. Usually Kobe is well known for their spread of steaks and sizzlers across the country, having visited their outlets in Pune and Bangalore, I had a set standard of how the food will be, unfortunately was let down in Hyderabad. We had ordered a starter of fish and chips and a Hokkaido sizzler with rice and fries. The fish and chips were horrible, outright sad, no salt, no condiments, absolutely bland (no salt kind, not continental kind), somehow they managed to not put salt in both the fish fillet and the batter, beats me how though. The sizzlers were relatively better off, but then again no steak knives. We had to manage with a butter knife to eat the meat, which was again lacking in salt. The sauce wasn't as good as I remember, but the meat was nice and juicy. Pretty sure we won't be going back again. I think a major issue is the fact that this place isn't a steak joint, but a Chinese restaurant serving Kobe's menu. It is lacking in proper ventilation and requisite cutlery to support a steak and sizzler menu. Perhaps they should look into it else most Kobe enthusiasts might just skip this place entirely after the first time. ",2,"2019-03-10 09:54:27",11,136,0
"53404133","Pathetic food..we ordered two different sizzlers but both were having horrible taste and veges used were horrible in taste and not baked well. Not worthing going place ...taste of sizzlers of kobe sizzlers at jublee hills and here are completely different. Ambiance not at all healthy , cockroach on table😖😖😖never visit this place",1,"2019-03-07 22:56:26",2,1,0
"32209785","Shanghai Chef 2 has partly turned into Kobe Sizzlers. So don't worry if you have entered one and wondering where you are.
Speaking about the food, we ordered a fish shashlik sizzler which was perfectly cooked and tasted like the sea, but was of no match to the Roasted Chilli Lamb sizzler. Its a dish you'd always remember having.
The price may seem a little edgy, but thanks to Zomato Gold, it dialed down a lot.",5,"2019-03-02 09:49:13",1,56,0
"34950150","Ordered a paneer chilly sizzler and I must say, it was yummy. The veggies were appropriately cooked, good amount of paneer which was tender and juicy and mashed potatoes were cooked to perfection. Undoubtedly, the best sizzler I had in Hyderabad",5,"2019-02-24 22:43:38",2,1,0
"36585534","Ordered paneer steak and paneer shashlik sizzler as a part of Zomato gold. Taste was awesome, quantity was also good but felt a little over priced. ",4,"2019-02-24 09:06:12",4,30,0
"1202564","Okeydokey! Kobe! The sizzle house! Where do i start from. Okey!
So i've heard about Kobe many times in the past, have been waiting to go to the other branch at Filmnagar, but then today was the day. Just opened the Zomato App and checked for newly opened Restaurants @Gachibowli and here i see, Kobe! WOW! 
I go there. I see its a small place. Just right for a decent foodies to get in. Promptly seated! Just two of us. I had made up my mind what to eat. The other friend was a first timer on Sizzler. Ordered a Veg Chilly Paneer and a Kobe Signature Non-Veg Sizzler. And while we were waiting i see this person roaming around, could make out he owns it or he might be the main guy there. So i ask him ""Hey, when did this branch open"" ... ""We opened this on 1st of Feb"" ... and we began talking. 
That is Sohail. Who had the Master franchise of Kobe Sizzler, and i must say, it's in the right hands. I've tried Sizzlers in many places in Hyd, there are honestly just a couple of them who do it the right way. We know Indijoe was one big player and it completely nose dived recently. But this place, to tell you how much i enjoyed it, I'll ask you to check one of my photos i posted in this review, the one with the empty base, thats how much i enjoyed it. I hadn't cleaned the sizzler base ever before like that anywhere.
You see, eating sizzler is a thing you need to do when you have time. When you are hungry and have the patience to let the flavour of the smoked cooked veggies and rice get to your taste buds. It's hot, it's tasty and you cant gobble on it. You cant sit there and ask them to make it fast, you eat it slow & it's also prepared with lot of care. It needs to taste right, or you wont like it.
Sohail was very nice to us and served us a drink i guess that wasn't on the menu and that's his recipe, i name it ""Twisted Chocolade"" hehe, Chocolate, Lemonade and what not, it was nothing like i tasted before. Was very kind of him to compliment us with it.
All and all this place Sizzles and how. Be patient, go there, sit, eat, indulge. Ahhh! Exquisitely enchanting lunch! Thank you!",5,"2019-02-22 14:45:54",54,68,6
"59072370","Awesome in taste and especially the flavours of Veg and Non veg both are good ....
Must try items....
And the hospitality by Suhail Bhai and team is always good ",5,"2019-02-19 00:27:05",2,0,0
"52676906","Waited for over an hour to get the orders, staff was unattentive, had to remind them even to setup ccutlery.The restaurant is terribly understaffed and wait times for orders are totally unacceptable. ",1,"2019-02-17 22:08:03",1,1,0
