"UserId","Review Text","Rating","Time","Reviews Count","Followers Count","Photos Count"
"53308089","Food was good and filling, but a little spicy.",4,"2018-06-23 21:44:09",3,2,0
"31222082","food was stale and taste was not good. need to improve alot.",1,"2018-06-22 23:54:54",1,0,0
"53387579","some items were pretty decent, & some where not as good, after order contact to restaurant.",3,"2018-06-21 10:02:08",6,2,0
"56724101","biryani was dried and chicken quantity was less",1,"2018-06-15 18:19:54",2,5,0
"991885","Please reduce the oil",5,"2018-06-15 00:39:14",5,128,0
"29081127","they didn't provide onion and sauces even I mentioned also...And food quality is also not that much good...Yes only starter is awesome...",2,"2018-06-10 10:22:50",7,0,0
"32789570","Quantity was good but food quality wasn't good at all..it was very greasy and oil used for cooking was not good either .
Only good thing was rates . Price was reasonable but quality was compromised",2,"2018-06-08 00:42:03",5,1,0
"30771219","good",4,"2018-06-05 13:38:48",5,0,0
"34011445","Food tastes awesome here.",5,"2018-05-31 21:15:18",3,3,0
"51947922","on time delivery",5,"2018-05-31 20:53:41",1,11,0
"54813084","Worst taste ",2,"2018-05-31 01:54:20",3,1,0
"54214155","Thali was not as good as other items",2,"2018-05-28 10:46:21",2,0,0
"45651238","Starters are good compared to Biryanis",4,"2018-05-26 15:34:36",1,1,0
"52281685","Such a worst experience..The haleem is not Haleem..Initially they gave mutton Curry then when we asked about Haleem they gave some other thing..Recommended not to visit this place..very unhygiene kitchen..",1,"2018-05-23 19:31:44",1,1,0
"52614035","good ",3,"2018-05-22 19:27:26",5,1,0
"656158","The haleem is not haleem but chicken bharta and cold drinks were missing from the order and there wasn't any chicken piece in one of the biryani and the quality of biryani is pathetic. I've never tasted anything worse than this. Kindly avoid food from here.",1,"2018-05-20 23:38:24",122,4865,0
"51905530","thank u",5,"2018-05-20 12:36:40",1,5,0
"52368361","Good Food for Good Price...... Taste Once",3,"2018-05-17 01:37:43",2,1,0
"644896","Ordered for a Bengali veg thali along with Chilli Egg...Delivery was before time and packaging was just perfect.
Coming to the food,
the Thali was good with a variety of rice,Luchi(puri),a mixed veg,dal and a sweet..a bit less oil here and there would actually help, otherwise fine.
What I liked was the Egg Chilli...nicely marinated and fried cut pieces of egg with an amazing gravy. 👍👍
Will order back soon!!🙂🙂",4,"2018-05-15 19:39:56",101,1127,0
"37811097","Paneer fried rice was worst i ever had... chicken lollipop was vth full flour and old stock one...never try any thing over here...the worst place for food..fried rice was vth white rice",1.5,"2018-05-15 15:17:11",4,28,0
"51584963","spoiled food",2,"2018-05-14 23:59:41",1,1,0
"53676474","Mental service ",1,"2018-05-13 21:34:26",1,1,0
"52749729","Geek salad quality need to improve.",5,"2018-05-13 21:16:13",5,4,0
"52606632","not good",1,"2018-05-13 00:01:38",1,15,0
"53436599","deadly combination of awesome quality and good quantity.",5,"2018-05-12 14:14:06",2,1,0
"51227955","worst food waste of money",1,"2018-05-09 20:52:34",3,0,0
"41398547","I ordered for bengali veg combo but I received bengali non veg combo and the food was very bad",1,"2018-05-08 15:22:40",2,0,0
"52021482","thanks",5,"2018-05-08 01:18:32",4,9,0
"48166450","Yummy",5,"2018-05-07 14:19:17",1,1,0
"53937117","Found plastic pieces in the food",1,"2018-05-06 16:26:05",1,1,0
"51025885","I never received any order",1,"2018-05-05 23:04:58",1,1,0
"53527386","ordered Biryani rice quality is not good....Biryani is OK ..not bad",4,"2018-05-05 15:30:39",3,1,0
"46803412","Worst experience.. the packaging was so bad that the food spilled all over the carry bag... Worst food.. this is like roadside food where you get noodles mixed with fried rice. No taste only chilli powder.. Feeling really bad to waste so much food..
Never gonna order from this place",1,"2018-05-05 00:40:29",41,84,2
"37107665","the delivery was an hour late.",1,"2018-05-04 23:17:45",1,1,0
"44913792","I ordered fried rice and chilly chicken. Just not the kind of rice for fried rice. Chilly chicken was okay okay .. But the rice was awful ",2,"2018-05-04 19:56:42",1,1,0
"33059388","no sweets ",1,"2018-05-04 18:09:39",7,39,0
"53646210","Food was decent. Also very affordable. ",4,"2018-05-04 00:53:46",1,6,0
"51723849","biryani rice is not nice",1,"2018-05-04 00:09:45",13,1,0
"33417653","very bad",1,"2018-05-03 21:21:38",1,1,0
"5979711","Awesome place and awesome food. The sizzlers are so delicious.... The way they serve and the way the treat you is really nice. Best sizzlers in town guys.. ",5,"2018-04-29 21:23:32",3,5,0
"36581164","We ordered the combos. Chinese and the indian non-veg combos. The quantities were sufficient for a person. The taste was pretty good. But in Chinese combo I could not differentiate those two chicken items. Tastes were almost same but good. ",4,"2018-04-28 22:37:28",6,2,0
"43495179","loved it!! ",5,"2018-04-27 20:02:40",109,547,0
"35210852","worst food",1,"2018-04-25 00:51:05",1,1,0
"29256092","The folk from the truck have now moved into a restaurant in the DLF area and haven't lost even a bit of a touch on their taste and the price. The staff is pretty amazing and caring and were readily accepting the feedback. The ambiance is good considering the budget and pricing of the menu. Their menu offers quite a wide variety of dishes at a very cheap cost. I ordered sweet corn soup, mixed sauce pasta, honey chili potato, noodles with manchurian  and they all tasted good.  Honey chili potato was one of the best I have had in hyderabad and would recommend you to try it here. The sizzlers are pretty amazing here. I ordered sizzling with tutti fruit and fried ice cream with hot chocolate sauce and I really loved both the dishes.",5,"2018-04-24 02:46:42",15,63,8
"15651733","Food - 3.5/5
Service - 5/5
Value for money - 5/5
the location is perfect, and a good place to go to when you are working late nights and don't like eating the cafeteria food in DLF. ",3.5,"2018-04-14 14:06:07",36,138,0
"51286365","Very Very Bad Service and Taste of Food is very Bad dnt order from this restaurent..
Rice is not cooked well and chicken also not cooked well.....",1,"2018-03-26 15:13:31",6,2,0
"32872654","pathetic biryani",1,"2018-03-25 20:41:21",4,43,0
"2914830","Wide variety of sizzlers being served. Had Peri Peri sizzler and taste was average. Other varieties of foods are also available and quite cheap for sizzlers.",3.5,"2018-02-27 19:15:45",72,225,0
"1157345","Located near DLF this is the only place where we can get sizzlers at very low cost. Taste is not that great. I ordered chicken biryani also and it is OK. Visit this place if you want to try sizzlers. ",3.5,"2018-01-27 21:27:27",18,133,0
"42385323","Words are not enough for Sizzlers . What a taste . What a combinations . Minimum 3 times a week . Me and my friends visit this place . Everyone of my friends love it . And chef make sure to give us the best food everything with something new . 
Today I had cocktail Sizzlers . It's awesome . He said next time he will make even better . Waiting for next visit . Try once for sure .",5,"2018-01-08 22:54:21",3,3,0
"31801118","On one of my visit to DLF I came across food-truck serving sizzlers .Being a sizzler-lover I decided to give this place a try.To sizzle our taste buds, we ordered Hawaiian sizzler,Green apollo fish sizzler and Oriental BBQ chicken legs.
Flavor of the Hawaiian Sizzler was spot on.Juicy grilled Pineapple on top added an enhancing dimension to the coated-tossed meat.
Flavors of fish sizzler could be improved further.
Oriental Chicken legs tasted real good.Crispy flavorful non-oily coating went real well with juicy meat.But, the smoky BBQ kick was missing.
Considering the inhibitions and quality:costing  ratio they are working around with, I believe they are doing a good job.crackdownflavors.com",3.5,"2018-01-06 18:25:55",121,1005,0
"49457204","The food is very nice especially you can't miss the sizzlers over there.. with lot many food options available, this is one of the perfect places for a foodie",5,"2017-12-30 12:12:03",1,1,0
"49456117","Total menu items or good .it's tasty food for eat .but biryani taste was not good .u have to improve more than Hyderabad biryani .remaining is perfect.",5,"2017-12-30 11:40:41",1,13,0
"27379114","Has to be one of the must try out places if you are looking for good taste sizzlers at nominal prices.. The food is great and the service is also great... Had a nice time everytime I went there",5,"2017-12-28 23:33:06",6,7,1
"49306584","This is the place which services sizzlers on food truck . Sizzlers are very tasty . Should try fired noodles ice cream sizzler . Kalimishetty Sridevi ",4.5,"2017-12-25 17:01:45",1,10,0
"40365720","Amazing food, great service , a proper setup near workplace to have snacks and meals, i went recently and tried Their Special Roll , and Special Veg Large Burger , both were amazingly tasty and Option of Atta Roti in Roll made it more stomach friendly, all items are economic and pocket friendly .",5,"2017-12-21 20:14:18",4,33,0
"34023006","I dont understand why many reviews given before me have written well!
This is one of my worst experiences ever having a sizzler.
Both me, and my partner had STOMACH ISSUES after having from here!!!!!!!!!!
The menu was quite attractive and cheap, so we decided to give it a try!
We ordered the 5 sauce mix chicken sizzler.
1. The moment the sizzler reached my place, Lord have mercy!!! the SMELL of it was too disgusting that dint allow me to try the chicken much.
2. Coming to the pieces in the chicken, there was hardly any chicken, if you closely observe in that darkness there you will see that there is a small pinch of chicken, rest is some kind of maida or something!!!!!!!!
NOW, i understood why the sizzler was cheap.
NEVER going there back!!!!!",1,"2017-12-18 18:20:33",107,226,0
"15550151","This is one of the new outlets beside my office lane. I visited this on a weekday evening. They have a quite different menu from the regulars. Sizzlers are a must try here. We have tried the five spice non veg sizzler which is spicy. You get to know it once you finish it and not while having it. Another sizzler we had was paneer. Loved the paneer sizzler. Another popular dish over here is paneer pakoda. Biryani isn't much great as one of my friend's has tried it. Friendly on pockets and must try place. I will definitely go back.",4,"2017-11-22 08:55:05",44,229,6
"32087626","Sizzler was absolutely delicious. Great hospitality which I really appreciate. We have tasted 5spicy non-veg sizzler and spicy noodles non-veg sizzler. You can also have fish sizzler here. Food is affordable. 
Service - 5/5
Food - 4/5
Ambience - 3.5/5",4,"2017-11-17 21:18:08",13,42,0
"36727625","This is a sizzler serving food truck with affordable cost and good ambience situated near dlf gate 3.We ordered 5spicy Chicken Sizzler,Spicy Non veg sizzler with noddles and spicy Veg Sizzler with noddles.The quality,quantity and taste of the food is price worthy.I liked ""Spicy non veg sizzler with noddles"" most.
I loved the food and especially the behaviour of the cook.I would like to visit the food truck again.",5,"2017-11-17 21:15:00",1,3,3
"48155444","With too many regular restaurants set up all over the city, if you are looking for a different ambience and taste of food, this Food Truck is a must visit for you..!  Located right opposite the DLF Gachibowli building, this truck has a various options of dishes to choose from..!
Although I would suggest that Sizzlers are a ""must try"" when you are here..! 
Piping hot finger licking food served with 2 different sauces makes it a steal of a deal for the price you pay..! The ever friendly staff helps you in customizing your dish according to your palate..! 
They made sure that Vegans are done equal justice by providing multiple options in their Veg Sizzlers..!
Moving away from the regular dining style, you have an outdoor dining over here where you can make yourself comfortable in a cozy seating arrangement..! 
I personally loved the food and would definitely come back to this place on any given day..!
Over all Experience :
Food : 5/5
Value For Money : 5/5
Ambience : 4/5",5,"2017-11-17 13:27:30",3,2,0
"1366361","A food truck serving sizzlers at an affordable price .
Being right opposite to where I work I had to try this one, but unfortunately it's not upto the mark.
Well the pricing is bang on , the portions are alright but there are a few things missing.
First , the sizzlers are not served with either rice or noodles. Choice of meat is what you get .
Second, the chicken was overcooked and after being on the sizzling plate for a while it was too chewy .
Third, there is a distinct lack of sauces and taste , feels you are only eating chicken pieces without any Taste.
The above observations are made on an order of triple non veg sizzler.
Triple non veg sizzler has fried chicken chunks ,fried fish chunks & 2 fried chicken lollipop pieces.
Overall , for the price ,yes it can be okayish but from Taste perspective Definitely a lot to improve.
They should include a barbeque chicken sizzler & try adding some sauce options.
Ratings
Food -2/5
VFM -4/5
Service -4/5abthefoodie.wordpress.com",3,"2017-11-15 01:00:50",275,4156,1
