"UserId","Review Text","Rating","Time","Reviews Count","Followers Count","Photos Count"
"52137531","Noodle Bar used to be one of my favorite places to hangout in DLF.
Though the quality and quantity are okay when you dine in at the restaurant.
But delivery from Zomato is horrible.
Have ordered Momo's twice but the quality was poor both the times. And it has degraded to an extent that I will never order from here again.
Also they are charging extra.
Veg Momos is priced 60 in the restaurant but here it is 75 bucks.",1,"2019-05-11 22:50:42",84,368,0
"86153884","i am not sure how this restaurant has been given 4.0 rating noodles are skinny and full of sauce less quantity Zomato should personally validate the restaurant quality hygiene and ambience",3,"2019-05-02 03:36:07",1,6,0
"15763529","This is one of the best places for Noodles and Veg Manchurian Fried Rice....Wooooo my fav is Veg Manchurian fried rice with Schezwan Sauce,Love it....the started which is present made of Aloo is something you shouldn’t miss out ...for me I don’t like sweet tinge but have tasted honey aloo 65 it was tasting different but for me spicy aloo 65 was like bang on...Definitely you need to try out and don’t expect a great ambience,ambience wise it’s ok but taste wise you can surely look out for",4,"2019-05-01 17:59:33",62,115,3
"83825014","I love this place. The combos are good and mouth watering.
The price is also justified. The best dish is lollipops.
Will be visiting here more to try out their other dishes. ",5,"2019-04-29 19:50:36",3,1,0
"4743521","Its been 3 years since I started visiting them. 
Previously they used to give momos and pasta. I must say I was a fan of their chinese pasta. 
The footfall at the restaurant is a testament to the fact the deliciousness that is served over there.
The food is priced right with the authenticity  intact. And the secret lies in using good quality sauces.
They  dont compromise on quality and that is what have kept them in the business and growing. 
Everything is at best over here. 
My personal favorite, Soya honey chilli chicken and I am heading right now to have one.
Less is More, so no need to say more!
Taste: 5
Service: N/A
Ambiance: N/A
Value For Money : 5",5,"2019-04-29 19:40:53",207,1048,0
"39819841","I have ordered twice from Noodle Bar through Zomato and I am in absolute love with this place.
It's very hard to find reasonably priced authentic Indian Chinese food in Gachibowli. And I finally found that place. I am yet to visit the restaurant, but I hope I'll do that soon.
This place is just perfect for my Chinese food cravings.
Both the items I tried were Chicken Chilly combos. My choice of sauces were hot garlic sauce and soy honey chilly sauce. I ordered it with fried rice. They have options for noodles too. I still can't decide which one I liked more, because both of them were SO good.
The fried rice had quite a number of chicken pieces, the chilly chicken was super delicious with lots of capsicum, onions and chicken in it. Usually fast food centers or small restaurants tend to put a lot of batter while frying the chicken. But this one was more of soft and tender chicken with a thin layer of batter.
If you stay nearby, I highly recommend trying out food from this place. They have a limited menu, but quality matters more than quantity!
Quantity: 5/5
Value for Money: 5/5",5,"2019-04-26 17:13:53",18,41,2
"33568646","A casual hangout..!
We’ve tried fried veg momo, veg noodles with gravy Manchuria and burnt garlic egg noodles. 
The taste of the food was good but Momo’s were oily. 
A pocket friendly place. 🙂",3,"2019-04-24 05:19:10",85,917,5
"57559588","I had ordered fried noodles in garlic sauce along with chilly chicken. What I received was normal noodles mixed with garlic sauce and paneer pieces. Never order in this restaurant",1,"2019-04-20 06:00:03",1,0,0
"46473227","One of the best noodles I have ever had. Truly, they are the connoisseurs of chinese dishes at pocket friendly rates. Unlike other wannabe chinese food outlets who add curry leaves in fried rice/noodles, or add wrong ingredients messing up the dishes in one way or the other, these guys know what they are doing.",5,"2019-04-16 13:23:52",9,1,0
"14541441","This place is located just before TCS office at DLF,beside Coconut Juice Bar. Run entirely by north-east experts of cooking, the food will taste and next to authentic is not a bad guess. Don't expect to get a place to sit or get a great ambience if you are visiting during peak times. Enjoy the food and you will not be coming back home being unsatisfied.
I have had momos, noodles, rice and chicken side dishes from here. I love the taste. I love the way they prepare and serve the food. Take your bowl, stand there and enjoy!
Must Try: Momos, rice, noodles, chili honey potato, chicken in soya-honey sauce which goes well with spicy schezwan rice/noodles.
Pocket Pinch: Your tummy will be full and satisfied and so does your wallet. 300 bucks for two if you are going for main course and side dishes, beside starters.
Payments : cash, card or Gpay but they charge 5% extra if you pay via card, god knows for what reasons.
Cons: You have to be on your toe to place yout orders, stand and see if they are properly sent to the cook. Or else, a simple order can make you wait for hours during peak.",4,"2019-04-14 16:40:42",685,792,4
"8855061","Noodles love go get it ! You should have better judgment of choosing a dish before you order! It was really a quite place in that foodie junction road. Tastes good and could have been more better than expected.",4,"2019-04-10 21:16:10",8,123,0
"16750381","Lovely place with really tasty food and an amazing staff. The place is usually crowded but there is a lot of place to sit in the back. The food here is cheap in terms of cost (Honey Chilli Potato for 70₹ is great) but it is really tasty and it's good quality too. Great options for Vegetarians too. Noodles were quite amazing too and the overall food quality, presentation and quantity is great. We tried the Honey Chilli Potato, Schezwan Potato, Burnt Garlic Fried Noodles and weren't disappointed by anything. Surely deserves a recommendation and I'll go there to keep trying all the dishes.",5,"2019-04-02 13:03:05",5,1,1
"764741","This place is perfect for Chinese food lovers. Next to authentic taste of Chinese food at decent price. Good place to hangout. The only problem is the place is too crowded for its size. And that, I think, explains the quality of the food here.",5,"2019-03-27 03:47:44",55,108,0
"98113210","I had honey chilli potato,schezaun rice and noodle Manchurian combo.The honey chilli potato was more crispy than at other places,rice was tasty would be better accompanied with manchurian ,noodle combo was good.",3,"2019-03-10 23:46:13",10,0,3
"34826982","Forget ambience, forget music! If you are a foodie, Noodle bar is the place for you. Located in the middle of an array of street food outlets, it can be identified as the busiest on that street. And why not! The food is super yumm and very light on pocket. My favourites are Thupka and steamed Momos (served with in-house mayo and schzewan sauce). Honey chilli potato is another dish on the menu that I would recommend. ",5,"2019-03-10 23:10:43",2,9,0
"34866082","If you are looking for some nice desi chinese with pocket friendly price, then look no further than noodle bar. Small joint but amazing food with descent quantity. Tried their chicken steamed momos and chicken chili combo rice. ",4,"2019-03-04 21:30:13",43,314,2
"677679","Noodle bar is a small eatery in the lanes of DLF building and is one of the hidden gems in Hyderabad.
The cooks of this restaurant are great in their skill and they present you with lip smacking Chinese food.
I have been here numerous number of times with my friends and we are still short of words for this place.
The chefs (cooks from North East India) puts full dedication in making those dishes and I can vouch that you would like every dish of this place.
Some mention worthy dishes which we loved are : Fried momos, Honey chilli potato, schezwan noodles, vegetables soup.
This place is only open at night and they don't deliver at your homes, so find a chance to visit this place and try our their amazing food. ",5,"2019-02-10 12:17:37",328,1858,0
"33804951","They have one of the best momos in the city...Steamed ones are way better than fried one
Reasonably priced not great ambience.Thier noodles combo and honey chilli potato are too good",5,"2019-02-01 11:30:29",2,1,0
"36918691","Amazing place to chill with your friends
A place you can actually hangout
Budget friendly , good quantity
Must visit
Food is really tasty ........",5,"2019-02-01 07:53:06",3,37,0
"3032462","A small food joint with delicious food items. The chicken momo and the honey chillinpotato are must try. The place is quite pocket friendly. The combos are really good. This place is highly recommended if you are a roadside food lovers.",4,"2019-02-01 00:30:50",146,332,0
"31008988","This place is located just beside the Coconut juice bar at Gachibowli. This place has got great tibetian/indo- Chinese food.I usually order the chilly soya chicken noodles with honey chilli potato. The noodles is soft and non sticky while is honey chili potatoes is crunchy and tasty. Other options also include thukpa and momos. Overall this place has got great food and it isn't harsh on your pocket.",4,"2019-01-27 22:48:42",192,866,0
"132958","Easily one of the best Chinese eateries around DLF. Serves freshly made tasty & scrumptious Chinese grub at reasonable prices. None of those harmful spice or chilli powders, they let their sauces speak for them and they are the bomb!
My regular fare is the Veg Momos & Egg Fried Rice. Their Momos are good if inconsistent at times; steamed ones better than fried. The real kicker is the hot sauce that is served alongside. It’s sticky tangy fiery goodness. 
Their noodles are of the thin variety, something very rare amongst Chinese eateries in town. They also have Wok Combos - rice or noodles, served with gravy of your choice - Paneer, chicken or manchurian in Schezwan, Hot Garlic, Soya or Honey Chilli sauces. My pick is the Chilly Paneer hot garlic sauce with egg fried rice. 
Prices are very reasonable, 60/70 bucks for normal fried rice or noodles & 100/120 for combos. There’s always a good crowd so one has to wait a while but their order taking and serving system is quite efficient so you’ll get your grub in time. ",5,"2019-01-25 03:55:28",166,459,1
"31193333","The best place to have pocket friendly, hygeinic, tasty and really well made street-style Chinese food. The egg-drop soup, chicken momos and burnt garlic noodles make a perfect meal. The noodles are light, and thin unlike other places we know. I've been here countless times now, and will keep coming back for more :)",5,"2019-01-20 19:55:23",7,44,0
"15420551","After a long time I had such amazing Chinese #love.
The place is small but the food is amazing.
We have ordered chilli garlic chicken noodle and chicken chop suey and Loved both the dish.
The ingredients are fresh and the prepare everything freshly and The pricing is decent as well. A good place to have evening snacks. ",4,"2019-01-12 21:38:48",55,1296,2
