"UserId","Review Text","Rating","Time","Reviews Count","Followers Count","Photos Count"
"93280940","The biryani was good.The service is good.suggest everyone to visit.Its a good place to come with the family and it's a place where you can visit again and again",4,"2019-05-18 22:18:55",1,1,0
"56096367","Haleem is very very good and I am enjoying the food
And nice place in paradise gachibowli
And service is very good I like it
Next time visit again ",5,"2019-05-18 21:30:09",1,2,0
"35122098","We had Haleem and mutton biryani, both of the dishes were amazingly well cooked. The service provided here is tremendous. Must visit restaurant.",5,"2019-05-18 21:25:04",1,1,0
"2741974","Chicken biriyani is very good and
Chicken pice is soft so I am enjoying the food 
Nice place in paradise Gachibowli 
Next time visit again with my friends ",5,"2019-05-18 21:14:33",1,123,0
"8141181","Great place and ambience. Service is also good.. taste is nice. Biriyani quatity is more for chicken biriyani than mutton. So order accordingly. ",5,"2019-05-18 21:01:35",1,78,0
"55311744","Menu is good.service is also good.taste is good .Biryani is good.all items are good.birya is having nice flavour.staturs or good and lime shoda is good.",5,"2019-05-18 20:33:29",1,1,0
"54918297","Food is delicious and service is also good. Environment is very good with pleasant pictures on the walls and veg items must be specially tried",5,"2019-05-18 20:26:55",2,0,0
"84403111","Delighted with the taste.Always expect very fair and good service.Value for the money!Had an awesome Hangout here.I always recommend this place.",5,"2019-05-18 17:46:36",1,0,0
"62593945","Awesome taste n assisting staff with good ambience... though its the first experience of Biryani in Hyderabad ..loved it on its peak...superb....",5,"2019-05-18 15:59:41",1,1,0
"113435909","On of my favorite restaurant...😋
Food was really awesome....and the service was great...n the manager who served me was very polite n sweet....",5,"2019-05-18 15:58:16",1,1,0
"51844920","Ege biriyani is very good and
Service is very good and
Nice place in paradise gachibowli so I am happy
Next time visit again with my friends and family ",5,"2019-05-18 14:33:24",1,2,0
"69940309","Good food and the service of quality are very good and the ambiance and hospitality are amazing t I really enjoyed the food Judi busy bug birth Nick",5,"2019-05-18 14:05:05",1,1,0
"52468854","Chiken biriyani is very good and
Muttan biriyani is very good and
Service is very very good so i am happy
Nice place in paradise gachibowli next time visit again ",5,"2019-05-18 14:03:22",1,2,0
"35965273","I am regular customer in paradise but i am first time Zomato ratting given very delicious chicken Biriyani very speed service and staff also very good  thank you paradise ",5,"2019-05-18 13:39:27",1,4,0
"54626872","Excellent food over the years . Don’t miss whenever you visit Hyderabad . You love paradise biryani much more than Hyderabad. Excellent services .............",5,"2019-05-17 21:57:24",2,2,0
"52726836","Chicken biriyani is very good and chicken pice is very soft
And
Place is very good and
Service is very good and so i am happy
And
Nexr time visit again with my friends ",5,"2019-05-17 21:33:59",1,4,0
"32852876","Mutton biryani is amazing as always. Expecting to increase the quantity. Ambience is good. Staff is good. Quick response to everything. Food was served within no time which is really appreciated ",5,"2019-05-17 21:26:17",7,2,0
"58829744","Awesome food.. But services degraded compared to last year... Will come next time for sure... But expecting thing better than this... Thank you",5,"2019-05-17 21:11:31",1,6,0
"59815313","Polite and friendly. Visited this place for the 3rd time, and the food is decent enough. Good place to visit with the family for dinner and lunch.",5,"2019-05-17 21:03:58",2,0,0
"85845118","This is my first visit gachibowli paradise i am very happy and biriyan very delicious and service also very speed and than you all service staff ",4,"2019-05-17 18:17:29",1,0,0
"50713041","Mumbaikars have heard about the famous paradise restaurant... Hence decided to try out this one with great hope.
Ambience at this place is great; however i was not really impressed with the food and service. 
We ordered :
Chilli chicken : 2.5/ 5 
Paneer tikka : 3.5/5
Chicken masala : 0.1/5 ... lowest rating possible
Chicken biryani: 3/5
Garlic naan: 2/5 
The staff were least bothered and  kept us waiting for like 20 mins jus to take order and after all that the food was very disappointing.  This is only a much hyped restaurant. I would not go and recommend this place to anyone for frequent dine experience.",1,"2019-05-16 20:26:19",7,1,0
"52579105","Ordered Mutton Haleem. It was awesome! Taste of it has been really exceptional while comparing with the big names as pista house & shah ghouse. Definitely try, if you are found of Haleem. ",5,"2019-05-16 19:42:48",15,2,0
"89505225","Chicken biryani, chillie chicken were really tasty...service is very good and nice place in paradise Gachibowli so happy
Next time visiting again ",5,"2019-05-15 21:03:16",1,1,0
"73348927","Friendly staff,ambience is so good,hygiene ,got to know about the history of paradise and the biryani here is must and should try anyone can fall in love with this",5,"2019-05-15 20:52:08",1,0,0
"1893914","Ambiance is very good and food was very good and we all have tasted different flavours our office team had a very good time ,staff were very polite and friendly ",5,"2019-05-15 20:37:37",1,15,0
"94296326","Gud food..fast service.. best people in the restaurant so fast delivery asking me to rate the restaurant nice restaurant good service many badtrips in the filed don't go",4,"2019-05-15 20:22:12",1,0,0
"30690715","Kebab was tasty also the service was very prompt the staff was very courteous too.  Kunal catered to all our needs and saw it to it we had a good time. A must visit place for all biryani lovers!!",5,"2019-05-15 20:10:45",15,90,0
"106217171","Biriyani is good and provided a good service and ur restaurant was nice and looking goodBiriyani is good and provided a good service and ur restaurant was nice and looking goodBiriyani is good and provided a good service and ur restaurant was nice and looking good",5,"2019-05-15 19:57:38",1,0,0
"52230367","The taste of the food is good. The varieties as well are many. They can work on the ambience of the restaurant. Service was pretty fast. Overall if you are a fan of biryani. You can visit it as many times as you can. ",5,"2019-05-15 17:51:45",1,1,0
"44246720","Very good service and food, chicken lollipop was delicious and so was the chicken biryani, large portions so you won’t be left hungry, please do visit",5,"2019-05-15 17:45:27",1,1,0
"30996830","Service was amazing been to biryani places but paradise birayani taste great ,
Place is cozy and great to hang out with friends 
Would love to visit again ",5,"2019-05-15 15:00:27",1,1,0
"101118153","good service firstly.. and most importantly delicious Biryani.. love to visit again good food food service visit again and again chicken biriyani only for biriyani",5,"2019-05-15 14:14:16",1,1,0
"62039503","Suprim muttan Biryani is very good and
Service is very very good and
Nice place nice in paradise
Next time visiting again with my family and friends",5,"2019-05-15 13:50:52",1,2,0
"60534866","Very delicious haleem Ian so happy feeling and service also very good haleem price also very good and haleem quantity very good and staff also very good",4,"2019-05-14 20:26:35",1,0,0
"75276775","The food was simple and tasty. I also like the ambience and the quality of the dishes. Service and the restaurant were overall good and soothing to one's mood.",5,"2019-05-14 20:02:35",1,0,0
"87490550","The staff were really good ..the food is delicious. The egg biryani is too good. The place is clean and neat . Ambience is amazing.a place to visit in Gachibowli.",4,"2019-05-14 19:00:02",3,1,0
"3820031","Chicken Biryani was awesome.
Service was good .
Toofan thankyou for your assistance.
Place and location is easy to locate.
Thankyou for the service , would love to recommend friends and family as well .",5,"2019-05-13 16:02:24",2,65,0
"47999381","was beautiful-peaceful and relaxing. Staff was outstanding. The restaurant was exceptional along with the hosts and servers. A must visit place",4,"2019-05-13 14:52:58",18,10,0
"104845681","Good food with very good service. Their Biryani's are excellent, chicken curries are good. The breads they make are alright..Good place to hangout",5,"2019-05-13 14:28:59",1,0,0
"90179579","Good food and service Of quality very nice and ambience or hospitality are amazing the chicken Biriyani was amazing ni redo mission Justin muffin Butch Cassidy ",5,"2019-05-13 14:27:07",1,1,0
"105894585","Briyani was good and so crispy Briyani was good and so crispy Briyani was good and so crispy Briyani was good and so crispy service is also good ",5,"2019-05-13 14:07:35",1,1,0
"58220624","Good food with nice infrastructure.serving is good but need some fast. Food was very tasteful and satisfied with every thing in Paradise. Restuarant i",5,"2019-05-13 13:29:08",1,0,0
"55354876","Good food..egg friend rice was nice and also chicken Tikka masala was awesome. And service was great we enjoyed the food.. people's are very nice ..",5,"2019-05-12 22:46:28",2,3,0
"79200285","Nice food as always, briyani is great.
Nice to visit here.
Specially chicken tandoori. Thank you to Kunal for serving and helping with serving.",5,"2019-05-12 22:04:24",1,2,0
"35364672","Taste is good 😋
Service is good other then for restaurant and very helpful employees. Sweetdish is nice and also many varities in menu card for other than restaurant",4,"2019-05-12 20:55:19",0,3,0
"112249889","This is my first visit gachibowli paradise i am very happy and biriyani very delicious and service also very good and all staff also very friends ly",4,"2019-05-12 18:49:02",1,1,0
"56442581","A very nice place with a very humble staff. Quick service and a hospitable ambience. Very delicious food, probably the best biryanis in the country and the starters are no less either. ",5,"2019-05-12 16:42:08",2,2,0
"35937747","Nice Biryani. The taste was good but the quantity was less. The service was good and staff was curious. 1 biryani is sufficient for two people. Value for money",4,"2019-05-12 12:27:38",2,50,1
"111461725","This my first visit gachibowli paradise i am very happy and biriyani very delicious and test also very good and service also very speed and staff also 2 good ",4,"2019-05-11 20:11:56",1,0,0
"67702463","Paradise is one my favourite restaurants to eat briyani once in a while .... It's good with the service and as well the food .... Too yummy ... Tasty too .... ",4,"2019-05-11 17:31:18",1,0,0
"34385936","Chicken Biryani is excellent one of the best Hyderabadi and Service is perfect, will visit again
Ambience is good and staff is very polite. Best place for a family outing ",5,"2019-05-11 14:44:59",1,2,0
"80951861","Good service and all food very good taste......Biryani super looking and my family is very happy thank u so much so come for again paradise gachibowli.",5,"2019-05-11 03:18:38",1,1,0
"37574887","Good food and ambience good servise  staff was good and food and servise both are good i had veg biriyani its relly good come again and again ",5,"2019-05-10 22:48:29",2,6,0
"111844295","Chiken musallam was really good and in dat we had keema also ...nice flavour..loved it .next time definently i would like to come with my family.
Toofan served us and he is really amazing guy...lovely person..nice to meet him.",5,"2019-05-10 22:29:26",1,2,0
"1048291","Experienced the best haleem here. Murg Musalam taste was good. Service was awesome, they were too respectable. Good ambiance. I recommend to my family and friends.",5,"2019-05-10 22:26:31",2,34,0
"54125819","Nyc restaurant.. should come and taste haleem .. even veg is sooo good .. there is scope of imporvement.. good management and staff is also good .. ",5,"2019-05-10 21:53:34",1,2,0
"55724186","It's is very tasty and very good for health,haleem is very yummy.And the atmosphere is also very good loved the place better to try this place.",5,"2019-05-10 21:52:31",1,5,0
"109247268","Very tasty, specially biryani we are satisfied , service is very good, I suggest you come can try it had a great time here had a good sense of humour to the staff ",5,"2019-05-10 21:35:27",1,0,0
"48488071","Very polite and good hospitality staff even food is good and awesome environment and had a good time and had funny staff had a good sense of humor serving is good ",5,"2019-05-10 21:34:11",1,1,0
"59152060","Service is good and the place and ambience is good. Starters are good in taste, quality and quantity. Biryanis are good and the sweets are also good.",4,"2019-05-10 21:17:51",2,3,0
"73217168","Very good starter, with soup. Excellent veg biranay and excellent service. Very good place for family and friends dining in Gachibowli. Recommended for family dinner.",5,"2019-05-10 21:17:16",1,2,0
"49129182","Good service and good food chicken drumsticks is really good and I have mutton Britani and chicken, veg Briyani both are good... Good food service ",5,"2019-05-10 21:07:16",1,2,0
"54274823","Best place for food. Best haleem. awesome mutton Biryani.A good place to spend time with family as well as friends.Good Service with clean and hygiene ambience. Best food with Affordable prices.Kebabs should be tried which are best in taste.",5,"2019-05-10 20:41:11",1,3,0
"55870890","Nice Taste.. Staff are well behaved. Nice experience..!
One of the best places to have biriyani in hyderabad.
This is all i had to say. Will visit soon.",5,"2019-05-10 14:34:43",1,1,0
"52333259","Food quality and quantity good
Food service,items and servents are very good 
Ambience and tasty food n drinks 
Menu and place is precious 
Overall good ",4,"2019-05-09 22:58:54",1,1,0
"58574635","Food is Soo good and nice service and is quite fast.mmn Well ambience..... Had fun with my friends...pleasant atmosphere...food is available at late night as well.",5,"2019-05-09 21:02:02",1,1,0
"35569763","Biryani was not up to the mark and starters were not up to the mark, no really up to the mark as expected from the ""paradise"" , service is. A little slow ",1,"2019-05-09 18:41:18",54,84,0
"59985594","Excellent quality of food good service mutton biryani and chicken biryani both are good speccialy chicken biryani is excellent.. Service also very friendly ",5,"2019-05-09 16:19:40",1,0,0
"110020437","Service is good.veg Manchuria tastes good 
Service is good.veg Manchuria tastes good 
Service is good.veg Manchuria tastes good 
Service is good.veg Manchuria tastes good 
Service is good.veg Manchuria tastes good 
Service is good.veg Manchuria tastes good ",5,"2019-05-09 16:09:01",1,0,0
"53354660","Had panner butter masala and its very tasty than expected. Service is also too good but it was little delayed even though the food was excellent . I would prefer this all time",5,"2019-05-09 14:52:26",1,1,0
"47576390","Wonderful food, good ambience.. Great service.. Best veg biryani i ever feel.. Friendly service.. Valet parking Aviabality.. Would like to come again.. ",5,"2019-05-09 13:59:51",1,15,0
"69816479","Had Hyderabadi Biryani after 8 years and God it brought back so many memories. Special shoutout to Abhijeet for serving us with a great service. Service was awesome. Food was out of the world. I will be back soon. Hungry for more.",5,"2019-05-08 23:18:55",1,1,0
"38353509","The food is good.. awesome service specially by Avijit. We have ordered Chicken and Veg biriyani and both are too delicious.. I recommend this place to everyone who has been to Hyderabad.",5,"2019-05-08 23:18:33",1,2,0
"33281238","The food is very tasting and hygiene. Service is good. Response of the staff is quick and the food is on time. Ambience is nice and it represents that it is serving since times",5,"2019-05-08 23:11:34",1,3,0
"56035480","Very good service good food Toofani tika and pepper chicken mutton biriyani everything good definitely come back again happy time good servise",5,"2019-05-08 22:54:51",1,0,0
"51757092","Good service, good taste and ambience. Waiting time was less despite a lot of people. Ordered fish starter and mutton biryani.really good taste. Must visit again place",5,"2019-05-08 22:35:20",1,2,0
"30569375","This place is a heaven for any foodie. Paradise is always in my best places to have food list.
Good food, always crowded, great kebabs and Biryani. ",5,"2019-05-08 21:41:06",12,33,0
"72008918","If you want to have biryani then must visit to paradise and experience it and you will love it.. Service is good and nice ambient with different varieties of non veg items",4,"2019-05-08 21:10:03",1,1,0
"53955232","I ordered chicken kabab is very good and then I ordered Morton biryani is awesome. Service r to good and staff are very friendly. Ambience r to good...",5,"2019-05-08 20:47:15",3,8,0
"43064908","Very good and tasty food... Nijam chicken Biryani...one of the best service i ever n ever... definitely i will be visit this place again n again",5,"2019-05-08 20:25:42",1,23,0
"57727878","We glad to have a dine in paradise it's too good and awesome,so madly say that the food is too delicious thank you ☺️ ☺️☺️☺️☺️☺️☺️☺️☺️🙂🙂🙂",5,"2019-05-08 20:17:39",1,0,0
"69060718","Most over rated restaurant. Ordered for special mutton biryani and to my surprise biryani served was smelling badly and was rotten. Mutton pieces were undercooked. Have attached pics and can see red colour clearly. Tried calling restaurant to share feedback but no response. Paradise is big name in market and should not spoil this way. ",1,"2019-05-08 17:16:21",13,94,0
"67319829","Food is very good. Service is very good, staffs are polite. Taste of biryani is awesome. If you are looking for Hyderabad I biryani then this place is best",5,"2019-05-08 17:14:10",1,0,0
"55545876","the haleem is very good and testy so nice
and
nice places comfortable and
service is very good
next time visit again whith my family and friends",5,"2019-05-08 16:34:57",2,2,0
"60129594","Mutton biriyani was amazing kiddo Jessi hawk Brazil yeah beach break chain break beacon bean can back check Brazil trail I really enjoyed the food ",5,"2019-05-08 15:53:04",1,1,0
"38013423","Biryani is delicious but less spicy in default version. Ask the waiter to make it spicy otherwise you might not like it if you like spicy food. Rest main course items like chicken keema are average ",4,"2019-05-06 18:12:53",7,2,0
"53080023","Food is very good the butter Nan is very soft so enjoy the food I am very happy and service is very good
Nice place this paradise
And
Next time visiting again Whit my family and friends",5,"2019-05-06 14:27:01",1,2,0
"36571609","Chiken murgh dumpukht kakeb is very good and muttan biriyani is the best in town,
Enjoyed the experience and service here. A must visit when you are in Hyderabad",5,"2019-05-06 14:04:42",2,3,0
"48586439","Biryani is the first thing that came to my mind when I landed in Hyderabad. Paradise being one of the most famous places in the city, serves the layered Hyderabadi biryani, the aromatic saffron  flavored rice which is the star of the dish.  It was delicious. 
I also had the Qubani ka meetha which is an Indian sweet made from dried apricots originated in the city, It was perfect with just the right amount of sweetness. 
It will definitely be my go to place the next time I m there!",4,"2019-05-05 16:20:46",8,7,2
"41027228","Fish kebab tikka has 6 small pieces for 289 INR..Not at all worth and arrogant staff because of restaurant’s fame...Delivery person called me saying Restaurant guys asked him to wait for mutton biryani ka saalan...So disguisting service from paradise..",1,"2019-05-05 16:16:34",1,17,1
"34287927","Very kind and courteous staff. The food is so delicious and not too spicy. The dishes are worth for the money. Perfect place if you want to have a grand lunch.",5,"2019-05-05 14:40:06",2,9,0
"48665237","I heard a lot about  this restaurant for Biryani . But i don't like the taste as i expected. I ate much better Biryani on other places.Though i really enjoyed veg curry i.e. Malai Kofta. I never ate such tasty malai kofta ever. 
Service was good and friendly staff.I visited this restaurant many times for north Indian food :)",3,"2019-05-04 17:44:05",8,2,0
"53358678","I heard about these restaurant many times finally got a chance to visit their Gachibowli outlet,when i entered to restaurant i was really excited but when I tested foods it was bit of disappointment cz taste was not up to the Mark and quality wise not as good...but I like their ambience....Staffs are good,polite in nature.....but apart from these I think they should improve their food quality...",4,"2019-05-01 17:30:40",12,1,4
"20458498","'If you are a biriyani lover and in Hyderabad then you must visit this place', this was a saying that I had heard all throughout my life.
I must say I was seriously disappointed with the place.I have had better Biriyani in my life and that too at places which do not get so much of limelight",3,"2019-04-30 09:49:04",43,140,0
"53006467","Delicious food. Service is very good worth of money . A place to visit in Hyderabad . As the name suggest it a paradise for biryani. Must visit place",4,"2019-04-29 17:01:00",1,2,0
"38099230","Had a good experience with the taste of chicken biriyani and the desert was awsome and nice service..stuff behavior was polite ..will come again soon..",5,"2019-04-29 14:24:50",2,2,0
"37015042","Very good service... I loved this place.. Neat environment. Good serving staff. Food was tasty as expected. Finally yum food as we want. You can visit this place. ",5,"2019-04-29 14:23:55",1,2,0
"54703277","We tried paradise for the first time and the food was great, freshly cooked very tasty and well presented. The waiters were attentive and service overall was good. Overall a good meal and great value we will certainly be going back.",5,"2019-04-28 20:20:28",1,0,0
"32130680","Nice ambience,food so so..
Biriyani is good. But jeera was deal breaker... Staff behavior is very friendly and nice.. they should upgrade their menu",4,"2019-04-27 13:45:20",1,73,0
"33773229","Very bad.. didn't deliver after order acceptance.This is not good on thier part.zomato should look into this as it brings dissatisfaction to customers",1,"2019-04-27 12:54:18",1,1,0
