"UserId","Review Text","Rating","Time","Reviews Count","Followers Count","Photos Count"
"34009097","Ordered via Swiggy and tried the Egg Kadai Masala Bowl. The rice used was Basmati (a brownie point for that) and the quantities of the rice and curry were good. Personally, I did not like the curry so much. It was bland, devoid of the 'masaledaar taste' that the name hints at. Not too good and definitely not the worst meal ever. ",3,"2019-01-11 11:17:10",122,636,0
"49921342","Ordered a large chicken tikka rice bowl thru swiggy. It was delivered from their Gachbowli outlet while there is one right near my house in Manikonda. Large portion size, good amount of meat and spices. They should have included a small Raita.
Packing: 3/5Taste: 3.5/5Quantity: 4/5Value for money: 5/5
Overall Experience: 3.5/5",3,"2018-11-15 12:54:50",72,42,1
"52169296","You are doing great! I ordered chicken tikka rice bowl and it was great. The chicken was perfectly cooked and the spice contain was minimal yet tasty.",4,"2018-09-16 21:19:09",108,241,0
"34351833","Had Kerala egg roast rice bowl from this place.
The spices were perfectly blended and the rice was aromatic too.I ordered this through swiggy pop, it was delivered to me in 10 mins which is simply wow",4,"2018-09-15 12:22:37",35,9,0
"48993007","I tried multiple options here from Veg, Non Veg & Egg. I suggest only the Egg rice bowls here as the veg and chicken ones didn't taste good even once. I think they can improve on the taste but considering their low pricing, I think they are trying to keep common gravy base for all/ most of the items that is not helping the experience. I can only say that try at least once and continue if you like as it is a value for money outlet.",3,"2018-09-15 00:57:34",137,1057,0
"40089471","Please don’t try at this place. 
Food is not tasty too. You gonna be get sick.
It’s not worth full and the ambience is also sick.
I feel writing a review and completing words is waste for this.",1,"2018-08-19 21:53:48",4,5,0
"2571704","Simple and a brilliant meal. Right from the packing, the quantity and the taste, everything on point.
The keema roast bowl was brilliant with scrumptious amounts of keema and rice. Perfect dinner meal",5,"2018-08-17 22:36:50",124,370,1
"36495441","Tried their butter chicken rice bowl via Swiggy Pop. Finely cooked rice with some really delicious butter chicken. A bit spicy but some good number of chicken chunks. More than enough quantity, fine taste and prompt delivery, no complaints! ",4,"2018-08-12 07:37:27",140,362,1
"51382317","Chicken biryani is not good ... I was dissapointed and dissatisfied with the order , waste of money .Better try green bawarchi or shah ghouse ",1,"2018-08-03 15:14:41",1,9,0
"29639498","Ordered butter chicken rice bowl(large) via swiggy pop. The delivery was prompt. Also, the butter chicken rice was tasty and spicy. Quantity was enough for 1 and it had many chicken chunks.",4,"2018-07-22 09:27:52",158,228,1
"54862030","The order was completely wrong and very much oily food wrong order as I ordered non veg delivered only veg when I was hungry BELOW is veg munchuria",1,"2018-05-17 14:56:47",1,28,1
"51761273","Good and quick food to overcome hunger . They only have rice bowls here with selection of different curries. I would say vegetarian bowl is good here , specially the paneer one .Chicken/Non veg is not that up to the mark .
Would recommend to order it online or carry it.They just have 4 chairs kept outside the kiosk and area to sit is not that clean .",3,"2018-04-05 00:05:51",19,32,0
"32900613","Rice bowl is budget friendly outlet which serves tasty Indian food. Almost all the rice bowl dishes are really good. Don't miss their butter chicken rice bowl. They do have two variants of quantities which is really a good thing.",4,"2018-03-10 10:42:28",5,21,0
"32839187","A lovely place which has some magical food which makes your mouth water. The way they present the food in those containers is very good. The quality of food is also awesome. My favourite chicken sambar rice makes my day when ever I eat there. Service is perfect. Value for money is perfect. Ambience is also perfect. A must visit place for all.
Ambience 5/5
Service 5/5
Value for money 5/5",5,"2018-03-06 12:06:04",28,69,0
"35964821","I highly recommend this place to everyone! 
The butter chicken rice bowl and Rajma rice bowl are heavenly. Reminds you of “ghar ka khanna”. 
The paneer butter masala rice wasn’t too good however. ",4,"2018-02-07 23:13:57",9,3,0
"15962386","Quantity was ok ok. 
We had taken chicken and panneer rice bowl.
Chicken rice bowl was not upto the mark as much as panneer rice bowl.
The packaging was good.",3.5,"2018-01-21 20:57:01",74,210,0
"15842609","Well well i was hungry and wanted have good food but not in big portions. And i had the suggestion popping up for Rice Bowl. I ordered the Butter Chicken Rice Bowl and it was a disappointment. There were only gravy and the quality of rice was good and the rice tasted good. Somewhat i felt the butter chicken was not freshly made and may be from previous nights. There were 3-4 tiny, micro pieces of chicken. I understand that it was a combo plan and much cheaper. But people would expect at least inch sq pieces of chicken 4-5 pieces. The quality need to be improved. The bowl looked nothing like the picture shared on google. 🤷🏻‍♀️",3,"2017-12-16 12:11:18",56,318,0
"892874","Super pocket friendly and and great taste!!! Have tried pretty much every on their menu!!!! I have read a lot of reviews complaining about the quantities which I agreed they do give very less pieces of meat. They need to do some thing about this !!!!!",3,"2017-11-29 12:15:44",302,228,0
"41208518","food is cold and there are very few chicken pieces(only 2 that too very small)",1,"2017-11-19 23:00:50",1,1,0
"44347702","worst food food was very cool packing was not at all good dnt think food order frm here",1,"2017-11-18 02:55:20",7,9,0
"727537","Amazing taste and the best rice bowl (veg or non veg) in hyd so far!!!  Go for it, the style is missing but no reason to hold back. Flavors are ekdum mast!!",4.5,"2017-11-10 11:45:53",14,13,0
"47525453","I had worst experience here. I took one rice bowl to eat at the stall. I asked the staff for drinking water. They told me that they won't provide and I did not understand and asked them they should provide it as we are eating there and it is minimum custom . They did not respond . I did not expect this kind of service from Rice bowl franchise. I do not want to visit any Rice bowl stall further and I do not recommend any one for this",1,"2017-10-27 21:44:44",5,2,0
"39360601","A highly disorganized and an irresponsible restaurant. 3 examples...
(1) They accept the order, tell you it is getting ready in the kitchen,... keep you waiting about an hour, you call Zomato and they contact the restaurant and they update back that the order is on the way. You wait for another 10 minutes and then call the restaurant, Zomato gets back to you and you have BREAKING NEWS :).... restaurant is 'Closed now' and that the 'order is rejected!'
(2) You order Sambar Rice with Boondi. You receive the item... only... they forgot to add the Boondi on it and replaced it with fried all...;)
(3) You order a Large Shahi Chicken rice bowl... We receive the item, when you ask the delivery boy, what's the item being delivered ... And he does not know it :))... And then you have a small bowl delivered!! Enough is enough. My next order is coming to you when I reach heaven!!
Hearty congratulations and good luck to all @Rice Bowl Gachibowli Hyderabad customers for patronizing this restaurant & (un)professional team! Ribhu Bhaskar Pratap Ranjan Swain Ravi Shankar Muthyala Sunil Chakravarthi S Esther Thangam Chelladorai Kamaal Ahmed Neha Sairam Deven Das F & B Radhe Krishna Basudeb Mahapatra Ratnadas Wadayar Aditya Iyer",1,"2017-10-19 22:39:07",27,58,0
"46171117","Butter Chicken comb. Taste was good. But no chicken in Chicken Butter Bowl. Better to add some chicken peaces to the bowl. overall its good.",3.5,"2017-09-17 12:49:52",8,1,0
"45342455","Twice disappointed. I ordered aloo chole and was given aloo matar. Second time ordered butter paneer rice bowl and it was a bowl of rice with some sprinkling of paneer and matar. Matar seems to be their go to substitute for everything. They might as well call themselves matar bowl.",1,"2017-08-25 14:02:16",1,1,0
"43082430","The food is filling and good. Both non veg and veg is good. Pocket friendly for students like us. Paisa vasool food.
The ambiance gives the essence of Street food which is perfect for Street food lover like me. ",4,"2017-08-03 22:30:46",52,43,0
"29303875","Very good food at an affordable price.
+ve:
Tasty Food, Serving Time, Moderate Prices
-ve:
Outdoor Seating, Less number of items, Parking(in case of car).",4,"2017-08-02 01:44:52",12,16,0
"31801118","If I have a food-weakness, it's probably butter chicken. Thereby ,I went ahead and ordered Butter Chicken Rice bowl .Aromatic Basmati rice , well-seasoned curry and tender meat together created an exotic flavor symphony. I have earlier tried their other bowls ,which were equally good ,but comparatively on a spicier side . 
They deserve applaud for consistently serving good quality food at reasonable price.crackdownflavors.com",4.5,"2017-08-01 13:29:59",121,1005,0
"39813578","Damn spicy. We had Paneer rice, it was very spicy. Hardly 3-4 small pieces of paneer could be found. Also found the container's plastic peel off in the food. Check the pic.",3,"2017-07-29 14:45:04",2,2,1
"39659550","Best place near Gachibowli if you would like to have a quick and delicious meal at throw away price. Butter chicken rice bowl tastes yummy and the chicken pieces just melt in your mouth..!!! Paneer, Fried aloo sambar, dum aloo and egg rice bowls all taste awesome. The rice quality is very good and the quantity is sufficient for one person.This place is a must visit and trust me u'll never be disappointed :)",4.5,"2017-07-06 19:14:37",10,8,0
"15799423","One of my favorite places to eat when my body runs out of rice power. My favorites are Butter chicken bowl and the chicken kheema one. The rajma chawal bowl is a great option too when you have your vegetarian friends around 😂 Remember to order a large one. Regulars just are not enough when you are hungry 😉",4.5,"2017-06-25 09:43:23",21,138,0
"454362","Good, no frills kind of place. Have ordered for home delivery a few times. Packaging was nice and the dishes that I ordered (chicken or rajma rice bowls) were quite good for the price I paid. Quantity is sufficient for one.",4,"2017-06-25 08:19:43",25,28,0
"33042463","Quick fix food place for students/office goers in the area. Consistent and convenient. Like the Aloo Sambhar Rice Bowl and Butter Chicken Rice Bowl.",3.5,"2017-06-18 17:50:02",16,6,0
"2015776","This small joint specialize only in one thing Rice curries and they do enough justice to it. Quality wise too good. Price is pocket friendly, quantity is filling. Tried the regular Butter chicken rice bowl and it was more than enough for my hungry soul. It was a tad too spicy, nevertheless very tasty.",4,"2017-05-16 14:54:04",187,2282,1
"20571130","We ordered Rajma which is a little above average.. Panneer Tikka is really yummy and Butter chicken is equally good.. Delivery is pretty quick :)",4.5,"2017-04-18 13:22:03",1,19,0
"32112633","Strictly not recommended for spicy lovers.As the chicen rice bowl is too sweet.One time eatable.
And this place is just a stall,so only parcels.",3.5,"2017-04-08 21:00:32",60,91,0
"1215253","when ever I feel to eat rice I visit this place.. I esperance that all rice eaters will love this place. In quality of food it is superb. my all time favourite tandoori panner curry & Butter chicken rice. ",4,"2017-03-16 19:36:53",46,134,0
"193134","I don't write reviews. But I had to write one about this place, as I had to let others know how pathetic a restaurant this is. Do yourselves a favor, and never eat at this place. They'll provide plenty of rice. But it'll be missing whatever you ordered with it. Chicken rice,with no chicken. Keema rice, with no keema, just a sad slop of sambar.
Incredibly useless.",1,"2017-03-06 13:22:07",7,246,0
"35836801","There are 2 aspects I want to share about the food. I have tried butter chicken, aloo matar and some other rice bowls. 
Plus points: quite cheap. Quality and quantity wise fine 
Minus: I ordered regular size alu matar rice bowl,it hardly had any alu! All I could find were carrots and beans. Personally I don't prefer much spice or gravy.But as I digged into the rice,all the rice was mixed with spicy gravy. The taste was good but I had no option to mix the gravy with the rice as per my choice/requirements. ",3,"2017-02-12 20:37:08",247,316,3
"1727590","This is place opposite alsaba in gachibowli.  Visited this place two time and they offer a small and simple menu. I have had keema rice and butter chicken rice. I liked the chicken rice. Quick and immediate food is the word for this place.",3.5,"2017-02-06 17:01:05",155,363,0
"29042504","I had ordered Chicken Tikka Rice Bowl from this place! It was awesome and so delicious! I was really impressed with the packaging! They had also provided a tissue and a plastic spoon!",5,"2017-01-21 16:13:41",344,650,2
"36048432","never order food from here only gravy for chicken rice bowl and very 2 very small  pieces of chicken and taste is bad.i will never order from here again",1,"2017-01-15 14:17:45",8,3,0
"321159","Good blend of rice and curry. Have only ordered food from here. A little spicy food but good value for money and enough to satiate my hunger when I don't want to dine out.",3,"2017-01-02 10:57:56",25,95,0
"34081601","I generally eat from this outlet for lunch on weekends. The butter chicken rice bowl is my fav  and i would recommend it. Quantity is too much good according  to price.",3.5,"2016-12-28 15:38:59",41,50,1
"570318","Found this place in zomato street food category and decided to try. Had butter chicken rice bowl and paneer tikka rice bowl. The quantity is good. Masala is bit adequate in the bowl which made it heavy after having half of it. The chicken pieces are tender and delicious. Overall its worth to try when driving around gachibowli ",3.5,"2016-12-18 22:06:23",66,100,0
"33093114","Been to this place for a takeaway lunch.
Had spicy chicken rice bowl@90₹
Had plenty of chicken and enough rice to fill an empty stomach.
Quality and quantity is good.
Tastes ok.",3.5,"2016-12-15 15:07:41",439,1012,1
"16090405","One word - Delicious.
It is small road side stall but they deliver through Zomato and other sites. The list of items on offer is less but each one is cooked with great attention.
I have been taking home delivery every now n then and I must say that I am completely satisfied.
Butter Chicken Rice bowl & Methi Chicken Rice bowl is highly recommend.
Keep it Up Rice Bowl. Love the food.",4,"2016-11-17 03:30:47",115,636,2
"31806519","I have been to this place reading the reviews in Zomato. I feel Butter chicken rice bowl is over rated It didn't taste great. The food wasn't hot either.",2.5,"2016-11-11 13:26:15",2,0,0
"1169606","Home Delivery
I have heard so much about this place so finally decided to place an order here. 
Butter chicken rice bowl was good which my friend liked it. 🥘
Shahi panner tikka rice bowl was average. 🍛
The way they give the gravy in between the rice is good. The concept is good actually. In fact one can mix properly the rice and gravy.",3.5,"2016-11-05 21:04:35",31,73,0
"75898","This is one of the most ordered food for home delivery. I stay in a PG and most of the other PGmates call from rice bowl for dinner. The rice quality is good and is moderately spiced. I'm a vegetarian and had almost all varieties available here. Personally I like sambhar rice the most. Aloo fried rice is next.
Thanks",3,"2016-11-02 19:09:07",46,2605,0
"16679044","Hubby had picked up a pack of butter chicken and rice on the way to receive me from the airport..
And it was perfect, neatly packed not too spicy and yum and hot enough to devour it on the way itself..
Will definitely try the rest of their menu when we make a trip that side... ",4,"2016-10-20 12:51:45",160,769,0
"36361514","Completely bad food food ever I eat. I didn't receive Coke when I asked delivery Boy.he don't have any information then I called restaurant and they are saying we don't have stock.. what the hell is this.. I clearly mentioned that I don't required spice after that also it was too spice and I thrown it out side unfortunately. Can anyone explain Me on this... 
Below are My email id
srikanta_lenka@hotmail.cim",1,"2016-10-15 07:06:55",3,1,0
"1182617","Ambience: 5/10 - its a kiosk located on the old Mumbai highway, near Cyberabad Police Commissioner bus stop. Few chairs are provided in the front.
Service: 7/10 - its pre cooked - u get it instantly, n hot!!
Food: 7/10 - the added advtg of having fewer options in the menu is that the service is quick n usually food tastes good.. I ordered Butter Chicken. It was provided in a lovely little plastic take-away container and chicken pieces (boneless) r cut in small pieces - so u dont have to dirty ur hands - Ideal for quick bite or take away for a journey. The chicken pieces were tender n spicy. The gravy n pieces were delicious n were in ample amount even in the ""regular size rice bowl"".. prices r reasonable. Loved the concept of providing chicken rice in a way you buy n consume fast food..
My rating: 6.6/10",3.5,"2016-10-08 18:49:14",118,469,5
"3054276","A quick lunch place. 
Nothing extra ordinary on the menu but the quality of food is good and thecsane us maintained consistently.
The chap over the counter does know how to treat hus customers. 
Good gob rice bowl👍🏻",4,"2016-09-28 14:49:52",4,51,0
"34546105","I have ordered from this restaurant.                          
Veg items are not that much spicy.                             Non veg is good. Costs are reasonable.",3,"2016-09-26 19:22:03",20,16,0
"35085729","I went to this place after seeing the reviews....Immediately after having the dish I am writing this review...So, coming to the pros the only thing is that it is indeed pocket friendly...and the taste I can say was just ok...As We all know that most of the streetfood centers provide mouth watering food without creating a hole in your pocket..So, may be my expectation was more..I brought chicken butter masala bowl and had that at my home.The taste as I already said was just ok...and both rice and chicken were completely cold.....so, i really didn't enjoy even a single bite of it...As first impressions are the most lasting so, i dont know weather I would visit this place again or not....
Thanks ",1.5,"2016-09-25 16:19:35",3,0,0
"2974916","Good for a quick meal,  very simple menu of three veg and three non-vegetarian gravies layered with fragrant long grain rice and served in a box. The quality is top notch,  especially love their butter chicken bowl and Rajma bowl though the quanity can seem to be a bit low if one is super hungry. Also,  the gravies are on the spicier side usually but go well with the rice. Very reasonably priced. ",3.5,"2016-09-24 23:59:35",161,199,0
"849785","This is a place where u can have a quick bite and get recharged in quick time. We tried paneer tikka bowl, kheema sambar rice bowl,  Butter chicken rice bowl. Butter chicken has special place among the rest the value of the bowl is super worthy.",4,"2016-09-22 23:30:29",1031,1653,0
"1308293","This place just got clicked from my subconscious mind thinking about where and what to have in dinner. So landed here to get a rice bowl parcel for myself. I took butter chicken rice. Ambience is not good as it is open air and there are other small outlets located side by side. Parking is not that much of a pain as there is plenty of space for parking. Coming to the quality the rice were cooked perfectly and went very well with the curry and this was the 1st time that I had butter chicken with rice pretty good experience I must say. Next time I need to try their kheema stuff hope it doesn't disappoints me. Price is economical and the quantity is sufficient to fill in your normal appetite. Overall a good one.",4,"2016-09-12 23:57:54",242,418,3
"2152402","Good taste and good packaging. Less quantity for the price offerings. Large packs seems like Regular ones.  Butter Paneer Rice Bowl is a must try. ",3.5,"2016-09-06 08:05:36",124,148,1
"30555481","So.. I went to have something from this place when I was in a hurry and didn't saw much options.
And I took a rice bowl of some veg rice, don't exactly remember what I bought.
And I loved it... Such a cheap price and the food was awesome!!!! 
I have been ordering online since then. You must try the rice bowls they offer atleast once.",4.5,"2016-09-03 21:22:03",65,86,0
"16549948","A bowl of rice with any flavour or curry mix and some veg or nonveg snack will be given as a dip !! 
The most recommend was the sambar with Kheema !! I really like the sambar rice .. But it was bad with sambar rice .. It was too oily !! 
The second time it was chicken rice bowl which was just avg !! 
Reasonable prize !! ",3.5,"2016-08-28 09:00:46",144,714,0
"2959622","Rice Bowl is located near more supermarket,Telecom Nagar Gachibowli.I went to this place today and ordered butter chicken rice bowl.Taste was good, quality and quantity was super.Totally it is a pocket friendly place.This is a small outlet,hardly five to six chairs were there to sit.",3.5,"2016-08-12 15:21:23",659,1056,1
"33520116","I have ordered paneer rice bowl multiple times, the taste is average and fits into every pocket. however I recently noticed a change in taste of the gravy..It is not exception tasty but good if you wish to have your lunch or dinner in a small budget, also the quantity is enough for one person.",3.5,"2016-07-31 22:26:41",25,33,0
"35163049","Ordered butter chicken rice bowl. It's very good and i think they should increase quantity of food. Butter chicken taste is very good overall I'll recommend this place. ",3.5,"2016-07-09 14:34:49",1,1,0
"13641991","orderd butten chicken bowl and sambar rice bowl tasted good will try again next time easy for office goers for lunch nd dinner the packing is good delivery may take a bit late ",4,"2016-07-09 13:20:08",7,63,0
"7943351","This place always disappoint me for two reasons:
1. Quantity for the prices charged. Not a VFM at all.
2. The stuff is too spicy even if it should not be. Guys, you cannot make Rajma Chawal so spicy which is the staple food of north indian bachelors.
For me, it is a miss miss.",2.5,"2016-07-02 13:20:09",116,158,0
"1927986","Value for money!!..not too heavy and not too little..perfect for on the drive brunch..nice variety and my pick is sambar alu fry. Don't worry about the cleanliness as the food can be seen while being packed.",4,"2016-06-12 03:15:14",18,6,0
"33685989","Value for Money  *****
Service / Speed   *****
Taste *****
Quantity ******
Perfect for anyone who wants to have a quick, tasty and sumptuous take out meal. The management is sincere and has not altered the quantity or quality at-least since last 1 year !",4.5,"2016-06-10 21:58:29",4,1,0
"14514011","This was my first time when I tried rice bowl. It was a average experience for me. I had chicken rice bowl. Taste was fine for me not so spicy good for a person. But chicken pieces are very less, cost is pocket friendly. The only thing which attract me was grained rice quality.",3,"2016-06-09 15:01:21",19,78,0
"32856677","Tasteless food. Extremely bad. Too much spicy. Only RED CHILLIES IN RICE NOTHING ELSE. HORRIBLE WILL stay hungry but never eat rice bowl. Beware of such bad food.",1,"2016-06-03 14:18:52",109,234,0
"34692289","Great FOOD :) Best PRICE :) And Fastest Delivery :) Cheers guys :) The Food was so delicious especially The Butter chicken bowl... YUMMY :) :-p",5,"2016-06-01 21:08:12",1,32,0
"33137836","I order from this place whenever I want have chicken and rice. The butter chicken rice bowl and the keema tikka rice bowl are absolutely delicious. The quantity is enough for a person.. Even a very hungry person and the delivery is incredibly fast.",4,"2016-05-30 20:45:54",103,1310,0
"30628732","Really this place won't burn a hole in your pocket.If you ever run out of money in Hyderabad and have a hungry belly to satiate,try this one.The food tastes great and in terms of quality and quantity, it is awesome.",4,"2016-05-28 21:29:09",109,190,0
"582969","I've ordered for lunch from here several times over last year. My favourites are Rajma masala rice bowl, Kheema rice bowl and butter chicken rice bowl.
Nothing very special. Road side kiosk - home delivery should be preferred. Nice quick low cost rice meal.",3.5,"2016-05-20 08:46:29",57,310,0
"34333734","Ordered here via swiggy! The packing was neat. It gave us the feeling of lunch box. Butter chicken is the best,'id recommend to try their butter chicken rice bowl.It is perfect option for for foodies for a pocket friendly experience..",3,"2016-05-13 23:16:41",16,5,0
"33986224","I had ordered Kheema with rice(large). The taste was good and the quantity of Kheema was quite good in it. It can easily feel up the tummy if you are very hungry else go for the medium size. The delivery was pretty quick, they delivered in 20 mins or so.",3.5,"2016-05-11 14:36:12",3,2,0
"32393234","Had ordered creamy egg roast rice bowl and kheema sambar rice bowl. They were simple and elegant. Kheema with sambar tasted good and quantity was great. Price was very reasonable for the quality and quality they had provided. It  would be a perfect lunch if you are looking for a budget meal.",3.5,"2016-05-03 12:21:39",16,69,0
"3217284","I have ordered online quite a few times but never visited the place. Food is good but didn't find it as anything exceptional. Will try more from the menu next time.",3.5,"2016-05-02 20:44:55",111,312,0
