"UserId","Review Text","Rating","Time","Reviews Count","Followers Count","Photos Count"
"2807672","A sumptuous meal for lunch , in my case both lunch and dinner ! The food was good as well as the price !! I have a lot about this place and got to order it today.....looking forward to taste some other bowls other than the butter chicken bowl as I already had it today !",4,"2016-05-01 23:19:53",121,883,0
"27668","Seeing the rating i just ordered 3 vareities of rice bowls. Butter Chicken, Aloo Phool and Rajma. 
Food: The food was really good. The taste was perfect. The butter chicken one is the best. Decent amount of gravy infact exactly the amount to be mixed with rice. Lots of indian flavour. Did not see much of oil or ghee used so it was healthy. Rice was properly cooked.
Quantity and price: Quantity was awesome. One rice bowl can easily fill one person. Veg rice bowl will cost INR 60-70 and a non veg one will be INR 90-100. 
Recommendation: Please try to put in more variety maintaining the same quality.
I would have given this place 3.5 but because of the quantity and price .5 extra.
Please try it.",4,"2016-04-30 15:25:09",35,241,1
"16056305","For faster food it's good... I like kheema sambar rice ... remaining dishes are okay .. overall it's good if you don't want to wait long for food ",3.5,"2016-04-25 15:56:48",13,75,0
"34184773","I have ordered a Rice Bowl on Zomato and it accepted the order. After some time, I got a call from the Restaurant saying the item is not available and I have to change the order.  It was already 10PM in the night, so, I couldn't cancel the order.  I advice that Zomato update the menu from time to time.",3,"2016-04-15 22:15:43",1,0,0
"15795291","Tried their paneer bowl. Quantity was good. The taste was good as well but nothing out of ordinary. It was a bit on the spicy side. A good option if you want to grab some quick meal to go.",3,"2016-04-09 16:13:23",83,233,0
"2997422","We usually order lunch from this place since it serves really nice rice bowls, delicious, hot and comforting which come at a very reasonable price. Their sambhar bowl topped with the minced chicken is my personal favorite. The sambhar rice is smooth and the kheema adds a texture to the whole meal. Yumm! We have tried the chicken kheema rice bowl, the butter chicken bowl as well. Good eat for a week night as well, well you are too lazy to whip up a meal. ",4,"2016-04-07 15:01:02",88,856,2
"96567","The food tastes goid. They serve you simple portions of rice with some gravy as the food. It is fine if you want a quick meal when you're on the move. I'd recommend to try their butter chicken rice bowl.",3,"2016-04-04 00:36:46",138,207,0
"1413093","Rice bowl is the worst! Ordered a Paneer Tikka rice bowl , they sent a bowl of rice with some oil and 2 pieces of capsicum. No paneer, no vegetables. Their customer service never goes through.",1,"2016-04-03 15:45:02",17,58,0
"367779","My brother is a fan or this place and today he took me.for lunch here..it looks like a take away counter..though you can sit and have it too..As a veggie we ordered shahi paneer rice bowl..with good quantity and taste..i really enjoyed my lunch and the price was unbelievable just 80 bugs, also we were stuffed in 80 bugs..Perfect Lunch!!
Final Review:
Menu and Taste - Good
Pricing - Easy on Pockets
Service - Quick 
Definitely Recommended!!",3,"2016-04-01 16:13:52",110,356,1
"33885070","The food here tastes very good,the service is also quick!Both veg and non veg are good. I'd like to recommend you to try the butter chicken rice bowl.",4,"2016-04-01 00:18:22",26,282,0
"33886011","Awwww Rice Bowl.... its is very unique and simple.. and they wont make customers  wait for the dish more than 5 min-its their concept ... i have tried almost all rice bowls and they are the best rice bowls ever had..foodies please go n give a try ul jus fall in love with those rice bowls and coming to prices they are very resonable.. actualy am surprised having  rice bowls for reasonable price, espescially butter chicken rice bowl( yummy yummy) . It is perfect option for for foodies for a pocket friendly experience..",4,"2016-03-16 12:25:34",3,0,0
"33791774","Happened upon it by chance. Had rajma n rice. Quite nice. Can follow up with a nice juice from yosta express next to it. VFM 4/5 taste 3.5. Ambience 3.",4.5,"2016-03-11 23:22:01",1,1,0
"29978074","Rice Bowl Is Located At Gachibowli Just Near More Supermarket, opp to Al Saba Restaurant, Telecom Nagar Gachibowli Hyderabad.. Rice Bowl is simple n unique concept.. They served rice bowls with many varieties of curries..either it  would be veg or chicken rice bowl..  This is very small outlet like kisok... They serve amazing Heavenly delicious rice bowls... It is perfect option for for foodies for a pocket friendly experience..
Order.. 
Butter chicken rice bowl 
Butter chicken rice bowl is heavenly delicious.. Mix of Jasmine rice n authentic butter chicken.. Taste is perfect n very gud combination... One must try this place for delicious n tasty veg n Chicken rice bowls prices are very very reasonable n full value for money...",4.5,"2016-03-05 10:41:22",626,1226,0
"1882624","Are you tired of your office cafeteria? Do you have enough time in the morning to cook your lunch? Are you looking for a healthy substitute to ordering from restaurants every day? Then search no more for Hyderabad never disappoints. All roads lead to one location – Rice Bowl located in Gachibowli next to More Super Market....Read full post on flavouredexpressions.com",4,"2016-02-24 13:25:14",NA,716,5
"31668088","Impressive concept .A quick bite food joint .
Not a very large menu.menu should include more varieties now that the brand has a good enough customer database .
Keema sambar rice bowl is my pick out of the lot !!!!!",4,"2016-02-18 19:44:20",126,277,0
"324047","If u wanna grab a quick grub in ur office break and are tired of eating the same stuff at the office cafeteria then rice bowl might just save you .. A concept taken from the Chinese of the convenient style if eating rice in a bowl with curry or meat works well here .. They take delivery orders through Swiggy n Food Panda too which works well if you work around the hi-tech city area .. The Kheema Sambar rice bowl is my favorite .. You gave various others on offer too .. The service is quick which is good cuz sometimes the place gets reallt crowded not forgetting the continuous delivery orders they keep getting. One bowl is enuff to satisfy one person's hunger pangs .. The portions of rice are good however it would be even better if the proportions of meat were better for the meat lovers .. U can pay extra for more meat but not a lot of ppl do that .. As the saying goes .. "" Itne paise mein itna hi milega .. "" ;P oh .. No seating .. It's a food stand so u stand n eat or sit if there is a chair available .. Doesn't really matter cuz most of the crowd that comes here is the work crowd that wants to get back to work on time .. ",4,"2016-02-14 17:03:38",40,192,0
"32362438","Good tasting food. Hygienic. And a very pocket friendly concept. No waiting time, immediately served and good amount of options for a quick bite.",5,"2016-02-05 22:17:29",28,118,0
"30505946","One of the best pocket friendly places in Gachibowli..! Had ordered chicken kheema sambhar rice, Paneer rice and fried aloo rice bowls. They tasted really amazing and definitely bang for the buck! The quantity, quality and the packaging is good. Very filling. Would definitely recommend.. ",4,"2016-02-01 10:36:46",37,193,0
"3112496","One of the good take away corners in this locality. Quality and Quantity are Good.
Had Chicken Tikka Rice, its very Tasty.
They have branches in Kothaguda and Kondapur also.
Surely visit again. 👌👌👌",3.5,"2016-01-20 23:06:38",92,299,0
"2305232","One of the best places to eat around gachibowli. Very tasty food at a very reasonable prices. Every thing here tastes yummmm. Specially, kheema sambar rice. ",4.5,"2016-01-16 16:08:12",21,85,0
"1731011","One lazy afternoon I used swiggy to order two rice bowls from this place
Egg roast rice bowl and Mix veg rice bowl. The delivery was on time. Now from the pics I expected a larger bowl. The rice was small compared to the pics given.
The quality of food is above average. Would rate it as 3.5. However one rice bowl per person is not good enough for a person on a weekend afternoon. For the quantity I would rate it as 2.5/5.
Verdict - Good food but less quantity. Order it if you are feeling lazy and want to eat rice and curry.",3,"2016-01-11 19:05:06",30,50,0
