"UserId","Review Text","Rating","Time","Reviews Count","Followers Count","Photos Count"
"36523232","Haven’t visited this place yet. Ordered online from here. The delivery 🚚 was on time. 
Try 1. Chicken 🍗 shawarma in rumali. The shawarma they delivered was really delicious. I got it for 50 percent offer as well. So it was a double delight. ⭐️⭐️⭐️⭐️
My rating : 
1. Food : ⭐️⭐️⭐️⭐️
2. Ambience: yet to visit 
3. Service: yet to visit 
Must try : 
1. Chicken 🍗 shawarma ",4,"2019-03-15 21:46:23",176,3777,0
"52975652","Calm and cool, delivered shortly without any hitch. Good wishes to this boy. The Showerma point also make the items ready faster than many others. Thanks zomato",5,"2018-12-05 18:17:27",2,1,0
"81621569","packing worst ",2,"2018-11-20 00:21:23",1,0,0
"35272193","chicken quantity can be improved.",4,"2018-10-01 17:48:05",7,9,0
"69880218","The food was very good .. I tried special shawarma.. loved it .. The mayonese was very good in taste .. a very good place to try shawarma .. the service was very fast",5,"2018-09-09 19:24:47",1,0,0
"53939842","I ordered a Pizza Shawarma , but got a rumali one 😐, disappointed",2,"2018-08-19 22:00:38",2,1,0
"49501889","The delivery was on time. ",5,"2018-08-13 21:49:08",1,1,0
"56623796","worst food... chicken is not cooked properly and it's raw... small size shawarma for 90?? it would cost only 60 else where... ",1,"2018-08-12 20:01:27",1,0,0
"52367081","Not good in taste n stuffings very poor and it was cold also",1,"2018-08-10 19:02:21",1,1,0
"60126638","good",5,"2018-08-06 22:14:46",3,0,0
"60116169","nice ",5,"2018-08-05 20:35:27",3,1,0
"48849981","",1,"2018-08-03 17:45:22",3,52,0
"53645502","vwer bad ",1,"2018-08-02 16:53:25",2,1,0
"63129413","not good taste.. ",3,"2018-07-30 18:28:52",1,0,0
"32529337","quantity was less as  per the price.",2,"2018-07-29 23:00:34",1,4,0
"61995186","shawrma was not hot",4,"2018-07-29 20:47:56",3,0,0
"3202884","Agent was rude, took extra money for the order and misbehaved ",1,"2018-07-29 18:03:39",3,157,0
"294601","good",5,"2018-07-26 18:37:23",1,13,0
"53318784","Good",5,"2018-07-22 18:10:34",1,1,0
"60109947","i don't recommend it, quality is not so good and quantity is very less",1,"2018-07-22 14:33:45",1,0,0
"61463279","Very fast",5,"2018-07-21 20:48:07",2,1,0
"59824970","quick one",5,"2018-07-20 19:25:00",1,0,0
"53182354","good",5,"2018-07-19 17:35:56",5,10,0
"45192449","prfct",5,"2018-07-18 16:22:45",3,2,0
"60110583","worst food ever eat ",1,"2018-07-17 20:24:42",1,0,0
"31978365","much spicy..stuffing was not good",3,"2018-07-17 18:56:57",4,53,0
"55923072","yummy",5,"2018-07-17 15:05:43",2,14,0
"59900834","good",5,"2018-07-15 23:57:42",3,1,0
"47067186","not delivered on time .theres no cheese at all very bad service.",1,"2018-07-15 22:31:22",1,39,0
"554157","Cold, raw, unhygienic",1,"2018-07-14 19:47:27",10,2,0
"59520621","good",4,"2018-07-12 20:58:10",1,0,0
"60249751","it is not as great as when we go to Arabian delight and eat. less chicken in home delivery . otherwise the taste is good.",3,"2018-07-09 19:04:20",1,0,0
"59194760","yumm",5,"2018-07-09 17:43:14",2,0,0
"59996812","nice",2,"2018-07-07 20:53:32",2,0,0
"32992498","Good",5,"2018-07-03 17:47:17",3,5,0
"59478596","quick delivery I liked it ",5,"2018-07-03 15:22:16",1,0,0
"52715","Super spicy, couldn’t eat.",1,"2018-07-02 21:00:42",3,28,0
"57997018","Quantity is pathetic ",2,"2018-07-02 20:16:38",2,3,0
"32992498","Grate behavior ",5,"2018-07-01 18:22:50",3,5,0
"58848336","there were very less chicken stuffing inside the shawarma",4,"2018-06-30 19:39:15",1,0,0
"32866081","I ordered double chicken shawarma it's not that..it's normal shawarma..",1,"2018-06-28 18:13:53",11,13,0
"56707192","Not nice",2,"2018-06-28 16:42:02",1,10,0
"52043687","packing is not good and price is high",1,"2018-06-26 18:24:32",2,2,0
"55104644","worst shawarma I have ever eaten.",1,"2018-06-24 20:12:25",7,1,0
"51205216","good",4,"2018-06-13 18:47:32",8,1,0
"53592188","poor quality",1,"2018-06-12 16:03:41",1,1,0
"56815370","sauce is not provided",2,"2018-06-07 19:22:47",1,2,0
"39690450","One of the worst shawarma I had till now. Better to give zero rating. Yak yak shawarma. I have ordered chicken cheese shawarma, they gave vegetable shawarma wth 2 chicken Pieces. Waste of money .",1,"2018-06-04 20:18:23",12,33,0
"53877035","Very disappointed with the food as compared to the other shwarma restaurants. Also had a stomach ache after having it. Very poor quality. Thumb's down.",1,"2018-06-02 07:01:36",1,0,0
"47112172","In chicken shawarma thier is veggies more😣",2,"2018-05-25 16:16:10",1,4,0
"52621282","not worth of money",1,"2018-05-22 17:21:56",2,1,0
"46720675","taste of chili shwarma is not good",2,"2018-05-21 18:50:25",5,6,0
"54958899","very bad not making good",1,"2018-05-19 20:20:53",1,1,0
"40156245","Nothing like shawarma, I got a feeling that we ate a roti with chicken xD",2,"2018-05-18 19:56:23",1,0,0
"34496072","low quality n quantity too , very less chicken that too not good ",2,"2018-05-13 19:41:55",2,1,0
"2177892","who puts cabage in the shwarma?",1,"2018-05-11 22:04:43",3,65,0
"52602915","good",5,"2018-05-11 17:04:30",3,4,0
"51637727","Food is good. ",5,"2018-05-09 19:47:07",3,1,0
"1690911","tast is not good. I did not feel cheese in side. plz upgrade your quality guys",3,"2018-05-08 18:18:21",3,10,0
"54027528","too bad",1,"2018-05-07 21:28:50",1,5,0
"4056571","Best fast food joint at More Supermarket!
Have tried almost all the varieties available here. Chicken cheese shwarma is the best one.
Yesterday tried the falafel, absolutely loved it! thegreedygluttonsgastronomicjourney.wordpress.com",5,"2017-11-07 18:51:30",112,1242,0
"15837134","Good Shawerma at the right location. Decent place for a quick grab. Never fails to disappoint the stomach. Was a regular here but with the hike in price, got compelled to look for an alternative. ",3,"2017-07-16 03:14:53",20,23,0
"35836801","It's a small shop beside road. I have been there once or twice. They offer a variety of shawarmas that too in a reasonable price. The only thing I didn't like that the chicken stuffing was a bit too oily. ",3,"2017-02-11 17:53:24",247,316,0
"37926880","I had the chicken shawarma . It was delicious with gud filling and all around perfect . The mayonaise was gud in taste . One of the best shawarma i had  . .",4.5,"2017-02-06 16:13:50",1,1,0
"700569","Shawarma here was not that tasty. It was had just the taste of mayonnaise. Chicken was not much cooked. It's just a kiosk but adequate seating was provided.",3,"2017-02-04 20:20:11",142,221,2
"240089","Had taken chicken and veg shawarma.
Chicken was anytime better than the veg one. Stuffing was generous. The white sauce aka mayonnaise used was a little less and hence it tasted better.
Must try for choti-choti bhuk.",3.5,"2016-07-11 18:48:16",207,611,0
"31526621","We ordered the food online .
Taste is good but the filling is less even in special shawarma !
A good thick filling would be really awesome and more dressing as well !",3,"2016-06-18 17:49:30",34,177,0
"7943351","Better than most of other shawarma shops. I have a big complain from Hyderabadi Shawarma shops, why don't you guys heat the chopped chicken slices properly and why not give cheese sauce with it. Also, who adds onion and cabbage in chicken shawarma.
I am from Delhi and 'Al Bake' can be called as 'Madina' of Shawarma lovers. Well cooked, well chopped and with ample cheese sauce.
Well about this place, Veg falafal was equally good.
Its a small outlet and can be missed, so keep your eyes on this place.
Easy on pocket and good on stomach. A try is always worthy.",4,"2016-06-07 13:28:54",116,158,0
"29978074","Shawarma Stop & Arabian Delight  Is Located Gachibowli.. Near To More Supermarket, Telecom Nagar Gachibowli Hyderabad.. They serve very gud chicken shawarma's.. Visited them recently n ordered...
Double Chicken Shawarma...
Double Chicken Shawarma is rumali roti is gud with huge mayonnaise n chicken stuffing is tasty n delicious... Prices are reasonable n full value for money quality n quantity is superb",4,"2016-03-19 11:52:19",626,1226,0
"31668088","My friend ordered shawarma and momos  from the outlet in the evening .trust me the worst momos ever  .The look n the taste of the momos was horrible .
The shawarma was descent .The taste was good but just coz the momos were so bad that's y the low rating  . 
You can try the shawarma  ....",1.5,"2016-02-18 17:29:20",126,277,0
"214506","Tried the Falafel in Rumali. Khubbus was not available that day. 
The falafel were not too fresh but were microwaved. I would prefer more flavour in them. 
The Garlic Mayo was thick enough as to not leak. 
The salad was fresh and the veggies retained a good bite. 
Economically priced. ",3,"2016-02-07 14:33:38",156,344,0
"1052349","Its a small stall in gachibowli, located in an area which has many such small food stalls around. We had chicken shawarma roll which was just average in taste. The vegetables inside the wrap was not that fresh and the white sauce also was missing the drooling taste. In a way its ok for a quick bite. ",3,"2016-01-06 15:27:03",81,363,0
"764741","A nice place to just go and hang around with friends at mid night and to taste the famous middle East dish.  Not at all costly and the best part for me is its location from where I stay.",4.5,"2015-10-04 02:01:39",55,108,0
"1381739","Loved the chicken shawarma.  Simple and tasty. Had this dish the first time and loved it.  Momos are ok. Being from North East can't expect awesome Momos here. ",4.5,"2015-09-20 01:28:24",25,1104,0
"31742250","Nice flavors, the wrap was very soft and total hygienic @60rs, You cant expect big at this amount. We will visit again for the other menu to try.",3.5,"2015-09-06 23:13:46",71,116,0
"103549","I didn't had much craving for food in dinner, my family wanted to have lite food kind of roll so went to food panda searching for roll home delivery . I found this place for which minimum order was 250, so I ordered 3 double chicken shawarma and 1 plate chicken momo . I got the confirmation of order and it was delivered on time. I started eating the momo 1st didn't like one bit of it. It was pretty bad.
Then ate chicken shawarma which was good taste full chicken and sauce .
I would love again to try shawarma 
Food 3/5
Service 3/5",3,"2015-09-05 12:37:09",206,622,2
"30536104","I have had shawarma from lot of places but I did not find anything great from here. the stuffing was very less although we ordered special chicken shawarma. Even a rating of 1 seems to be over rated in my opinion",1,"2015-06-28 22:39:38",3,0,0
"3181596","There's nothing below 1 on zomato I can rate, in reality I would rate this -5/5. Pathatic would be the only word to describe the shawarms from this place. He's literally selling rumali rotis hardly with chicken filling. And that too half cooked. I have tried out spl chicken shawarma. If some one has it for the first time here u'll not have a shawarma for rest of ur life.
Highly not recommended even if this fellow offers it for free.",1,"2015-06-22 22:46:22",18,36,0
"15761330","Nice one if you are looking for Arabian taste.                                                                  ",3.5,"2015-06-13 23:40:20",18,103,0
"1725437","Good shawarma to try for.but yes i had better from shawarma in other places. Price is pretty much same as it's in most of the places once in a while good place to go for snacks. Pushkar ",3.5,"2015-06-03 09:23:47",99,414,0
"545853","Being a shawarma lover was always looking for a good one n tried this place today evening.small kiosk in front of more super market gachibowli.there r both shawarma n momos but I tried only shawarma.
Ordered for spl chicken shawarma which is 70/- ...It's average n I had with rumali roti.he's got options wid bun,kuboos n rumali.Not so hygienic inside n nothing great about the taste.",2.5,"2015-05-27 22:55:11",328,1432,2
"170269","I stumbled upon this shop last evening on my way to Yosta. There is nothing much of an ambiance .
Its clean , they have a fridge and a microwave that barely functions , but its not something that would drive you a way , but yes eating in is the best option - home delivery isn't . The microwave barely warms the shawarma and will loose heat in 5 mins, complaints about cold food aren't surprising ...
I had the SPL shawarma in roomali roti - quite a mouthful this. Loaded with double chicken and some cucumber and some punchy sauce - Spicy mayo probably not sure. The chicken/marination itself is spicy and leaves your mouth zingy.
All in all - pretty filling and pretty happy if they can keep up consistency thegastronomix.net",3.5,"2015-05-05 06:00:15",305,2418,2
"661509","A street side stall ..The shawarmas are mediocre... Nothing that great .. But not bad if u want to grab something on the go .. :) .. No place to sit as such.mohdazad.wordpress.com",3,"2015-05-02 11:51:55",122,2177,0
"29085854","Never eat their double chicken shawarma. They use a lot of bitter cucumber in it, which makes it really bad.
The special chicken shawarma was still good, but the amount of mayo is really less.
I ordered online and the food was cold, when it was delivered, which made the experience really bad.",2.5,"2015-04-26 15:14:11",12,75,0
"20359549","Never order online with these fellows. Take a minimum of 2 hours and you have to call them to remind them that you placed an order. 90% of the times, their numbers will be switched off or they don't answer the call.",1,"2015-03-02 20:42:11",1,0,0
"4457291","This place offers a good non-greasy shawarma with a lot of chicken pieces, but less mayo and other heart-burning stuff. Quite a mouthful. 
Only drawback is that the home-delivery takes a long loong time, in which the shwarma goes cold. Anyway a prefect snack :)",3,"2015-01-26 15:06:17",48,373,0
"40400","One of the worst places I have ever had a shwarama from. No hygiene and no taste. Mayo is watery. Very less chicken n adds a lot of cabbage and tomatoes that spoil the taste.",1,"2015-01-06 11:44:58",67,662,0
"8572511","Worst   shawarma ever i saw his chicken taken by dog and he literally  snached from dogs mouth and washed and started to sell back to customers
I never going back  ",1,"2014-11-01 18:54:55",16,8,0
"2411964","Please don't go and try guys, its the worst shawarma I ate. The mayo there is kind if liquid, they mixed lot of water in mayo and the bread they use is kinda stale one...don't even think if chicken...donno from how many days its there....u get much better shawarmas in toli chowki.",1,"2014-05-21 01:36:03",10,12,0
