"UserId","Review Text","Rating","Time","Reviews Count","Followers Count","Photos Count"
"57935083","My brother ordered 4 aloo parathas on #zomato from this place. The food was very homely. I felt like it was ghar ka khana. The pudine ki chutney and tomato curry compliment the Paratha very well. 👌
According to the prices, the food served here is extremely delicious 💯. 🙌
One suggestion : give curd along side, It'd be amazing.👌 ",4,"2019-04-11 01:03:51",37,89,1
"2913956","I had very pathetic experience with zomato and vaishnav dhaba , I placed an order at 8 58 pm and I did online transaction and the message was order incomplete and suddenly at 22 49 I got message saying that food will be delivered, I called the delivery executive immediately to sort out the problem ,he was trying to talk to restaurant to cancel the order and I heard the restaurant lady abusing me , I feel very bad that in past many times I had to order from such a restaurant also they were shouting at me in phone . Then I disconnected the call and tried to contact zomato service and I was replied with lies , I promise never to use zomato and never visit the restaurant .",1,"2019-03-21 23:26:23",2,7,0
"36263035","Shri vaishnav dhaba is located close to the DLF. It is a good place to visit if you are looking for a budget eatery. The place is running from a house, where one room is converted to a kitchen and other 2 rooms to sitting area. The ambience is just like that you would find when you visit someone's home for lunch or dinner on some occasion or festivity.
Coming to the food part .... I had ordered dal baati churma. Yes its one of the rare places to get the same in hyderabad. My friend had ordered butter kaju jeera rice and dal tadka. The serving time was pretty decent considering that there was only one person serving and taking order. The taste was also decent, though I had high expectations from dal baati.
Dal baati was nicely fried in ghee and the size also proper. But what faltered was the fact that baati was too hard from outside and not properly done from inside. The serving portion was also 2 nos. and when I expressed my surprise at that, they were generous enough to give one extra at no additional cost.
Kaju jeera rice was decent. I too had high expectations from the same but again faltered. Tadka Dal was really spicy. But in all they were generous to put in decent pieces of kaju (cashew) in the rice.
My suggestion is, if you are looking for having a budget food and and really looking at ambience, then this could be a place.",3,"2019-02-17 08:50:31",59,182,0
"16724635","Good food and better ambience. People can visit this place as it is a budget restaurant with good taste . Different people have different appetite some eat more some eat less  why I am saying this is I have seen few reviews of this restaurant which are baseless and doesn’t relate . Coming to quantity complaints having seen here at restaurant they charge hardly 100 bucks for starters and curry and just 6 rs for the Roti and curd 10 rs so please guys don’t complain order double don’t cry like kid. And also I have seen people just have one follower and in their profile just one review that too for this restaurant only so beware for the restaurant someone is trying to get you down.  And please do not misguide this app this platform is not just to hate to help people for the better food.",4,"2019-02-13 13:49:21",18,89,0
"69194777","Genuinely liked the food.I have ordered several time from here and every time I liked it.Most of the time I have ordered parathas and parathas are really good 😍😍",5,"2019-02-06 23:53:10",19,10,0
"39998142","I had ordered Dal Tadka and Jeera rice.Rice quality was also not that good a normal quality rice was used. Taste wise also I didn't liked it much. In short I would never repeat the order.",3,"2019-01-20 20:14:30",2,1,0
"15790472","Great Parathas. It will be better if they reduce the spice content in the Tomato Rice though. Quality and Service of the food is quick. I will recommend this restaurant for it's various Parathas. ",5,"2019-01-16 14:25:53",46,84,0
"37601788","Pathetic food. Do you guys even know how to cook average taste food(Shri Vaishnav Dhaba)?Please don't order from this shit place if you don't want to spoil your mood.",1,"2019-01-05 14:43:09",3,11,0
"27415399","Bakwas Food that too in Hyderabad....
Ordered Gobhi Machurian - Never had like this much bad Gobhi M... 
Aloo mutter - Simplest curry but they made it like worst...
Entire food waste",1,"2019-01-01 22:00:23",5,45,0
"39385480","Ordered Malai Paneer and roti.It was delivered on time and food was hot and nicely packed. Malai Paneer was delicious and hit all the right cords of the taste buds.Definitely will order again ! :)",5,"2018-12-25 11:51:42",34,327,0
"54943786","food is not hot, not mixed properly with chilly powder and masala.",3,"2018-12-05 21:40:33",5,4,0
"54943786","curd qty is very less , worst ",1,"2018-11-28 21:51:26",5,4,0
"54943786","qty less",3,"2018-11-22 21:40:55",5,4,0
"52096459","very good ",5,"2018-11-17 15:13:44",3,2,0
"56624910","I have just ordered a food it has a cockroach in it ,its disgusting ,food smells bad, rotten smell in it waste of time and money.
I want my full refund otherwise ill complain to food department. Find attached pictures",1,"2018-11-03 15:25:20",1,1,0
"52933383","Paratha was bit hard. Fried rice and chutney provided with paratha were tasty. ",4,"2018-11-02 11:38:29",6,1,0
"57132820","it's not good. worst . eve if we order in the road side we should get better taste",1,"2018-10-29 14:34:54",2,1,0
"48604686","gravy was not upto the mark and there was too much oil in the gravy.",3,"2018-10-28 18:16:17",1,0,0
"52185115","i really do not want to give you rating bcoz your food is really shit and such a waste of money ",1,"2018-10-28 15:52:50",2,1,0
"30552507","The food was very disgusting and ordered 3 veg-65 and the quality and quantity was very less and not up to extent ,making fools by giving 50 % off and there is no veg -65 in it just like onion roasted and food was not good at all ",1,"2018-10-26 19:07:33",9,53,0
"61988754","worst food and no Seal for food and tastes bad i hate it and I thrown it out. not so hygienic che...worst food",1,"2018-10-22 14:36:06",1,0,0
"52154195","Very good quality food at economical prices. We have tried veg till now. Very soon non veg we are going to try. Jeera rice at 54 with masala curd and cardamom curry, amazing restaurant.",5,"2018-10-14 23:48:26",1,1,0
"52823697","very worst i have ordered aloo pakoda and they have given aloo bhaji which doesnt cost 20rs also worst at peaks and i will never opt this again",1,"2018-10-14 13:20:58",5,1,0
"53006134","Mushroom Biryani was Very nice! Taste reminded me of few resturants out there who provide quality nd tasty VEG biryanis. PS: Quantity provided is value4money but i craved 4 more after finishing it. Will add pics Next tym. ",5,"2018-10-12 23:44:35",1,1,0
"53901281","on time delivery",5,"2018-10-07 18:16:32",0,0,0
"38513232","Less quantity",4,"2018-09-30 20:35:05",4,1,0
"55432845","the paneer used in preparation was not soft.",3,"2018-09-22 16:47:30",6,3,0
"61501069","not even wanted to give one star... are you mad!!! my food didnt reach me.. you did not send it.. there was no call.. even the restaurants is not picking up the phone ",1,"2018-09-22 11:22:54",1,0,0
"33179966","nice 😀",5,"2018-09-12 22:27:19",2,6,0
"34509225","Their aloo paratha use to be very good, but now it’s really not up to the mark. Very dry, less stuffing.
Ambience they should work on as it.
The place in evening looks very dull",3,"2018-09-12 12:18:28",4,2,0
"58292376","satisfactory ",3,"2018-08-26 20:44:26",2,1,0
"39001125","ordered thali.  test was ok ok. sabji quality is poor. ",3,"2018-08-18 14:47:32",3,13,0
"31865988","okay food",4,"2018-08-12 01:49:38",2,0,0
"27725380","It is a value for money food, delivery was on the time. Packaging of the veg combo was very good, thank you for not packing everything in small.pouches(please do same for parathas as well). Taste of veg combo was not very good I will give 3/5 to veg combo but 4.5/5 for parathas. But overall 163 rupees for this much food with delivery was quite impressive and 1 more star for that.",4,"2018-08-11 21:03:25",59,40,2
"51451175","they didnt give ketchup with noodles",2,"2018-08-04 20:34:26",1,1,0
"63432733","gd ",5,"2018-08-04 16:17:14",1,0,0
"62740958","food was stale",1,"2018-08-02 22:10:14",3,0,0
"46479191","Taste and quality of food very low standard. Ordered kachori, biryani, poori sabji, paneer chilli. Everything had poor taste. Paneer chilli lacked sauce flavors , it was just deep fried with maida coating. Biryani was actually neither biryani nor pulao, it was something weird. ",1,"2018-07-29 23:09:55",1,2,0
"16135586","Aloo Paratha was very good, paneer curry was below average.",4,"2018-07-29 13:42:24",0,0,0
"32154068","Rotis were not fresh",2,"2018-07-29 13:19:50",1,76,0
"53287479","Usually i order foor from this restaurant .i am a fan of aloo paratha",5,"2018-07-26 21:14:56",2,0,0
"44045105","tasty food",5,"2018-07-24 22:33:00",1,1,0
"32882128","worst paneer manchurian ever , paneer is very hard even not boiled properly .",1,"2018-07-23 22:34:21",2,33,0
"53178184","nice roti",5,"2018-07-22 16:50:34",5,1,0
"31893928","nice delivery guy ",5,"2018-07-22 12:50:56",1,1,0
"36603278","Had high expectations! But was very disappointed. To start with, the food (paneer butter masala) was extremely spicy. No water served throughout. No tissues on the table. There was only one guy ""Chotu"" who was trying to manage it all. The owners were least interested and busy (and loud) in their own personal conversations.",1,"2018-07-10 21:27:31",27,29,0
