"UserId","Review Text","Rating","Time","Reviews Count","Followers Count","Photos Count"
"49462468","Bad service at this place overshadows the good food.
They are clearly understaffed, and the existing staff seem to not care at all about the customers.
The place felt like a heat box when we went there as they didn't care to switch the ACs on.",2,"2019-05-10 14:13:17",111,1009,0
"50981040","The worst experience. We told them that we'll be unlocking zomato gold and they said yes. Come the bill without gold benefits... Then they started arguing with us that we didn't tell them about zomato gold.
P.S.: Don't order pasta here , or maybe do if you like sloppy goo.",1,"2019-05-04 19:50:43",4,2,0
"29786056","Chocolate room!!
A must visit place for all the chocolate lovers!! 
This chain has been around for more than a decade now and they still keep me amused each time I visit.
I tried dark chocolate fondue. The dark chocolate was flavourful, thick and glossy. The dips were very well coherent with the chocolate and they are all 100% eggless! 
Potato wedges poutine was another dish that I loved the most and you should not miss this! It has white sauce pasta base with well seasoned potato wedges!
The pancakes were fulffy and are perfect when paired with hot chocolate!
Service - was bit slow as we went around 10 pm but the staff is really attentive !
Price- Reasonable price for the quality and the quantity they serve!",5,"2019-05-03 00:28:05",75,202,5
"33539505","It's a nice place but I didn't have a great experience with their home delivery. I had ordered pasta via Swiggy and they sent the wrong order. I complained and got the order sent again. The sent the wrong item for the second time around as well. Poor experience. But decent when you go there and eat.",2,"2019-04-13 21:22:27",62,96,0
"16100018","Didn't really enjoy much here. Its a dessert place, so you go with a mindset to increase some kilos. But the desserts were not so good. The ambience quiet dull and boring. Haven't gone there since",3,"2019-04-06 15:26:07",78,510,0
"31586305","Not worth for money, ordered french fries and chocolate milkshake...waited for so much time after ordering, waiter forgot about the order and came again for taking the order.",3,"2019-03-31 13:15:33",8,1,0
"37307462","Nice ambience..fast serving..near to my place.. enjoyed it. Ordered shake and brownie. It was amazing, hest place to visit witg friends it was quite rush on fridays and weekends",5,"2019-03-23 22:16:52",25,6,0
"40129130","Place have good ambience.
Gold benefits are eligible even on shakes.
We ordered shakes on sunny day.
Service is slow, we have to go to service counter and asked twice for taking order.
Smooties are okish, they are not thick shakes.
Pricing 3/5
Ambience 4/5
Location 5/5
Service 2/5",3,"2019-03-11 13:20:10",17,5,0
"99375323","It was such an disappointment. Agent Mannan was so rude to me. Also, I ordered 3 kits of from Chocolate room; although I received only one. I would say it was a worst experience. I felt so ignored.",1,"2019-03-08 18:47:16",1,1,0
"52169296","The food is quite decent here, but extremely over priced, from the coffees to the cakes everything is over priced and few days back I bought of hand made chocolates for my roommate and they were not upto the mark according to the price.",3,"2019-03-06 23:45:46",108,241,0
"39975834","It's actually quite nice. Ordered pasta, cold coffee, waffles.
The taste was yummy.
It's a cute care like ambience with small television screens that showcases matches. and music video.
The service is good.",4,"2019-02-24 13:46:41",42,49,7
"36399606","We ordered four different ice creams
1 chocolate ecstasy
2 chocolate chocolate sundae
3 chocolate banana split
4 the chocolate room brownie Sundae
and all of them were same ",2,"2019-02-23 21:40:22",4,1,1
"34494902","One of the best places for a hangout especially if you are a couple or a group. With the rich ambience of a chocolate filled aroma and delightful lighting, it would definitely be one of the best place to go. They have a variety of hot chocolates and coffees with subtle differences, only a true lover would be able to appreciate.",4,"2019-02-16 09:52:45",10,43,0
"15737982","This is a good place to hangout, as they wont kick you out no matter how long you stay. The playlists played are really good. Food is just up to the mark if you just want to hangout and are not a food critique. The ambience and service are good, except for the occasional cockroaches that run around.",3,"2019-02-10 17:06:14",10,1,1
"35321456","Really disappointed after receiving my cappuccino , I had ordered through zomato app only and they delivered the coffee in a disposable juice glass covered with foil. Worst experience of online ordering! Never order online anything from here",1,"2019-02-06 00:21:26",4,10,1
"15795677","I'm disappointed after last night's dinner I had here. I was visiting TCR after a long time and ordered a Dark on warm mug, Salad and a Mint Mojito. While the Dark was awesome, the other two items disappointed me. The Salad had very raw cucumber and it gave me a bad stomach pain from which I'm still suffering. They also gave a plastic fork to eat a salad which has chicken, cucumber, lettuce, capsicum and tomato. Giving plastic fork to substitute real cutlery is way more disappointing than anything in a place as reputed as TCR. The mint Mojito was a tad bit less disappointing. The syrups flavor dominated all the way till half the glass! ",2,"2019-01-30 09:14:08",20,73,2
"42654985","To be honest, it is an average place to hang out. The cold coffee or drinks made by me tastes better than what is served here. Minimal efforts have been done to maintain customer satisfaction. Almost all the items tastes average and not worth the money.",2,"2019-01-24 23:51:59",23,58,0
"29609196","First of all... Very classy ambience... You will just love sitting here and pass your time while nibbling on its starters...
Do have oreo shake..
Panner and corn Sandwich.. I had to eat this because i went with a vegetarian friend.. So sorry for that.. Cant tell you what to have in non veg.. You can connect to free WiFi and work peacefully too if you are a workaholic.. ",4,"2019-01-19 23:04:16",24,8,2
"10285311","The place lost its charm and service. Things like drinking glass with bottle of water that too 1 glass in the whole restaurant . Serving plate with food is something you have to ask for. Tissue paper on table is missing again ask for it. In all my last visit as everything have shelve life .. RIP Chocolate room 🙏",1,"2018-12-25 22:19:51",3,0,0
"38220968","Did not like the quality of chocolate ice cream served with the pancakes. Tasted as if it was laced with some chemical, gave a metallic taste to the palette after few bites. Was also dissatisfied with the waffle. Very rubbery, was difficult to cut. Lastly, the service was poor and rude. Wont bother going here again.",2,"2018-12-23 22:22:13",3,1,0
"37962833","Love their sandwiches, specially tandoori paneer grilled sandwich. The place has a great ambience. The prices are little high but quality is good.",5,"2018-12-08 00:36:05",11,13,2
"45929621","The one which I always eat here is chocolate sizzler.But now I feel it’s not worth to visit chocolate room for chocolate sizzler as the quality is decreased.Sizzler which we got this time is having so much of brownie but they din’t think of giving enough chocolate sauce and also the brownie is over cooked.",2,"2018-11-27 17:40:31",1,1,1
"50065257","Great place for chocolate lovers. My kids enjoy it every time. The cuddle cup concept is too cute. Chocolate fondue is to die for. The staff is a little untrained. Could do with some more sophistication. ",5,"2018-11-25 12:25:18",9,2,0
"4059311","Ordered chocolate brownie from online.... The pic was sooo good but in reality its not that much.... LOL... Anywaz it was good. Nice brownie...",3,"2018-11-25 08:10:54",150,233,1
"6834481","The traditional chicken sandwich was amazing, but the Earl Grey tasted like salty water :(.
Will be back to try the pastries. Environment was pleasant but could have been a bit cleaner",3,"2018-11-24 16:34:52",3,1,0
"35718304","Have been to The Chocolate Room at other locations so visit to this one was quite awaiting. Like the ambiance and the aroma of hot chocolate that fills the restaurant. A good place to date. Definitely a little heavy on the pocket. Staff is friendly. 
We ordered: 
•	Chicken cheese sandwich
•	Chocolate walnut sundae
•	Hot Hazelnut 
The staff needs to focus on hygiene, there were cockroaches around the billing counter which was really disappointing; we pointed the same to the staff. The washroom was bad, no tissues or hand-wash. ☹",3,"2018-11-16 17:45:00",90,117,5
"2586752","This outlet is the worst i have ever seen . There were cockroaches on table , food quality was bad and no one to take order on time. Please go to some other outlet don't ever try this outlet",1,"2018-11-14 12:19:47",4,7,0
"35563742","Absolutely love this place. Best place to visit for a cup of hot chocolate in Gachibowli.
Do try hot chocolate in one of the cuddle cups with someone you wanna cuddle too ;P ... Staff is courteous. Ambience is really nice. Pocket pinch is totally worth it.
I won't get tired of recommending this place. Do try pancakes and waffles and hot chocolate here..",5,"2018-11-06 00:21:22",36,170,3
"2449588","Great place for all the chocolate lovers you will find All varieties of chocos in this shop.
Ambience is good....service is also good. Food items are also good.",3,"2018-11-04 00:24:53",66,131,0
"66980169","Tried Pizza and Spaghetti looking at the reviews. Not sure how this place has 3+ Rating. 
Food taste- not that great and specially at the price you would expect some quality or effort in it.
Pizza had an uncooked base and the sauce they used on the base was normal sweet ketchup. A few bellpeppers on top and rest was normal cheese. Not what you will expect after giving 250 bucks for it. Same with Spaghetti- came in a tiny box, no garlic bread, On the name of Aglio olio- it was just couple of olives and olive oil and nothing else. No herbs/ seasoning or flakes.",2,"2018-11-02 09:42:00",42,6,0
"16142730","Ordered the chocolate avalanche. The quantity is too much that easily 3 people can have it in dessert. Hence, the price is not too costly if you keep the quantity in mind. It was a brownie and ice cream kinda mixture which was too chocolaty and perfect for the chocolate craving. The waffer became soggy in it and didn't taste good. They should start serving a smaller size too so that we can order for one person too at a lesser cost! ",4,"2018-10-31 22:00:30",166,977,0
"51453887","Ordered swiss chocolate cake from here.
Nice when it arrive. packing is good
Could have used nice quality ingredients to make it better as the cream was like some powder mix
Would try again if they improve the cream of cake.
Thank you .hope the restro improves",3,"2018-10-28 10:08:13",50,167,0
"32272157","Bounty milk shake: -1/5We ordered  a Bounty milk shake and that was the pathetic so called ""SHAKE"" I ever had in my Life so Far. And the price was Rs 189 which was not even worth if given for free. A normal tea from office pantry tastes far better than this drink. I dont have an option for giving a NEGATIVE Rating, hence forced to give a ""1"", when its not even worth to have a rating. We were so hungry and planned to have some food, but we were so tired with the shake given and we packed up without even finishing half glass of the drink. I will never prefer this to anyone even the restaurant offer for a free treat.",1,"2018-10-26 18:49:04",1,0,0
"75022914","Have been a fan of chocolate room since years and this ones really disappointed me . A worst experience an awfull taste and they call walnuts as almond ",1,"2018-10-08 23:14:17",1,0,0
"39027030","The chocolate options at The Chocolate Room, Gachibowli are amazing.
I personally love their Chocolate Avalanche ❤️
The ambience of the place was good with friendly staff around 👍",5,"2018-10-01 23:43:38",18,15,2
"70051577","THE WORST EVER PANCAKES! I’m not even kidding. It’s a total waste of money! And they delivered something way different than what was mentioned in the menu! Hope they improve 🙄",1,"2018-09-22 22:45:08",1,2,1
"49229770","This is one old good place to have deserts since years.
I have visited many outlets of chocolate room, at Himayat nagar, Banjara hills, and this.
The best i feel is Gachibowli chocolate room.
They have little app offers too
- one+one on pasta
-sandwich+thickshake
Etc
Do checkout!!
Alfredo pasta isna must tryyy :)
The paneer tikka sandwich could have been better...",4,"2018-09-22 01:16:51",40,445,4
"888021","Sinful. Nothing describes this place better. 😬
Going through their super extensive menu would probably make you tired, but the service is so appalling, probably you’ll die of hunger waiting for your order to arrive. The place is cosy enough for you to carry a laptop and spend a couple hours on an assignment. I’d recommend you do that cause anyway, they deliver orders after forever. 🙈
As the name goes, I’ve always had it in my mind to relate this place to a dessert bar. And hence, I’ve never tried the savoury items offered here. But I’ve heard they have a good offering among sandwiches and nachos. So that would keep my review limited only to the sweet dishes. 🙂
The Toblerone Shake and the Kitkat Shake are the shizzz. So full of the taste- actually well prepared. The chocolate brownie is really a waste of money: you’ve probably had much better brownies all over Hyderabad. 😝 
Nutella Waffles and Death by Chocolate pancakes: so good ! A heaven full of chocolate sauce and ice cream. Make sure to hit the gym soon after :P
Slightly higher on the price point, but worth a try! 😀",3,"2018-09-14 22:20:10",86,215,2
"44237244","Superb place. Went to fulfill some early morning cravings. Easy to locate it as it's situated in the busy street of vinayak nagar Gachibowli. Ambiance is nice and calm they have separate kids play area and a party hall for celebrations. The place can easily accommodate 50 to 70 people. Coming to food we ordered 1. Garden fresh sandwich it was really loaded with some nice veggies and perfect amount of cheese and toasted to perfection 2. The veg cheese sandwich again it was yummy and had roasted mushrooms to go with onion and cheese. 3. Oreo cookie shake - Sweetness was just adequate and flavour was awesome as well though they can do something with the thickness of it as it was way watery for my liking. Recommended 🤘",5,"2018-09-03 20:49:59",23,330,5
"48198829","Very poor packing. ",2,"2018-09-01 13:53:59",2,1,0
"32612312","Pancakes not cooked properly ",3,"2018-08-27 19:34:27",10,2,0
"49420787","We ordered cakes, shakes and hot chocolate. The cakes were simply amazing! Shakes and hot chocolate was alright.
The ambience is good. We sat there for hours at ease and didn't realise time had gone by!
Good place. ",4,"2018-08-23 17:21:45",5,12,2
"39296001","Hazelnut coffee 2/5
Poor quality, the coffee already had sugar and it was watery.
This was my 2nd time here and the place still disappointed me.
Might not come again..",2,"2018-08-20 22:15:41",61,119,0
"3031128","I ordered hazulnut delight, however there was no hazelnut flavour. The beverage was all spilled in the plastic bag it was delivered in 
Not a good experience ☹️",1,"2018-08-16 15:15:21",5,58,0
"1767733","It’s just like the other Chocolate Room outlet I’ve visited and the only difference I noticed here is the missing cycle! Service is good but it’s unhygienic even though it doesn’t look like one. Chocizza and sandwich are worth trying here! It’s accessible to Gachibowli residents and it’s located midst other leading outlets!",4,"2018-08-15 00:12:18",99,238,3
"6595651","Food was cold.",1,"2018-08-12 12:44:51",1,83,0
"15789282","Have been delivered a very bad version of this cult favourite dish of chocolate room. Didn't give ice cream instead it was clearly whipped cream.",1,"2018-08-12 00:18:25",4,71,0
"3093673","Nice and subtle environment to hang out with friends with really nice food. However the staff can be more cordial.
Food is really nice. Do try out their Chico brownie sizzler with Vanilla Ice cream. Also try out their mushroom and cheese penne pasta, if you're a white sauce pasta fan.
P.s. you may follow me on my Instagram page by the name of simbas_sister for more interesting food feeds. ;)",4,"2018-08-11 13:21:32",66,83,0
"40898599","taste and qulity good. packing bad.",3,"2018-07-31 23:11:36",1,1,0
"56867136","good ",5,"2018-07-29 17:53:19",3,1,0
"48610692","Ordered toblerone and kit kat  milk shake from this place...both looks same and tastes also same...its like boost and bornvita milk without any cream or any icecream...both are mixed with more water and less milk and chocolate syrups...spoiled our taste buds by ordering from this place...waste of money never order again ",1,"2018-07-28 22:44:49",0,4,0
"42274022","amazing food with the sandwich being thr very best. Being a lover of non veg, this veg combo was sooo good!",5,"2018-07-27 20:13:59",14,5,0
"43283406","I'm totally maaaad about chocolates. So when I came across something named ""Chocolate Room"" , you could imagine my happiness! As expected, I was so confused about what to order because everything on the menu looked DELISH. I ended up ordering a Choco Crunch Mocha. The ambience was so cool for hangouts and the service was good too. The prices were reasonable. I'd love to go back there pretty soon! ",5,"2018-07-25 16:23:02",10,3,1
"34544793","A nice place to hangout with friends.
A lot more to explore about chocolate dishes here.
A place with good ambience.
A place with late night food & chocolate dishes upto 12 in night.",5,"2018-07-25 03:22:05",20,460,1
"39721400","The chocolate room, I think the name itself is a like a bliss for chocoholics. Well, it was around 6 in the evening & I wasn't even hungry so I had to order something light.
I ordered for a KitKat milkshake.
It took a little bit of waiting for the order to come. The main thing was that it wasn't chill when served. I felt the milkshake would had tasted much better if was more thick. It kindof lacked that real chocolaty flavour.
The place was fine to sit & talk. Well, nothing much to mention about the ambience.",2,"2018-07-17 09:25:29",24,54,1
"54609387","food is not good",2,"2018-07-15 18:13:13",1,1,0
"52092185","taste not good",1,"2018-07-14 21:31:12",1,1,0
"32750692","I got food that was completely different from my order. ",1,"2018-07-13 21:55:10",1,0,0
"41245269","Low quality",1,"2018-07-07 20:31:22",2,1,0
"39305368","The so called cheese dip tasted like peanut chutney... Had a good experience with this place before... but previous delivery was disappointing.",1,"2018-07-06 19:09:26",3,1,0
"4965301","Good place for celebration with Small group of friends/family. The service need to improve. Hot chocolate and and paninos are favorite combination for me The crisp of bread and sip of perfect hot chocolate can make your day..",4,"2018-07-06 16:25:33",22,89,5
"39791636","good",4,"2018-07-02 18:41:44",2,1,0
"48987022","Taste and quality is good... May be a bit more better.... ",4,"2018-06-24 10:47:14",4,1,0
"54265216","Provided seasonal fruit as banana.. Which is not expected ",2,"2018-06-16 15:37:20",1,1,0
"29826029","Ordered Paneer Tikka and Garden Fresh Sandwich with Oreo shake. 
Paneer Tikka - 5/5
Garden Fresh - 5/5
Oreo Shake - 4/5 ( As it was not so cold )
Staff : 1/5 If you request them some changes they would behave like kids and are not flexible at all, removing a topping would not cost them anything but they deny to do so. Something which is terrible out there.
Overall the ambiance was not so good. Ac was not working properly and it was a bit dull out there.facebook.com",3,"2018-05-25 16:19:24",157,364,2
"54090478","very good service",5,"2018-05-23 15:23:59",3,3,0
"54090478","very good service. very good offers. Better than Swiggy",5,"2018-05-22 15:30:06",3,3,0
"51637361","bad",2,"2018-05-17 11:39:35",7,1,0
"1610696","Not as regular, No choco Sticks are there, not satisfied, Lose of money",1,"2018-05-14 22:41:05",2,3,0
"37641817","Good combo",5,"2018-05-13 00:30:43",2,34,0
"47179587","Good",5,"2018-05-10 07:43:49",2,13,0
"38943786","The chocolate room as name suggests should have variety of chocolate flavour products. But variety is quite less. Very few cakes and drinks. The place should be only place for chocolates and its products. So live upto your name.
Food - 3.5*
Ambience: 4.5*
Closes at 12 am, hence good place for late night cravings. ",4,"2018-05-07 20:21:26",6,57,0
"44647570","no that tasty it's like 20 rs chocolate shake!",1,"2018-05-07 17:52:25",5,3,0
"3648501","They offer a lot of varied products, especially variants of Chocolate flavoured food. Check out their shakes, pancakes, waffles, pasta and lot more. The ambience and service is great, and makes you feel like spend more time.",4,"2018-05-05 20:25:05",5,0,4
"37584205","food was not fresh",3,"2018-05-05 18:34:00",8,0,0
"53856548","Very bad not worth the prices at all",1,"2018-05-02 23:07:36",1,2,0
"43099040","the box that came with the ice cream is harmful to open. it cut my fingers. just saying. please pack a little less sharp lids next time. 😂",3,"2018-04-29 17:17:33",2,1,0
"50093315","I didn't like it",1,"2018-04-26 12:31:44",1,1,0
"45542699","Nachos were tasty, but toblerone shake had bournvita in it.",3,"2018-04-25 21:45:56",1,1,0
"52746505","taste is not gd",2,"2018-04-23 13:52:10",2,2,0
"27143629","Cold Coffee here is really good with the wiped cream.
Didn't expect the garlic bread with corn be so good. Better than many places.
Next time will be trying waffle for which this place is more known, have been at other branches.",4,"2018-04-18 21:06:42",37,115,1
"52641946","The shake was not up to the mark",3,"2018-04-17 22:51:52",1,5,0
"52702229","milkshake is not good and it was not thick",2,"2018-04-16 12:29:37",4,0,0
"41234297","good",5,"2018-04-15 11:26:41",3,1,0
"53216100","Quantity was very less.quality wise its good. Taste is above avg",3,"2018-04-14 13:48:50",1,1,0
"47410131","Fab 👌🏼 best chocolate room. Service, food, ambience everything was very good. Best place for chocolate lovers. Chocolate sizzler was amazing.",5,"2018-04-11 08:26:50",6,1,0
"51916413","this is not the one we expect and this is not the brownie shake which doesnt had any flavor of brownie## worst shake## it has only milk and sugar that's it## loss of time and waste of money##",1,"2018-04-10 19:05:37",3,8,0
"49887193","I ordered cappuccino and got black coffee, read orders correctly first.... ",1,"2018-04-08 23:49:51",16,15,0
"51276185","taste was super but size was small",4,"2018-04-08 22:03:36",1,1,0
"51584668","Good",5,"2018-04-08 20:47:55",14,6,0
"5649451","Chocolate quality is very bad considering the high price. It tastes similar to an equivalent 30 rupees milkshake you get in cartons. I so lodge recommend this to anyone. ",2,"2018-04-07 16:23:58",5,0,0
"51330168","avg it was",2,"2018-04-06 21:09:39",1,0,0
"43543869","The Gachhibowli Chocolate Room is a nice place.I thoroughly enjoyed the delicious food on all of my three visits so far.However the quantity as shown in the menu is never the same on ur plate.Expect always a half filled stomach once u return back after spending comparatively a higher amount than any other meeting points like CCD.",3,"2018-04-06 20:39:44",11,28,0
"31254078","Mocachino was not hot",1,"2018-04-04 16:13:32",1,0,0
"6676351","I'm not satisfied with this order,waffle wonder is the worst  one I've ever seen .I don't know how it is served to customer can you plz close ur shop ,so that people will alive. I don't know what to say, direct I was thrown in dustbin u know.",1,"2018-04-03 23:33:11",2,8,0
"2458214","late delivery. plastic found in food. Bad service.",1,"2018-03-31 12:45:13",7,75,0
"51305292","I didn't received the items of my order fuck off",1,"2018-03-29 16:57:06",3,2,0
"171269","really bad food. the coffee spilled over pancake",1,"2018-03-26 15:32:24",2,97,0
"20228608","the chocolate chip cookie was bad, rest of the food was quite good",4,"2018-03-25 16:26:55",27,281,0
"1087542","wooah nice tastyyy",5,"2018-03-24 22:07:07",10,23,0
