"UserId","Review Text","Rating","Time","Reviews Count","Followers Count","Photos Count"
"12628451","Visited ulavacharu with my son who are both non veg lovers. The food was good but the quantity was very less for the price that was paid. We ordered Raju Gari kodi pulav which costed around 400 and the meat was very less in it. ",3,"2018-11-18 07:11:43",1,6,0
"1477233","Food - 4
VFM - 3.5
Ambience - 3.5
Service - 3.5
We ordered Bamboo Chicken and Pachi Mirchi Kodi Pulao. Both the dishes had fresh ingredients.
Bamboo chicken has good flavors but was more than mildly spicy. It is served directly from the bamboo box it is cooked in. It also has dry gravy so it's not entirely a good choice for starters, will go well with any Indian bread.
Pachi Mirchi kodi pulao was awesome. The rice was flavorful. Chicken curry served over it was semi - gravy and yummy as well. The chicken was nicely complementing the rice.
Service can be improved a bit. Will go again to this place to try other dishes. ",4,"2018-11-18 00:01:36",77,323,4
"54935010","nice service",5,"2018-11-17 13:35:13",17,13,0
"6829411","I ordered Raju Gari kodi palav from this pathetic senseless restaurant. Why the hell there is water in Raju Gari kodi palauo? It is full of water. I have to heat and boil it again to take water out and it became paste. Is this how you serve customers? Pathetic. I am never going to order again from this restaurant. Stupid restaurant ",1,"2018-11-16 18:52:52",1,52,1
"43911294","Amazing food.. Ordered:
Bamboo chicken - Above avg
Chicken Vepudu - Great
Chepala Vepudu - Great
Raju Gari Kodi Pulao - Above avg
Andhra kodi pulusu - Great
Rated 4.5 because of noise or else would have rated it as 5. ",4.5,"2018-11-10 22:59:45",2,2,0
"35743839","First of all..excellent ambience. Perfect for family gatherings . Coming to food we ordered bamboo chicken , raju gari kodi pulav , korameenu vepudu , kodi vepudu pulav and my favorite junnu which were okay in taste but the starters were delicious. ",3,"2018-11-09 18:26:19",36,57,5
"56836410","Extremely disappointed with the food taste.we have ordered Kodi roast which was average when compared to godavari royyala vepudu.we usually expect dry item when it is named as vepudu but we got gravy and semi gravy items.same experience with two more items kakathiya mamsam vepudu biryani and Kodi vepudu biryani..
Even the prices are extremely high.if taste is better no one would be bothered about price.😑",2,"2018-11-05 09:11:51",1,1,0
"54051337","The service was very fast and taste was awesome the ambience was super and raju gari kodi pulao was very tasty,totally everything is awesome.",5,"2018-11-03 19:17:59",2,2,0
"1351602","Lovely ambience and equally lovely tasty food . Best part is the valet parking. Good variety of options of authentic food. We had starters, main course and appetisers . There is a complimentary jalebi and at the end masala pan which is a very nice gesture . Overall a very good experience",4,"2018-11-03 14:31:00",102,268,0
"33013948","Been there with the hype by waiting for 30 mins nearly for the table meanwhile looking at the authentic theme on a Sunday for lunch and management finally provided us a table and we have ordered few items in which ulavacharu biryani  is yummy . Service can be better. ",4,"2018-11-01 15:19:20",22,47,0
"51490204","delivered late",4,"2018-10-31 17:12:04",3,2,0
"2659726","Heard so much about this restaurant and went to enjoy the weekend dinner, but the rotis were served cool and the curry is full of oil. Inspite of complaining to concerned staff, there wasn't much difference. Try to avoid Ulavacharu, if you want to have a tasty and healthy food. ",1,"2018-10-29 12:38:06",8,185,1
"51621756","This is best place compared to all other restaurants of Ulavacharu in Hyd. Service is very quick and obviously tasty food. If you are looking for spicy dish, try Chicken Fried Piece Biryani. You'd love it.This place is highly recommended.",5,"2018-10-25 18:48:14",3,11,0
"43515803","I have been here twice and the food was yummy yummy I say.
Ambiance was kind of historic type with all wooden sculpture kind. It was nice .
We have tried pandumirchisticks which is my fav till date.
Coming to ragi sankati , it has disappointed me a bit. I expected it to be more tasty but it was not bad.
Over all you can enjoy there with yummy food. ",3,"2018-10-18 13:04:52",30,68,5
"63754046","The ordered Food was not good spoilt. ",1,"2018-10-14 21:31:41",2,0,0
"20275387","Comimg out of a restuarnt with full satisaction after a long long time. Kotha kodivepudu, loose prawns, bamboo chicken, chapala vepudu, natu kodi pulsu, andra kodi kura, ragi sankati evevry thing was perfect except konasema kodi vepudu was a little spicy. Special mention: really quick service. ",5,"2018-10-14 15:31:31",23,782,0
"20204926","Most of my star rating goes to the ambience here.This place is simply amazing with authentic Telugu menu and the food presentation.Prices are on higher side though for the ambience.Spice lovers must visit the place to satisfy their hunger.",5,"2018-10-12 19:38:24",11,6,0
"54408202","The experience from the Jubilee Hills outlet led us to try this one with colleagues on a couple of occasions and we were not disappointed. This place lives up to its reputation as a destination of choice for Andhra delicacies. Check it out...",4,"2018-10-09 18:05:59",12,9,0
"75043742","No taste in food, starters were served cold, probably it was already cooked so waiter suggested us that dish. It is expensive and not worth at all. they are trying to be over authentic and spoiling the basic taste of food. 
Rotis are very hard and Ulavacharu biryani is too much masala and no tasty.
Not suggested to visit.",1,"2018-10-08 00:53:27",1,0,0
"1526435","I had a family lunch today at Ulavacharu Gachibowli. Natukodi kaju vepudu was seriously bad in taste, chicken higeneness. When we complain about the same, staff didn't respond in proper manner. ",1,"2018-10-07 16:43:54",2,2,0
"16657381","Good place for team visits , ordered raju gari Kodi pulav and bongulo chicken both tastes great ....ambience is good, place can be extended to have more seats, it is always over crowded .. a must visit place ",4,"2018-10-05 13:44:53",9,60,0
"31929629","India is a food nation, every 50 kms you travel from one point to another the taste,spices and the approach changes. Andhra Pradesh and Telangana is no different. Andhra the way they cook their dishes is more earthy and less spicy compared to Telangana cuisine. Rayalseema being all healthy as they use Raagi, Spices are very earthy. Why am I preaching this because all these varieties are to be found in Ulavacharu.
Ulavacharu is a vibrant Telugu Brand having branches throughout Hyderbad. Banjarahills, Gachibowli etc....
Their Unique Dishes names, taste especially their crispy chicken skin, although a little tweeek is much needed to the palatte of Hyd. So overall the setup is amazing it just doesn't serve food it gives you an experience. A Must visit place. Points to consider for restaurant their Rose milk is a bad imitation of Rajamundry ,they serve fruitpunch naming it as Rajamundry.. so as I said tweeks are much needed.
4/5 is my rating",4,"2018-10-05 08:56:36",128,5520,42
"41786097","The moment you enter the restaurant the ambience is good.We ordered Godavari royalla vepudu that was good.Then we ordered Gadwal kodi pulao was ok their sambar rice was so sour more of citrus taste that was not at all acceptable.",2,"2018-10-02 15:44:18",10,18,0
"34009097","So, when I went with my parents, I observed the restaurant was jam-packed with people (I swear, it was difficult to get to our seats also). In a way, I couldn't appreciate the ambiance much. We ordered Ulavacharu Vegetable Pulao and what I believe was Pandu Mirapakaya (I hope I'm right). The food was tasty, well-made, with a slightly different mix of spices from the usual. I enjoyed the rice and the flavor it had. Having never tried any rice item of that sort, it felt like a novel burst of flavors to my restless buds. I'd recommend trying the food here at least once. ",4,"2018-10-01 15:56:39",122,636,1
"1109382","Tandoori fish, pachi kirchi kodi pulav and their welcoming sweet is a must try. Also check for the chefs special and please dont miss this out in hyderabad",5,"2018-10-01 11:34:26",44,39,0
"16161871","My favourite place in town for authentic Andhra food 
Andhra kodi kura with roti, mutton Pulao cooked in the pot was nice not very spicy with well cooked mutton chunks  , Prawns vepudu , apricot delight , Bangla kodi , ",4,"2018-09-28 21:03:36",144,1028,4
"2492264","Bamboo chicken is good here and the service is best .Each and every item is tasty and not disappointing. 
I also recommend pulavs and butter chicken here",5,"2018-09-28 15:15:24",10,9,0
