"UserId","Review Text","Rating","Time","Reviews Count","Followers Count","Photos Count"
"30164313","Too much expensive for the quantity served. Not worth the money. Most items in the menu aren't available.
Taste is just average. Not recommended",1,"2019-05-15 13:37:47",3,0,0
"659713","One of the best place to serve Andhra delicacies in Hyderabad. I love the pulaos here. Their speciality dishes are definitely a treat. Little expensive I must say. Overall good place.",4,"2019-05-11 13:53:52",56,317,0
"31233898","One of the best food experience in Hyderabad 
Raju gari kodi pulav- Unique and Mouth watering😋
Quantity is very less compared to other similar level of restaurants ",5,"2019-05-11 08:54:24",13,11,0
"37307462","Went for lunch to this place on Friday. It was full crowded and we waited for almost 1hr. If you want to go this place first reserve the table.
Coming to the taste, it was awesome. We had Raju gari kodi palav, ulavacharu biryani and chicken vepudu. All were really good and serving also very fast.",5,"2019-05-10 17:10:49",25,6,0
"75451457","The food was good as usual, but the service is become worse. The waiters are ignorant and lame, not attending tables , even for the menu we had to Menu multiple times. Not attending the table even after calling them multiple times. It was not even a busy business time. 
Request the management to have them trained, it just th food which is bringing us here",1,"2019-05-08 15:53:24",2,0,0
"875796","Ordered Gadwal Kodi Pulav, it had no salt. No resolution on it even after complaining that it had no salt. The quantities served are very less, so everyone who think one Pulav will serve two, to need to order one for each. ",1,"2019-05-08 14:07:40",11,49,0
"9183481","Me and my friend went for authentic South Indian pulao, and boy, the dishes are really tasty! We had kodi pulao and it was super tasty.. Definitely going to go again.. ",5,"2019-05-05 01:31:01",2,79,0
"3020078","This place is worse, you will see flies and Don’t have courtesy to the customers. 
Zomato accept the booking and restaurant will not accept ",1,"2019-05-04 23:53:01",1,0,0
"34413327","Reservation confirmed for 11pm, (shows open till 11:30pm), denied dining on arrival without prior intimation saying kitchen closed by 10:30 Pm and that they are not on zomato.",1,"2019-05-04 23:14:46",2,22,0
"15962386","Undoubtedly pocket friendly place.
We had chicken sambar rice. And leaf- wrapped roasted chicken. We also had curd cutlet which was super yummy!!!",4,"2019-05-04 09:21:36",74,210,3
"454440","If u are a non vegetarian and if you r craving for some good authentic Telugu food...This is the place to be....Their Raju garu pulao is one of its kind...Guntur billal Mutton biryani...Kodi chips, and Gadwal pulao....These were the dishes we had and trust me they wer just exceptional...highly recommend this place..",4,"2019-05-03 20:09:18",23,90,0
"1869506","Nice and friendly place to be in the ambiance is great and nature colour has been use to make the place nice and appointed 
I could the service to be very good and friendly 
We ordered for bamboo chicken and chicken pulav both the dishes were nicely presented 
Spice content was high has always in Hydrabad cuisine bamboo chicken was well done with nice aroma and taste 
Pulav was served in nice quantities sufficient for more the one person chicken tender and rice perfect 
Seems will need to pay more visits to try other combinations 
As a compliment a very nice Mysore paak was offered great taste !! 
Will visit again ",3,"2019-04-08 13:12:31",55,159,2
"1202564","WOW Ulavacharu. I NEVER ever knew your biryanis are so freakin awesome.
So I happened to go here by chance as my friend suggested we should just try this place. And my god. Me being eggatarian, obvious i ordered for an Egg Biryani. What presentation and what taste. Usually you just get the egg booked on top of the rice, but here, they cut it and the spice is inside of the cut Egg. How cool and tasty. I did have some before like this but this, this taste. Yummmmm. Kudos!
However they have done complimentary sweet for everyone the day I went there. That wasn't all that good. Way to sweet. Uhh. And my friend is a Non-vegetarian, he had some chicken Biryani and sure he licked his fingers. Awesome Ulavacharu. I'm coming back soon. Thank-you.",5,"2019-03-31 16:57:53",54,68,3
"39072153","Worst service. Food quantity is very less. Even the AC temperature was high. I suggest not to visit this place. Ridiculous thing was thums up and water was served hot.",1,"2019-03-29 20:11:47",8,6,0
"52788539","I got to know about this place from a TV show so went to try some biriyani. Ordered kotha chicken and Bamboo chicken which is a must try 
Ambience:4
Food taste:4.2
Staff:4",5,"2019-03-29 15:15:37",4,14,0
"29560018","Rustic ambience was good. The prawn and crispy veg starters were very average. The Andra style curry was good. Complimentary laddoo tasted yummy. Overall decent place but nothing amazing as far as the food is concerned. ",3,"2019-03-25 11:04:47",12,327,0
"35626817","Too expensive and is served with very less quantity. Went with family and it was disappointing as many of menu items weren’t available and Poor service. Not so great and it can be skipped. ",2,"2019-03-21 18:59:52",7,4,0
"29529580","Been here with parents. Ordered hot and sour soup and pachi mirchi pulav. The soup was a bit spicy but tasty. The pulav was to the point neither spicy nor bland.",4,"2019-03-20 19:38:25",162,265,2
"1164000","Though this food chain has got some fame, I totally disagree with it for the experience we had on our Friday lunch. Poor response and tardy service. Management failed to take care of the waiters who were very few around the tables. Waiters has to be augmented along with swiftly handling the services.",2,"2019-03-17 10:56:03",228,419,2
"16022493","Heaven for people who love Spicy Food!
Head here if you have spicy non-veg craving. Order the fried chicken and biryani, and oh God, just wait for the spice gods to come and sit next to you to bless you.
Ulavacharu FTW. ",5,"2019-03-09 21:01:15",71,125,0
"37746045","The worst experience ever. Ordered achari ghoshti it came with more salt later asked him he repaired the remaining curry after half an hour. Also the service was too slow and pathetic.",1,"2019-03-08 22:48:13",2,8,0
"43097485","This is one of a place where you won’t be disappointed, everything is good right from starters to main course to deserts. Nice service by Sri and team. ",5,"2019-03-07 16:15:44",1,1,0
"30785857","A lot of people suggested this place for some real spicy food. Had been there twice and in fact the first time I went there I knew that whenever I have guests at home I need to bring them here. Nicely done interiors - the antique door and the idol at the entrance, very beautiful and welcoming.
Coming the food this tile we we're welcomed with some ghee Mysore pak (yummy). The staff is really helpful in giving suggestions so we ordered a chicken, fish and mutton biryani /pulao. Delicious , full of masalas and tasty. Nothing to complain about the food. Bamboo chicken was the star dish , it just melts in your mouth.
So it's a place for some really fine dining. On Fridays and weekends do make a reservation, the have some crazy waiting .
Definitely recommended.",5,"2019-03-06 03:18:46",21,17,0
"69666013","This place gives a strong Telugu vibe. Taste of the food is little spicey. I ordered Bengali Kodi and bamboo chicken in starter. It was good and in main course took ulavacharu special fried rice which is little spicey. In dessert ordered kulfi which is very less amount as compared to price.
Good thing about the resturant is it has a decent ambience.Service was generous.",3,"2019-03-04 00:14:06",13,2,0
"33424261","Great decor, however it doesn't match with the name. Wonderful atmosphere, ulavachru biryani was exceptional and starters as well. Excellent service and a nice place to enjoy food with family.",5,"2019-03-02 20:35:42",15,6,0
"45899131","Food and ambiance are great here, but cost of the food is high with respect to quantity. Service was too slow and can't able to manage things.
We ordered Raju gari kodi pulao, chicken majestic and ulvacharu kodi pulao, names are self explanatory and village names which makes the taste buds high to taste.  
Overall review: Raju gari kodi pulao is spicy and must taste food if you like some liquidity in pulao.",3,"2019-03-01 18:26:01",26,22,0
"2317890","The name of this food place and the ambiance is amazing. Food is expensive here, meaning high cost and less quantity. The taste is good. It is advice to them to train their servers to get knowledge of all the items on the menu.",3,"2019-02-24 23:52:56",161,1778,0
"734533","Awesome place.. very good ambiance... Good variety in food.. polite & helpful staff ... music also gives andra feel.. best veg pulav in Hyderabad!!",5,"2019-02-21 00:27:59",4,52,0
"3010162","One of the most recommended places to enjoy authentic andhra cuisine. Been here multiple times and tried many dishes, they never let us down. As soon as we enter, we were offered with complimentary sweet - jalebi. (Sometimes they forget, in so, you can ask for it)
Among starters, bamboo chicken and bangla kodi are my favorites.
Bamboo chicken is very tender and it gets cooked inside a hollow bamboo stick and its sizzling hot with yummy taste.
Bangla kodi is very unique with each chicken piece wrapped in a sliced potato, this is a must try.
They have got a wide range of main course to cater to everyone's need, I have tried prawns vepudu pulav, this is the dish to go for if you like prawns, spicy, yummy, tasty, fulfilling and satiating.
Pachi mirchi kodi pulav and Gadwal kodi pulav are great too. Raju gari kodi pulav is their signature dish, but it will be soggy so not everybody may like it.
Don't forget to cool off your taste buds with rose milk or junnu in the end
Ambiance is soothing and sets the right atmosphere for a great meal. Service is bit slow and could be improved.
No issues with parking, they've got valet.",4,"2019-02-19 07:11:32",108,2531,2
"34593326","Ordered Nellore Chapala Pulusu and Andhra Kodi Kura. Both are Worst Awful Tasteless Pathetic.
Dont waste your money and time  complete useless stuff.",1,"2019-02-18 15:10:59",2,10,0
"33270041","The ambience is good. But the food took too long time to arrive at the table. We ordered some 3 kinds of pulav items but had to cancel them due to delay ",3,"2019-02-18 12:04:25",1,6,0
"51671476","Ulavacharu is well known for its taste. But the service I received today was the worst and this is not the first time even after complaining to the manager about it he did not even apologize for it and moreover he delivered me mutton instead of chicken and when asked about it he was like this is chicken and he tried blaming me instead . The way they behaved was worst . Manager named veera babu was very rude too. He was not even responding whatever we ask he said I am the sole owner and no one is above me. Even after we paid the bill they behaved rude. I do not recommend going here..",1,"2019-02-15 18:23:06",5,26,0
"39176993","Went here for dinner with my big time foodie friend Surya Tej Kanuri, he only recommended the place and I liked it. As we entered, they served complementary badusha, and it was good. Both of us being non-vegetarian we ordered fish, bamboo chicken, mutton biryani, and some regional dessert which I am not aware of (also they have limited number of desserts, and some of them were not available). With bill they do serve paan.",4,"2019-02-15 15:15:46",43,23,10
"37543093","Ulavacharu is one of the best south indian cuisine here I have tried in Hyderabad city.. Being a north indian (oppps, West Bengal is not considered as a northern state, so being an East Indian) my first step for an authentic Andhra rochulu (am I pronouncing right?) Went pretty good.. The ambience, decoration & presentation were amazing.. Food taste was amazing.. They serve 2 laddoos as complimentary when you sit on the chairs.. overall a good experience!
I exactly forgot the names of those 3 dishes we ordered but Junnu in desert was something different I never tried before.. mildly sugary desert made from fresh cowmilk (custard pie type) was amazing.",5,"2019-02-13 12:12:44",35,170,2
"30355286","Very bad experience with this place. Ordered lemon corriender soup with godavari royyala vepudu. soup is good in consistency but high on sourness. Not really good. Royyala vepudu was good but not hot, looks like they prepared an hour ago. After that we ordered gadwal Kodi pulao which is my worst experience ever. It is an highly spiced rice which a normal person can't eat.
Ambience and service is very good but not the food",1,"2019-02-04 13:51:49",8,14,0
"1988100","The place is really nice and gives a very strong telugu vibe. Nice old songs to go with courteous service. We ordered for Chicken fry pulav and sweet corn soup. Sweet corn soup was ok. The pulav was really good but really spicy which was expected. Suggestion would be to order a boneless pulav instead. Also we finished with a veg ulavacharu biryani. The veg option was disappointing. Should stick to non veg pulav/biryani and boneless. ",3,"2019-02-04 12:53:55",194,509,0
"476107","I visited this place first with my friend s and late with office colleagues, Place was very good like ambience, service food quality. Try koramenu it will be very good.",5,"2019-01-30 22:06:15",2,60,0
"36344123","Very very bad sooo waste taste less dont take order online.Very very bad sooo waste taste less dont take order online. Very very bad sooo waste taste less dont take order online",1,"2019-01-28 22:02:38",2,1,0
"55177327","Food - 4
Ambience - 3
Service - 3
Bamboo Chicken and Raju Gari Kodi pulao is a must try here. Prawns and Chicken Roast is okay. Service is little slow and messy. Ambience can be improved a little. Good place to try the authentic Andhra dishes.",3,"2019-01-25 16:26:13",19,3,0
"27743512","The place doesn't serve your booking request. You have to still wait an hour to get the table even after doing a booking, it just completely spoils the mood .",1,"2019-01-25 14:00:41",7,76,0
"32608766","Wanted to have some good authentic Andhra food and Ulavacharu didn’t disappoint me , loved the food even though it was a bit spicy . The Masam Vedupu Pulao and the Masam Miriyala are a must try here , The Andhra Kodi Kura didn’t quite live up to my expectations though . Ended the meal with the Rajahmundry Rose Milk which also ticked the box .Service was fantastic throughout.Overall enjoyed my experience here and would recommend this place to people looking for spicy authentic Andhra  food . Cheers !
P.S- Extra points for the motichur ladoo they gave us as a welcome snack . ",4,"2019-01-19 21:05:33",7,172,0
"90095082","Authentic South Indian flavours. I loved the biryani. This is for the first time I tried some Biryani truely n completely different from other restaurants in Hyderabad. ",4,"2019-01-18 14:13:03",11,8,0
"41975653","Food isn't great for the price. Ulavacharu Veg Pulao or Ulavacharu by itself wasn't to the taste.
Not a great place for Vegetarians. Heard good about Non Veg options.",2,"2019-01-18 13:23:34",1,1,0
"38716666","I visited 3 month ago it was good but it was very spicy .. ans somewhat costly also interior is good as well behavior of stap members.........",4,"2019-01-16 01:04:22",17,9,0
"50506211","I got to visit this place through a giveaway by @hyderabadfooddiaries and it was worth a visit. We tried the bamboo chicken which is an iconic telugu appetizer that has soft tender chicken cooked with right amount of spices. Mamsam vepudu which was the star of the show with spicy, perfectly cooked mutton that justified it being telugu cuisine. The Rajugari Kodi Pulao was the best of all.
This pulao had a different taste and texture, unlike biryani, this dish is similar to a porridge with soft chicken and delicious curry. This place has huge variety of appetizers, curries and rice in chicken, mutton,seafood and veg options.
Best destination for spice lovers👍
Food: 4.5/5
Service: 5/5
Ambience :5/5
Price : 1200/- for two
Follow @lazeezgrammer for updates
Follow @lazeezgrammer for updates
Follow @lazeezgrammer for updates
Follow @lazeezgrammer for updates",5,"2019-01-13 18:43:06",8,15,4
"46188945","The taste n quality of the food is awesome but its pricy. ambience is ok and crowded.Service was good. You would definitely not regret for the price you paid.",5,"2019-01-13 11:33:15",61,25,0
"44732858","Been to this place with my friends today, Let me start with the good part first, ordered ""Bamboo chicken"" as part of starter which tasted awesome but the quantity is little compared to the price they charge. 
As part of main course we ordered ""Rayala vari kodi pulao"" which tasted good but again the quantity is very less compared to the pricing and also the portion of chicken served is little in quantity, next comes the dish which was hyped ""Raju gari kodi pulao"", they took almost 25 mins to get it served on the table, we were waiting on the table after finishing the starters and first part of main course for this dish to be served, we were kind of disappointed as the dish did not taste good.
In short good place but pricing is bit high, value for money 3 out of 5.
Bamboo chicken tasted good but pricing (INR 435) is high for the quantity we get.",3,"2019-01-09 16:20:21",10,20,0
"47083221","It's worst place to dine
Too much hyped!!!!!!!!!
Last Sunday we visit this with my friends.. I tried here bamboo Chicken n pachi Mirchi kodi pulav both not at all up to the Mark ",2,"2019-01-04 21:23:08",34,7619,0
"15973910","Was there for new years eve, the ambiance is great and so was the staff but it was overpriced by almost 50% and Mutton wasn't cooked well.
Fish vepudu though was finger licking good.
Would have been 3 stars but reduced two because of pricing and poor Mutton dish. ",1,"2019-01-01 16:58:04",15,8,0
"59971214","We went on the new year day. Menu was limited. We waited 1 hour almost to get our food on the table. Service was horrible due to rush. Food was not that tasty. We ordered rajugari natu kodi pulao, which was bland. We ordered kothmira kodi kura as curry with roti. It was just OK but less spicy. We ordered junnu for desert which was the only good thing amongst all the dishes bit the quantity was so less for the price. Overall it's too much hyped restaurant with ordinary tatsing food at expensive rate. My suggestion better look for other options. Don't go during festive seasons it's crazy crowded.",2,"2019-01-01 16:39:01",2,0,0
"32480302","Ambience was good..went on a busy afternoon..ordered mamsam roast..was okayish..then ordered ulavacharu chicken pulao and pachi mirchi royyala pulao..ulavacharu chicken was good..royyala pulao was nothing special..service can definitely improve..",3,"2019-01-01 12:50:22",4,52,0
"29523388","Have been to this place couple of times... Though it is expensive, you will have a chance to taste few amazing starters like bamboo chicken, Kotha Kodi and variety of pulaos... The food here has authentic Andhra taste.. ",4,"2018-12-31 15:53:47",3,1,0
"88086506","This is such a over rated stupid place. I really dont know why is this even liked by people.
Food was very bad, service too.
Menu is an ocean and taste is nill.
I dont think they will survive over time, quality has come down soo bad.",1,"2018-12-31 14:52:06",1,0,0
"29060196","After hearing from my friends suggestions. I had prawns fry and chicken biryani... They need to improve food taste and quality... my dinner at ulavacharu. Food is okay",2,"2018-12-30 21:23:31",1,10,0
"46865782","Too much hyped....!!!
Heard a lot about this restaurant, but finally it ended up with a disappointment, mainly the pulav's.
Initially we were offered complementary sweets.Tried Pachi Mirchi Kodi pulav,Oorugallu Veg Pulav,Kotha Kodi & Crunchy curd cutlet.
Pachi Mirchi Pulav - was nice but lacked the expected spiciness,though its a medium varient.
Oorugallu Veg Pupav- Mostly tasted like normal rice but the spice mix was quite authentic, tasted like baby onions coocked with mango pickle.Quite a different experience, never had one like this before.
Kotha Kodi- Just an edited version of Chicken Majestic.
Crunchy curd cutlet - Good but too oily.
Finally ended the meal with a dessert(Junnu), which was good of all the items i had in the restaurant.
Good thing about the restraunt is it had a decent ambience and can accommodate quick a good number.Service was generous but a bit slow.
Overall food taste was just ok, lacked the heat.Can be improved a lot...",3,"2018-12-30 19:28:42",49,986,8
"50543680","If you want something really spicy.. try ULAVACHARU....  Starters are very tasty especially the peanut chicken. And good to listen to old songs..",5,"2018-12-30 11:52:37",2,2,0
"1979790","Great ambience and awesome food served here. Onion Rings, Curd Cutlet, Godavari Royyala Vepudu, Bamboo Chicken are must try starters. Pachi Mirchi Kodi Palau, Raju Gari Kodi Palau and Gadwal Kodi Palau are good options for main course.
P.S. Try their Rajamundry Rosemilk too.",4,"2018-12-29 16:30:12",13,118,0
"52161464","They tried to create authentic experience right from the ambiance. Food is a real treat, especially for those who like Andhra Cuisine. Bamboo Chicken, Raju gari Kodi pulao, Guthivankaya Pulao, are a must try. The only drawback is the service, which is slow.
Ambiance – 4.5/5
Service – 4/5
Food – 5/5
VFM – 4.5/5",5,"2018-12-27 19:20:43",52,43,0
"16204591","Have been to this place after hearing lot of good reviews, I can rate the food as very delicious,(specially pachimirchi Kodi Pulao) accurately spicy, varied dishes in the menu but I had a very bad day with respect to service.First of all there were hardly 2 waiters who were available and even though it was not crowded they were unable to address the customers and were confused with the menu as once they said bamboo chicken was not available and then when ordered some other starter came back with bamboo chicken secondly after some time those 2 waiters were missing and the whole floor was left without anyone to take care of guests. I hope that this is one of those cases and there wouldn't be other customers facing the same issue given the brand they own.",3,"2018-12-25 19:45:49",1,0,0
"418203","This place is simply amazing with authentic Telugu menu and the food presentation. Lovely ambience and equally tasty food . There is a complimentary jalebi and at the end masala pan which is a very nice gesture . Overall a very good experience",4,"2018-12-24 11:25:18",31,115,0
"1460146","A nice place to taste some of the local delicacies.. 
I really liked the rusty feel this place has, which takes you back in ages..
Loved the started.. although pulao was not the best I’ve had.
Overall, a nice dine out..",4,"2018-12-21 15:12:02",36,29,0
"3032935","One of the best biryani's I have had in Hyderabad. Ambience is awesome with copper glasses, plates with banana leafs. Service was fast on a Sunday afternoon and the taste was delicious. Ulavacharu veg pulao, Mokkajonna Vepudu filled my appetite. Would definitely visit to try other items. ",4,"2018-12-16 23:27:34",20,87,2
"34726008","This is my favorite restaurant always... But i dont know this time the service was very bad.. Taste of food is always awsome here....very disappointed with the staff need to ask everything thrice and more... ",4,"2018-12-16 20:18:08",7,12,0
"647258","Nice place...food was good.. we had sambar rice which was yummy, Guti vankaya pulav was avg...we had Gadwal pulav which was decent and other starters was also pretty decent...but some items which are mentioned in the starter menu(like Mirchi bajji) are always not available...management should be looking in to this....",3,"2018-12-15 21:15:42",13,55,0
"85413714","Food was awesome but expensive. Food was awesome but expensive. Food was awesome but expensive. Food was awesome but expensive. Food was awesome but expensive. ",5,"2018-12-12 20:55:44",1,1,2
"63754046","The food was different from what I ordered and this is 2 nd time  I Think will nvr order again",1,"2018-12-09 20:27:19",2,0,0
"53888810","Great 👍 ambiance, tried avakaya biryani tastes awesome, I would rate food 5/5, ambiance 5/5, service 1/5, if u plan to come please get your water because they won't offer you water until you request them, waiters ""sai "" Is busy in doing his works, the way he communicates is more like road side restaurant.",2,"2018-12-08 18:04:05",2,1,0
"54935010","Good service",5,"2018-12-03 14:55:02",17,13,0
"70899220","Food is very tasty. we ordered more than 5 times from same place and every time we feel the same.
Pandu mirapakaya starter is veg starters is superb.",5,"2018-12-02 14:28:28",1,0,0
"395709","Went to this place with colleagues for a lunch. Good ambience and good food sums up this place. Bangla Kodi was very unique - chicken pinned with crispy fried potato. We ended up ordering another plate of it. Must try at this place. ",4,"2018-12-01 13:23:46",51,149,0
"37381522","Food 1
Ambience 5
Serving 4
Food is not so tasty
I prefer not go to this restaurant when u want to enjoy ur food, u can go if u want abidence,
We have ordered both veg and non veg but not all satisfied ",1,"2018-11-24 10:29:38",1,5,0
"44459866","I wanna give 10 but I can't . I simply love it . If i Wana spend time with the family the first restaurant come to my mind is this because the retro songs and the old recipes they have make it a best combo ... I simply love it .",5,"2018-11-23 07:05:28",22,14,0
"81241534","I had huge expectations on food based on the review but taste was not up to the mark. And staff is not customer friendly.
Not recommended to anyone",2,"2018-11-21 02:20:20",1,0,0
