"UserId","Review Text","Rating","Time","Reviews Count","Followers Count","Photos Count"
"34226693","Been there last week ,food was very tasty really enjoyed . special thanks to chef Manoj,chef narbu and manager ram Charan .I recommend this place for everyone must try ",5,"2019-03-13 20:06:24",1,1,0
"53776957","Food is good, but service is too slow. Chairs have food stains which is not expected at a 5 star restaurant, probably this is due to they maintained a light colored cover of chairs.",4,"2019-03-11 21:55:52",11,10,1
"37166770","Great ambience. Service is little slow as very few staffs are there. But staffs are very professional and well mannered. Food quality is great. Different types of food items are there. ",4,"2019-03-07 21:32:15",84,166,6
"37381843","When we visited Radisson Gachibowli we tried the food from Wai-Kiki. They have a typical hawaian/polinesian menu which is quite unique in Hyderabad.
The ambiance is good, peaceful and serene. Definitely one can relax and enjoy a good meal.
Food is delicious! We had Mushroom Aloha with Fish Stew hawain style, Tahiti vegetables with Huli Huli Pineapple Chicken and also Grilled Chicken. All the items were delicious! Not even one to be blamed.
For anyone interested in having a different type of food (something else than biryani and curry) this is the place.
Recommended !",4,"2019-02-28 11:26:31",173,332,4
"61718852","Have been meaning to write a review for this place for a long long time now. We absolutely loved the service here! While the food is delectable, what really caught my attention was the customer delight that the staff especially Srinu aims for. Our first visit, he was kind enough to make some great suggestions on terms of what we should order as well as what would be the perfect quantity.
The second visit was for the Radisson brunch where we reached slightly early but Srinu remembered us from our last visit and while we were waiting got us some coffee and cookies. The brunch began and the chef (I'm so sorry for forgetting your name) had a great experience planned for me. Since I loved cooking, the chef made me cook the dish we were going to eat. The experience was something I would never ever forget and once again a shoutout to Srinu as well as the chef!
Great great place for sea food lovers! I would definitely recommend that you visit! Do try the cocktails while you are there :)",5,"2019-02-24 17:35:14",14,5,0
"51941267","Wai Kiki(at the radisson blu, Gachibowli) is one of my new favorite places in Hyderabad. With being the only restaurant serving a Polynesian and Hawaiian cuisine, they’ll have you wanting more. Every dish we tried was delicious and filled with various flavours. The ambience is of the place is one of an all day diner, except a lot more stylish. Unknowingly, we ordered only Polynesian so you know I’m going back. All in all, wai Kiki was a wild new experience with exotic flavours and lots of nui na aloha . 
Everything we ate was excellent. The katsu was my absolute favorite and the Chocolate Island (dessert) is a must try.
Special thanks to Ritushree for her excellent service and for being so hospitable.",5,"2019-02-17 12:33:35",7,4,5
"33309288","This place is one of a kind! No literally. It’s the only restaurant in the city serving Polynesian and Hawaiian cuisine. I normally love Italian and Indian cuisine but it was becoming a bit repetitive. We were afraid trying out a whole new cuisine but we were so wrong. Wai - Kiki was a very pleasant change. The Executive chef - Mr. Manoj asked our taste preferences and suggested various dishes and soon our skepticism changed into sheer delight. Every single dish was just bang on delicious. Besides the great taste, Chef Manoj also put in amazing effort in the presentation of the dishes and they looked fantastic. The must try dishes are: Polynesian Drummies, Crispy Prawns, Korean BBQ chicken, and the Wai Kiki fried rice. Coming to the desserts, you MUST try the Chocolate Island. It is one of the best desserts I’ve ever had anywhere. Everything about this place is amazing. The ambience too is very modern and elegant. The glass waterfall is beautiful. You have to visit to see for yourselves. A special thanks to Chef Manoj and the servers for the flabbergasting food, hospitality and service! Keep up the amazing work!",5,"2019-02-16 04:32:07",18,38,10
"9718221","Too gud food, very friendly behavior place, must go for date, team outing, salad was too gud, and dessert were really beautiful, nice nice nice",5,"2019-01-10 21:09:55",3,8,0
"35694979","The one thing that strikes you about this place is the soothing ambience. And when you settle down, the food just hits you bang.
The Polynesian cuisine is nowhere near the Indian taste but thanks to chef Manoj's nack for being innovative, I got to taste some of the best dishes.
We started with the jalapeno cheese balls which had a mix of two cheese and where really yum. the pick of the appetizers was the mushroom Aloha which was very peculiar and very garlicky.
Veg kothe would be unlike any dimsums you would have encountered. It was a lil spicy but I thoroughly enjoyed the sauces.
I really really liked the spicy cocktail, though it's really not recommended for people who can't stand chilli.
For the main course we had the Hawaiian fried rice and the coconut rice which was rather sweet.
The rice was paired with Tahiti with a red gravy and the kelelo which was coconut based and again on the sweeter side.
One must try the rice with the Tahiti coz the combo brings the best of the taste, very different than the usual indian flavour but really nice.
Thanx for such a great hospitality team WAI KIKI. ",5,"2018-12-28 17:28:21",113,1194,4
"62127700","Beautiful place, awesome food. Very response staff attending to all your requests. Manoj the chief chef was very attentive to your specific requests to ensure the food is absolutely top notch.",5,"2018-12-26 19:34:38",1,3,2
"31832910","A good place for tasty Asian food... everything we ordered tasted great... friendly service and sober ambience..... The Thai Red curry was absolutely yumm!!",4,"2018-12-21 05:40:19",169,326,2
"63954863","Amazing hospitaly the food quantity and quality is decent.Comparing to other five star restaurants outlet this was the best.Kudos to Chef Manoj and FB Team Priyanka and Ritu they made our aniy event so special. I bet this is the best place to try Polinesian cusine in South India. Thanks Radisson.",5,"2018-12-18 13:37:26",1,1,0
"3146270","It's a great place to hangout and you will find delicious and wide variety of chicken, pork, fish & prawn. Staff were so polite and friendly. I visited this place along with my CEO, boss and of course with few other team members. I tried Indonesian chicken satay & Korean bbq chicken and I liked chicken satay the most. I recommend this place if you want to try some Polynesian.",4,"2018-12-13 22:32:09",6,47,0
"1464970","We walked into Waikiki not knowing the place and their Chef Manoj welcomed us and introduced himself which was the reason we chose to have dinner there. Waikiki is a new place and they have interesting Polynesian fare along with Thai and even Indian food from their other restaurant. We tried the Dimsum, Kothe and the soup which was coconut based and very soft on the palate.
The Tahiti rice was a nice but not a dissimilar taste to some of our own rice Pilavs.....
Ritushree was cheeky who served us and all in all a nice evening. Certainly highly recommended. We did not know till Manoj said they won the Times Food award.....",5,"2018-11-30 23:11:31",2,48,0
"55949035","I am extremely delighted with the experience i have had at Wai kiki, wonderful staff especially Priyanka and Srinu and delicious food, I would like to visit this place again and definitely my
recommendation for a good restaurant.",5,"2018-11-24 13:50:33",1,3,0
"27048493","One of my friend referred this restaurant. Though I was cynical about the variety of food, ms.priyanka had helped to choose as per my preference. I had cheese balls and waikiki fried rice which seems to be their signature dish. It was superb and hacked my taste buds!! Finally met chef manoj who was courteous enough to extend his services beyond kitchen.. over all it was a pleasant experience and I'm looking forward to come again with my colleagues.. ",5,"2018-11-19 11:43:09",2,15,0
"2402026","Delicious food..! Great service and Cheif Manoj is very polite and kind. Must try wai-kiki schzwan rice with chilli sauce.  We have got a complimentary dish Kungpao Chiken of worth 950 rupees",5,"2018-11-18 22:17:48",1,39,2
"31704207","First thing, it's just a hyped up place. I don't know what's amazing in this place according to many people other than the hefty menu prices. The hospitality is in top notch and that's the basic thing you can expect in any star hotel. Other than that, i didn't feel anything worthy. You could go to some other place and spending same money but can have a lot items compared to here.",2,"2018-11-18 09:25:07",10,17,0
"65357296","It’s a wonderful place for being relax. Mr. Arun and Chef Dayal and mr laxmikant 
Chef Nihar are very kind,polite and friendly. 
We had great experience with chama guacha at dinner time with live music rooftop. 
I wish them bright future
.  
-Meghana Dhakan
Thanks for your hospitality ",5,"2018-11-11 23:12:53",2,10,0
"51814722","Earlier I was not sure about this outlet,But the perception was wrong. One of the best place to wine and dine. You can get all kind of food it's not restricted to polinesian Cuisine.And Kudos to Chef Manoj and F&b Manager Laxmi ,Priyanka for giving me the opportunity to prepare food live with all modern technique. I never had such experience.Radission really does wonder to Clients.
Neil Mukherjee.",5,"2018-11-11 00:08:39",4,8,0
"709081","Amazing food and the chef was very polite to make us a part of the preparation of flambéd prawns san fransisco. Everything was on point and we had wholesome meal with great ambience and good company. The preparation time was apt and the food was mouth watering. Will definitely go again. ",5,"2018-10-20 14:15:36",11,187,0
"76573398","My first visit to Radisson Hyderabad, for an official trip with my colleague from Germany. For first day dinner we choose Wai Kiki, we were very impressed with the ambience and we were welcomed by very friendly Restaurant Manager.
First impression or experience with Polynesian food was really great, prepared by Chef Manoj. 
Throughout the stay around 14 days, Wai Kiki was our main hub for relaxing and had variety of delicious food with cocktails.
Special thanks to Restaurant Manager-Priyanka, Chef- Manoj and Bar counter staff - Srinu for giving us a great experience.",5,"2018-10-18 11:22:59",1,4,0
"76648053","Ate out at WAI-KIKI, Radisson's Polynesian outlet in Hitec City, Gachibowli, after a long time. For those who haven't been there yet, its a must-visit place with it's delicious food, amazing cocktails and fantastic service.
We had Polynesian Chicken Drumsticks for starters, Korean Barbeque Chicken for main course. We tried out their coconut rice which was wonderfully different. The chicken was lip-smackingly good and the accompanying dips were just right. We had the Chef's special Chocolate Island for dessert; it is so good you will want to have more!
A special thanks to the restaurant manager, Ms.Priyanka, and her smart, courteous team for making our meal more memorable with their prompt and smiling service. Kudos to the Chef and his team for presentation and taste. They will pleasantly surprise you by preparing your order on a live counter!",5,"2018-10-18 08:49:17",2,4,0
"1795209","👋🏻 Hi there . U want ur trip to be happy then it has to be starts with a fine dine restaurant. As I got invited to the restaurant to try their food and enjoy the ambiance. I decided to visit the restaurant and yessss it is one fine restaurant. My friend Priyanka  was amazed us with her greetings. I met her in ohris and she invited me here . So I was feeling more comfort Bcz we know her . 
We had few items from menu as Priyanka was asked us try this volcano shrimps , pork chops n finally had hupia. It was fantastic. So yummy 🤤 still have tht taste in here . 😘. Thnks to chef manoj personally came to the table and told us about the dishes as well . Will definitely come back and will invite my friends to go there .  Thnks guys ",5,"2018-10-17 22:31:21",9,6,1
"76441936","Lovely place!!!
Been here twice for this place had a wonderful experience..
Got a surprise cake 🍰 from the restaurant manager priyanka and chef manoj
Food was great we had jalapeño cheese ball, tempura vegetable , Hawaiian fried rice and tahiti all the dishes were super tasty
Forgot to mention about cocktail don’t remember the name but it was fabulous..
Thanks to bar guy (Srinu)
Overall we had great time love to come back .",5,"2018-10-16 19:21:38",1,4,0
"76332245","One of my favourite place..I always prefer Radisson coz of the brand....
When we enter the hotel I met someone in the reception ..they have explained me about new restaurant so we visited finally it's lovely experience loved food and service it was wonderful experience thanks to Waikiki team especially Ms.priyanka for the great service...😊",5,"2018-10-15 21:14:23",1,2,0
"63906358","Great place for get together.. been here with my friends for dinner we all had great experience ..
The food was very delicious and service was great loved the grilled sea bass with mash potato.
Thanks to priyanka restaurant manager for making us comfortable",5,"2018-10-15 21:07:08",2,1,0
"32571180","Amazing food and very good service by priyanka , Srinu and team lovely ambience..
Lamb rack was extremely delicious
Would love to visit back.",5,"2018-10-11 20:39:33",3,0,0
"36277690","Been here yesterday night along with my friends by the time we reach it was very late 11:15pm the restaurant got closed then we met the manager (priyanka) she welcomed us very warmly
Food was amazing and service was best
Thanks to priyanka for the best hospitality 😍😍",5,"2018-10-11 18:25:59",1,1,0
"41961328","We had Hot and Sour soup, Fried rice and Tahiti. It was amazingly nice. Good part is we don't eat onion and garlic and chef Narbhu made exclusively for us without those ingredients. The complimentary cheese balls was another surprise. Ambience was nice and the staff (Ms. Priyanka) very courteous 
We would like to visit again for sure!! ",5,"2018-10-07 22:47:20",1,1,0
"44020773","The food was simply outstanding and not to mention the drinks / cocktail well made and served in totally different kind of glass. The restaurant manager / staff were polite and showed true mark of courtesy to a customer. Enjoyed the evening and the dinner.  If i visit Hyderabad again, visit to this restaurant is a must. ",5,"2018-10-07 13:59:15",7,10,0
"36787112","Visited Polynesian excellent service and ambiance.
Pls get in touch with Manoj and Priyanka for exclusive items .Thanks a lot for the tasty food.",5,"2018-10-01 20:21:09",1,4,0
"35481690","Lovely place :)
Visited here aloneg with my friends we wanted to try something especially so we choose this palace it's a beautiful Palace.
Food was damm good especially Polynesian princess and coconut rice.
Service was great staff are very helpful great Palace
Must try Polynesian princess ",5,"2018-09-30 22:01:22",12,355,0
"1556565","Been bere yesterday for a dinner before coming we blocked the table as i know priyanka (restaurant manager) from ohris i met her in many foodies event ..
Best place ever...We ordered cheese ball, flambed prawns, lamb chop and many more all were tasted excellent and service was great ,
Thanks to priyanka she hosted our event very well
Thanks to kicthen team for the lovely food.
Cheers👍👍👍",5,"2018-09-26 17:55:08",12,55,0
"72254214","Loved place very much its been one of best place so far
We love the place because of the extraordinary service people are so friendly.. Specially Mr. Sreenu from bar we loved cocktails very much and food was fabulous thanks to chef narbu he personally visited our table to find our feedback which was great effort.. Overall we had great experience once again thanks to Sreenu and narbu
Keep up the good job guys:) ",5,"2018-09-23 22:16:57",2,0,0
"72053747","Food was exotic and tasty.. 
Ambience was good.  Service was very prompt.  One great place to be..  Lovely deserts.  Also loved volcano shrimps..  Thanks to whole Wai Kiki team for my my experience  wonderful.  Great hospitality  given by Manoj,  Priyanka as well as sristika..  Keep up the good hospitality. Hope to see u again. 😃",5,"2018-09-23 11:06:47",1,0,0
"30246166","The blend of Polynesian and Inventive Chinese food which was unique and pleasing in presentation, and utilization of top-shelf ingredients made our taste buds satisfied..
Nice ambience and stupendous respresentative Ms Priyanka and the chef Mr Manoj who really made us feel fab by their sweet gesture and hospitality.
The best restaurant to try for!!
The Mandatory recommendation for people seeking change.
Thankyou waikiki..
Kudos to you🙌🏻🙌🏻",4,"2018-09-20 23:03:01",1,11,0
"32509115","We have been meaning to come here for quite some time, and ended up here for lunch on a Sunday afternoon.
We were pretty impressed with the ambience. It was very quaint, and we were welcomed and greeted by a very friendly hostess. 
The menu looked very exotic, and we were excited to try the dishes, which are said to be Polynesian, with a bit of French influence.
We went for their Flambed Prawn San Francisco and Waikiki Hawaian Pork Chops.
We also ordered the cocktail Mahia, to go with the main course.
The Chef was very very generous and gave us a complimentary portion of golden fried prawns, with a beautiful, fiery sauce.
The chef prepared the Flambed prawns in a live counter in front of us. They use white wine and vodka for the preparation of this dish.
It was very engaging, and I love it, when restaurants make a whole experience out of dining out.
Loved the prawns. The pork chops were a little tough, but the in house barbecue sauce was brilliant.
Presentation was top notch.
The chef and the staff kept taking feedback, and did their very best.
All in all a very good experience.",5,"2018-09-20 18:25:23",117,980,3
"71329437","Chef Manoj n Priyanka was good and polite... And the food also was good..... Ambience inside the restaurant is also good..... Must try for all those coming this side ",5,"2018-09-18 22:37:53",1,0,0
"70878889","One of the great place been here twice once with family and once with my friends both the times my experience was amazing love the food and great service thanks to chef Manoj and Priyanka for the great customer service..
Must try volcano shrimps",5,"2018-09-17 19:39:17",2,2,0
"71138321","My friend invited me for dinner .amazing food & great service Polynesian princess and Waikiki rice was too good . Love the interior as well . Waikiki is first Polynesian restaurant in Hyderabad .people must try this place .thanks team",5,"2018-09-17 13:26:25",1,1,0
"31605270","One the best hotel in Hyderabad
Food was great, ambience was soothing accompanied by lovely polynesian dish..the staff was knowledgeable and cater well to their guests
Overall it’s a lovely place.",5,"2018-09-16 16:29:21",10,84,0
"34024377","Best Place to try Polynesian Food... Tried Red Thai Curry.. Just a Perfect Blend as expected... Veg Kothe were mindblowing! Last bt not the Least Chocolate Island with Caramel Sause(****must Try) product...
Got an Polite & Warm Service by Priyanka.. She did guided me well with everything on the menu...
Thanks!!!!",5,"2018-09-10 14:43:47",33,294,0
"1873330","Great place to hang out with a couple of friends. Excellent service. Their chicken wings were spicy and heavenly. Spring rolls are a must too. ",5,"2018-09-08 22:40:18",2,8,0
"36786876","Heard a lot about this place 
Finally visited this place ambience was bright not so impressed with the lighting’s ..but coming to food I will give 100/100 amazing Waikiki and crispy prawns and staffs are very friendly they were keep on checking our needs and feedback which was excellent job ..
One of the best restaurant  blindly you can visit this place..
Good job guys👍 thaks priyanka n team",5,"2018-09-03 21:38:06",1,17,0
"32371093","Been here with my family for dinner loved place..they serve amazing Polynesian and Chinese cusine in the city must try chicken kothe with spring onion dip and Waikiki dish service was fabulous ...
Strongly Recommend this place",5,"2018-09-01 22:31:13",2,16,0
"32240715","If you’re looking best place to hangout then this is the place ..
Been here for a birthday party and I had a wonderful day chocolate island was the best dessert I had till now staffs are very polite and friendly
Overall we had great experience best hospitality 👏🏻👏🏻thhanks to PRIYANKA",5,"2018-08-29 20:55:37",61,127,0
"54823431","One of the best place 😍
Visited here for a dinner loved place the food was just amazing we ordered for complimentary birthday cake (strawberry cake) you made our day special
Also I would thank to chef who prepared the cake 🍰 because cake was just awesome",5,"2018-08-27 23:21:47",3,2,0
"34656123","I was wanting to experiment in continental and this place struck me...happen to come across this place through a friend who had told me it offers polynesian cuisine so hence tried it and i wad extremely pleased with the food and more for the wonderful service thanks to the restaurant manager priyanka who helped me with the right food options basis my opinion. I am extremely delighted and would recommend this place if you would like to experiment and wish to try something new and different and be pampered by the service staff.",5,"2018-08-27 03:30:50",1,3,0
"43381944","The experience at Wai Kiki was very good. Ambience is very decent. Staff was warm and welcoming and the service was very good. 
We ordered Polynesian Drummies and Polynesian Princess with Jasmine Rice. The drummies was excellent. The head chef also got us a dessert which was not on the menu.
Would love to go again to try out some of their other signature dishes.",5,"2018-08-23 17:44:41",2,2,0
"39225454","I am regular to Radisson, so last night I went with friends...food mashroom aloha..n cheese ball was nice...same server were attentive n eager to serve...nice restaurant from Radisson..",5,"2018-08-23 15:03:51",52,528,0
"31392608","We had a great experience in Waikiki.a wide variety of chicken ,fish (salmon, sea bass, snapper),pork (australian),lamb and it’s keeps going on.once you think tht it’s a good treat,than you will realise that few more delicacies are waiting because their cocktails are 😮 wow
The staff had been very friendly and had been Keen to get our feedback on how our experience with food was
Overall it’s great place",5,"2018-08-20 14:39:34",71,2090,0
"1705045","Apt rating will be 3.5. 4 for ambience and helpful staff and 3 for food. I came here expecting Hawaiian cuisine but whatever was served was normal but well made Chinese. Food order was dimsums served with very well made and unique sauces(4/5), water chestnut and broccoli (3/5) which was regular but tasted nice, Hawaiian noodles which again were well made but nothing Hawaiian about it (3/5), Tahiti (3/5) with same issues as noodles. Dessert order of chef special chocolate cake was above average. Overall a good place to visit but not sure if this qualifies as a Hawaiian food joint. ",3,"2018-08-19 21:36:52",119,110,0
"43356003","Went with friends for dinner.it has all the authentic Polynesian and Chinese cuisine which makes you dive deep into the Hawaiian culture. Food is super good you will have many options to choose from. Do not forget to have Hawaiian fried rice , Thai red curry and hupia (dessert) even their cocktails are good . Pina pina (cocktail)A best place to visit.will surly visit again. At last but not least the hospitality is super good and feel like home.Special thanks to Ms.priyanka and chef Manoj for the amazing gesture and to make my dinner memorable as I already wrote about my review in trip advisor
Best place to visit 👍",4,"2018-08-17 13:46:44",2,4,0
"32863849","Came Hyderabad for a business meet and we choose this restaurant for our lunch when we enter manager welcome us with a beautiful smile ..
We order manchow soup it was nice we skipped starters and ordered for Waikiki fried rice , grilled seabass both the dishes are fabulous ..
I should mention this I am very much impressed with a service as well food
Must visit place",5,"2018-08-14 14:13:07",19,3021,0
"1794677","Visited here yesterday night with my friends the food we here was amazing pork chops was too good..
Staffs are very polite after each dish they will come and take the feedback I am very much impressed with a girls service I would like to say thanks to Ms.priyanka (manager) and her entire team for the best hospitality ",5,"2018-07-30 11:53:50",93,564,0
"35767139","Visited the place recently. Loved everything, right from the their traditional drinks to their desserts. The food is delicious. Very good hospitality by the staff. We had lamb flambé in our main course, and that was par excellence! The Haupia in the dessert had very subtle flavours and thoroughly enjoyable. Overall an food experience worth remembering. I would suggest that everyone visit the place once to try out some Samoan and Hawaiian food!",5,"2018-07-30 09:43:06",7,8,2
