"UserId","Review Text","Rating","Time","Reviews Count","Followers Count","Photos Count"
"46147347","Awesome service and ambience...Praveen helped us with the food choice which turned out to be good..the virtual reality games and Ps games are add ons ..looking forward to visit this place with friends and family again",5,"2019-05-18 22:32:58",1,0,0
"45947231","Very good food.. had a great time at Bdubs. We specially enjoyed the buffalo ranch chicken burger.. yummy it is. And the roller coaster ride with Virtual reality is a great experience for the first timers.Thanks Adil :)",5,"2019-05-16 15:08:17",1,3,0
"1723393","One of the most amazing chains for Non Veg lovers and sports freak! There are gaming consoles all over the place and a lot of fun to spend time with friends and family. Highly recommended!! #Triedtheblazinchallenge",5,"2019-05-15 21:32:13",11,31,1
"2306268","The staff really nice and wing with the hot sauce was yammy mocktails was raelly good all the i recommend this place to every one who love wings... speciall the service is unparalled Mr. Praveen keep it up...",5,"2019-05-15 19:10:21",2,333,0
"52664505","Lipsmacking food ,wings with variety of sauces
Basil grilled fish was really good and chicken pizza was perfect with thin crust and my favourite cheesecake bites
Danger zone - blazin sauce and should try it for spicy thrill
Thanks to bro sunny for serving us",5,"2019-05-14 23:54:11",1,2,2
"44031177","Wonderful place to chill-out with buddies and can have fun part with PS4 gaming
Food is really awesome and they have different sauces ,blazing is really hot should give a try
Sunny was with us to entertain and giving good experience of bdubs",5,"2019-05-14 23:44:16",2,2,0
"44534330","Was my first visit and it was awesome experience given by sunny...really thanks to him for serving us with joy and helping us in dish selection and sauce tasting
Nice place to hangout with friends and have fun with games",5,"2019-05-14 23:39:46",1,2,0
"86253203","Came to bdubs for the IPL final and we really felt like we were in a stadium and the commetry was well played by playing songs in the breaks ..and the service was really awesome by Prabhu and Praveen..thnku guys",5,"2019-05-12 22:53:50",1,0,0
"39886222","Had a wonderful time at bdubs Gachibowli 
Stadium feeling with great delicious food and drinks 
Thank you Praveen YADAV was god with his service 
We will visit again for sure",5,"2019-05-12 22:47:32",1,29,0
"86189951","Awesome food and best service I have ever seen. Sunny was very polite and provided best suggestions regarding the dishes here. Worth visiting this place. ",5,"2019-05-12 16:46:46",1,1,0
"89435333","Great staff #Bharathi has given her best in her service. Good food and great service. Kudos to the management and staff. I would recommend it to friends and family.",5,"2019-05-12 15:12:03",1,0,0
"51732945","This is a place to enjoy and chill out. If you want to celebrate your birthday please do come here.best place. The service here is fantastic . We were were well treated by Mr praveen. Felt very special here",5,"2019-05-12 00:09:13",1,1,0
"82451302","Lovely place and good food. Very good service provided by Bharthi. The taste of the wings is similar to one you get in US. It would be good if they had some tap beers.",4,"2019-05-11 16:00:45",1,0,0
"80310199","Very friendly team. Praveen helped us whenever needed. Good vibe . We watched IPL here
If yu like something spicy try options with blazing sauce.....👌👌👌👌👌",5,"2019-05-10 22:34:27",1,0,0
"37264235","This is a very overhyped and overpriced place.
The wings are small in size and very shrivelled and the sauces are not that great too. The Jalapeño poppers we undercooked and nachos were very bland. They just have ps4 games and thats the only decent reason to spend any time there. ",1,"2019-05-10 01:21:18",5,4,0
"47412862","The food was amazing and the staff was very sweet. Prabhu Reddy and the captain were being really nice and were making sure that we we're comfortable.",5,"2019-05-09 21:10:01",1,1,0
"36111192","Polite and friendly and service is awesome and I loved the ambience. Sunny served us well and I loved being here for the time spent. As part of Deloitte party evening, we loved to be here. Thank you sunny for the good service.",5,"2019-05-08 23:28:50",1,14,0
"6658351","It's my first visit with my team Deloitte,happy with the place, their food and service by sunny was quite friendly
Their unique food , wings are awesome
Highly recommended place in it sectpr",5,"2019-05-08 23:19:00",2,11,0
"59950695","Nice place for a team parties
Wings are excellent ,tried with different sauces like Thai curry and spicy garlic which I liked most
Place was really cheerful with plenty of screens and polite staff adds to it , sunny served us and given good time",5,"2019-05-08 23:08:02",2,3,0
"55064657","This evening  visited bdubs and the food was really good and the friendly service provided by Prabhu and his team was good ...really had a good experience watching IPL ...",5,"2019-05-08 23:01:50",1,1,0
"54040504","Thanks to team bdubs for giving us a wonderful time
Server sunny was taking care of us and he made sure we had a cheerful and enjoying moment
Food served was hot and delicious ",5,"2019-05-08 22:59:32",1,1,0
"55632927","Awesome place for corporate parties ..trust me guys u will love it..especially the service provided is awesome and the food ...chicken wings are really hot and must try thank u Prabhu for ur amazing service",5,"2019-05-08 22:58:18",1,7,0
"48248393","The food was awesome especially chicken wings and we enjoyed a lot and thanks to all the staff especially Prabhu and Jenny for being very attentive and for ur best service.. thanku bdubs",5,"2019-05-08 22:54:11",1,26,0
"53133024","It's good place. Had a good gaming experience. Crazy place to hangout for any sports event. Also gaming experience is amazing on x box. Should try out once ",5,"2019-05-08 22:54:00",9,3,0
"105142352","The party was great...the food was awesome and the best place for corporate parties...Prabhu took really good care of us and his service was very good",5,"2019-05-08 22:51:29",1,0,0
"48582867","Had a office party must visit good service and amazing food and drinks also had a great gaming experience... More then 250 people in our party managed well by b dubs team keep rocking Adil...",5,"2019-05-08 22:49:32",1,1,0
"74848315","Wow, what a wonderful time we had ,really awesome staff and friendly people 
Thanks for mr nitin who was handling our party operations ,perfect place for corporate parties in gachibowli
Food was to the standards and drinks too,
Coming to the service part thanks to Sunny who was very cooperative with us.....",5,"2019-05-08 22:38:37",1,1,0
"60826485","Delicious food ever had 😍😍 found very tasty
Very much impressed with the staff(prabhu, praveen, sunny) ... Very polite, humble
Awesome place to hang out ",5,"2019-05-07 23:35:07",1,0,0
"58076393","It’s very good place for vegetarians as well, we asked a waiter about how they prepare vegetarian food or kitchens are separate or not but they told us that they are preparing everything in one kitchen. 
We came out to a mall and manager came till there to just explain that their utensils are separate and they are taking all precautions. We are impressed with customer service. Also, Praveen was very polite and quick in service. Cool place, must go.",5,"2019-05-07 22:45:14",1,4,0
"1476616","Nice place to hangout.....nice gaming consoles for kids....good job Mandeep and team,....spent 1hr here with my kid he was kept complete busy with gaming and mouthwatering food great service guys keep up thank you so much",5,"2019-05-06 18:56:03",1,39,0
"40375410","Nice freshly atmosphere!! Good place to hangout with friends and family!! Prabhu did a great job!! He is friendly and offered amazing service!! ",5,"2019-05-05 00:33:35",2,22,0
"45132135","As usual, awesome wings, try ur guts with blazin sauce with a compensatory ranch sauce. The drinks were good, say it cranberry or muzu, Sandeep and Vineet crafted it just awesome.. nice place to hang out with family as well. Adil and rose received well, they just now how to handle their customer with smile.",5,"2019-05-04 21:55:50",2,2,1
"54475957","Great combination of Good food and gaming stations.
Staff is really friendly and nice.
If you have a group of friends who want to re-live the 90's Video-Game era, definitely go to BDubs and fight over Tekken.
Try visiting in non-busy hours as you'll be able to get more Game-on time.
A Bit expensive though, but that really justifies the PS, XBox abd VR experience. ",5,"2019-05-04 15:16:23",10,3,0
"97192728","Nice place. Great service. Thanks Praveen for the great service. Also many options to play games with 40 screens to watch the match. Great fun",5,"2019-05-04 00:18:10",1,0,0
"30575566","Good experience, nice ambience and amazing staff!!
Plenty of stuff to do, gaming VR experience, and obviously ongoing IPL matches. A must go place!!
Praveen's service was good!",5,"2019-05-04 00:09:30",2,83,0
"56000215","It was nice experience here.chicken wings are really too taste and a very respectful service by sunny i like the way he interacted with us and x box gaming is mind blowing.",5,"2019-05-01 23:09:02",3,11,1
"57391018","my all time favorite chicken wings (thai curry) and ultimate nachos..service is the best part they have,sunny bro gave us a gud time,
been to jubille hills branch before...this is the first visit to gachibowli branch....servers are pretty friendly which everyone hopes.....",5,"2019-05-01 22:38:56",1,1,1
"10705921","Great place to just hangout and watch an IPL match. 
And near the bar are the best seats in the house.
A great host Sandy and an interesting cricket match makes the experience awesome ",5,"2019-05-01 22:27:54",3,29,0
"4797071","I loved this place. Akhil had been a very friendly person who came up with good suggestions. Ambience is very good with screens casting IPL. Gaming options were fun too. Coronarita is one drink that I am going to suggest to everyone I meet for the next few days.",5,"2019-05-01 14:28:01",1,87,0
"2843402","Great place to watch any game here!! Great ambience!! Nice and polite staff!! The service is quick!! Nice place to watch any game with few beers and to bite down on those wings!! The main reason to go here is their wings and beer!! That’s what I feel!! You’ve got many sauces for you to pick from!! My fav was mango habanero sauce!! Place to sit back and relax!! A great sports bar!!",4,"2019-05-01 02:10:40",50,1510,1
"34585165","Really good ambience and good service by Praveen and co the food is beyond expectations!!and the gaming centre is pretty good with lot of selection of games and the desert of nachos was best!!",5,"2019-04-30 21:33:40",1,1,0
"29229619","The ambience and food is awesome..Cool place to hangout. A lot to try Games,Virtual Reality. Loved it.!its totally cool and fun place to go with friends and couple",5,"2019-04-30 16:09:14",1,10,0
"55152307","The food was good, the environment is pleasant to freak out. After long time I played my favourite game Teklen7. Thanks to Bdubs a nice place",5,"2019-04-30 15:21:28",1,0,0
"16174233","Sooo... It's a sports bar. On the side of a busy road , so easily accessible. Very lit... Bright.. a bit too bright for my taste though.
I went on a special day , so there was a live music band playing. But it was too loud. So the brightness and the loud music didn't do justice to so much as setting the mood.
Food was ok, taste wise. But price was on the higher side. Limited variety of food. But they have done some nice experiments with the wings. So , try worthy.
But there are very nice people working there. Very friendly, Nice staff. Service was very good.
Along with that, if the ambiance would be set for proper occasion, then what a hit a road side sports bar would be..!!
Hope to visit again soon.. to a nice ambience 😊",3,"2019-04-29 00:21:48",47,143,0
"32360513","the place was really ultimate for watching ipl matches and food was really yammy drinks was superr i really like the place praveen yadav who servered nice and helpfull",5,"2019-04-28 21:49:46",3,0,0
"40074839","Its been first time to this place and its awesome place
Wings were perfect with blazin sauce specially for spicy lovers....plenty of screens for sports
Server sunny and praveen yadav helped me and gave me good time....thanks ",5,"2019-04-28 17:57:37",2,3,0
"1540556","Came here for the first time.the experience was really amazing .I liked the way they celebrated my frnds bday..thanku prabhu for ur best service.....",5,"2019-04-28 00:56:37",1,56,0
"1217476","Awesome place to watch sports , njoy wings, and do VR gaming
Went with my old friends who came Hyderabad first time and they were so happy that we chose this place to hangout as they enjoyed a lot 
Wings were so yum . Adil was our attendant and he was so good 
Thank you for making our experience amazing",5,"2019-04-27 23:52:39",68,209,0
"38605163","Great place to hangout. The blazing wings are really a must try, yeah it comes with a warning. But its absolutely worth it. Me and my friends are planning for a challenge with the blazing wings. The wings have a nice hot flavour, that will leave u wanting for more. ",5,"2019-04-27 23:19:38",1,16,0
"55266262","That was a really awesome experience visiting to bdubs and the wings are really awesome....prabhu and Praveen took really good care of us...and the gaming was too good ...really willing to visit again",5,"2019-04-27 22:53:34",1,1,0
"49913106","It's been really nice to be at BDUBS for this weekend , really nice place with good food and nice ambience...Wings are real american style will refer this place...Sai Raj was a really great server...appreciate 😁",5,"2019-04-26 21:55:47",1,0,0
"37635707","Praveen has been very courteous with his service. The food and ambience of this place is beyond appreciations.
I would love to visit this place again with my friends soon.",5,"2019-04-26 21:07:37",1,1,0
"52806460","I love this place for food as well as for gaming with friends. Mr.praveen here is very polite and cooperative with my friends. This is my second visit with friends. Best place for this ipl season",5,"2019-04-26 20:43:57",1,1,0
"54611559","Praveen Good service and nice gaming experience in vr as well as PS4 nice ambience nice food totally satisfied 😍😍😍😍😍😍,,,,,,the place very good I really like the place",5,"2019-04-26 20:39:30",2,15,0
"2659124","Great place to chill with friends. Value for money. Love the taste of the food and the service of staff. Especially Praveen was amazing at his job.",5,"2019-04-26 20:37:33",3,63,0
"29092415","B Dubs is an awesome place. Tasty food good ambience. Mr. Sairaj helped us by explaining the menu and helped us in choosing the best option for the food as well. Loved the service! ",5,"2019-04-25 20:50:57",5,6,0
"60182000","OMG!!! You guys are simply AWESOME. I love everything about this place - food, drinks, crew and ambience. You slayed it with the spice level of mango habanero wings. Love you guys for your hospitality. A ton of thanks to Prabhu and Akhil for taking super duper care of us. Once again, you guys are super awesome. If anything we will definitely come back for your hospitality. Yayyy!!🙌🥳",5,"2019-04-23 16:01:45",2,0,0
"33149262","This place! Amaze balls!
I mean the food, the ambience, the games, the whole experience was so worrh it!
Akhil thankyou for your hospitality! We had lots of funnnnn!
If you want a place to just have fun, this is the go-to place!",5,"2019-04-22 22:00:07",3,106,0
"107847950","Great place to watch all your sports screenings 
Huge screens and great food with lovely hospitality 
Great collection of food and drinks 
Would love to recommend all
Must visit place thanks to Kaushik for his service.",5,"2019-04-21 22:19:13",1,0,0
"33030176","Fantastic place to watch ipl. Great wings. Fantastic stadium atmosphere. Great crowd. Excellent food served here. Staff is so caring thanks to kaushik for his service.
Will be back soon ",5,"2019-04-21 22:11:31",1,16,1
"11125011","it great ambiance with some of variety sausages and ketchup it ill come together with all members like family and friends 
nxt tym when you vist gachibowli you must visit with family ",5,"2019-04-21 20:47:43",4,0,0
"742021","One of the best sports bar I’ve been to in the country. Their service and the hosting is impeccable. The staff is super friendly and I couldn’t have asked for a better place to spend my sunday here.",5,"2019-04-21 19:43:09",2,38,0
"495584","Best service I’ve experienced in the city, will most definitely come back for the food and the brilliant service.
Ask for Akhil, start server at the place!!",5,"2019-04-21 19:42:41",1,57,0
"87628742","The ambience of this place is amazing. B dubs is the best place to be during any major sports seasons. The food is yum and the staff is very very nice. This place will not disappoint. ",5,"2019-04-21 19:42:07",2,1,0
"45566306","Good place to hangout friends ans special thanks to akhil for friendlu service and saving us after the deadly blazin wings 😅😛. Very happy to eat here",5,"2019-04-20 23:16:13",2,7,0
"1089529","Good service. Sunny (waiter) was very helpful in selecting the sauce for BBQ wings. Pretty cool place with many play stations and VRs and great ambience",5,"2019-04-20 23:09:52",2,1,0
"52336963","Ambience is good and well known for wings and service by sunny is very good.Good place to chill out with friends as well as family with tasty food and drinks",5,"2019-04-20 22:08:21",2,2,0
"1250436","Great atmosphere... Good time to hang out during IPL and BPL. .. Food is ok ok... Cheesy balls were superb.... Prawn tempura as ok. Wings were great.. thumbs up to the hospitality and service. ",4,"2019-04-19 00:13:14",46,125,0
"55084153","Excellent service and food was really good ... Gaming section specially the virtual reality game was awesome great experience Good service by Sunny",5,"2019-04-17 22:52:30",1,3,0
"3052361","The food was great. The service for tasting sauces before having wings is unique. Great watching experience with live matches Fifa and vr . Server sunny was amazing at his job and making us feel welcome ",5,"2019-04-17 22:14:14",7,6,0
"50733462","Wonderful place,excellent wings especially spicy garlic , Sunny's service was great!great place to have fin.One time visit is required if u live in Hyderabad",5,"2019-04-16 21:30:20",3,2,0
"36872734","#abdul helped us to taste the best, ambience is not so great as jubilee hills but it's Nice, wings lemon flavour n loaded French fries was yummy......",4,"2019-04-16 14:45:53",1,1,1
"43849343","Amazing food and service...Bharathi is excellent...thank you for making our day...quality of the food is excellent and does not deteriorate with every visit which is the best part...thanks to Aslam as well",5,"2019-04-15 15:28:41",5,4,0
"106304764","Praveen yadav and anilpatel very helpfull we celebrated my fnd birthday and we enjoyed a lot with games there was a vr game it's really great .....thanks bdubs",5,"2019-04-14 20:22:30",1,0,0
"247811","Nice place to hang out casually. Wide selection of sauces and wing selection.
Syed, who waited our table was really nice and helpful.
Worth going to at least once.",4,"2019-04-14 19:08:02",7,209,0
"54901385","Sunny is very well wisher for customers
All the items including drinks , wings and pizzas are very tastefull,it's good place for weekend vibes.....",5,"2019-04-14 19:01:55",1,30,0
"86487260","Nice place for traditional wings.....They are having different sauces....Sunny helped us with tasting and choosing the sauce, and nice service
Tried mocktails due to dry day.....Mango madness is really mad😋
Perfect place for sports lovers....",5,"2019-04-14 18:57:02",1,1,2
"55177327","Food - 3
Service - 3.5
Ambience - 3
The Chicken wings are the best here. We tried Chicken burger and Artichoke dip as well and it was just average. Chicken Patty in chicken burger was dry and not fresh. The Lemon slush was just iced sugar water with few drops of artificial flavor. Overall an okay experience.",3,"2019-04-14 15:55:08",19,3,4
"34927385","Anil patil and sai raj have served us very well, please try vr gaming there and watching ipl.is best over there...Thanks alot for the this awesome experience we enjoyed a lot.",5,"2019-04-13 22:32:01",9,25,0
"46713694","Tonight we visited bdubs gachibowli... They have amazing gaming devices that was really really fun .... The food and service was awesome... thanks for helping anilpatel ....i love bdubs wings and has become a regular hangout joint for us.v",5,"2019-04-13 22:26:54",1,27,0
"39101724","We enjoyed my friend birthday party at bdubs gacchibowli anilpatel was Assam he trieted us great ... thanks sairaj for service.....we enjoyed lot with ipl also",5,"2019-04-13 21:45:32",1,1,0
"33885469","Big fan of the wings  . Service is great , big screen game viewing with stadium sound .Standard  selection beers !of Sandeep at the bar was excellent . !",5,"2019-04-13 21:35:35",6,16,0
"37374358","The place is great. Love the wings! A very prompt and customer friendly staff. Tried Hot BBQ and Hot sauces both were awesome! The ambience is pleasant too. Special thanks to Jop.",5,"2019-04-12 12:31:51",1,51,0
"68296316","Really awesome service by Ranjit and Santhosh ther make our visit so amazing. we are welcomed by beautiful host anita and jenny .Food and drinks are so tasty .specially wings with spicy garlic amazing.we enjoyed lot with gamings like TEKKEN7 and need for speed and special thanks to captain mandeep who help us with vr gaming.Finally thanks to b.dubs team keep rocking...",5,"2019-04-12 12:24:03",1,0,0
"4528781","This place is not as good as  jubilee hills branch, very less sauce used for wings. Which will disappoint you with the real taste. Ambiance & Service is good. ",2,"2019-04-12 10:10:53",3,0,0
"35672092","B-dubsssss the best for all food lovers and had a great and good experience visiting and you got a good response from the management is well ",4,"2019-04-11 15:05:06",9,7,0
"49336831","The place is very convenient and it's pretty good for chilling ....The most important thing is they look after the customers very nicely...I got Served by the guy called Abdul Rahman and he was very kind towards us...",5,"2019-04-11 14:29:42",1,1,0
"49361695","Abdul was a very good server I think he has a lot of Pep is step. Very knowledgeable about the menu as well since it was my first time. Go bdubs",5,"2019-04-11 13:58:30",2,11,0
"36880737","Anil Patel and Rose were very good with the receiving and the way they were throughout the session was amazing . I loved the basic grilled fish and mainly Thai curry sauce is my all tym favourite ",5,"2019-04-11 13:41:49",2,65,0
"425916","Had a great time here. I really love blazing sauce, that's the spiciest thing I've had, ever.
Our server was actually the best part, he was cordial and attentive. He suggested tone we should try",4,"2019-04-11 13:21:22",8,102,0
"59984779","Jus chilled out at b dubs with tangy citrus...n welmade watermelon punch...thanks for guiding us rahman  for the delicious treats v had...it was just an awesome experience...thank you n thanks b dubs...",5,"2019-04-11 12:04:11",1,2,0
"40476824","Awesome place to hand out with friends especially during IPL season. The environment is awesome and the food is great. There are a many games on PS4s and on VR. Had an awesome time!",5,"2019-04-10 14:51:09",1,2,0
"34140716","Best wings I have ever tasted !!! 
Tries wings with Thai curry sauce , ranch burger and nachos are really  awesome .  A must visit place during any sports season .",5,"2019-04-10 11:07:13",3,26,0
"873715","I have visited this place on 2 occasions and once i have ordered at home. While in my restaurant visits, i have had wings, quesadillas and burgers, I have ordered only burger at home. So my review is for all of them:
Pros:
1. Spacious place, big screen, perfect for watching match/football in group over beer.
2. Many virtual games to keep the visitor entertained
3. Perfect for large game fan groups, bachelor weekend parties etc.
4. Decent wings but definitely not a selling point.
Cons:
1. Not ideal for couples, ladies and people looking to have a calm & cozy ambience
2. Food is super expensive, and the biggest disappointment are burgers - tasteless, no seasoning on patty, no seasoning on fries, you just have to reply to the sauce for some flavour.
3. On anyday, hands-down, not worth the price.",3,"2019-04-10 00:31:39",40,32,3
"39466466","Rahman has been so polite and helpful since the time we came in. He has been explaining the menu and suggesting varieties to try. It's a great experience.",5,"2019-04-09 21:10:26",6,3,0
"34832287","This place has great ambience, tasty food and friendly staff. Everything is great and it's a perfect place to hangout with friends, play games etc . A totally amazing place to chill. Loved it. ",5,"2019-04-09 18:27:17",1,4,1
"61063747","Perfect place for wings...they have different sauces with different levels of tasting
Sunny helped us in tasting and choosing the sauce
Nice gaming zone like ps4 and virtual reality",5,"2019-04-08 23:59:23",1,1,0
"69150434","One of the best place for chilling out with friends during ipl matches and any sports......comfortable place with many screens to watch....we can have chicken wings with different varieties of sauces....they are also offering good offers specially for IPL
thank u sunny giving us a good time.....",5,"2019-04-08 23:55:05",1,1,0
"84802206","Nice place for american food lovers
Wings are nice with hot sauce.....they also have plenty of screens for watching sports......
Service given by sunny was good....thanks for helping us",5,"2019-04-08 23:51:28",1,1,0
"70163953","I am well satisisfed wirh his service
Qurious to help ,became frnd ,lovely guy ,humble ,and the ambiance is very nice really its lovely place to come and enjoy",5,"2019-04-08 21:40:12",1,0,0
