"UserId","Review Text","Rating","Time","Reviews Count","Followers Count","Photos Count"
"35503982","The food was good but the problem was with water. We were not given water. After we were done with the food, we asked for the bill and water. We were given a mineral water bottle. We said we wanted regular water. They said they don't have regular water. Then we asked how do u cook then? Then he said he has regular water but doesn't have glass so we'll have to buy the water.
Now providing water is a basic courtesy. Water is a basic amenity. Our bill was for 513, why couldn't they provide us regular water? They are doing business at the cost of humanity by refusing to provide regular water. It's because of this reason that it's my first and last visit to the place. The food is good but the place lacks humanity.",1,"2018-08-09 23:25:11",3,0,0
"54512683","good ",4,"2018-08-09 17:27:36",1,0,0
"39553147","Loved their TV series mural. Nothing extraordinary about this place. Not-so-great menu. We ordered peri-peri fries and cappuccino. I'm satisfied with what I had cause i heard bad reviews about the place but went ahead to give it a try. ",3,"2018-08-06 19:37:03",49,310,1
"29664012","As the name says, the restaurant is dirty and the burgers are even dirtier. Unhygienic place. Do not even online order from this place. They have a menu but half of the items on their menu is not available.",1,"2018-08-06 13:43:54",55,26,0
"34155130","Juicy burgers and sumptuous taste. Probably the best burger I've eaten in ages. Worth the money  I've paid for. Takes a while to bring our order but the ambience is good for a quick snack or two with a group of friends. Parking is quite difficult in the narrow lanes so suggest you to park near the police station and walk to this place.",4,"2018-08-04 20:33:07",4,5,0
"43208831","Probably I'm the first customer on the day they opened, ever been a regular customer sweaty palm burger is all I order regularly, I think it is fairly overpriced but it's worth it. ",5,"2018-07-30 22:58:10",3,9,0
"771140","“ Good food but need some improvements”
So we went to this place on a Saturday evening for some yummy burgers. This is a small resto with few tables and some quirky tv show posters on the walls and few board games for time pass. so good job with the decor, thumbs up for that.
Now coming to the food, we ordered sweaty palm chicken burger and some chilli cheese French fries to go along with it. The burger was tasty but as the name implies you need to get your hands dirty with the sauces from the burger to eat it . The bread was soft and sauces were well spiced and juicy. Overall the burger was really good. The fries were good but the cheese was little dry and chillies were just sprinkled all over it. It was ok but not that great.
Coming to the worst part the service. There is only one guy to serve food and take orders. He was trying hard to keep up with the orders from what we call a full house at the restaurant . Looks like the kitchen staff takes too much time to cook. It would’ve been ok if the burgers took time but burger was on our table within minutes but it took half an hour for chilli cheese fries.Few people came in saw that there was no one to take orders and left . I can say they lost 10 customers in the half an hour that we waited for fries. So if the management is reading this please improve your service it would definitely help your business.
Even though the burger was tasty I don’t think it lives up to the price they charge when you add it along with the service. So if you are someone ordering burgers online then go ahead and order without a doubt. But for dine in I will say go there only if you have lots of free time to spare.",3,"2018-07-25 17:18:03",79,291,2
"50783990","good delivery",5,"2018-07-23 23:09:28",2,1,0
"61607106","The packing is not at all good and the quantity is not as expected",3,"2018-07-20 16:59:42",1,0,0
"38773387","Loved the interior and the board games. Ordered Sweaty palm and Lumberjack sandwich. Both tasted awesome. And those French fries were amazing. Service was good. ",5,"2018-07-19 20:40:22",6,4,4
"161629","the burger was delicious, however, the peri peri fries were soft not hot. I will recommend the burgers if ordering from home but not the fries.",4,"2018-07-15 19:07:56",26,301,0
"29633430","The worst place to be in. I had high hopes for the burgers here, as per the descriptions. But needless to say, i had to satiate my taste buds with the awesome but low priced items from Yellow Deli, that is right beside it.
The burgers were awfully small for the price. The place was a decoration failure. The taste and quality didn't deserve a price more than Rs. 90.
The waiting time was too long for that tiny burger (45 mins).
Wasted 360 Rupees.
If you are ever planning to go there, DON'T! ",1,"2018-07-11 21:13:43",2,0,0
"506651","Rather disappointed. Expected a lot more at this price.",1,"2018-07-08 14:44:59",43,96,0
"40977847","The sweaty palm burger lived up to it's name. one of the best burgers I've had.",5,"2018-07-07 01:53:28",3,133,0
"1903288","Tried some chicken burgers late night. Was surprised such a delightful place was available at odd hours.
Went in and you definitely notice the decor. A rustic ambiance with card games invite you in. We ordered the chicken 9 to 5 and Sweaty Palm burgers. Both the burgers were delicious. The 9 to 5 came with thick pepper chicken patty with a fried egg on top. It went well with the flaky burger buns and crispy fries on the side.
But it was the Sweaty Palm which took the cake. Juicy patty with some thick gravy was out of the world. I have tried burgers in quite a number of places around the world and I will not shy to say it was one of the better ones.
Overall the burgers were delicious. The only thing i would mention is the pricing. For the price, you would expect slightly more quantity or the size of the burgers. Have been to multiple other burger places of similar size and given the burger quantity, the pricing would be lower.
They have multiple other options on the menu so would give another go.
Service - 3/5
Food - 5/5
Ambiance - 4/5
Value for money - 3.5/5",4,"2018-07-01 00:39:49",159,753,2
"39023501","Place is dull with very silent environment... 1st j must start about food, i ordered dirty veg and fire house... it was not at all good... then ordered fries... that's also not good...
but like the service n staff politeness...",2,"2018-06-29 01:30:05",73,110,0
"325073","Let's start with the basics. The food was awesome. I really enjoyed the 9 to 5 burger. And, I don't agree with people saying it isn't reasonable. Because, although the 9 to 5 burger is priced at INR 260 (excluding taxes), the restaurant serves two burgers and a small helping of fries for that much money. The burger patty was nice and juicy and the sauces gave it a nicely balanced flavor. The service was prompt, courteous and polite. The ambiance is really cozy, and the drum-shaped sink is quite quirky. Lastly, the presence of many board games is a welcome sight. Carry on the good work.",4,"2018-06-26 14:32:39",5,123,0
"34326550","Very bad quality of burger and patty ",1,"2018-06-21 19:19:03",14,4,0
"1617133","This a the second time I have reserved an order from dirty burger gachibowil....
I like the concept and the name..
Service is really good as well.
...
So first time I ordered 9 to 5 burger with extra.bacone... that was a good burger, packet in anjic box, with proper branding and all, but the issue here was, the bun was really big compared to the fillings, taste was really good.
Today I ordered a fat boy, it came in a regular packing withought any branding, I liked the burger, nice juicy mutton patty, with perfect veggies and sauces in it, but the but needs to be of better quality here please..
Taste: 4/5
Service: 5/5
Product quality : 3/5
Value for money : 2/5",4,"2018-06-17 00:05:19",80,529,5
"35755415","One of the best burgers i ve had in Hyderabad. Its very hard to get good burgers here. Plus the customer experience is amazing and the ambience add more beauty to it.",5,"2018-06-14 07:37:37",1,48,0
"35864721","Though the Burger was good but still don't consider them for ordering again. Reason is, they charged me for burger and fries but on delivery, fries were missing. Basically, order was incomplete.
Regarding prices, not that reasonable also but taste wise its good. Delivery was on time.",3,"2018-06-13 21:32:27",208,771,0
"27009361","Great food. Peri peri fries and aloha burger was awesome. Heard so much about this restaurant it surely lives upto expectations. Would love to try food from here again. ",5,"2018-06-13 19:28:16",76,113,0
"680602","Atrocious packaging when I got 🍔 delivered via Zomato. It seemed as if the flimsy box was being reused!
Food was also cold.
My experience last month was much better.",2,"2018-06-11 09:41:03",2,72,0
"446894","Amazing burgers.... Infact the best burgers in town... Kudos!... Must visit..
Tastefully done interiors with a wide range of burgers to choose from and board games to just hang with frnds",5,"2018-06-11 01:10:47",2,1,0
"38735711","One of the best burgers I've had in hyderabad are here.  Much better than the popular burger places.  Tried the double party chicken burger and it was just about fantastic.  Also tried the wings and fries which were good.  They've kept some board games on the table to keep you busy while the food is being prepared.  We personally congratulated the chef for making such amazing burgers.  Sandwiches are also good.  ",4,"2018-06-07 00:18:11",56,534,10
"35836801","I have ordered sandwich and veg burger from this place.
Both of them were quite good and came with nice packaging. Food was also delivered in time. ",4,"2018-05-31 20:32:57",247,316,0
"4532951","Indira Nagar is slowly becoming the Road Number 36, Jubilee Hills of Gachibowli. Small or big, a lot of eateries line up the road. One such tiny one is Dirty Burgers.
Located near Karachi Bakery, the place shares a common wall with Thickshake Factory. Bonus: You can place, and receive, your Thickshake Factory order, while sitting in Dirty Burgers.
My visit was on a Tuesday, right after office. Dropping by at around 7.30 p.m., the two of us were early for dinner, but hungry enough.
The place, as I said, isn't that big. Wooden benches and tables serve the seating purpose. If you're someone who's into English shows, you'll find a lot of posters on the wall to stare at. The tables are also stocked with board games to help pass the time. The lighting is perfect for the ambience
Coming to our order, we went with Screwed Over Cottage (veg) and Fat Boy (non-veg) burgers, and Peri Peri fries. For the drinks, we ordered them from Thickshake, and paid up for them as and when they arrived.
Speaking of the burgers, they get served with a portion of fries. The veg one was good, a bit spicy, but had no much trace of cottage cheese. The quantity of peri peri fries was quite a lot.
Our total was vaguely around 700+. A one time visit place, but a good one to hangout. ",3,"2018-05-28 21:51:02",150,2105,6
"34202606","They are decent but nothing great for that price. ",3,"2018-05-27 20:06:22",2,4,0
"291509","It was great to be at this new and raw place. The ambiance is very clever and nice, very raw and new elements have been used. It is a small and cozy place. Though, there are not many veg options which I would advice to the management to add more. The Dirty Veg burger I ate was very nice and fresh. Would visit again some day...",4,"2018-05-27 11:15:30",17,260,1
"38868089","Amazing Place! In love with the Burgers! Delightful ambience, perfect place to hangout and enjoy a delicious meal. All Hail Dirty Burgers!!!",5,"2018-05-25 22:12:16",2,1,0
"51786619","Though the food served here is not that satisfactory... The games available for playing and the ambience is good... The main drawback is they take a lot of time to prepare the food.. The waiting time is not bearable... But i say that this a place where you should visit once if you are a burger lover",3,"2018-05-25 20:00:54",4,1,1
