"UserId","Review Text","Rating","Time","Reviews Count","Followers Count","Photos Count"
"71539356","On my special day (BDay), I had been there. Overall it was a great dining experience. Courteous staff was the strong point here. We took a special dinner buffet. 4/5 starters served was delicious. Less option in main course and dessert though. Would like to visit here again. :)",4,"2018-09-22 14:48:17",1,0,0
"31918414","Late review. Ambiance is good(theme : ancient India with various stuffs). I forget the name of the dishes and mocktails (most probably 1 chicken and 1 mutton dishes (main course)). Main course was good. I preferred chicken dish.",4,"2018-09-20 16:08:14",44,98,4
"910659","Being a foodie and going for a buffet is like craving for a lump sum treat! 
But the restaurant has disappointed. 
1. Ambience and service was great.
2. We went for buffet , firstly the starters weren't that good at taste. Common panner kebab type of starter, corn , chicken, veg kebab. Well none o them weren't good as having them twice.
3. Main course was a disaster, very few choices that too of rare vegetables and less eaten. No panner the main dish, rice items weren't good. Skipped and went to the desert section.
4. Desserts was like stabbing a dead man. Nothing exciting, only the ice cream was good.
Overall, it is expensive and less satisfying. If you are hungry and looking for a buffet please skip this one.",3,"2018-09-16 21:43:09",7,12,0
"12671941","This place served the worst Indian food I could ever ask for in Hyderabad. The towels were dirty and not properly washed. The food was just horrible. Loud music from the pub above will spoil your dining experience even more and when I asked for outdoor seating they lied saying it's only a smokin' area. Not visiting this place ever again. An extra star only coz of the interior otherwise this place is just worthy of a 1 star. ",2,"2018-09-15 08:34:22",33,269,1
"32509115","Eat India Company is attached to Urban Asia.
We tried out their buffet.
Food was decent. Liked the starters, and the main course menu. Thai green curry was impressive.
Service was a little slow.
I would have liked more variation in deserts.
Nonetheless, a decent meal.",3,"2018-09-13 22:09:21",117,980,1
"8729261","So so place. You can visit there if you have zomato gold. Otherwise place does not deserve a special visit. Location is good and food is average.",2,"2018-09-13 19:53:14",12,4,0
"12418551","Pathetic!!! A group of 20 people from work visited this place, we didn't have great expectations, at the same time we didn't foresee a terrible experience that it eventually would turn out to be. Half of us were seated close to the glass facing the Gachibowli road, thanks to their incredible maintenance, the ac was so poor, we were all sweating profusely. We weren't served starters for atleast 40 minutes. The choice of plates and their maintenance is extremely poor to say the least. The food (starters, main course, desserts) tasted so bad that most of us were content just eating curd and ice cream. We will never be going back to this place.",1,"2018-09-13 01:16:48",25,7,0
"36356675","Horrible place 
Nothing for vegetarians 
Service is awful
Paneer was not properly cooked
Corn cubes were hopeless 
We had to wait for an hour to get vegetarian starters
The main course for vegetarian dishes was empty ",1,"2018-09-12 14:18:57",3,1,0
"41145163","Had been here on my birthday and opted for unlimited dinner and have to say till then my birthday was going great because the food was real disappointment including soup, starters, main course and dessert. ",3,"2018-09-10 16:49:03",32,1440,0
"888021","A group of 4, we decided to visit this place on Saturday evening. The location is quite on the main road, however, the parking and the entry is terrible. They can surely improve in this aspect as it can be a big turn-off.🤦🏻‍♂️
After entering the restaurant, we were quite impressed with the ambience and the decor. It had a very India taste to it. They had old locks, keys, doors and other wooden stuff adding to the rustic look. 😍
Coming to the food, there is a plethora of options on their menu. Instead of going through it all, we decided to quickly take recommendations and order it with the bearer. Hariyali Paneer Tikka and Corn cubes made for the perfect starter combination. Corn cubes cannot be missed here. My friend ordered a Chicken starter which was quite average though. Moving to main course, we wanted to keep it simple with rotis and a few curries. Paneer Lababdar, Mushroom curry and Nizami Handi seemed like good choices. Food was decent. 
The service was not impeccable. It ca surely be improved. Also, they did not even serve finger bowls at the end of our meal. Quite a surprise. 😑
The price point is a little on the higher side- probably much more than average. 😅😅  It can be a great negative. They accepted gold on food, so yay! 
Overall, a good experience, but probably not one worth visiting again. ",3,"2018-09-09 22:56:38",86,215,2
"39409987","Good selection of dishes in the menu.The best thing about this place is it's ambience and serving.
Dambaru the steward who has given the service to the best. 
Thanks to the team who have organized really good.
Not but the least the brownies was to yummmmmmmmmmmmmmmmy
We enjoyed a lot :)",5,"2018-09-07 14:32:35",2,27,0
"36344317","I went in for a late night dinner after work. I was happy with the service provided. Best part about this place is their interior. The antique royal doors, old locks and vintage pictures hanging on the wall and ceiling added to the charm. Quality and quantity is almost worth the price. The ambiance is perfect for a peaceful sumptuous meal. I would definitely suggest this place.",4,"2018-09-07 13:19:58",21,125,0
"30491407","If you’re wondering what to do on Sunday then head to Eat India Company, Gachibowli. Eat India Company has been one of my favorite restaurants in Hyderabad since years. Now they’ve opened a new branch in Gachibowli. Yay to all my office folks. Everything from the ambience to the décor, to the music is wonderful. The quality and taste of the food over the years has been consistent. I love love love Indian food and they have some delicious dishes if you’re a meat lover. Everything from shorba to kebabs to nalli ki nihari to dum biryani is sooooooo yum!
On Sundays, the branch at Gachibowli teams up with Urban Asia to host a special brunch from 12 pm to 3 pm. Urban Asia is another brilliant kitchen for Asian food. If you love Chinese and Indian food, you cannot miss this brunch. They have more than 27 dishes with veg and non-veg options plus desserts. Apart from this, they also had chaat and sushi as well when I went. All this at 888 per person only. What a steal deal. My favorite five dishes from the menu are hara bara kebab, chicken angara, kang pao fish, mutton rogan josh and of course the Dal Bukhara [for those of you who don’t know, this is a velvety makhani style dal that is not spicy but packed with flavor].
Make sure to book your table in advance. Another good tip in case you’re someone who wakes up late or you forget to book a table is to go after 2pm cause it’s usually not crowded at that time. Let me know how you like it! Thank me later.",5,"2018-09-06 12:07:38",23,61,0
"114164","A family dine in place great ambiane tasty food 🥘 nice view and awesome ambiance. The place has an ancient indian look with old locks, supari cutters, old doors on walls and ceiling are amazing.  Its a lovely experience.
Cheers Rakshita Nath ",5,"2018-09-02 14:08:15",197,1378,3
"45449710","This place has two restaurants in it. One is Urban Aisa, and ankther one is ETC. Ambience and entrance was good . Food quality and presentation was too good. Ordered chicken , and mutton biryani here . Taste was good , not awesome. Will visit again ✌️
Overall Experience : 4/5
Ambience - 4.5/5
Seating -3/5
Food Quality - 5/5
Taste - 4/5
Service -5/5
Value for money - 4/5",4,"2018-09-01 21:45:25",88,201,9
"119284","Just love this place. If you are looking for proper north indian place then this is the place. Zomato Gold takes you to different places and this was one of them. Tried Paneer butter masala, butter chicken, dal makhani along with breads and pulav. Definitely worth a visit.",4,"2018-09-01 13:28:07",22,33,0
"43582189","Visited this place for the good experience we hd earlier at their jubilee hills outlet but at yachi bolu it was a disappointing experience.Purina chutney was sour , methi chicken was bitter. Don't think will visit again. Attitude of service staff was ok.",2,"2018-08-29 23:30:21",5,1,0
"1887362","We went here to celebrate a Friend’s birthday dinner ...
The staffs , service ,interiors and ambience was really great...
Coming to food, it was something ...
We all really did enjoy ...
Although the food preparation time was bit more than we expected...
But overall its a must visit place if you wanna hangout with either your office colleagues, friends or family ...
Regards,
Sakshi",4,"2018-08-29 20:41:57",52,179,7
"36248082","The best thing about this place is it's aimbence. Food was good, would have been better for it's price. Gachibowli branch is clubbed with urban aisa. Zomato gold customers can take advantage of it.
Aimbence: 5/5
Service: 4/5
Food: 3.5",3,"2018-08-27 19:24:03",49,1310,5
"2620398","It was supposed to be a really casual lunch and we didn’t expect this place to be nice but were surprised for sure. 
So it’s a nice restaurant with well arranged furniture and light. Has a buffet lunch which is very convenient for Software professionals and casual lunches with friends. 
I have small complaints which are listed in the end but apart from that I had a nice time. 
So in the spread, something that I loved dearly was the Chilly Prawns. I just couldn’t get enough of it. It was amazing. 
The chicken was alright. But I can say but prawns were the best. Although they were really small, but can’t complain much. They didn’t give us fish even after we asked for it. 
Staff: attentive and service was okay. 
Ambience: very nice place, looks good, clean, effort was put in to make it look nice. 
Food: food was definitely good I liked it quite a lot apart from the desserts. They were pretty bad. 
Complaints: Starting with the ice cream guy- they have a cold stone ice cream. He broke a water glass on the bar counter while making ice cream (technically just mixing it) and he used his already worn gloves and ice cream scoop to push the glass pieces away. Didn’t wash his hands or change his gloves or wash his scoop. For all we know the glass pieces were still on his hands and scoop. 
Second is also with the ice cream guy, we found hair inside the ice cream he made us and returned it immediately. Lost our appetite soon after that. 
Third is with one of the waiters, probably didn’t want to give us fish even after we asked him to get us some which was on the buffet menu. He agreed to get some but never showed up with it. I hope it’s his memory and nothing else that caused the problem. 
Hopefully management reads this and takes action on it. 
If those factors are avoided, then will go again definitely. ",3,"2018-08-24 22:25:10",144,911,0
"1021603","Great place and wonderful service by Dilip! We ordered a fist starter and a biryani. Fish was very good. Loved the place! Will visit again for sure ",5,"2018-08-22 14:31:25",3,203,0
"46312205","Good food. Amazing service. Decent enough prices. Paneer lababdaar and palak paneer are a must try. This outlet (Gachibowli) provides you more options since you also can order food from Urban asia menu. Overall a good experience.",5,"2018-08-21 22:33:45",15,23,0
"904380","Service is very slow. We waited for 30 min for the non veg starter and ended up having lots of time soda and left.. the dishes had very least salt. The chat was bitter.",1,"2018-08-18 14:54:55",3,5,0
"485283","The whole place was vibrating because of the loud music from the club above, completely spoiled the ambiance. The food wasn’t great either. The atta rumali roti was kachcha. Butter chicken lacked proper thickness. The biryani at jubilee is way way way better. Wouldn’t visit again. Especially when there’s a better alternative in the city. 
The service was very good. No complains about the service. Very well trained staff. ",2,"2018-08-17 23:21:50",102,360,0
"27347281","Ambiance (3/5): 
Decent place for family get together. Comfortable seating arrangement, boring music. 
Food(4.5/5):
The quantity and quality of dishes served are exceptionally great. 
Service(2/5):
Service was extremely slow. Starting from menu to finger bowls to bill we kept calling the waiter and waited for ~10 min after every order. 
I was under the impression that after GST service charges are removed but i was charged additional ~10% service tax. 
Also AXIS bank offer as mentioned on Zomato site was not given by restaurant.",3,"2018-08-17 17:52:23",58,148,3
"40284200","Food is delicious.Even service is good.SK allauddin served very well. We ordered
1. Chicken Sholay
2. Paneer lababdar
3. Peas pulao
4. Tandoori roti and butter naan",5,"2018-08-12 15:21:22",2,2,0
"31830538","Urban asia and eat india company are in the same premises. Stale food, slow service, oily food. Water dripping from AC vents on tables and food items. Really bad experience.",1,"2018-08-11 12:45:34",3,1,0
"43225339","Enjoyed the lunch buffet, had multiple varieties of starters. Tasted like awesome. There are many variables in main course as well. Desserts are less in number but should be fine. The final ice cream mix was just sumptuous !! ",5,"2018-08-10 15:34:23",2,11,0
"61345332","Food is good, but service is pathetic. Had keep asking for starters, but they couldn’t serve all the items at least once. Finally we gave off",2,"2018-08-08 14:13:24",1,0,0
"9284591","The food is good, the ambiance is good, we were greeted by Dilip Das, and he made it an amazing experience for us to dine in over here.
Surely would like to come again!",5,"2018-08-05 21:00:49",3,27,0
"42258261","Had a greater time.. Great ambience coupled with delicious food...!!! Service was awesome..Thanks to S K allauddin.. Continue the same😊 cheers!! 👍",5,"2018-08-04 23:58:44",1,1,0
"52492352","Skallaudin did an awesome job and serve very well. Very happy!!! Will come again! Do try to come and experience the same. Highly recommended",5,"2018-08-03 23:27:58",1,8,0
"2915932","I visited this place along with a bunch of colleagues. It was on 1st of august. Eat India Company had once been my favorite restaurant. Now I had this experience of buffet at this very location, the food was not even to the mark of a normal restaurant. The chicken starter had no salt, the prawns were all mashed up, fish was just ok. The veg starters were tasteless. There were not many options on the desert side too. ",1,"2018-08-03 23:18:35",2,30,0
"1229765","Great food and service was good
SK Aladdin was our table manager. It was really very nice experience having dinner at this place. Staff and ambiance was also very awesome. The most loved thing about this place is the Thai food. Best place to have dinner. ",5,"2018-08-03 23:14:45",1,124,1
"35743839","Ambience was a wow moment when we entered..we had pre-booked the table and it was necessary as it was already housefull by the time we reached . Coming to food..the foodwas really tasty. I wish there were more desserts , only the service was little slow i felt but rest all good. ",4,"2018-08-03 21:11:59",36,57,3
"63648851","Food is awesome, but staff is not polite.  If you want to use Multiwallet card/ food card/ meal card, then please dont go there as this EIC is not categorized as restaurant merchant list.  They are categorised as Bar and kitchen, hence your Multiwallet card from ICICI or HDFC will not work here.  Please be careful.  Advice to Hotel manangement.  This hotel Manager dont know what is food/meal card, such a dumb he is.  Being manager in food industry and he knew nothing about food/meal card and what for it is used which is shamefull to the EIC.  If your restaurant is categorized as food outlet / restaurant then these food cards are accepted in all the machines across 50,000 merchants in india.  Please categorize your company as food outlet or maintain 2 swipe machines, one for bar and one for food buffet.  Thanks.  Vinay kumar",2,"2018-08-03 10:23:35",1,0,0
"10803631","Eat India Company in Gachibowli is one of the fine dining place with super cool ambience which is near perfect, an unusual combination of Rajasthani traditional architecture and modern lite decor. This place offers some very decent starters. We tried Paneer Lasagne which is not in the menu but recommended by the staff. S.k Alauddin is an asset to Eat India Company. Service is decent. Best suitable for Dinner dates on a weekday. 😊 Kiran Devarakonda ",4,"2018-07-26 21:29:42",17,75,2
