"UserId","Review Text","Rating","Time","Reviews Count","Followers Count","Photos Count"
"27871838","Visited with some old friends for a buffet. Good set of starters, decent food and hospitable staff. Of the staff Mr. Amrit was very courteous and ensured that all guests are taken care of very well. Thank you ",5,"2019-05-18 21:54:53",7,5,0
"113014997","Had a lunch with two of my friends today,it was such a good experience..Service staff were friendly and polite,and service was excellent...highly recommended.",5,"2019-05-18 14:34:37",1,0,0
"1883970","This place has a good ambiance and is a treat for people wanting to take pictures but that's about it.
Went on a Sunday and there was no crowd at all. The AC was literally non functional which made it uncomfortable considering the heat outside. The service was on the slower side and the mocktails were underwhelming. Starters were brought to the table and while they tasted good, the pace of refills needed to improve.
I honestly liked the veg biriyani and the schezwan fried rice from the main course. The stone ice cream in the desserts section was worth a mention and that's about it.
It's expensive factoring in the food and service you get. These guys need to pull up their socks if they want really survive in a competitive environment. Could give it a try for the ambiance though.",3,"2019-05-11 21:28:41",106,634,4
"31037435","Have been to lunch with friends here today, first things, ambiance seems to be pretty good, i think people just carried on ambiance for this location. Serving is damn slow, even though not much of crowd in the restaurant. Price is pretty on a higher side, virgin mojito just tasted as mint lemon drink. We need to ask several times to serve, also when we for main course figured out that few dishes were not served to us which were part of starters, when asked, the same was brought later, Welcome Drink is the one which is served after several remainders and tasted bad. Desserts were not so great and not many. Felt with the cost that was paid this is not much upto mark. All in All pathetic service, you will literally ask 'n' number of times for food which is served on table. Not a wide range of dishes. Taste not so great especially with mock tails. Totally disappointed",2,"2019-05-08 17:15:09",14,5,0
"39569012","Beautiful ambience. The vintage look took me back to some good old days. The food was okay but they take quite some time to bring in the order. For instance, 30 min for a glass of Coke? We had been here for dinner and it took us a while to figure out that both urban Asia and Eat India company are together. The staff didn't attend us for a long time. I gave the 3 star for the ambience and the experience I had with the people I went with. ",3,"2019-05-04 14:01:36",25,12,0
"39137427","Instagram | veganyums_
Drop in to this place with my partner for lunch,.They have zomato gold 1+1 food offer.. Ambiance is pretty authentic more like village and antique piece were drawing my attention....liked the quotes on pillars..
In starter, we ordered Kaju aur bhutte ki seekh which was too soft that break in small pieces.. Actually the consistency was not proper so could not take a bite properly.. Taste wise it was little bland so, there was only cashew taste I could feel..
In main course, we ordered Patiala Shahid paneer
Which was one of their signature dish which I was expecting to be good in taste..but again I disappointed with the taste it was normal onion tomato gravy and consistency of gravy was thin instead of creamy..Ajwain paratha and naan was good in taste
My experience was not so good..plus, staff members were not aware of anything regarding dish..",2,"2019-05-01 15:45:28",148,2104,5
"34884988","Instagram | veganyums_
Eat India company has a sharing kitchen with urban kitchen. Interestingly, in eat India company, they also gave the urban kitchen's menu. Ambience is pretty good that has cobination of modern furniture and ancient India decorum.
When we reach there, we asked waiter to suggest their best sellers in starters and main course. Very disappointed with the kind of knowledge they have about their dishes. They were not trained enough to speak confidently about the items mentioned in the menu.
Finally, we ordered kaju aur bhutte ki seekh in starter. The order arrived after 15 minutes. Plating looks good but tastewise, it was well below average. The stuffing was too dry, even with the chutney, it doesn't taste good.
In main course, we had patiala shahi paneer. Quantity was enough to serve two people, but again, don't expect the taste. Curry was too ordinary with lot of Curry leaves in it.
After having such a horrifying experience, they included 5% tips for their waiters. Think before you visit this place. And in any circumstance, if you are visiting, beware of this waiter tip and you have right to remove it from your bill.",2,"2019-04-27 14:00:26",100,1210,7
"2517906","Best one to try for, had Ala-Carte and starters were too good with decent quantity and good taste. Prawns and Fish items are must try here which anyone would fall in love with. Looking forward to try Buffet too",5,"2019-04-26 09:43:45",3,1,0
"1743313","It was a good experience. Could improve on the quality of the starters! The prawns were amazing and the main course was good too. Could’ve been better if they changed the menu of the desserts ",4,"2019-04-23 18:19:07",1,211,0
"36183539","Ok-ish food and price and taste doesn’t tally. 
Ok-ish ambience 
Not so great place to sit and have a chat, as it also combines with Tiki Shack and Urban Asia under one roof you felt that I was sitting in some crowded place",3,"2019-04-21 13:48:52",5,2,0
"697871","We had specially requested the waiter to make the paneer dish less spicy .But the dish turned out to be just the opposite .To top this we get a wrong bill to pay :).Mostly our last visit to this restaurant,neither will recommend .",1,"2019-04-13 21:22:03",1,11,0
"29205968","Great place to hangout with friends and colleagues..
Lot of options with the menu and delicious too...  Service was also great..
Only issue was with the parking.. ",5,"2019-04-01 00:53:41",10,8,0
"30532258","The buffet was not to impressive so we ordered from menu.
Can go for a change but definitely not frequent visits
Food 2.5/5
Ambience 3/5
Service 2/5
Food option for Vegetarian 1/5
Overall 2/5",2,"2019-03-18 16:24:55",19,1,0
"2656702","Happened to visit this place for dinner on last Sunday. The ambience is amazing with decor pieces from Rajasthan. They have used various elements in a smart way. We opted for a dinner buffet. The variety of items in the buffet were good. But starters were served cold on the table. This place is decently priced. I personally loved the Thai soup, chicken kabab, butter naan and dal. 
Food : 3.5/ 5
Ambience : 4/5
Service :4/5 ",3,"2019-03-17 19:01:40",7,6,1
"46072191","I love this place in Gachibowli. I have been here several times now and the quality of food is amazing and the staff are good.
I highly recommend this place and just above this we have tiki shack.",5,"2019-03-09 15:37:00",12,4,0
"30753091","Me and my wife are foodies and we went there for lunch. We went for ala crate , and ordered Murg Badami Shorba. It was delicious. If you visit the place you should try it. With Shorba we ordered Malai chicken tikka as starter.
The chicken was soft, and it was delicious.
For main course we ordered zafrani Murg. This dish was again delicious. The spices were right.
I would go there again.",4,"2019-03-04 22:05:08",4,56,0
"51690616","Food is superb here. You can randomly choose any item from the menu and be assured that you will not regreat. Staffs in the restaurant are quite professional .",5,"2019-03-04 16:42:56",4,1,0
"2538916","I've been here a couple of times, and I must say, it never disappoints! Everything I've ordered so far has exceeded my expectations everytime. Hara bhara kebab and dal qureshi are a must try. The service is prompt and ambience is great! An overall good experience. One of my favorite place to dine out in Gachibowli.",5,"2019-03-02 19:42:38",7,65,0
"56889459","14th Feb planned for a dine out. Eat India company# Ambience was apt# Chose alakarte# Dragon chicken was tender & Juicy# Nizami Handi went perfect with Phulkas# chicken biryani was good as expected# Srikanth the guy who suggested good dishes & was very quick in service. Thank you Eat India for giving as a very good experience ",5,"2019-02-14 21:52:05",4,2,1
"40216725","Went for team lunch and took buffet for all.
Nice place.
Great ambience.
Food and service is also good.
Nice place to hangout.
Quantity and quality is good.",4,"2019-02-13 19:00:11",4,13,0
"405448","#Disappointed
Went for dinner with friends. Was bit disappointed with the service and food. Firstly due to lack of space they have clubbed Urban Asia nd Eat India on the same floor. Which make service bit slow and confused.
We opted for buffet, here also they served fusion of both the restaurant. For example they served chicken sorba for non-veg and Khaw-Souy for veg.
It's simply confusing and making ur dinning experience not that great.",3,"2019-02-10 11:46:47",120,789,0
"1202564","Eat India Company (EIC). So this is a very interesting place. You go there, and first impressions very good. When you are seated, you get 3 menu cards, 4 actually. Besides EIC, you are also given the menu of Urban Asia and Tiki Shack. It's all in one place. Now dont be surprised if you go there to have in Urban Asia and are given all three menu cards. HAHA!
Ok. So there was buffet at the EIC. I scanned thru it and they had very good options. There were number of options. Very intriguing. Though i had À la cart. 
Ambience is very good. You want to go and see whats on every wall, it's interesting. Lighting is good, you get to see what you are eating (i've seen some dont have enough lighting. Not talking about Dialogue in the dark here, hehe). 
Taste was good, as in ok. I've tasted better biryanis at other places. All and all it was a good experience. Nothing like WOW or Very different. It's a good place, your regular go out and have good food.",4,"2019-02-01 05:58:49",54,68,7
"4586731","The place gets its name probably from EAST INDIA COMPANY and they have maintained a quite good vintage ambience in there.
Though the prices are in a bit higher end, but thats something you can expect from a brand like URBAN ASIA.
Now talking about the food, the varieties offered in both veg and nonveg is quite good and delicious. They take there their time to get the food, but thats because they cook it hot right after the order is placed.
Overall a good place for family as well as to hangout with friends.",5,"2019-01-18 09:28:49",17,25,0
"40537515","Pretty average fare.. tried the paneer lababdar and zafrani chicken .. just about fine.. the butter nan had very little butter.. service is good .. the waiters were very attentive and cheerful .. eat India company and urban Asia share the same kitchen and floor .. so one can order from either menus..they also have a buffet on the table.. however we tried the ala Carte",3,"2019-01-15 21:56:14",25,13,0
"1154346","Visited this place twice.. Love the food here and the ambience, service is also good, price is worth the experience .. its a must visit restaurant.. ",5,"2019-01-13 22:25:01",21,31,0
"53916467","Too costly and food was not up to the cost quantity also very less i will not recommend to go to this place, Crowd will be less and waiting time also little more ",1,"2019-01-07 20:58:52",3,3,0
"1057019","I have been to Eat India Company twice. To Sum up my experience, I found the service Sloppy and mindless. Food has fluctuating standards here, for a meal that cost almost 2k for 2 people without drinks one would expect at least some good to come out of the most basic cuisines. 
The kadhai paneer which should have been lip smacking and flavourful was totally bland.
The service was so lethargic that I had to wait almost 30 minutes for my food on a day when only 3-4 tables were booked.
The only positive side of this place is the ambiance which is great, authentic artifacts from the past add a good aurora but the place needs to step up its game in terms of food that they offer.
P.S. I was pretty excited about going to this place but unfortunately my experience was so bad that I shall never visit this one again.",2,"2018-12-21 05:41:37",8,128,0
"27941758","No proper food. Wouldn’t recommend to anyone.
They dont even bother to come when we call them. Forget about serving us.
Very bad experience.",1,"2018-12-20 16:10:23",1,0,0
"32897318","Very bad services, I booked table in advance with zomato gold , after taking first order, they did not turned up to table to take main course order or to serve water or to clean up table. One should not come with family here.",1,"2018-12-18 21:49:57",2,1,0
"39176993","We decided to go to Eat India Company for dinner, then found that it in conjunction with Urban Asia, Good for us, as we got the opportunity to try both the restaurants. Food was good so was the service, prices were moderate to high. Heard about frozen ice cream, and it was a nice try. The Place is located on the busy foodie street of Gachibowli, good that valet parking is there. Taste and Prices are decent with good portions.",4,"2018-12-05 08:00:26",43,23,5
"313647","We visited a day before diwali and we were deploy disappointed.
Service was poor except for one server who was courteous and smiling.
We ordered fresh lime soda which was not sour
Starter were okay (hence 2 star). But main course was pathetic. We still couldn’t figure our how they screed up simple thing like paneer butter masala. Tasteless.",2,"2018-12-02 14:28:54",14,7,0
"36889231","It has absolutely nothing for vegetarians. There are a couple of starters, but that is pretty much it. Absolutely no variety either for the main course and even the deserts were disappointing.  All in all a pretty disappointing experience that felt heavy on the pocket. Hope you will start considering vegetarians and their palates too.",1,"2018-12-01 22:50:14",2,2,0
"32961416","This place is fantastic and the ambiance has a very different concept and the service and staffs treats us as a our friends. Loved to be in this place",4,"2018-11-23 20:36:16",77,648,5
"39546660","We had an unhappy dinner. Really very slow service, least interested to bother or care about the customers.
Waited for 45 mins to be served cold food (almost the leftover). Lack of cleanliness.",1,"2018-11-16 23:11:47",5,25,0
"49462468","If you are craving for some really good food and cheap drinks, this is the place to go to.
Zomato gold is applicable here on food.
The ambience is top notch and soothes you.
The menu for Urban Asia is also available here to order from.
The staff is friendly too.
Must go. 10/10",5,"2018-11-07 07:51:24",111,1009,0
"6496871","A nice place to have food with buddies.. We went for a team lunch and had a nice experience. The ambience and food variety are great and the music is continuous and soothing.. Overall we liked this place.. Especially the starters are well cooked and served..",5,"2018-11-02 14:03:25",1,0,0
"66049789","The receptionist was very impolite. She started shouting at us when we asked her to call her manager. The most amazing part was when we were told that manager was very busy and cannot come to us. I am not sure what was more important for the manager than customers (the restaurant was definitely not on fire). And funny business model of not catering to a group of 8 when they had 5 tables for four free.",1,"2018-11-01 14:03:06",1,0,0
"41229998","Visited this place for buffet lunch with team.The Starters were very good.They will serve starters on table..Even the main course was good...Loved Phirni and Chico Lava cake as well.However, the ice cream was not good.Staff was courteous as well..",5,"2018-11-01 13:48:50",7,5,1
"50107164","Want to eat food... Come to a place where you can eat food big time.. love life food repeat... In love with the best starters and main course......",5,"2018-10-27 22:17:50",2,1,0
"66449453","We had a great time with awesome food and great service by SK Alauddin. I recommend Thai Coconut Soup, Malaysian Laska, Signature fish Phuket sauce",5,"2018-10-25 22:08:23",6,0,0
"48352022","#Good food#goodambiance #greatservice #pocket friendly##
This is what u need to say about this place u can call it as urban Asia or u can call it as eat India Co easy access to the place good place to hang on with friends",4,"2018-10-25 19:17:56",1,1,0
"31565043","Thank u eat India we had made out day outing.. We are almost fifteen people and we had enjoyed the ambiance there food and there service, food was quick as we went for a buffet and it's a good spread we got a good rate too... Love to visit this place in the night... Soonnnnnnnn.
I love there ice cream counter :-)
We will come back soon",5,"2018-10-25 19:10:26",2,1,0
"52685766","Very very bad experience I had. Too worst serving which I never experienced in my life and they were not respecting customers in a good manner.",1,"2018-10-25 16:48:16",2,1,0
"71974656","Too much of crowd and no one will attend you for quite some time. Worst experience till date. Totally waste of time visiting this place, you ll leave this place in frustration.",1,"2018-10-25 16:40:02",1,0,0
"51128441","Worst service and management! Waiters will not attend you and all you have to do is wait even to get menu card. Manager's behaviour is totally rude.",1,"2018-10-25 16:30:51",3,1,0
"42262527","One of the most irresponsible staff i have ever seem till now. The only nice thing happened that receptionist guide to the table. After that we waited for almost 10 min but no one attended us even we have called couple of attenders. After some time when we spoke to the manager, we were shocked at the rude response which made us to leave the place",1,"2018-10-25 12:55:06",4,1,0
"35576878","This place is not even worth 1 star. Nobody's even attended us for more than 5 min, no courtesy of giving menu card even. When we spoke the same to manager, he himself is rude telling that it will take 5 to 10 min for the waiter's to attend. Rude manager and worst service!! Absolute no, if you are seeking to dine in peace!",1,"2018-10-25 12:06:31",1,1,0
"76830130","Had a great time with my friend at Eat India company last Night, along with good food & superb service too.. Thanks to Srikanth the Tall guys who take good care of us !!!highlight of the evening is Murgh Angara and Thai chicken !!
And not to forget the man who leading from the front Mr Nishant thanks to him for his suggestion to go with buffet.... Love the combination of urban asia &Eat India...
Surely we will visit soon...",5,"2018-10-19 20:04:45",1,0,0
"54064598","1. Service is too slow.
2. Chef does not check the dish and throw to customers. Worst quality for vegetarian food (Paneer dish) . Better to have road side in 100 Rs.
3. Spoiled my evening.",1,"2018-10-18 23:09:52",3,2,0
"49653583","Well, it seems that they are juggling all the 3 restaurants the owner own. We were given 3 different menu cards, one for appetisers, one for main course and one for Asian cuisine. The service was too slow. We asked for paneer Kadhai instead they served us with Sauf filled Kadhai of paneer which tasted pathetic. The Zomato gold benefits were denied as the Asian cuisine menu was from the other restaurant of the same owner which was not told to us before we ordered. I missed my outstation bus because of this silly confusion of the management. Overall not a place to go if you want some peace of mind and good food. ",1,"2018-10-15 20:46:02",41,125,2
"42833406","Had a good time in Eat India! Along with great food the service was excellent as well! Shout out to SK Allaudin who took great care. The Irani fish was a new discovery, and was soft, and tasty.
the biryani is an all time favourite.",5,"2018-10-14 20:53:45",3,2,0
"31303565","We ordered Veg Thai Coconut soup and corn squares which were a highly recommended item on the menu. Both the items turned out to be utterly disappointing. The soup smelled fishy which was not expected in a vegetarian dish. And the corn squares tasted were soggy and oily .. No crunch or crispiness. Nobody bothered to ask us about the food or why we had left the soup. ",1,"2018-10-14 20:34:33",1,0,0
"1454847","Descent place. Nice and different Ambience. Buffet was ok ok. It started on a high note with Chicken Shorba followed by starters and main course. And as we were moving to main course taste of food was not great. It was either too much salt or garlic ginger paste.
All starters were really nice. Mutton Rogan Josh was best. Thai Green Curry with Steam Rice was delicious. Desert we're hardly available and no one even bothered to refill. Service was nice. Over all ok ok. May be second visit will think and decide if no option available. ",3,"2018-10-14 18:40:18",78,76,5
"46188945","Been there after seeing the rating. It is an absolute No resturant. The starters came after 30 min n we always need to remind and followup for serving and its not worth for wait as its tasteless. The drink served is like a coughsyrup with a medicinal smell. There is absolutely nothing to dine even at chinese side. Dessert section is something you will not feel to have it. You will immediately goto icecream counter where you will wait for 20-30 min and finally that fellow will state we dont have that flavour and can only give butterscotch. Its not that it got over by the time ur turn came, it was never there and they made u wait n finally forcing u to have wht he prepared than wht u want. Finally you will end up paying such huge bucks for drinking water and go straight to office to do lunch at your own office canteen which will look so beautiful than ever before. If u dont want to have food but soend money then its a worth resturant to visit. ",1,"2018-10-14 12:35:27",61,25,0
"38033572","Worst food ever..... Very bad taste, i will give negative rating.. no dishes were properly made.very bad experience. Just name is big but no quality and taste Maintained",1,"2018-10-13 22:14:45",2,2,0
"502078","If it's Dal Bukhara in hyderabad it must be Eat India Company!! The hot and tantalising dal bukhara when rolled over a garlic naan with tinge of butter spread is an orgasmic treat to the tongue!!  
While the other items were good, bukhara was the show stopper !!! Missing bukhara in EIC is a big miss! You may rather order just Bukhara dal and your palette has had its share of joy and would not ask for more !!!",5,"2018-10-06 14:14:19",12,103,0
"6571031","Good ambience but average vegetarian food....it was just like any other restaurant....we order paneer tikka and nawabi handi....tikka was fine but handi was very average...",3,"2018-10-02 21:00:16",26,47,0
"59232644","Been here for Sunday dinner buffet. I liked the ambiance with lite music.very peaceful place. Good for families who like to spend with their loved ones. and about food I liked cube corn in veg and fish, chicken & prawns in NV. I loved the mutton curry, it was so tender and delicious. And other items were ok. One thing they need to improve is service, though we opted for buffet they were serving starters at table that too with damn slow service and with repeated reminders.
Ambiance 4/5
Food 4/5
Service 2.5/5
One word review: Can try once.",4,"2018-10-02 13:38:51",2,0,0
"2162600","Lovely decor, straight out of an Asian Paints Royale demo house. 
Ceilings were littered with enamel painted doors and the pillars with utensils.
Absolute cracker of a place. 
Repeat visit is a must. ",4,"2018-10-02 13:04:32",125,1810,1
"968170","We went there yesterday for a late lunch. Google showed their closing time and we were going to reach at 3.15, so we called to confirm and they were ok. We ordered a la carte. Though the food was good, it arrived in pieces. For eg the noodles came first and the gravy came only only half the noodles were finished. The server too looked bit tired indicating it was end of his shift. The Virgin Mojito lacked the freshness and felt like fresh lime. 4.5 star for food, 3 star for service.",4,"2018-10-01 09:06:54",26,192,0
"32277400","Pathethic service and bad quality of food. Its hard to give any particular recommendations for this place since neither the ambience, the food or service is good anyway.
Disappointed. ",1,"2018-09-29 15:36:50",21,157,0
"1853730","Been here for lunch and opted for ala carte..
Must trys - corn cubes
Turn offs - extremely slow service, desserts
FOOD - 3.5/5 - tried corn cubes, crispy potato with butter chilli garlic sauce, paneer lababdar, mint and lemon Ice cream.
Corn cubes 5/5 - one of their unqiue dishes. Simply loved it. A highly recommended starters you need to try here.
Crispy Potato 4/5 - tasty and light!
Paneer lababdar 3.5/5 - taste was quite different and paneer was fresh. The tangy taste was dominating and not all may like it.
Tandoor roti 3/5 - was hard.
Lemongrass and mint ice cream 2.5/5- I expected a single serve of ice cream with a mix of these 2 flavors, but I was served with these two separately. Mint ice cream was too strong and we didn't like it, lemongrass was avg.
AMBIENCE 4/5 - decent ambience for a family dining..
SERVICE 2/5 - extremely slow. Had to remind 2-3 times to get our order. This definitely has to be improvised.",3,"2018-09-25 22:10:41",61,261,0
"37684781","Decent Ambience with light music. Taste of food - Not that great, No much Varieties in buffet. In all, it is not worth the money spent.
They really need to keep more varieties.
No salads.
only 3 desserts including ice cream.
So, it was an average experience",3,"2018-09-24 23:20:56",8,4,0
