"UserId","Review Text","Rating","Time","Reviews Count","Followers Count","Photos Count"
"3191573","If your intention is to order food and eat on the very same day and not the next day then i suggest you pick some other place. I ordered a biriyani from this place and its been close to 2 hours. Unless and until the delivery guy is crawling from the restaurant to my house, I don't understand what might take him so long as I stay around 4 kms away from this place. Thank you Hello Curry for your incredible service and now you definitely feature in my 'NEVER EAT FROM HERE AGAIN' list.",1,"2015-03-09 02:35:26",3,0,0
"15807092","had chicken biryani soft and tender chicken pieces with good enough masala , at the time of opening the packing the dum was flavorful and it made more interesting to have a bite. more over the salan was awesome but less quantity, the packing was highly designed which gives a high look. as per the pricing was reasonable very good then comparing with with bone biryani of other joints. good place to make a order for delivery at home step.",5,"2015-02-22 20:52:41",2,1,0
"9631141","Visited hitech city branch last week. It was of okay types !! Ordered kabab biryani. The taste was not that great. If u r a biryani lover, u will not be satisfied.",2.5,"2015-01-30 21:01:49",3,1,0
"1442396","Never had a bad experience with these guys but if they do not work on their prices i am sure their journey is not too long. Taste is good, quality is good, packing is very good, quantity is bad especially with the regular sizes for the price they are charging.
Hope we see revised menu soon. Else until u close down, i am sure i will order from u guys... Good Luck.",3.5,"2014-12-26 17:29:43",19,117,0
"15363111","The most pathetic place to order food from... I ordered a biryani but it never arrived, even after 1.5 hours of ordering it !  And they had promised a delivery time of 55 minutes to begin with...On top of that, the manager is making excuses saying we are busy instead of apologizing...I am never ordering from this place again...",1,"2014-12-07 15:46:21",1,0,0
"1903332","The worst place I ever ordered food from. I had to wait 2 hrs and even then I didn't receive my food. I called them every at 1 hr , 1 1/2 and then at 2 hrs. I never got any update on the order and I didn't even receive an apology from the staff. I am never gonna order from this place again. The only reason this place has got 1 star is that I can't give negative rating. ",1,"2014-11-24 22:06:14",2,0,0
"7139791","I've ordered from Hello curry for team lunch today..I asked them to deliver it at 1:00 am,delivery guy called me up at 12 and told he is waiting down stairs..We started eating at 1:20..To our surprise food is still hot..
We have ordered royal paneer makhani and lacha parata,kadai paneer,jeera rice,veg biryani,mutton biryani,double ka meetha.
Every thing tasted bland and paneer makhani is very bad it's not even edible.Jeera rice and kadai paneer is yum!!!
double ka meetha is the star with cream on top of it..it is so tasty...
Over all quantity is good,packing is awesome. :)",3.5,"2014-11-08 14:59:01",29,239,0
