"UserId","Review Text","Rating","Time","Reviews Count","Followers Count","Photos Count"
"6087451","This one's simple. They have great food, be it whichever cuisine. Especially the starters and my favorite Thai curry. However, they could work on the service. I have been here multiple times. One time we kept waiting for a waiter and nobody was willing to turn up and the other time we got there at 10 pm, and they were trying to get us out the minute we entered, by insisting it will be last order, would we prefer takeaway, so on so forth and this is when they were serving quite a good number of tables.
Full marks on food, none on service. Ambience is that of a typical restaurant in a fancy hotel (you know what I mean).",4,"2019-05-18 23:58:10",15,20,0
"35192681","Worst experience with this hotel. Food taste was very bad. No attention from servers. We even doesn't know that there are rotis and icecream. No one bothered to serve. Only peanuts was good among all the food. But for peanuts 1000 bugs is too much. And most special thing is a tile from wall fell down where a customer missed it in a inch. Plz don't sit at the last.",1,"2019-05-15 16:47:28",1,2,0
"4924931","Not recommended for sure.. Average quality and highly overpriced. Took eternity to serve chapati, that too cold ones.. Desserts were good as they have menu options.
Overall disappointed.",1,"2019-05-15 15:00:23",1,37,0
"35745628","Bad experience.. Food is fine but their AC is not working and staff says this is out of their control. We were sweating. Didn't expected this from such reputed restaurant. ",2,"2019-05-15 14:27:33",1,1,0
"32728257","Went to this amazing place quite sometime back. It's a very pretty, romantic place for a fine dining experience.
Great food, service and hospitality. They had live music elate the already beautiful and well lit ambience! I'd suggest a dinner at this place with your close ones! Better to reserve a table in advance.
Lovely taste in food. Delicious mushroom soup and the Quattro Formaggi is a wonderful burst of different cheeses in your mouth! Loved the appetizers and desserts as well.
Must try: Forest mushroom soup, Crispy corn pepper salt, Quattro Formaggi, Tiramisu
Would actually give it a 4.5/5",4,"2019-05-14 14:45:52",52,123,0
"49017436","Awesome white sauce pasta and chicken pizza. Great place to go. Been here multiple times, pasta is consistently amazing to eat. Plus Zomato gold is great plus. ",5,"2019-05-12 15:53:38",5,9,0
"73059334","Had a lovely experience with my daughter at Jonathan's kitchen once again. We love to eat at this place as it has as awesome menu.
We are very happy with the service provided was Yamuna. As she helped in customizing the dishes for my daughter. Thanks",5,"2019-05-09 14:27:57",1,0,0
"51120528","Very good food and service. Butter garlic prawns are particularly good. Staff (in particular a lady named Yamuna) was very polite and helpful.",5,"2019-05-02 22:20:31",1,6,0
"38377826","Visited with family for dinner on a special occasion.
The valet parking was a relief.
Unfortunately there was no maitre'd and we had to seat ourselves.
The ambience was great - I loved the light colours and bright lighting as it put a positive spin on the evening.
The food was really good. The sushi (even the veg variant) was worth trying and the starters and ravioli was superb.
Service however was lacking on all parameters. It was cold and inefficient. It was a real struggle to get the attention of waiters and when we finally did, they seemed perpetually annoyed and unwilling to help us out (couple of women in particular - could not catch their names). The billing too took an unreasonable amount of time.
The food here is great, but the low service standards compelled me to restrict the rating to 3. Quite unfortunate since this place has the potential to be a great restaurant.
Will we return? Perhaps not in the near future - the only reason we would return at some point would be Zomato Gold on the food.",3,"2019-05-01 15:06:57",13,11,0
"262224","Been to this place twice-once with friends and ordered ala carte and other with collegues for a buffet- loved both the experiences. The food here is really good.Unlike others, I will start with the dessert-love their creme brule the best and followed by their baked cheesecakes..Have tried their chickn burgers, pizzas and thai cuisine as well--i loved the burgers the best, followed by Thai curry..Buffet was less impressive than ala carte but was happy with the variety-whic included Hyderabadi cuisine apart form meditteranean...must place to visit in Hydereabad.",4,"2019-04-30 22:30:39",113,1569,0
"33199510","Went for lunch with friends...ala carte. Liked the ambience,though it was really far to get to!! We had the Caesar salad, which was fresh and could have used a bit more seasoning; Pizza arabiata-really nice, crust thin and ingredients fresh and tasty! Penne pasta-chicken was also good, though the chicken seemed dry. The best dish was Thai green curry vegetables which was served with a jasmine rice-the best ever flavours-a must try!! Now coming to the desserts- we had the philadelphia cheese cake baked-nice plating but cheesecake can be improved significantly. Creme brule was good--loved the crispy carmelized sugar crust.
There was a lot of crowd and it took us a long time to get our orders. Overall it was a nice experience, hope to have a better one next time.",3,"2019-04-30 18:09:47",101,1518,0
"34243275","I think there is no point of taking a buffet here. I took a buffet for the purpose of having mutton curry; but it was spoilt. Hence, there was no benefit from paying 2000 for 2 people.
I took this plate like this. I left this plate like this. ",1,"2019-04-27 23:02:39",9,8,1
"1071070","*over rated? I feel it is. Desserts are good*
Food -3/7
Ambiance -3/7
Service -2/7
VFM - 2/7
Jonathan kitchen had been on my check list for quite some time.. I was very happy when we finally went over a weekend for the buffet.. 
The early impressions were not great as it seemed very crowded and the ambiance wasnt bright which aroused a non positive vibe.. As we dint want to Go to another restaurant at that time.. We proceeded to have the buffet.. 
Except for the desserts section which was huge, I was disappointed with the overall quality of the food.. The taste want great and at the same time, the meat had a lot of bones.. service was bad.. There was always a shortage of plates and the dessert spoon they gave me was the highlight of the whole  experience.. 🤣",2,"2019-04-24 01:17:29",200,389,3
"1119031","This is by far the best buffet option on weekdays.
The spread is wonderful and quite enjoyable for vegetarians. I loved the pizza and some of the continental starters.
The main course options were also wonderfully flavorful.
And the desert spread also had more than a dozen options.
Not for the weight watchers :) ",5,"2019-04-20 13:22:35",24,15,0
"215477","A great place for pleasant evening dinner, not too noisy.
We ordered a pizza and risotto, pizza was great lots of veggies and nice crispy crust. Risotto was nice and had good texture, not an expert on risotto but liked it overall.
Quality of service is really good though very few people know details about the menu like which dishes are recommended etc.
Ambience 5/5
Food 5/5
Service 5/5",5,"2019-04-18 11:07:14",15,84,0
"1211323","Heard a lot about this place and many suggested that it’s a must try. I finally tried this and it was a LIT. They have a very interesting a la carte menu with food from different cuisines.
The ambiance good and pretty much similar to any fine dining restaurant except wobbling chairs.
I found service quite quick and clean. Food was brought to table right on time. The quantity of the dishes served did justice to the term value for money.
Everything I tried were perfectly done and delivered.
Chicken Peking Style, Peri Peri Chicken breast, Fish and Chips, Crispy Veg Uramaki (Sushi).",4,"2019-04-17 18:23:42",21,36,3
"47894683","I was invited to this place by one of my friends to have a dinner and experience the hospitality that Jonathan's kitchen provide.
Let me talk about the ambience , the place is very well designed and Maintained. The lighting at the place is very warm and cosy. perfect place to have a romantic outing as well as family time.
Now coming to food , for the starters we ordered tiger prawns , butter garlic prawns , mutton sikampuri kebab, crispy corn.
Out of all the butter garlic prawns were the highlight. I'd go back to this place just for butter garlic prawns.
For the main course we ordered beef steak and rice and dal tadka, though I am not a fan of beef and I don't eat , my friends told that it was too good. Dal tadka was awesome.
Overall this is a perfect place to have dinner and lunch , I'd definately recommend this.",5,"2019-04-16 10:47:16",74,97,14
"39537010","Ordered Achari Paneer Tikka through Dwight and for a restaurant that claims to be a top notch restaurant and charges exorbitant rates for the same....they sent stale stinky paneer tikka which had to be thrown in the dustbin. Extremely disappointed. Money lost and no replacement provided from the restaurant....not worth it!",1,"2019-04-14 20:22:46",3,7,0
"52485847","#HYDERABADIFOODTHERPAY
One of the best buffets you can have in hyd is at Jonathan's Kitchen. A very calm place with a beautiful ambience. Every dish will make you realize that you didn't do any mistake by coming at this place. This is a to-go place for every one
We had few mocktails like :
Ornge Delight : likely to boost u in this weather.
Cucumber & Mint
Virgin Pinacolada
Spicy Tango
Blue Lagoon
Now coming to Food :
GRILLED POMFRET
CHILLI CHICKEN - This was good, neither spicy nor less
CRISPY CORN - This was crispy with onion added in it. If you love corn then you're gonna enjoy this.
THAI BASIL CHICKEN WINGS
CHICKEN WONTON
NAWABI SHIKAMPUR KEBABS - This was perfectly prepared kebabs with pudina chutney was delicious
BUTTER GARLIC PRAWNS i loved them as prawns are my fav.
DRAGON PRAWNS - The name itself defines Dragons
DAL TADKA
RARA GHOSHT
AMRITSARI KULCHA n BUTTER NAAN was yummmmm
BURNT FRIED RICE WITH SCHEZWAN CHICKEN GRAVY
This combination can never be wrong, as i feel everyone love this combination.
Deserts :
One can never end their meal without a desert.
GULAB JAMUN - This is a favorite one.
CHOCOLATE JAMUN WITH ICE CREAM - A Hot choclate brownie topped with ancold ice cream. when you eat this. its so amazing in taste. and everyone who's going to order this would love this desert.
Service - 5/5
Ambienece - 5/5
Taste - 5/5",5,"2019-04-14 16:04:25",56,126,16
"34515229","A decent place overall. It has a nice ambience though it can get pretty crowded and noisy during peak hours. The menu is pretty wide-ranged. We ordered a couple of appetizers and a Pasta in main course. Appetizers were not very good. Chilli broccoli was too oily. However the Pasta was really good. ",4,"2019-04-11 17:39:24",6,7,0
"52357067","My steak experience here was a lovely one. Though I asked for medium rare done steak I was served a well done chunk of chewey meat that I didn't appreciate. The sides however were perfectly made and impressed me all on their own. The light and brightly lit interiors with white flowy curtains that never allow harsh sunlight to make eye contact make this place lovely for a laid back brunch. The eatery has an aura of tranquility that you simply cannot deny. ",4,"2019-04-11 03:42:14",48,19,0
"2280096","I have heard lot about the place but finally tonight I managed to visit it. They have an interesting and a wide range of a la carte menu and thats what we all were hoping to try out. 
The ambiance is similar as of any fine dining restaurant.
I heard reviews about their service being a bit slower, but luckily I did not experience that tonight (might be due to the lesser rush on a weekday night), rather I found the service quite good.
The quantity of the dishes served did justice to the term value for money.
Recommendations: 
Blackened salmon steak
Rib eye steak (one of the very few places in Hyderabad where they served an actual medium rare steak!!)
Sirloin steak
Cilantro fish
Jumbalaya
Cheese cake with blue berry compote",4,"2019-04-10 00:14:09",74,266,8
"34449853","It was a lovely experience. We ordered kimchi fried rice and exotic assorted veggies with chili basil sauce. Loved both of them. They were properly cooked . Mushrooms in kimchi fried rice were just delicious.
Not to forget the dessert: baked Alaska: it's a must try.
4 stars coz it's quite far. Baring that it's a pretty sweet restaurant ",4,"2019-04-07 17:18:20",4,4,3
"1000652","Went on a Saturday night. Nice cosy place,well lit and classy ambiance. Opted for a'la carte as we had a snack on our way. We were in a little early and found ourselves a good place to sit. Ordered a burger and pizza. Both were lip smacking. Portion size was huge. Absolute VFM. Zomato gold helps keep the place pocket friendly :) Will surely visit again.",5,"2019-04-06 22:45:25",8,78,2
"873715","I have visited Jonathan's kitchen on many occasions. One thing that strikes me is for such a big restaurant, their service is not so nice. Also, they denied us Zomato gold services saying we were sitting in Komatose, however as per their front staff, they told us to sit in Komatose as they didn't have seat in Jonathan's kitchen but the food, menu and staff will all be from Jonathan's. Hence we sat and ordered and later, found out, no gold accepted.
I have tried their buffet, ala cart, Sushi and everything else, Nothing extraordinary. The only benefit is, it is close to my place. ",3,"2019-04-06 22:36:33",40,32,0
"34767243","Came to get dinner, made a reservation in advance. Sat for the first 10 mins waiting for someone to get a menu and water.. after 20 mins of waiting for water and asking a few times for someone to take the order we decided to leave when no one came. Still no questions asked on why we're leaving. I guess one can plan a visit if they have a lot of time in their hands and or are not hungry. Had heard good things but this experience changes my mind completely. Won't recommend it for the service",1,"2019-04-06 21:55:03",2,1,0
"29973853","Go to place for office team dinners. Food is simply amazing with a large variety of dishes being served. felt the lighting can be improved a bit.",4,"2019-04-06 18:09:13",25,5,0
"1383151","Did not enjoy our evening at all. Just realised not to order Sushi if it's not an authentic Japanese restaurant. Nigiri and uramaki were rice and rice and rice.. I made it a little interesting by adding as much wasabi as my brain could take. Waiters were very transactional. Told them it's my daughter's birthday and asked for a cake. They had a blueberry cheesecake in dessert and said that's all they can offer. We'll ordered the cake and had her cut it. None of them bothered to wish her or atleast be by our side while she was cutting the cake. Why do I bring this up? Cos this is a 3-4 star hotel and the staff is expected to be well trained and courteous. Service was very slow.. overall a lousy experience. ",2,"2019-04-03 22:19:18",36,138,0
"22092","The place has a nice vibe and the dishes are really tasty and they have a lot of options in buffet. Very nice ambience and polite waiters. The place little pricey but good to go with family.",4,"2019-04-03 11:09:57",4,5,1
"76783669","A peaceful n quite place is something u want after a hectic schedule where u can spend some quality time with friends or family that relaxes u for sometime.....even I wanted to relax n take a break from my hectic schedule.......one or two days later few of my friends invited me to this place n was delighted to know this place n it was perfect for me as I exactly wanted to head to a place similar to this......believe me guyz it's an awsome place n definitely u will fall in love with it.......
LETS begin with drinks first
They served so many MOCKTAILS like
ORANGE DELIGHT had amazing blend of vit C to give u the boost in this hot weather
CUCUMBER n MINT very refreshing to beat the heat n taste was good too
VIRGIN PINA COLADA not good as it had coconut n pineapple flavor n I'm not a fan of coconut flavor especially in drinks,so it was a No No for me
BLACK CURRANT tasted good
SPICY TANGO had a tinge of masala like jaljeera n a dash of spiciness dat had a pinching sensation on the throat.....little different n can be taken
BLUE LAGOON as the name says it's a blue colored drink dat had blue caracao syrup added with few lemon wedges n mint leaves.....tasted realllllyyy good
FOOD
GRILLED POMFRET
a big fat good looking pomfret😋 marinated with an awsome blend of very basic n flavorful spices n grilled to perfection....served with mint yogurt dip along with onion rings n lemon wedges.......fish was full of flavors with each bite giving superb taste n it was fresh as the taste of fish meat was very good n not at all smelly......well presented n delicious👌
CHILLI CHICKEN
Chunks of boneless chicken coated with batter n fried till golden brown,tossed in a chilli soy based sauce with onion,cubed capsicum,dry red chillies n spring onion stalks topped with handful of cashews n raw cabbage.....overall tasted very good n chicken was perfectly cooked n the sauce that was coating it was fab too...
CRISPY CORN
Crunchy corn topped with some garlic n onions is the best of anything that one could possibly desire for........ if you love crispy corn then u you cannot miss this.....it was a fantastic appetizer to start our meal with.......do not miss this guyzz 👍
THAI BASIL CHICKEN WINGS
When chicken wings are coated in a delicious schezwan style thai chilli garlic sauce with a touch of basil leaves u get an awsome result.....it was very different kinda wings which we don't usually get at other places.......delicious
CHICKEN WONTON
Minced chicken filling wrapped in wonton sheets served with sweet chilli dip......filling had a quite dominant flavor of vinegar otherwise it was fine.....
NAWABI SHIKAMPURI KEBAB
Usually shikampur is flat round shape n filled with yogurt,but here it was in a round ball shape filled with yogurt n onion dip.....shikampur was cooked very well n was going very well with the mint sahi chutney n onions on the side...
DRAGON PRAWNS
Crispy fried prawns tossed in red chili n garlic sauce
BUTTER GARLIC PRAWNS
By far one of the best butter garlic prawns I had till now.....crispy fried prawns tossed in a velvety buttery n garlicky sauce with onions n spring onion stalks topped with sesame seeds n raw cabbage......👌
TIGER PRAWNS
Jumbo is also a small word to describe the size of these prawns....whoa mahn!!!!
Tiger prawns was the right name given to this dish as the prawns sized huge....tossed in a very basic garlic,salt n pepper sauce served on a bed of blanched spinach topped with lemon wedge.....it was a bit hard but other than that the flavors were good
DAL TADKA
Well blended with perfect tempering of dry red chillies,chopped garlic,cumin seeds n oil.....was one of my favorite from the main course items.....delicious
RARA GOSHT
Minced meat gravy dat was delicious n spices did not overpower the whole dish which was the best part of this dish
BUTTER NAAN n AMRISTSARI KULCHA tasted yummmmm
BURNT FRIED RICE WITH SCHEZWAN CHICKEN GRAVY
This combo can never go wrong.....both the dishes complimented each other n it tasted fab!!!
DESSERTS
GULAB JAMUN
Perfect rounds of gulab jamun served with sugar syrup n sprinkled with chopped almonds wer yummmmmm
Perfectly cooked with just the right color
CREME BRULEE
It consists of a rich custard base topped with a layer of hardened caramelized sugar....... it was served slightly chilled topped with plenty of fruit cuts n presented with apple slices by the side.......
It was different from other places n tasted yummm
CHOCOLATE FONDANT WITH VANILLA ICE CREAM
When a warm choco lava cake is topped with a scoop of vanilla ice cream drizzled with loadz of chocolate sauce n dusted with powdered sugar den there is nothing else u want in ur life😋
SERVICE was on point.....staff was very polite n humble
Delivered each n every item with punctuality n was never rude even if we asked something too many times....good team
FINALLY would like to recommend this place to people who would like to spend some quality time with family,friends or der loved ones in a peaceful n quite place accompanying with some delectable food.....even very good to conduct ur business meetings.....overall it's convenient for everyone.........do visit this place n njoy 😁 ",4,"2019-03-31 23:25:05",59,97,8
"33261230","One of the few places in Hyderabad to boast of delicious cuisines, amazing ambienence and splendid live music. A big shout to Surendra , for the exceptional service. They offer a wide spread of dishes and drinks.we had gone for buffet and enjoyed the night thoroughly. Would definitely recommend any foodie!!!",5,"2019-03-30 23:33:47",2,2,0
"1578119","exceptional service by the team especially Surendra thanks for having us and giving us a great time with amazing drinks and food. Anil gave us a great service too.",5,"2019-03-30 23:28:21",6,76,0
"52940679","Amazing food.. super amazing staff.. love all d stuff.. be it continental, italian, Japanese or Indian !!👍👍👍
Kids friendly.. lively n lovely !! Thank u so much Yamuna for all d suggestions ( hv all been super delicious) n for ur hospitality.
Keep it up guys♥️",5,"2019-03-29 21:21:02",1,1,0
"38294213","Very bad service, food was not good. They took lot of time for clearing the plates, arranging tables.  Had to pay the money without bill. not worth at all for that price.",1,"2019-03-28 16:26:13",1,1,0
"29793146","I love the food here they have a great spread for their buffet. However I have never had the buffet so I wouldn’t comment on the taste, but the spread is definitely good cz I checked that out. I come here and order right out of the menu and over time have fallen in love with their Fish items from the grill section. I have had the Blackened salmon steak, Cilantro Fish and the Murrel Crust and have loved each one. However, if I had to pick one it would be the Salmon and that too would win by a very close margin. Apart from their fish I love their Spring Chicken and Chicken Confit as well. If you love grilled meat that is cooked delicately in continental cooking style, then this place should be on your list of restaurants to visit.
Coming to the ambiance, it’s minimalistic and chic. The staff is polite and warm. They have a Zomato gold offer on food, so that’s amazing because the food is a little on the pricier side. I definitely plan to have their buffet soon and will update this post accordingly.",5,"2019-03-28 14:30:59",21,58,2
"50231866","I have been there for quite a few time now, for brunch, Ala cart as well as only for dessert.
Brunch- They do have a hell variety of items and I am sure you won't be able to taste them all...I liked their starters very much which had egg options, pan cakes, sautee vegetables, idly, dosa and many more.It was fulfilling in itself.If you also love brunch than it is definitely worth trying and value for money.
Dessert- I went their only for dessert once and had Tiramisu and chocolate ganache...both of them tasted amazing...except Tiramisu base was little watery after sometime but still it managed to satisfy my craving.
Food-5/5
Ambiance-4/5
Service-4/5
Price-4/5",4,"2019-03-27 14:58:42",93,155,7
"51488191","One of the worst places to visit ...horrible experience... We waited for 45 min after placing our order and then walked out of the place without eating anything... First they misplaced the order at a time when there was only two other busy tables and then they had the audacity to come with a pizza and offer us and then realize that it was for someone else...",1,"2019-03-25 21:24:27",5,1,0
