"UserId","Review Text","Rating","Time","Reviews Count","Followers Count","Photos Count"
"69970310","Best place Ever Jonathan's Kitchen
If you are near Gachibowli and are planning to have a perfect lunch or dinner so I recommend you the best place is Jonathan's kitchen, where you can visit with your family and friends. I really loved this place from it’s ambiance to food and service, everything’s top notch.
It was Wednesday night and we were near Gachibowli and really hungry, when I suggested we will visit Jonathan's Kitchen, it is my favorite place to hangout. I was with my five friends and we started our dinner with their special starters Grilled Pomfret, Chili chicken , Crispy Corn , Chicken Wings, Nawabi shikampuri kebab, Dragon prawns and Tiger prawns. All of the starters were the best, I have never tried such before anywhere. Now that the starting was the best, I promise at the end it will be a blast.
Grilled pomfret was tasty and soft to bite, it was properly cooked with perfect spices and we ordered this twice. It was so good! Chili chicken wasn’t much spicy, it was well equitable of spices and the best starter to start our dinner. Crispy corn I have tried at many restaurants and I loved Flechazo’s before, but now I can say the best crispy corn is at Jonathan's kitchen. I think this is the best compliment. Chicken wings for this just one word magnificent!
Then my favorite part were the prawns. Here we tried 3 different types of prawns, Butter Garlic prawns; this is just out of the world first time we have tried this really the taste is unforgettable, Dragon prawns; one of my friends suggested me to try this here, Mr. Tarak, the name itself represents dragon prawns. It is the best in prawns compared to tiger prawns, Tiger prawns; these were too large in size, I have never seen the size of prawns like tiger prawns taste also too good it was the best to end our starters.
Then we ordered some mocktails because it’s mandatory; Orange delight ,Cucumber n mint, Virgin pina colada ,Black current, Spicy tango and Blue lagoon or blue heaven. Every mocktail has their own specialty. Orange delight and cucumber n mint were the winners of the evening. Black current is really good in taste and refreshing. Spicy tango and blue lagoon were the ultimate mocktails. Every mocktail is best at Jonathan's kitchen.
Then it’s time for main course, in that we ordered Dal Tadka and Rara Gosht with Butter naan and Amritsari Kulcha, and Burnt Fried Rice with Schezwan Chicken Gravy. Every dish just left us speechless! Dal tadka and rara gosht tasted absolutely great with butter naan and Amritsari Kulcha. Burnt Fried Rice with Schezwan Chicken Gravy was the ultimate dishe to end our phenomenal dinner at Jonathan's kitchen.
But without dessert, I never end my dinner. So here we ordered Gulab jamun, Chocolate fondant cake with vanilla ice cream and Cream brulee with Fresh fruits. All the desserts are just marvelous to end our dinner.
Thanks to Mr. Rashid for the lovely dinner at Jonathan's kitchen. Thanks to the entire team of Jonathan's kitchen who served us in a very good way and special thanks to Surrender and Chef vijay.
Must Try:
Dragon prawns
Butter Garlic Prawns
Tiger Prawns
Grilled pomfret
Crispy corn
Orange delight
Cucumber n mint
Rara Gosht
Burnt Fried Rice with Schezwan Chicken Gravy
Chocolate foundant with vanilla ice cream
Creme Brulee",5,"2019-03-25 12:18:37",28,1623,9
"210604","This was my second trip here, after a long gap in between. Overall fine experience. Service is good. We ordered the Prawn Sushi and Jambalaya. The taste of the food is good. Liked the sushi, though found the pieces a little too big. The jambalaya was good in taste and presentation. Overall, good ambience with decent food. Liked the ambience and service better than the food.",3,"2019-03-25 02:18:36",9,103,0
"946306","This place is overrated donno why it's rating and taste doesn't match. We had a team lunch here. Food looked pleasing with vibrant colors but taste was tasteless please carry salt & pepper along. Only dish which our group enjoyed was curd rice & peanut chat.
Taste , rating & cost has no connection among themselves",1,"2019-03-24 15:17:41",27,15,0
"38795544","I suggest pls pls don’t visit this place . Such a worst food I never experienced. The worst experience is I found a bug in a blue berry cheese cake and also so many flies . I would rate 0 if i had a chance . No smiling service would again and again suggest don’t visit this place.",1,"2019-03-24 15:03:22",1,1,0
"2433000","They said it's one of the best buffets in the city and my experience says otherwise.The service of the place can test your patience in manyways when it's packed.Everything that was there in the buffet was icecold from starters to maincourse.Seriously guys..??!! Huge disappointment this one was.Been here for lunch on holiday,even though i made a reservation before hand it took 30 min for us to get a table.Service, i always let go even if the service is not uptothemark cause it's understandable and afterall they are human.This one was unacceptable.It was a buffet(everything selfservice) only thing they are supposed to do was provide cutlery which they failed even after asking for multiple times.I walked upto the cutlery table to get it myself and they gave me 2 spoons and one plastic spoon for a table of 6.😂The taste of the food in the buffet,total off.Below average spread and taste.Nothing caught my attention to even write about it.The kebabs were all dry,the classic crispy corn was rock hard .The fish curry,i think they accidentally put fish in the salt gravy.Why is it so hyped,i still don't get it.May be i visited this on restaurent's bad day.But it was a bad lunch day for me and my friends.We just know how to have fun in the crisis,good for us,otherwise you can land up in a huge disappointment.",2,"2019-03-24 14:34:15",84,635,0
"33916626","One of Hyderabad's most stylish fine dining places, Jonathan's Kitchen serves lip-smacking culinary delights paired up with a cool and extensive bar menu. The luxurious ambiance and enchanting music make this place an ensemble of various occasions. I was here for a Tuesday night dinner with some friends and we experienced a flavorful time.
We started off with some amazing starters; Butter Garlic Prawns, Grilled Pomfret, Dragon Prawns, Crispy Corn Pepper Salt, Chicken Wonton and Nawabi Shikampuri Kebab. The Prawns were just fabulous, they were a perfect start to our dinner. Grilled Pomfret was also very good. Crispy Corn were the best that I've ever had, they've topped my last best opinion. Chicken Wonton had a perfect crisp covering and the filling was really great. Lastly, the Nawabi Shikampuri Kebab were very juicy and succulent.
Next we had some of the finest mocktails; Orange delight, Cucumber n mint, Virgin pina colada, Black currant, Spicy tango and Blue lagoon or blue heaven. All of these were very refreshing and perfect to have before moving onto the main course, while still enjoying the appetizers. Although Virgin Pina Colada wasn't that great, and Orange Delight the best.
We had an array of dishes from the main course, starting off with the ambrosial Chateaubriand, tenderloin cooked medium rare and served with creamy spinach and mushroom cream. It is a high end dish, and it did keep it's name.
Then we savored Rara Gosht and Dal Tadka curries with Butter Naan and Amritsari Kulcha. Both curries were absolutely delectable and were a divine treat to our taste buds. Lastly, we had Fried Rice with Schezwan Chicken Gravy. This was an absolute favourite of all, a tempting and toothsome Chinese dish with succulent chicken crispy on the outside juicy inside, slathered with a hot sweet uniquely spicy and sticky Indo Chinese schezwan sauce that just made our night.
We ended our dinner with the most sumptuous desserts; a classic Gulab Jamun, a fruity Creme Brulee, and a luscious Chocolate Fondant Cake with Vanilla Ice Cream. A perfect end to an amazing dinner. We had a wonderful time here and are just waiting to visit again.",5,"2019-03-22 15:03:01",57,1122,8
"96353337","Attractive restaurant, gd service, staff and delicious food and drink.The restaurants was very bg even on Wednesday evng. And are getting always gd sign..its really impressive..there was two boys..namely surendra and rupesh was too gd i feel for this industry...god bless them for there bright life.
Regard
Dileswar",5,"2019-03-20 07:01:54",1,0,0
"14884251","Team's is quite good , especially The two hostesses Ms.Bhargavi and Ms.Yamuna are very helpful and ready to help.... Coming to food It's just heaven to my taste buds
I recommend this place to all of you..!!",5,"2019-03-17 21:07:06",1,2,0
"2025658","Pathetic service. Staff is not trained. Served cold food. Food is not great. Service is way too slow. Staff has no knowledge about anything. Will not come again. ",1,"2019-03-15 21:45:09",1,19,0
"41446940","The place had too many mosquitos.
Food was served cold and was below average
Service was not upto the mark.
Ambience was good.
Not worth it.",2,"2019-03-15 21:19:21",4,3,0
"56485817","worst service I ever experienced. If we order an item no one take responsibility to bring it. They will stay at the corner and chit chat each other. There was a lady I said ur servicing was very worst and smiled in sarcastic way and went off. They will replace items after 20min. We have to wait for that item. Even bowls for sweets they will bring after half an hour that too not more than 5. At last I feed up with the services and had thought to have sweet and I find an Cockroache in the bowl I called the lady and waiter they did not responded. Then I went to kitchen and called a person ranjith he took the bowl and went inside the kitchen and came back and said sorry and offered 5 Ice creams. We were around 30 people. And he saying to come in the evng or next day. I don't know what they think about the customers. Basically it looks like decent and star hotel but the people and the service just like irani cafe. At least in cafe if we order they will get it fast or else inform us if it late. I heard lot about Jonathan kitchen food is absolutely good. But the people their behaviour and neatness was very very bad. Kindly find the attachment. Thank you and I never visit u. ",2,"2019-03-14 19:55:32",4,4,0
"34073096","Writing this review for so called much hyped restaurant of Hyderabad- Jonathan's kitchen
Went to celebrate my bday today..It was the worst food buffet I ever had in any above average costly restaurant.They charge so high for this shitty buffet.
1. Ambience- Even a local resaturant also have some areas of decoration in their restaurant but they have it like a messy hall. No theme no decoration
2. Service- No serving of starters, no serving of even water until u ask,no serving of even sauce at your table and waters think themself like heroes here.
3. Food- The worst part of it..Some stale starters of chicken and fish. Veg ones you cant even chew corn items as they might be few days old.One chicken starter only had some taste. Main course is also pretty below average.Pasta is good.Pizza(so called best Hyderabadi pizza) was worse than a 50rs local shop pizza.
Deserts- they put some sweets of local shops as deserts.
Two juices as welcome drinks were Ok.
I gave two stars rating because manager politely listened to all my complaints on food ambience and all and gave a delicous pudding cake to celebrate my bday.Thanks for that.
They themself agreed that their lunch buffets are generally not that great we should try a la carte..Will do that if I will ever try to take this risk again😜",2,"2019-03-13 21:45:14",11,3,0
"48078471","Worst dining experience I ever had till now.
service staff was extremely rude, so slow that we had to cancel a few items after waiting for 45+ minutes and asking multiple times for it.",1,"2019-03-13 21:33:45",2,2,0
"3023504","Nice ambiance. This place has a very good fine dining experience. The food is good too. A little expensive but is worth the price. I used zomato gold, so received a nice discount on food. ",5,"2019-03-13 13:04:53",5,99,0
"34492416","We went here for a friend's birthday. The service is extremely bad. The servers routinely forgot orders and various dishes didn't come and they still charged us for the same. We had to fight to get those off the bill. The food is also bland and nothing to write home about. Extremely disappointed. Not at all recommended. ",1,"2019-03-12 22:02:27",1,4,0
"1263748","Quality of food is really great. Ingredients are top of the line which give a great product. A must visit. Service is equally great. Our food took some time but it was worth the wait. ( The restaurant was busy with the Sunday Brunch and probably alacarte orders need equal attention)",5,"2019-03-10 16:59:33",40,54,0
"44725617","Had a really boring day at office so I invited my friends for a lunch at Jonathon’s kitchen. The place has a really nice atmosphere. I ordered dragon prawns , which was as nice as it could that I thought of ordering again. My friends ordered soup, which is the most hateful thing by me in food. The prawns were really soft, crunchy and tasty. The vegetables onions, bell peppers were all tasted good due to harmony between the sauces used to cook the prawns. As main course we ordered salmon steak which was really the size of a steak with vegetables and creamy sauce. I, like usual , ordered Indian cuisine which was butter naan and chicken tikka masala which was really suffice for me. The taste was also good. As a whole the food had all the qualities that would make me to visit the place again. It had the taste , the aroma and the visuals were also tempting to try the dish as soon as it’s served. ",5,"2019-03-10 03:25:48",34,51,2
"31021274","Bad experience ,the dishes ordered were cold and all were brought together on table i.e. appetizers and main course. Sushi was very bad in taste , pina colada was just mild cold... Chilli broccoli was served dry without any sauces and post requesting 3-4 times the garlic sauce was served. Overall not worth it even one star and my last ever visit.",1,"2019-03-09 22:00:32",1,1,0
"38681696","We have to been to this place on a Friday afternoon lunch with my team, the place is so big and it can accommodate more that 100 people in the restaurant.coming to the buffet spread, it was really huge and lot many variety’s. We got this on a Dineout deal for 550/- which is quite reasonable. Looking forward to visit the place again ",4,"2019-03-09 13:55:07",32,3052,0
"1178738","Average food not tasty enough and not worth the price of the buffet, better to choose some other option than this until its the only option. ",2,"2019-03-08 22:56:42",2,35,1
"878435","Great place to enjoy your weekend. The food is amazing. Even had live music on Sunday.
We opted for à-la-carte and ordered Dahi ke Kabab, Thai Basil Praws, Fresh Lime Soda, Strawberry Mocktail, Penne Arrabiata and Chocolate Fondue Cake.
Dahi ke Kababs were very nice and soft like they should be. Thai Basil Prawns were also nice and tasty. They were properly cooked and well served. Fresh lime soda was.....well fresh lime soda but Strawberry Mocktail was super sweet and is a must try. Penne Arrabiata pasta is one dish that I would recommend you all to try here. The gravy was super thick and delicious, the pasta was boiled perfectly and the presentation was also good. Coming to the dessert, I never had such an amazing fondue, not too sweet, just the prefect balance of chocolate and sweetness. Overall had an amazing time here.
Dahi ke Kebabs - 4.5/5
Thai Basil Prawns - 4/5
Penne Arrabiata Pasta - 4.5/5
Strawberry Mocktail - 4/5
Fresh Lime Soda - 4/5
Chocolate Fondue Cake - 5/5
Ambience - 4/5
Overall - 4.5/5",5,"2019-03-03 19:48:25",24,35,5
"36387823","When you are in Gachibowli and have to make a quick descision for a team dinner/lunch or a buffet place..!! Jonathan's kitchen would be on the top of my list.
Been here twice (this time on birthday) :-p and never regretted the service or food, with live music(they do have a good taste for music) and courteous staff, this place is always buzzing and is on the roll.
checkout offers on buffet and you can strike a good deal if you have a large team visiting, amazing seating options indoors and outdoors,cool bar and buffet counter ,love their starters and live counters with really good varieits and options to choose from!!
Overall : 4
Taste : 3.5/5
Service : 3.5
Ambience : 4/4
Price : 3.5/5
VFM : 4/4",4,"2019-03-03 14:46:46",57,51,7
"50065257","Had a great lunch. The buffet spread was good. Very good for office parties. Desserts were good too. Rice varieties were too less. Ambiance is nice. ",4,"2019-03-03 14:40:31",9,2,0
"67450802","Ambience: 5/5 (Both Indoors and Outdoors facility)
Value for Money: 3.5/5 (This is with respect to Sunday Brunch# costing Rs. 1200/- per person)
Staff Service: 5/5
Quality of Food: 5/5 Simply premium.Items I like the most are veg. maki (sushi), broccoli salad* from their regular menu.But even more outstanding are their live counter options such as Tawa Fish (Not your regular bland bone-less fish, but the way you eat fish at home) had some real flavour. Omelette, French toast, Pancakes were simply brilliant.
Variety of Food: 5/5 Enormous.This is where Jonathan's Kitchen truly excels, there has to be at least one item you will madly fall in love with. They claim to have over 60 items on their menu, which can be verified rather immediately upon looking at the serving table.
#In the name of unlimited drinks, there was no real variety to choose from. I couldn't even get my favourite soft drink Thums up (Franchise issue probably, I know), and on that particular day, there wasn't any option of Pina Colada. 
*I am a big fan of lettuce leafs. Please keep some.",4,"2019-03-02 00:13:54",3,3,0
"1587011","I went there for lunch on a Sunday afternoon. Four of us were there for lunch, out of four two of us opted for the sunday brunch and the other two went for à la carte. I was among the two who went for à la carte. For the sunday brunch there was a live performance by a band. The ambience was buzzing as the restaurant was quite crowded, they offer open air seating as well. The starters of the the brunch are placed in the open air section and the other courses are placed indoor. Personally, I felt the seating isn't much comfortable as the chairs' backrest lacked comfort. The air conditioning was not great as the temperature inside wasn't as comfortable as I expected it to be. However, the service by the staff is impeccable they help in every way they can.
Coming to the food, I had ordered Mutton Sukha, Rib eye steak and grilled tiger prawns. My companions went for the sunday brunch, as they told me the non-vegetarian starters were all wonderful except for the fish tawa fry which was not boneless. All the starters were very well balanced in flavour, the chicken kalmi kabab was exquisite. Compared to the starters, the main course was not so great the curries lacked texture and were not so great but the yellow dal was very soothing. Prawn cocktail was outstanding, the desserts were all very good and not extra sweet. Coming to the à la carte menu, the Mutton Sukha was great in every way, the spices were perfectly balanced they weren't overpowering the flavour of the meat, it's definitely a must try there. The rib eye steak didn't impress me much, the meat wasn't juicy as it is supposed to be and that was disappointing. On the other hand, the grilled tiger prawns were brilliant, they were served on a bed of sautéd spinach with garlic which was good too and prawns were boosting with flavour.
Overall, it's a great place to visit which serves dishes from all the major cuisines around the world. ",4,"2019-03-01 20:11:54",17,399,2
"192218","Lousy staff and lousy service. I went for dinner buffet and except a few things I didn't like anything. The deserts were really really bad. With so many options and none of them were good.
The only good thing is the ambience. I don't recommend this place at all. ",3,"2019-03-01 19:58:12",23,135,10
"13921711","This is one of the best place if you are looking for a quiet calm place for dinner or lunch .The ambiance is great,staff is excellent and food is to the point. The buffet has nice variety in salads,starters and desert.Main course is average in buffet but a la carte is amazing. The quality of everything served is great.I luv going back to this place.",4,"2019-02-28 19:07:04",12,30,5
"2749154","Jonathon's Kitchen was my yesterday's visit and it was good on part of food ...could be excellent if little more they will work on food ...it's ambience is very goo you can sit outside or inside...they have bar area... service is fast..they are always ready to serve you...food varieties are many but little it lacks on taste...for vegetarian people like me they an add some more things or can work a little more on taste...deserts they will kill you with lots of varieties..if you are on diet don't go..haha jokes apart they have good variety of deserts...few were too gud like gulabjamun, rasmalai, etc...cupcakes, were ok ok....but they have many many varieties...icing on the cake was live music....i loved the ambience because of that
My rating Food 4/5
service 5/5
Food 5/5
Overall rating 4.5 /5",4,"2019-02-25 16:40:15",10,23,3
"35239415","Here you can have a fine dining experience. The food is top notch and the plating is pleasing. There are a lot of options for ve/non-veg in buffet menu. I order sushi and opted for buffet instead of a-la-carte. If you have an appetite for good taste, this place is a must visit. The ambience is also rich.
P.s. - The sushi is a must try!!!!",5,"2019-02-23 04:02:16",27,81,1
"31223315","I visited this place for a Lunch Buffet recently.
They have wide spread of Starters, Main Course, Veg- Pizza+Pasta on table and huge variety of Deserts.
Food taste was Ok, but nothing different.
They have only butter naan and tandoori roti.",3,"2019-02-19 14:21:10",21,14,0
"488653","They have a very good spread in their buffet. The non-veg dishes have a unique flavour and taste which keeps this restaurant different from others, especially the mexican chicken and fish. All the varieties in veg are good. Ambience and service is excellent. ",4,"2019-02-17 20:15:40",8,159,2
"487840","This review has been long overdue, I visited this place for my birthday and gawd I wasn’t disappointed at all !! The place has this really sophisticated minimal design which isn’t too catchy but kinda looks like an elite ball room dining room. 
The service is just amazing ! Every staff member that approaches the table knows the menu in and out, the warmth that they have just gives this place extra points. 
Now coming to the main aspect of this restaurant; the food. The food is as authentic as it can get and this goes for every cuisine that the restaurant offers be it Mediterranean or Italian as a matter of fact even Indian.
Now I don’t want to go into detail with all that I ordered and describe it, I’ll attach images with this review and I’ll let the images talk for themselves albeit I’d like to describe a few dishes because those dishes deserve credit- to begin with I’d like to talk about the pizza, this was one of the finest pizzas I’ve ever had in Hyderabad, drizzled with a tad bit of olive oil and perfectly seasoned. 
Moving forward I’d like to talk about the mutabak, the chef had taken pedantic efforts to make this dish as authentic as it could get, I’d have to give him brownie points for his painstaking ability to make this dish, the omelet was perfectly cooked and not crisp like the replicas of mutabak that are available in other so called Mediterranean restaurants. The carbonara was  perfectly cooked, in the Italian way, the black pepper that stuck on each piece of pasta just showed how well versed the chef was with this recipe.
To summarize this I’d say yes this place is a must visit and I’d definitely recommend it for any formal or casual occasion be it birthdays or cooperate dinners, this place is the place to be !!",5,"2019-02-17 13:02:35",104,5123,4
"1167387","Amazing food. The way they serve it will make you even happier. Great presentation of food. Must visit if nearby. Also, not that pocket heavy for a fine dine.",4.5,"2019-02-14 23:23:51",13,67,0
"32884207","Ambience- very sophisticated.
Food - in terms of variety its great. We had continental. Pastas, Pizza are to die for. Fish and chips were just ok, nothing so great.
Desert- cheesecake is a treat.
And frozen alaska was pretty bad. 1 less star only for that. ",4,"2019-02-14 22:57:29",8,8,0
"2392262","I love clean and well lighted restaurants, Jonathan's Kitchen is certainly one of them Soft music, nice and clean seating arrangement appeals you to have a good meal there. I ordered Minestrone alla genovese soup, Thai Green Veg Curry, Agnolotti Pasta and Chocolate Fondant Cake. All were delicious and really lives upto your expectations. I expected the Chocolate Fondant Cake to be bit warm, but it wasn't. Food is amazing.",5,"2019-02-14 18:46:29",8,55,0
"348821","Got food poison after eating quesadilla yesterday(12/2). Had to admit in hospital for a day had to spend 4k INR. Will never recommend this to anyone.",1,"2019-02-13 20:12:52",9,1,0
"59186704","Went for a Sunday Brunch with family. The spread is absolutely massive, though veg options were limited, especially Starters. However, the food itself is lip smacking good, no matter what we tried. The staff was courteous, and always available to assist. Ambience was nice, though the live music was a little too loud, for our liking.",4,"2019-02-10 16:48:07",4,5,0
