"UserId","Review Text","Rating","Time","Reviews Count","Followers Count","Photos Count"
"4502511","Situated inside the Oakwood Residency in Financial District, Gachibowli is this swanky and high end restaurant catering to early morning buffs who would aim at getting the best quality breakfast spread at decent prices. 
The entrance is quite like the one of a 4 star hotel, there is bag checking and parking valet with musical lifts :D The moment I entered Oakleaf , I was way too excited to pick my area of grabbing and gulping as the spread was rather wide and sure enough any breakfast person cannot in this span of 2-4 hours gulp down two portions of each item. There was ham, pork, bacons, salami, sausages with all sorts of sauces and sorting. There was a good spread of flavoured yoghurts and dry fruits in small adorable jars. The breads were available in brown , white and miltigrain and there was Nutella and Peanut Butter along with jams of different flavours too. 
You could order parantha with curd or pancakes with your choice of syrup and the juices were just too fresh and pulpy. Tea or coffee or a different flavour juice would be served to you on your table at the drop of a hat. The presentation is amazing and so is the hospitality. The cost of buffet is quite reasonable and they would also offer corporate discount which is bonus.
The food was sumptuous and delectable and I was filled to the brim of my appetite so much so that along with my group, we decided to sit there for a while in the outside seating to just bake in the sun and feel a tad dizzy with relaxation and slumber. After all, I truly believe that good food does get the best of you and hit your high in a way nicer than alcohol. Overall, management deserves an applause for staff and service and the waiting at tables. DEFINITELY A MUST GO !!
P.S. Not many photos exist in this review as the buffet spread was removed before I could get myself to part myself away from my plate and palate. Kindly get back to the pictures in other reviews, or better so, visit yourself !!",5,"2017-11-21 03:47:25",77,669,3
"33855775","Thanks for spoiling my evening we been there for team dinner and coming to starter there was only 1 chicken starter for which we need to wait as beggers and it was cooked only 5percrnt and balance we might need to eat raw live chicken and coming to buffet this idiots should learn to cook some tasty food from at least road side food vendors and there was mutton puloa which was half cut 2 rupee kilo rice with coating of only red chilli powder and with mutton bore gravy.Now it's time 3:38AM still ma unable to digested and my stomach was upset n m not able to sleep and shame on us for this kind of third grade hotels being in hyderabad",1,"2017-11-11 03:41:09",4,4,0
"1010244","I had a really bad pun ready for the title which goes. “When Oakleaf told us OK! Leave!” (oak leaf, ok leave) but then thankfully thought otherwise. Also, not many would understand my sarcasm. Moving on towards the main content of my article, Oakleaf. This side of the city has very few fine-dining places and it really is a matter of concern. We need more of such pretty looking, good food serving, apt for candle-light-dinner restaurants in this part of the city. Also, I loved the fact that unlike many other hotels, the restaurant is not situated next to the lobby or the entrance thereby reducing the hustle. The view from Oakleaf is beautiful, especially at night! I was floored totally as soon as I entered....Read full post on fifatra.in",4.5,"2017-10-12 15:12:48",NA,898,0
"30680036","Went there for a breakfast buffet.
It was a huge spread :-
Baked potatoes
Cream and corn(loved it)
Idli
Aloo bonda
Punugullu
Assorted breads,jam and butter(you can even toast your bread)
Chicken and bacon
Live counter-Dosa/pancake/paratha/egg(boiled or scrambled or an omelette )
Tea/coffee
Fresh juice
Cucumber,pickles,fruits and definitely
Cornflakes.
It was good. All the dishes were up to the mark. Went ahead with Gobi paratha and it was a delight :)
Most likely will visit next time for lunch buffet.",4,"2017-10-08 08:34:07",5,29,0
"3589451","#InvitedByManagement #feedmehyderabad
Oakleaf, the all-day dining restaurant at @oakwood.residence.kapil.hyd launches its all-new menu and a brilliant one at that. Was there recently and I had a blast! Dahi ke kebab, Crispy corn, Thai curry, Masala naan, kulcha and the desserts were brilliant. Malai Kofta and Lasagne, not quite! Full marks for food presentation though!instagram.com",4,"2017-09-24 10:00:03",279,1947,30
"7406441","Came to this place with the Team Mates for the fare well lunch of our Team. It is located in Nanakramuguda. Has a prime location with all the Multi Nationals surrounding it. More of a buffet place with main importance on Residence services. Has a really nice pool. Ambience is great. The staff is courteous and very professional. 
Coming to the food, the Chicken starter was good. Along with the Steamed fish. They also have very well cooked Cantonese styled Veggies. Really liked it. The Bread along with the cheese and butter was very good. 
In desserts the blueberry Panna Cotta was good. 
One bad thing that turned me off was that I found a strand of hair in the Mutton Pulav.
Overall Okay.",3.5,"2017-09-12 22:07:50",194,2048,4
"125889","If you bored of routine regional dishes, then please visit Oakleaf buffet for continental flavor. We group of 10 been here for a dinner buffet last week and the buffet is large spread  with approx 70 dishes. Soups to salads, Startes to main course, Cakes to desserts everything tastes good in pure n fresh continental style. Crispy fish, Chicke  tikka, Mexican salads, veg pulao, Chicken biryani, pasta all well cooked and tasty. Excellent ambiance and serve to plate being buffet also looks good. Overall much recommended place.",4,"2017-09-12 20:31:58",70,529,0
"324556","Wouldn't write a lot about this place, because I personally won't want to go to fancy restaurants for lunch or dinner! I was taken there by an MD of an IT firm and he said the food was good!
I trusted his feelings about this place and agreed for lunch. This place is good, so was the food... but honestly, I recommend this place for meeting-over-lunch. Made me feel quite formal and wasn't comfortable eating just anything out there. I had to keep looking at the food for quite some time and pick one to eat! Maybe my bad..
I won't argue on how others feel about this place and food, bcz this is just my opinion. Could be good for you!
Happy eating!!",3,"2017-04-04 10:26:34",40,296,0
"32983102","Amazing hospitality and service . Excellent amenities. Very clean and Comfortable..Breakfast buffet was extremely superb. Their most commendable dishes from breakfast platter are pancakes, waffles, sausages and extensive south Indian dishes ",5,"2017-03-27 22:52:33",2,2,0
"849785","been here yesterday night for a buffet, The items were okayish in number but sad part the starters aren't present in the buffet counters they serve separately they started giving the starters after 20 or 25 mins of starting buffet it should not be that way.
The mutton curry was spoiled we showed him he says spices are different so ya i should accept without knowing spices i ate :P that's a crap the mutton was spoiled.
The service was terribly bad overall a hopeless place for food or service and it was to over pricy not even worth trying , cost around 850 or so per person but the city has a lot  of better places for buffet .Strictly skip it.",1,"2016-10-18 23:37:54",1031,1653,0
"34476397","I had to reach here with my colleagues for a lunch buffet which was a good.
But unfortunately we couldn't find many dishes here which are very common in others. We were served with 2 Veg and 2 NonVeg starters which are good. But the Main course which we had is not upto the mark as it was not hot. We were able to find only 1 chicken-biryani in the main course and 1 Veg pulav in the Veg. I prefer not to go if you like to have more starters stuff... :)",3,"2016-09-26 10:24:00",5,8,0
"35976042","Food provided by chef Rahul was awesome, nice ambience, excellent service.Buffet spread for lunch was good, Appreciate the great work done. 
Great job done.",4.5,"2016-09-14 15:45:08",1,0,0
"1668474","Excellent is an understatement.
Ambience is extremely pleasant. Service is just perfect. Be it the waitressing or cleaning.
We had a nice pleasant buffet and the only drawback I saw in the buffet was that there was just one veg curry and four non veg and being a vegetarian I was highly disappointed. But since we were quite pleasantly seated and enjoyed our meal with our infant I would still go and give 4.5 ..
Feedback about the veg curry as well was taken in an appropriate fashion ..",4.5,"2016-09-08 20:35:34",28,72,0
"473083","Have been to Oakleaf for team lunch. 
Ambience 4.5
Food 4.0
Serving 4.0
Starters were good and tasty and we asked to serve again n again til they are finished.  Dishes were very few and are very good.
Its a very big hands down to Vegetarians, since there were very limited items including curries, rice & Desserts as well. 
Whatever time you enter lunch closes by 3'0 clock, be planned to be there on time
Overall its a nice experience",4,"2016-08-24 15:32:59",30,69,0
"14541441","Whenever I feel like going outside and having 'good' food,  I try Oakleaf. This place remains open for 24 hours.  My picks from this place are the Tom Yum chicken soup,  beef burger and/or Chicken Ceaser Burger. Price is a bit on the higher side but the food is damn good. They make good pastas,  too. ",4,"2016-08-05 10:15:03",685,792,0
"1384719","Tried both the buffet and the ala carte here. Have to say the ala carte is hands down the better and more value for money option.
Try out the pepper mushrooms for sure - lip smacking good. The nachos were different too - they were completely indianized and tasting good. The pasta was something similar - was tasting a little indian but again in a good way.  On the drinks side my friends liked Rum Rickey out of all the cocktails.
In the buffet - the selection is limited and served to table. But they have a wide variety of salads and cheese to make up for the limited starter section.
They have a live pasta counter and the main course is a decent spread. The desserts again is limited but overall taste of all the dishes were good.",4,"2016-07-20 08:33:10",31,49,0
"11939621","Oakleaf is multi-cuisine restaurant sited amidst the famous Oakwood Residence Kapil Towers at Gachibowli. It’s already been a year since it started and has managed to garner attention mainly because it is located around the IT sector. 
The restaurant serves various cuisines like Continental, Italian, Asian and the likes. I must say the food is pretty much decent and a few definitely stand out. The interiors are beautifully done and I personally loved the paintings that were hung up on the walls. There’s an outdoor seating area as well that overlooks the entire Gachibowli area and would certainly make for a pleasant evening along with a cuppa coffee or chai!
I was invited for a bloggers table last week to try their buffet spread. We were seated along with their Executive Chef Brijesh Kumar who filled us in with all the details on the buffet. It’s always a pleasure to have a chef come and explain all about the food and works behind it.
We were first served the Mushroom Cappuccino which apparently is the chef’s signature dish and it was warm and welcoming. Also tried the Blue Bangle mocktail that was bang on taste wise making it thoroughly refreshing!
Next came up the starters which I must mention were a little disappointing, considering starters usually are the ones that taste best compared to the main course in various restaurants. But here it was the other way around! Main course was way better.
Bharwaan Mushroom Ka Kebab was just an average dish that had the mushroom stuffed with cheese and a few spices.
Prawns Fritters are usually everyone’s favorite kinda food because who doesn’t like deep fried food!? But unfortunately the prawns here were way too salty and the batter was very thick which turned it into an unpleasant experience.
Stir Fried Lamb was decent as the lamb was tender and the veggies served along with it in an Asian sauce were just fine. The taste overall was mild and not too strong.
Teriyako Chicken Skewers tasted fabulous! The chicken was tossed in teriyaki sauce which made the chicken taste divine. Certainly a good dish.
Dalcha Gosht is known to be a famous hyderabadi dish and I have literally grown up hogging on this one! The mutton was soft n tender immersed in the delicious dal which went well with plain white rice.
Gongura Mamsam was tangy and the mutton again was tender and wonderful. It was served along with a few rotis/parathas.
Gaeng kiow wahn is a Thai red curry that’s vegetarian. Curries made in coconut gravy are always tempting and delightful and so was this one that was served with plain white rice.
Dum Ka Murgh at first I thought was haleem, because the colour and the fried onions garnished on top looked very similar! I would call this the star of the show for it’s “oh so deliciousness!” the spices and the gravy along with the succulent chicken was to die for. I can definitely go back there just for this one dish! I personally haven’t tasted such flavorful dum ka murg in quite some time. Full marks for this one!
Grilled Polenta with wild mushroom Fricassee is a continental dish that’s made from polenta served along with rich mushroom sauce. An absolute delight!
After the heartwarming main course it was time for deserts. I would say it was nothing extra ordinary but the usual pastries and the likes. I liked the Kiwi Delight and the rest weren’t much to talk about. It would be nice if they could work on the desert section a little more.
Overall paying around 650 per person is a pretty good option for it’s variety in the buffet spread, quick service and aesthetically designed interiors.",3.5,"2016-07-15 01:17:21",34,154,0
"10186131","Oakleaf, The all-day dinning restaurant which has specialty in North Indian, Continental, Italian food at Oakwood Residence – Kapil Tower had made a name by serving delectable cuisine.  I was invited over a Blogger Tables to experience buffet and few signature dishes of Chef Brijesh. Buffet which is priced at 580 + Taxes offers Continental, Pan Asia cuisine and famous local dishes....Read full post on foodiexp.wordpress.com",4,"2016-07-14 16:21:32",NA,1513,0
"10186131","#FoodieXP #ByInvite #Blogger #Preview #Launch
Oakleaf, The all-day dinning restaurant which has specialty in North Indian, Continental, Italian food at Oakwood Residence - Kapil Tower had made a name by serving delectable cuisine.  I was invited over a blogger tables to experience buffet and few signature dishes of Chef Brijesh.  
The classy ambience and well trained staff draw my attention as soon as I entered. I like Oakleaf’s stylish interior which shows class of restaurant. 
The newly open bar has pretty decent option in cocktail and mocktail section.  We tried Tae Off and Blue Bangle which was refreshing drink to start with. 
In Soup section, Chef’s choice was Mushroom Cappucino. The garlic flavoured mushroom soup with creamy froth won my heart in one sip and I acknowledge by saying “WOW” to chef Brijesh. The perfect blend of ingredient and mildness of rosemary sprinkled on cappuccino was simply one of the best soup I have tried in recent time.  The signature dish of chef and FoodieXP’s recommendation. 
Bharawan mushroom ke kebab which has stuffing of cheese with indian spices and cooked in tandoor was good. Teriyako Chicken Skewers was next dish which has meritnation of Teriyako sauce on chicken was bang on the taste.  Prawns Fritters was little bit salty and bit thick coating didn’t impress me much. Stir fried lamb was also served which my foodie friends liked. 
Char kway teow, a popular Malaysia Singapore dish which was made with flat rice noddle with bunch of sea food proportion was not up to the mark and lacks perfection. 
Grilled polenta with wild mushroom fricassee was really show stopper. The polenta and mushroom base sauce was simply outstanding. This dish was something new for me and it impress me with its flavours. Grilled polenta with wild mushroom fricassee is FoodieXP’s recommendation.
Well know Thai dish Gaeng kiow wahn (Thai Veg Red Curry)  with steam rice was awesome combination.  The balance of spices with coconut milk and cream was outstanding. 
Dum Kar Murgh – Chicken marinated in a host of spices and slow cooked on a dum was delicious.  Famous Hyderabadi dish “Dalcha ghost” and famous Andhra speciality “Gongura mamsam” was favourites among lamb and mutton lovers. 
I took glance of Buffet which include Pan Asia and continental dishes and decided to pick up few dishes from Buffet.
A glass of Mint Lagoon was refreshing drink and defiantly a decent welcome drink.
In buffet there were 6+ options in salad section. That includes Greek Salad , Tossed Basa Fish Salad , Chicken Coleslaw Salad , Sliced Egg with mustered dressing and Pasta Salad. Each salad justify it’s ingredient and give distinguish experience. I really like variation in this section , flavours and freshness.  Yes…I am salad lovers and was happy to see variety and options. 
I liked Dahi Bhala and Chana Sev Chaat gives that typical indian tangy chaat taste. 
In Main Course there were good amount of options and I decide tried Vegetable in Hot Garlic Sauce , Barbeque Tossed Cottage Cheese ,Paneer Labbadar, Vegetable Korma, Fish in Black Bean Sauce ,Rosted Chicken with Rosemary Sauce, Curried Spice Grilled Fish…honesty speaking all dishes were perfect but few outstanding were Paneer Labbadar , Rosted Chicken with Rosemary and Grilled Fish.  Just loves these three dishes.  I skip Chicken Biryani as I wanted to keep some room for dessert. 
Check Exclusive Video of few dishes @ my Blog.
Buffet’s dessert section offers single serving size 6+ desserts.Kiwi Delight, Applie Pie and Mocha Pastry standout in Buffet’s dessert section.
Buffet which is priced at 580 + Taxes offers Continental, Pan Asia cuisine and famous local dishes. I was really satisfied with quality, taste and variety it offers and highly recommend it. 
Follow FoodieXP on FB - FB/FoodieXP to stay connected 
Rating –
Staff – 4/5
Service – 4/5
Food – 4/5
Value for Money – 4/5
Dining Experience – 4/5
( 5 Highest , 1 Lowest )
Bon Appetite !!!
Disclaimer: I was invited by restaurant for the event. The opinion on food is unbiased and honest.
Stay Connected with FoodieXP:
FoodieXP - FB.com\FoodieXP | Instagram - bfoodiexp | Zomato - FoodieXP | Twitter – bFoodieXPfoodiexp.wordpress.com",4,"2016-07-13 22:12:21",170,1513,0
"221477","Oakleaf a specialty multi cuisine restaurant in house of Oakwood Residence - Kapil Towers has made a name for itself within just one year of its inception serving international gourmet classics, Asian favorites, and a variety of healthy options and of course offering Hyderabad classics. Open for buffet breakfast and lunch , the place of course has garnished quite a name thanks to the ever demanding IT corporate crowds when it comes to food experiments....Read full post on karthikgandhi.wix.com",4,"2016-07-11 14:34:19",NA,1687,39
"35115174","Been to this place couple of times while staying at Oakwood's. The place has breakfast buffet and lunch. The breakfast buffet has wide spread of cuisines with Indian, south Indian, and continental dishes. They have live sausage counter. I personally liked their idli sambar and flavoured yoghurt in breakfast. But their omlette and other dishes are bit bland. For dinner I had tried following dishes:
Cury pata chicken tikka
Paneer tikka
Daal
Chole
Noodles
Biryani
Their curry pata chicken tikka and biryani are good to have but rest of food is below average.
But their staff is very courteous and polite. The best thing about oakleaf",3,"2016-07-06 21:00:26",175,452,0
"6408191","This is a fine dine restaurant with elegant ambience. The food is delicious but the best thing is the service. The staff is amazing, attentive, courteous, polite and efficient. They have valet parking. They have all the cuisines available but they are experts in South Indian and Chinese.",4,"2016-06-26 23:48:49",95,201,17
"30061142","After reading a lot in zomato decided for a dinner buffet. Totally over hyped and not really worth a visit. The rating i gave is only for valet parking. Nothing great about food, out of all they swiped my card twice and got deducted twice. Still Waiting for my money to revert to my card. 
VFM 2/5 because of desserts ",2,"2016-06-24 14:03:56",15,377,0
"10186131","Hyderabad,The City of Pearls, is defined by its cultural & culinary exuberance. The grandeur of this city is echoed in its rich heritage monuments. A year ago Oakwood Residence Kapil Hyderabad started spacious & well-appointed 158 apartments that is first internationally managed serviced residence in Hitec city & Gachibowli area....Read full post on foodiexp.wordpress.com",4,"2016-06-25 20:29:35",NA,1513,40
"34815406","The mark of a good restaurant is not necessarily its size, but the quality of its food and the generosity of its staff.
I had my boss visiting me and i was keen on taking her to fine dining. OakLeaf was one place on the list as i did hear about it being a great example of good food and a good hotel.
We started with drinks and talk of the town dishes such as Chilli Wok Fish, Paneer tikka and Chicken 65. They were all great, tasted fresh and surprisingly not blant at all! For main course we kept it simple by ordering a white sauce pasta and chicken schezwan noodles. I did not get a chance to taste the noodles but the pasta was delicious!! Not just food being the main attraction, there were other factors too that greatly influenced our dining experience one of which was the staff being attentive and asking us if we were having a good time there. I know ill certainly be returning soon :)",5,"2016-06-12 13:09:41",12,58,0
"10186131","Hyderabad, The City of Pearls, is defined by its cultural & culinary exuberance. The grandeur of this city is echoed in its rich heritage monuments. A year ago Oakwood Residence Kapil Hyderabad started spacious & well-appointed 158 apartments that is first internationally managed serviced residence in Hitec city & Gachibowli area.
Oakwood Residence Kapil Hyderabad was celebrating its First Anniversary in grand style. A invite to wine Enthusiast and Food Writer to an exquisite wine and evening which featuring the work of renowned artist Rangoli Garg, based on the theme ‘LAADLI’.
Check Exclusive Video of all Painting showcase during the event  at my Blog.
Oakleaf which has specialty in North Indian, Continental, Italian food at Oakwood Residence Kapil Hyderabad in a year time had made a name by serving delectable cuisine. Chef Brijesh Kumar had very thought cocktail dinner designed for First Anniversary Event.
The bartender serves Cocktails , mocktails , sophisticated red and white wines. The Bar section has lots of variety and I observer that bartender makes all popular and signature drinks with perfection with any effort. Guest enjoyed drinks by keeping bartender busy in serving variety of cocktails and mocktails during the event.Beverages are incomplete without great starters, prawns and tandoori chicken was made with perfection and Veg Manchurian was favourite among us.
The salad section has tons of variety which includes Indian and few international dishes. The standout salad was “Salad Caprese” and “Sea Food Salad”. Cheese Board with Nuts was another popular dish.
I must say Main Course was delicious and all dishes were made with perfection. In veg section, Vegetable Thai Curry and Lagan Ke Paneer was show stopper and in non veg section,Herb Gratinated Fish Steak, Butter Chicken and Shepherd Pie was simply lip smashing. Herb Gratinated Fish Steak wins the show stopper spot with narrow margin to Butter Chicken and Shepherd Pie. Potato Gnocchi with cheese Mushroom Fondue was another favourite among many foody friends.
I give full credit to Chef Brijesh Kumar for his expertise in North Indian, Continental and Italian cuisine. 
Desert section covers Sandesh, Kalikanda Khaja, Nutty Bar, Kurbani ka Mitta,Jambun , Brownee.The Kolkata special Sandesh was awesome and a bangaoli foody friend liked it a lot. Nutty Bar , Jambun and brownie was perfect for my sweet tooth.
My Food Experience was awesome and I highly recommend Oakleaf for its Bar and Food specially North Indian, Continental and Italian cuisine. 
Chef and Management talked about future plan and event which ensure that guest will get chance to taste verity and great cuisine in coming months. Stay Tune for further update.
Knowing fellow foodie friend Vishal ,Pallab and Sabyasachi Ray  was icing on the cake…It was my pleasure to meet you guys.
Rating –
Staff – 4/5
Service – 4/5
Food – 4/5
Value for Money – 4/5
Dining Experience – 4/5
( 5 Highest , 1 Lowest )
Bon Appetite !!!
About  - Rangoli Garg Art Event - ‘LAADLI’
“Laadli is a shy, attractive, doe-eyed Indian girl who dreams of an era of completeness for herself. The artist is mesmerised by the Indian marvel Taj Mahal, which become home of ‘Laadli’ in her paintings. The doors, arches, pillars, doors and motifs of the Taj Mahal ornate the background of the painting. ‘Laadli’ plays and hides in her beautiful home as her potentials wait to be fully sought. She lurks behind the pillars and doors as her shyness ornaments her entire existence.”
more detail on my Blog
.....Read full post on bhaveshrana.wordpress.com",4,"2016-06-09 12:22:21",NA,1513,11
