"UserId","Review Text","Rating","Time","Reviews Count","Followers Count","Photos Count"
"51636757","Good place and wonderful ambience staff was very qujck and all are aware of zomato gold so no issue about that but pulav which we order was little bit dry!! ",5,"2019-02-16 21:16:09",2,55,0
"30730348","Food: Extremely spicy. Noodles were made in Andhra style, were very spicy and had whole red chillies in it. There was hair in chicken.
Service: Bad, takes forever to bring food.",2,"2019-02-15 21:49:40",44,33,0
"10462161","This place is very crowded on weekdays. They have authentic Andhra food. My favourite is pot pours kodi vepudu. I had thrice and every time I get great taste. Pulavs are also so tasty here. Must try place ",4,"2019-02-15 18:43:46",52,164,0
"55712132","Good to check in there
The dishes are best to there theme.
Which they have the best of cuisine for there variant of selection. Have a good team lunch.
Cheers team ",5,"2019-02-13 09:51:44",2,1,0
"85053163","I ordered for curd rice, really very very good and lip smacking. The food is hygienic. Maintain the same quality. All the very best. I m marking this as one of my fav place.",5,"2019-02-12 23:00:32",3,0,0
"40129130","Starters are very good. We went for normal eating not for buffet. We ordered Andhra dishes. Kaju kodi and Pot Pouri Kodi starters are spicy and tasty. Pandumirchi kodi pulav is good. The quality and quantity is real good. Ambience is also awesome. But AC is little less. Definitely worth for re-visit. ",5,"2019-02-12 17:56:09",17,5,0
"1375466","I and my partner had visited this place during their Valentine's Day Romantic Candle light dinner. This place has a great ambiance and is low lit with lovely candles. Ask for waiter 'Pappu', he did a great job by recommending us some authentic Andhra style dishes which were ideal and he makes us taste b4 serving to check if everything is ok which is commendable. We ordered Pot Pourri Kodi Vepudu , Pandumirchi Kodi Pulav nd Khubani ka mitta with Vanilla ice cream someone who has a sweet tooth should try this dessert which is a perfect marraige of great tastes.",5,"2019-02-12 09:19:04",14,4,0
"51563107","i visited this place last friday with my friends and we had ala carte. I don’t want to give any rating the service was very poor and slow there main focus was people having buffet. After waiting for 25 mins and lot of reminders we got our food. When the bill came they have added additional items which we didn’t had cost around 600 to the bill and my friends bad she didn’t checked the bill that time. So after this horrible experience i will suggest not to visit and id you are visting and having ala carte please cross check the bill before paying otherwise you can be the next victims of this thugs restaurant. ",1,"2019-02-11 18:36:00",1,5,0
"73328891","Quality was excellent 
Ambience was good 
Great service by pappu
Chicken lollipops was good
Chicken fry pulav was not up to mark
Dessert was really delicious 
One should try it",5,"2019-02-10 15:50:40",10,0,0
"56921886","This is a very good place. I am fond of patiala chicken here. Ambiance is very good and service is OK. One can try this place once. Location is also good.",4,"2019-02-09 01:59:09",10,11,0
"62514900","Good portion sizes, quite tasty food, super quick service and got the right mix of cuisines in the menu. Everything just about right for your tum!",5,"2019-02-08 01:30:02",10,4,0
"64551159","The worst experience that I had along with friends. The starters are good but the main course is completely tasteless. Even after informing the management about the taste, they were asking if salt or spice is more, but not about the overall quality & taste about the food. Very much disappointed that I took my friends for a treat here. ",1,"2019-02-07 23:36:11",1,0,0
"58439706","Well, this restaurant looked really appealing and we wanted to try it very badly! So we ordered a lot. Veg and non veg dishes. The best was were the chinese starters. Honey chilli potato was amazing. The shangai veg was also good. Non veg starters were not that great though. And we ordered naan and kadai paneer. There was absolutely no salt and the paneer was really hard. Biriyani was really good and the schezuan rice not good either. I think they added coconut oil to it. I'm really not a big fan of coconut oil. Can visit once.
Ambience : 3.5
Food : 3
Service : 4
Cleanliness :4.5 ",3,"2019-02-05 16:37:28",42,53,3
"52046526","Worst biryani and worst serving experience ... Except 3 starters remaining items are very bad... Totally worth less food and time waste .. disappointed ",1,"2019-02-04 22:22:47",1,9,0
"52581434","This place has nice ambience and is very clean and hygienic.
Wat was good?
- chicken+kaju starter
- babycorn munchuria
What i didn't like:
- The chicken biryani was not upto the mark, the taste could definitely improve.
The staff was very polite and quick to respond..!! I appreciate their behavior. ",4,"2019-02-03 22:07:30",10,5,0
"36525228","Very tasty food with reasonable price and great service ,drinks also available very nice place to spend some time to your friends and families with lavish dishes ",4,"2019-02-02 17:35:31",4,1,0
"45449710","Its a good place to hangout with friends. The building itself seems busy everyday. Crowded place. Food was tasty . Worth the money. Service was too good 
Will visit again",4,"2019-01-31 23:44:32",88,201,0
"35619104","The ambience was good .
I would expect a faster service and the the staff should be attentive to customers rather than to themselves.
I would be a 2 star to the staff 
Food is good not that great",4,"2019-01-30 20:29:41",19,31,0
"71450226","I thought of giving ZERO, but there is no option instead I am giving it as 1. Very worst restaurant i ever visited for Buffet. 
If anybody is planning to go for it especially for Non-Veg, I suggest please dont waste your money.
No.of varieties and even the taste is very bad. Coming to the service NO WORDS. They will make us to go for Main Course even though we are not done with starters.",1,"2019-01-30 15:32:10",3,0,0
"32816775","Non veg is worst. Ambience and service is also worst. Taste is bland. You can easily avoid this restaurant. They take so much time to serve food and even they are not polite",1,"2019-01-30 15:19:05",1,0,0
"2196718","Food: 3.5/5
We have ordered
veg manchow soup- it's GOOD
Panner majestic - it was more sour and tangy in taste.
Nijam handi recommended by waiter- it was okay
Panner kulcha - its more salty may be because of butter
Kothimeera butter roti - this one is good and light.
Ambiance:3/5 is alright.
Service :5/5 it was GOOOODD (papu served us)",3,"2019-01-28 21:40:20",7,33,0
"35794921","Great place to have a good dining experience. Had breakfast and dinner here. Food was awesome and was surprised to provide us complimentary breakfast for all the customers on that particular day.",5,"2019-01-28 17:37:45",8,25,0
"36972654","One can try the buffet and the best thing I can experience here is the kodi pulav ..which tastes very good and also in deserve one can try gajar halwa ",4,"2019-01-27 23:47:22",22,4,0
"32113144","Excellent taste and awesome food. Chicken tikka was perfect in all the ways. Its good for veg and non veg food. Places is nice with good ambience. ",5,"2019-01-26 22:20:13",9,64,0
"34643668","One of the best restaurant to visit and have freaky chat with friends.Good ambiance and good place for corporate team lunch.Very well established place to dine in.",4,"2019-01-26 14:23:52",5,12,0
"50529300","The food was very good. Also, the service provided by one of the waiters Papu was really really nice. He is very kind and polite. Keep up the good work young boy!!!!",5,"2019-01-25 11:38:13",7,10,0
"15251191","Very good restaurant. Food tastes good and spicy. Disappointing thing is buffet cost has been increased. Ambience is little bit conjusted on fridays.",4,"2019-01-25 10:03:25",5,21,0
"39975834","The service was lovely.
The food I ordered were:
Chilly prawns,
Butter naan,
Mutton Rogan Josh
All the items were good, but mutton Rogan Josh was kind of very heavy and buttery. So that can be improved.
Overall experience: very good",4,"2019-01-24 13:15:23",42,49,3
"31120147","Nice place with decent interior and delicious food.
It's a hygenic place and the food is made of quality ingredients.
I like chicken biryani and crispy corn here.
If you want to try, they have some spicy options too. But be prepared, I eat a lot of spicy food, even I got tears.",4,"2019-01-23 17:15:48",12,1,0
"60003209","We went for dinner based on this 4.0 rating it did not meet bare minimum criteria. Food was over spicey/hot even after mentioning the spice levels in first course. Service was very bad. They asked how the soup/paya was and when we mentioned that it is too spicey , that was not bothered and next course was even more spicey/hot. I generally am ok with hot/spicey food but this is very extreme. I would not recommend going to this place.",1,"2019-01-22 23:27:02",1,0,0
"5535511","I personally a lazy person who don’t give a regular review but my taste buds made me to write this review. The only thing that worth was ambience. ",1,"2019-01-22 15:19:03",1,52,0
"50131438","Ambience and service is good. Locality of the restaurant is good. But taste of the food is not up to the mark. Can make it more better. Should improve the taste of their signature dishes",3,"2019-01-22 14:22:55",8,57,0
"47899696","Server(sushanth)is very friendly and polite. He suggests each and everything with patience.His service is also very good. Finally made this restaurant my regular place ",5,"2019-01-20 21:29:02",2,2,0
"37549445","We had been there for the lunch and the Food was Good but there were only few dishes in the buffet so unhappy with it.
Ambiance was Preety good. Needs to improve their service little",3,"2019-01-19 23:30:59",34,47,9
"41905998","Amazing place to have south Indian cuisine.
Good service, This restaurant offers ala arte and buffet both . we tried Natu kodi pulav and gongura mamsam
Both taste good, Good ambiance , good place to visit..",4,"2019-01-17 15:01:09",44,5204,0
"50960259","Our usual hangout place. Every time we think of eating out, we always end up at this place. Great staff, delicious food and calm ambience. Chicken drumsticks and Veg pulav are a must try. ",5,"2019-01-14 16:43:10",10,1,0
"64411030","I was there with my friends yesterday for dinner. We were served by Papu, he did great service. We ordered all south Indian dishes, each of them were tasty. ",4,"2019-01-11 10:37:03",4,2,0
"38621333","This place was in my bucket list since a very long time and my visit to this place is very random. I really liked the traditional ambience. The decor of the place is good. The service was very slow and the staff i felt were little confused.
So, pot pourri please look into that.
And about the food, we ordered Chilli egg, Pandumirchi royyala vepudu, Mamsam pulao, Nellore chepala pulusu with Tandoori naan. The quantity of the food was really good and the food was not different from home food.",3,"2019-01-10 17:51:14",75,172,9
"6233381","We were there with so much hunger. At a speed start we have ordered “Miriyala Natukodi vepudu” and “Mamsam Pulav”. Miriyala Natukodi vepudu was ok! But quantity was pretty good. Mamsam pulav was very good to taste and the spiciness was perfect and quantity was very high. I felt oil is high in both orderes.
Ambience was ok! And service was not so fast!",3,"2019-01-08 19:16:40",30,91,2
"2513752","It was a long due. Visited this place for dinner last month. And I must say we really enjoyed the food and the ambience. Perfect place to have some quality time with your family. Staff was courteous. Service was great. Food was tasty and so was the presentation. Overall a great experience.",4,"2019-01-08 18:53:54",20,82,0
"22193903","Very ordinary place - average taste, no dish really stood out - service was very slow as well on a Sunday night - I will give it a 2.5 star, there is so much scope for improvement.",2,"2019-01-08 10:18:21",12,41,0
"15723142","Liked the calm and soothing environment of this place. The food this restaurant serves is too delicious without much oil content. Good for family dining the calm and soothing environment of this place allow us to talk and discuss :)",4,"2019-01-08 01:03:11",20,72,1
