"UserId","Review Text","Rating","Time","Reviews Count","Followers Count","Photos Count"
"88856422","I ordered food at 7 pm, but the delivery guy gave low quality food without Santosh dhaba logo and even bill was at 06:35 pm...
Zomato is looting",1,"2019-04-10 21:08:58",1,0,0
"39067130","Delivery of food was good and taste of food is also good. But sometime they deliberately make your order late, I am taking about the restaurant",3,"2019-04-06 15:30:00",2,14,0
"37759558","I have ordered for kaju biryani through zomato but I received paneer biryani. The taste was good but quantity was very less and they have used excise of oil.",3,"2019-03-30 14:43:40",2,13,0
"32838639","Gobi  manchuri ordered was completely uncooked! Taste was ok quantity was ok but completely raw. Dal was good and worthy. Rice was very sufficient. Please check the food. I couldn’t eat yhe manchuri",2,"2019-03-17 20:36:37",7,11,0
"64920395","Ordered Mix Veg and Tandoori roti twice in a gap of 10 days, first time it was awesome food forcing us to repeat the order. Second time it was real disaster. Terrible food, burnt roti and not so good subzi as well. ",1,"2019-03-13 06:31:39",1,0,1
"46602776","mushroom was not well fried",3,"2019-03-10 13:43:43",8,0,0
"58609747","Biiyani which you was deliveyed was worst. Till the date i haven't eat this kind of biiyani. Worst taste. I can't even eat it. I kept the biiyani in the dust bin. And also i have order kaju biiyani, and i did not get even 5 kaju  pieces also.....................................................",1,"2019-03-09 21:42:11",1,0,0
"38297183","Worst food in Hyderabad. Very low quality and old stock food they serve. They are serving old stock food items after that not accepting their fault at all. Very rude behavior. ",1,"2019-03-04 22:55:29",2,1,0
"1144782","No salt in food",1,"2019-02-24 20:19:31",3,1,0
"50419243","Guys to be very frank the foods not good and the oil they used for cooking is not health eventhougj we can smell it in food ....wrost experience",1,"2019-02-16 01:08:51",1,30,0
"46602776","good test",5,"2019-02-14 12:42:14",8,0,0
"71768650","verry bad food.i am ordered hyderabadi specail birayani. and quantity also verry less and onions and lemons also not given.dont waste your money.",1,"2019-02-12 23:14:09",1,0,0
"38716666","I always prefer this restaurant for veg , since its near to my room as well test ia good and reasonable also....
But if you are looking for good interior then this is not for you .. ",4,"2019-02-11 00:07:50",17,9,0
"51016159","not good ..",1,"2019-02-10 17:30:38",2,1,0
"52391269","very poor quality",1,"2019-02-08 22:45:47",5,1,0
"64824961","Worst Taste, Late Delivery, Taste is Bad, Not Cooked Properly, I wont recommend this to any one, Zomoto guys you please look at this as we have Ordered through your Platform only",1,"2019-02-02 15:39:39",1,1,0
"53174944","taste is not good,  ",2,"2019-01-11 21:13:02",2,2,0
"51026717","I have ordered twice from zomato. I don't know why they are so obsessed with oil. I found half of the container comes filled with oil only. I bet you can't chew their chapatis if you have teeth strong enough to break stones. Really bad quality food for health... They will surve just oil.. this oil I have removed from dal.. more than that came in paneer as well which I have ordered earlier few months back. ",1,"2019-01-10 18:11:11",6,1,0
"68626584","3rd class food providing..spoiled food came..seriously the food was pathetic...dont go any santosh dhaba..in my entire life I never had this much bad food.",1,"2019-01-05 21:37:37",1,0,0
"52100788","Ordered mushroom pander curry but received only mushroom curry, taste was ok but order was not up-to the mark, please ensure it is not repeated again as it loses the credibility. ",3,"2018-12-24 16:05:18",1,2,0
"1144782","Very bad rotis",3,"2018-12-09 08:40:00",3,1,0
"53551683","Food delivery is faster but food is not hot and not that tasty ",1,"2018-12-01 14:30:31",2,9,0
"53052500","Very very warest food wasted money don't order this restaurent quality is very low less than 20 % show Rich and delivery very poor quality don't ordered",1,"2018-11-23 23:38:00",1,1,0
"80613348","Food Quality Is worst. Literally vomitted all the food what I ate.....Too oily....we can’t eat...I don’t suggest this restaurant . Didnt expect this from santhosh dhaba branches.",1,"2018-11-11 00:04:49",1,0,0
"31987891","Did a big mistake by ordering from this restaurant when I had so many options to choose.
Worst panner biryani I ever had.
If you have no food better to be hungry than to eat food from here.",1,"2018-11-10 22:14:40",2,13,0
"31577284","Ordered paneer butter masala and naans.The curry had lot of food color and oil which is ok.But two naans weren't even equal to one naan in general...they were way too small",2,"2018-11-06 11:58:05",24,24,0
"72014938","Worst quality and in veg biryani there is no any vegetables and i never order in shree santosh daba waste restaurant and packing also very nirmal like road side packing",1,"2018-11-05 00:27:46",1,0,0
"52077480","A good pure vegetarian family restaurant. The taste of food is somewhat similar to North Indian food. Kashmiri Naan of this restaurant is the best according to me.",5,"2018-11-04 20:41:02",35,26,0
"59553260","yuck biryani",1,"2018-10-22 14:48:04",2,5,0
"54010973","Nice food",5,"2018-09-30 16:38:14",1,1,0
"57046003","Food quality is below average except kaju paneer curry which is average..
and I ordered extra onion and lemon..there is no onion and lemon in the pack.
Please make sure the food quality is good.",2,"2018-09-23 12:31:20",1,1,0
"52363825","i order the  food through zomato. wide O.No. 1286553601 its a combo one, waste of money. never ever go to this Shree Santosh Dhaba Family Restaurant. don't waste your money",1,"2018-09-21 16:33:22",5,1,0
"54689711","taste was awesome but..... quantity was very less",5,"2018-09-04 21:48:41",2,1,0
"31842615","Taste is good as usual. I ordered Full Kaju curry and they sent half which is pathetic.",1,"2018-08-30 00:04:03",4,45,0
"46630442","We ordered Aloo Jeera and some of the pieces tasted stale. it was like the old and new dishes were mixed . ",4,"2018-08-22 21:41:39",2,0,0
"52030629","i got a veg fried rice insted of kaju fried rice ..",1,"2018-08-17 13:22:50",2,28,0
"64998375","worst paneer Manchuria I ever ate till now....total money waste. this restaurant should be removed from Zomato.",1,"2018-08-16 23:13:58",1,0,0
"65260720","As always !",5,"2018-08-16 23:13:03",1,0,0
"49265291","order was not good ...was so late in delivering food ",1,"2018-08-11 14:32:17",1,1,0
"51791297","Delivery is Good on Time",5,"2018-08-10 13:12:04",3,1,0
"59756199","good",5,"2018-08-03 21:07:30",4,0,0
"61782104","food was delivered before time",4,"2018-07-31 01:14:58",1,0,0
"36769902","Kaju paneer masala is great :-)",4,"2018-07-30 15:28:58",10,1,0
"59581559","good",5,"2018-07-30 14:26:23",1,0,0
"55834402","Good",5,"2018-07-29 17:00:19",0,0,0
"32761475","food is not hot",3,"2018-07-29 14:44:22",0,0,0
"62786748","waste of my money ",1,"2018-07-28 23:56:43",2,1,0
"32966112","paneer too spicy. manchurian an naan were great",3,"2018-07-28 06:14:41",6,33,0
"51326696","okay",5,"2018-07-28 00:32:29",3,1,0
"53657171","naans are totally burned unable to eat.",1,"2018-07-27 22:52:21",0,1,0
"62654946","gud",5,"2018-07-27 22:18:55",0,0,0
"52361177","very good",5,"2018-07-27 22:14:08",0,1,0
"53203243","good",5,"2018-07-27 21:44:23",0,0,0
"57521268","Good",4,"2018-07-27 12:47:24",0,1,0
"49669339","good",5,"2018-07-26 22:03:06",1,1,0
"49669339","fine",3,"2018-07-25 21:15:33",1,1,0
"62344800","good",5,"2018-07-25 20:53:04",0,0,0
"51673241","very bad ",1,"2018-07-24 23:11:40",2,1,0
"54258054","Order not delivered ",1,"2018-07-24 20:20:25",2,1,0
"55009569","___",3,"2018-07-24 19:55:27",1,1,0
"53674995","rotis are not delivered hot..not satisfied with ordered.",2,"2018-07-24 15:06:01",1,0,0
"53851141","on time delivery",5,"2018-07-24 12:51:43",1,1,0
"59795138","Veg Biriyani was Okay..Not so good",4,"2018-07-24 00:40:32",5,0,0
"33520116","Only chilly, no taste...chilly paneer was watery n no taste in Paneer Chatpata",2,"2018-07-23 23:12:28",25,33,0
"32601206","A must try. Food is a bit spicy..",4,"2018-07-23 01:40:29",11,58,0
"36649844","nice",5,"2018-07-22 21:24:25",3,1,0
"59002294","good",3,"2018-07-22 19:12:02",3,2,0
"45652625","roti became little black",4,"2018-07-22 13:30:11",1,1,0
"54465228","Superb fast service...thank you...",5,"2018-07-21 19:58:33",1,1,0
"30901074","He came at right time and place. ",5,"2018-07-21 14:23:49",1,3,0
"54845606","good",4,"2018-07-20 20:31:26",2,0,0
"59000411","on time ",5,"2018-07-20 13:36:32",1,0,0
"52304757","naan is not gud....",2,"2018-07-19 22:55:38",2,0,0
"51752644",".",5,"2018-07-17 13:41:29",1,1,0
"51771657","Goos delivery ",5,"2018-07-16 22:06:38",4,1,0
"419300","I haven't received the order and money was paid.. worst service of both Santosh dhaba and Zomato",1,"2018-07-16 14:35:25",2,0,0
"40423022","good service",4,"2018-07-15 23:03:33",4,38,0
"58524058","excellent",5,"2018-07-15 20:23:37",1,0,0
"53535582","I have to wait for so much time",2,"2018-07-15 15:52:34",2,1,0
"32010559","Well the order firstly came way beyond it's time and didn't came what was ordered originally.",1,"2018-07-14 22:24:25",62,102,0
"54249186",".",5,"2018-07-14 21:52:29",1,1,0
"59116362","mast",5,"2018-07-12 22:56:26",1,0,0
"60356814","verry good",5,"2018-07-10 16:37:53",2,7,0
"53133024","The Santosh Dhaba is one of the reliable place for north Indian food. The food here is somewhat oily but it tastes delicious. Should visit it once ",4,"2018-07-10 14:14:47",9,3,0
"52433651","very good",5,"2018-07-09 19:42:09",1,1,0
"4191491","Butter milk is waste. ",2,"2018-07-09 14:52:46",3,1,0
"60228935","waste!",2,"2018-07-09 14:52:45",2,0,0
"55381477","half boiled rice more masala than rice",2,"2018-07-09 14:26:40",3,1,0
"55701978","ok",3,"2018-07-09 12:55:00",4,1,0
"52987544","food was very worst I don't like the food...I'm very dissatisfied with they biryani nd baby corn manchuria",1,"2018-07-09 07:30:48",1,0,0
"60072833","expected better....too much raw spices used....",3,"2018-07-08 15:14:00",1,0,0
"35700788","Ok",3,"2018-07-07 16:04:59",1,1,0
"37758887","Quantity is less. ",3,"2018-07-07 13:43:35",1,1,0
"31810010","the worst biryani I ate in my life is this one",1,"2018-07-07 12:39:16",2,1,0
"54408391","Food was not that bad but it took too much time to prepare the order by restaurant. I avoid this restaurant in future.",1,"2018-07-06 23:00:20",1,1,0
"36189289","worst food completely spoiledddd cannot eat wasted completely ",1,"2018-07-06 14:27:33",4,2,0
"44787100","offers are not good",2,"2018-07-06 13:59:51",2,1,0
"59353299","what the fuck...i did order 4 butter rotis and u sent 4 normal roti...and matar paneer was uneatable.
disappointed",1,"2018-07-04 22:19:33",1,0,0
"5526721","You will definitely enjoy the food here... 100%Veg Ratings: Food 3.5/5, Service 3.5/5, Ambiance 3.5/5, Biryani 3.5/5. 
Kaju Biryani is good. #CanTry",3,"2018-07-02 20:58:45",5,2,0
"54915826","Good",3,"2018-07-02 17:49:13",3,1,0
"31871966","worst quality.",1,"2018-07-01 22:38:41",2,1,0
"59205796","hopeless fellow's asked for Punjabi kofta and there is no kofta in it. 
ordered for Pepsi and they are sending sprite 
naan are smelling like any thing.
bull shit this guy's and Bull shit this zomato. 
which I won't use again ever. ",1,"2018-07-01 22:05:04",1,6,0
"31623112","some what taste with out proper packing no spoons to eat noodles ",2,"2018-07-01 19:24:40",3,0,0
"43720107","Good",5,"2018-07-01 14:51:27",3,6,0
"57917678","bakvas paneer butter masala smell ..not fresh veg",1,"2018-07-01 12:45:17",1,0,0
