"UserId","Review Text","Rating","Time","Reviews Count","Followers Count","Photos Count"
"45331219","I have ordered panner paratha from with black beauty juice. Food was decent and delivered in time. 
Juice was unique. Menu looks very exciting, would definitely order again #FoodLover",4,"2019-01-19 12:41:57",12,31,0
"81268593","I tried Palak Chicken with Lachha Paratha 2 days back. This was the first time, when I tried this dish and I must say, I really loved it!! Taste of Palak with Chicken was jusss Yummm. Lachha Paratha was cooked nicely.",5,"2019-01-18 10:05:59",11,5,0
"1848408","I had ordered a portion of butter chicken with laccha paratha from this place a few days back and they make some really yummy butter chicken. Must try once at least ",5,"2019-01-16 14:27:47",37,134,0
"49825233","Best place to get delhi's hot selling items here,
There isn't a wide menu but optimum,
Chatpata chhola with jeera rice is good and spicy too,
Packaging and quotes on it are very creative.",5,"2019-01-16 12:57:08",15,2,0
"67712851","I ordered paneer parathas. They are so small that 3 prathas are equal to one. Filling is equal to zero. Wastage of money for me. Worst experience. Even dont get butter. ",1,"2019-01-11 22:35:47",1,0,0
"85604575","Ordered Purani dilli ki thali from here and the food was brilliant. As the name suggest it had taste of dilli. Being north Indian food lover i just love the taste. They served it well  and the packaging was superb.",5,"2019-01-02 16:44:47",17,30,0
"78590682","Ordered shahi paneer and laccha parantha from here and the food was awesome. It was served hot and fresh.Delivery was on time and packaging was superb.
Love it!",5,"2019-01-02 14:52:01",3,1,0
"31550424","Ordered the thalis. Delivery was late but the food was delivered hot and i would want you guys not to repeat this. I loved the taste.thank you ",5,"2018-12-24 22:51:25",1,3,0
"57963932","The rice bowls are superb in taste and highly recommended. It is soo delicious, and gives homely feeling. Loved the essence and the taste...",5,"2018-12-24 22:39:01",4,0,0
"86786431","Rajma chawal was good to have. Maa ki yaad aa gyi. I really loved the rajma, was thick and when moved with jeera rice, the flavour comes out to be awesome. Definitely recommended. ",5,"2018-12-24 22:31:26",4,0,0
"46451066","Ordered dahi vada and laal badshah, It was worth the price and the taste was fabulous.  I found the taste quite different which was the best part.  Would love to check more items.",4,"2018-12-24 14:21:54",1,15,0
"87045115","Ordered Purani dilli ki thali was worth the try. I was bit skeptical before ordering as the reviews were bad. But it turned out to be amazing. The Delivery was fine but the food was worth the price.♥️",5,"2018-12-24 12:34:43",1,3,0
"76851387","The food was really good especiallly the shahi paneer,dal makhni. To sum it up the veg thali was really good. The biryani was the star. Very good experience. ",4,"2018-12-24 12:23:14",1,0,0
"84138019","Ordered lacchha parantha with Shahi paneer and  it was delicious. The creamy shahi paneer looked tasty and tasted even better.  I was craving for one , and ordering from here works wonder.",5,"2018-12-24 12:16:55",7,1,0
"37379332","If you're looking for a meal to order, this place has nice combos. I ordered veg biryani, which tasted well. Plus every order is delivered hot enough which is a plus point to their service. Also, try chicken biryani if you're a biryani fan.",5,"2018-12-21 14:22:28",2,1,0
"41336942","Just trying something new in the town and saw this one. The food was good and I really like it. Simple and fine. Well packed no new flavours but I think that may not be the goal here. Making the same food and delivering it well is the goal which was very well achieved. All together as food is concerned it is an average once but hygienic and good packaging..",5,"2018-12-20 18:56:04",2,0,0
"52413895","I order jalfrezi thali and it was really good. The flavours of vegetables were really nice and the parantha were super soft. It was delivered hot. ",5,"2018-12-19 11:00:38",18,3,0
"78588273","The thalis are super delicious and it was give me “ghar vale khana” taste. The most important it comes fresh and delivery is also prompt. Good going guys. ",5,"2018-12-19 10:55:55",10,2,0
"39575109","Had ordered a thali. The size and quality of the parantha was very bad. Dal makhani was stale. Won’t advise this restaurant to anyone. Over all it was a lunch spoiler:(",1,"2018-12-09 14:47:31",17,5,0
"1673548","Food was blant and not so tasty with no flavors",2,"2018-11-22 14:42:14",7,55,0
"79952867","I got to know about the YYD recently which is near to my office. So I ordered my lunch from them. I had their Dal Makhani combo. It had a reasonable price and was super delectable.",4,"2018-11-09 22:07:44",9,12,0
"32610669","Ordered Shahi Paneer And Lachha Parathas from here along with the Shikanji, it was just amazing. Definitely going to order again from here. Absolutely relished it👍👍",5,"2018-11-05 18:44:50",15,74,0
"70835992","Last night ordered Dal makhni and laccha parantha from here. Dal makhni was delicious. Food was delivered on time and it was well packed
First experience easy brilliant.",5,"2018-11-05 14:55:22",29,104,0
"36894977","This place serves up some really delicious food. I ordered Kadhai Chicken Roll. It was fully loaded with juicy chicken. Wow what a delicious roll it was!
Will order soon from here!!",5,"2018-11-05 13:57:13",59,2065,0
"31574201","Ordered Kulcha and Dal Makhani with Watermelon juice for lunch.!!😍
Food was good and was fresh when received. Food would give you a feeling of Delhi Street food also.",4,"2018-10-04 19:41:38",31,95,1
"27308275","One of the worst foods i had till now. I ordered chola jeera rice, they accepted it and later called that it was out of stock. I said to send kadai chicken with jeera rice, they said ok.
Then i spoke to the restaurant owner again to confrim the kadai chicken, he too said that he will take the same, but they ended it up sending me paneer with jeera rice.
I am actually feeling embarrassed to give 2 star for this.
Coming to food, they sent me shahi panner where there were hardly 2-3 pieces and it was filled with capsisum.
Probably they should have called shahi capsicum instead of shahi panner, that would suit perfectly.
I think for name sake they kept as jeera rice instead of white rice, one of the worst jeera rice sorry white rice i evar had in my life.
Dont dare to try the food here.
For more details and posts, please visit :
LETSEATHYDERABAD on Instagram.",2,"2018-09-28 23:00:00",109,1806,0
"51793441","taste good",4,"2018-08-02 12:19:18",1,1,0
"31632337","Worst delivery experience.. I waited for 2 hours for my order to be delivered....zomato wasn’t of any help either .. they kept on telling me wait for 10 minutes for 2 hours ",1,"2018-08-01 16:25:10",1,71,0
"54091213","Taste wise not very good. Average taste.",3,"2018-07-29 14:27:38",2,2,0
"30829975","Authentic Taste is lacking, need to work on taste of the food, packaging and combos are amazing!",3,"2018-07-26 14:15:07",6,34,0
"54036592","The food was delivered on time. The taste is very good. I have ordered a combo tali contains two lachha paratha, dal makkani, Sahi Paneer and jeera rice.",5,"2018-07-26 13:16:21",3,1,0
"52467953","the order doesn't delivered on time",1,"2018-07-26 12:33:24",0,2,0
"2430364","Food was really yummy.. ",5,"2018-07-25 21:24:43",0,0,0
"53040288","good",5,"2018-07-21 22:11:18",9,1,0
"39803526","Satisfied my morning cravings for some North Indian food on a boring week off.. ",4,"2018-07-21 11:41:42",2,2,0
"61162106","best north indian food i ever had . the butter chicken was perfectly cooked and dal was very tasty . Yum Yum dilli never fails to surprise me ..",5,"2018-07-17 16:43:57",8,0,0
"60568646","i ordered aloo and gobi prantha and trust me when i say it was amazing . it wasnt oily or under cooked and they way they presented it OH MY GOD.",5,"2018-07-12 12:45:59",10,0,0
"58546103","They are ruining the image of north indian food",2,"2018-07-07 15:08:17",4,0,0
"31781020","Just wow ! No words to describe the food the serve ! The food was delicious and tasty ! The butter chicken was very tasty and nice ! Good place for North Indian food ",5,"2018-07-06 13:19:08",17,2,0
"41138577","If food was life Yum yum dilli is how we are suppose to live . If you love north indian and you are lazy then yum yum dilli is your saviour . Keep up the good work ",5,"2018-07-05 15:16:53",18,8,0
"16081484","Yum yum dilli has wide variety of food . I ordered butter chicken and dal makhani and I loved it . They have awsome packaging . The food was perfect . ",5,"2018-07-05 13:38:09",16,9,0
"30734514","Great place . The food was awesome and delicious . I am in love with the butter chicken . The food quality was nice and the food was delivered to me on time ❤️",5,"2018-07-02 13:40:42",10,62,0
"443420","Taste of Delhi in hyderabad. Had a purani Dilli ki thali. It was wholesome and filling. Dal makhani was superb. Packaging is excellent and food was delivered in 25 minutes. Good stuff",5,"2018-07-02 12:27:47",5,2,0
"52970565","North Indian food at its very best. I love the taste and the quality of the food. The quantity was also good. Thumbs up for yum yum dilli keep up the good work ",5,"2018-07-02 11:58:11",9,5,0
"35775339","jaljeera was missing",1,"2018-06-12 23:03:10",1,36,0
"55991160","good food value for price",4,"2018-06-11 13:53:15",1,1,0
"56939229","Had a great #butter chicken with lachha parantha. You should try it once, tiwice always whenever you are having a party. Chicken was tasty, delivered on time, was hot. ",5,"2018-06-09 10:40:50",2,1,0
"56937227","Ordered one butter chicken rice bowl. Best I ever had, well packed, dilevered well in time, chicken was well prepared ,tasted like some north Indian butter chicken. Good, enough serving in terms of chicken ratio. YumYumDilli!",5,"2018-06-08 23:11:39",2,28,0
"31906531","Only jaljeera was good. We ordered Dal makhani and Lachha parantha. Dal was tasteless. Lachha paranthas were okay. I don't think I'll try their food again. ",2,"2018-06-06 18:26:05",175,571,3
"48343470","Good food. Loved the butter chicken 👌🏻
The chicken was soft and the gravy was so well prepared. The delivery time was also short . Overall a very nice  experience .",5,"2018-06-04 09:51:35",7,1,0
"50863981","I ordered butter chicken with lacha parathas(serve 1).
Taste:
Taste of butter chicken is awesome. Feels like north Indian butter chicken taste.
Taste of lacha paratha is also good.
Quantity:
4-5 small size boneless chicken piece.
3 lacha parathas.
As it is combo type. Sufficient for 1 people.",4,"2018-05-27 13:22:40",30,32,4
"51741486","The salad which was part of the ordered dish wasn't present in the delivery package ",4,"2018-05-26 14:49:25",4,1,0
"55778425","i just loved the packing and alloooo parathas reminded me of delhi's parathe wali gali!! so yummmm!",5,"2018-05-26 13:49:09",1,1,0
"41711189","One of the best places to have nonveg.
my personal fav is butterchicken.
The food is fabulously marinated and added with quality ingredients and spices.I appreciate the food is freshly prepared and served .",5,"2018-05-21 14:30:28",2,1,0
"51828724","Bland",1,"2018-05-11 12:28:47",1,1,0
"31729444","very badly cooked and very spicy ",1,"2018-05-05 10:16:41",2,44,0
"45445077","pathetic food",1,"2018-05-03 19:03:47",3,1,0
"33258699","good",5,"2018-05-03 12:01:23",10,1,0
"52812386","not worth my money",1,"2018-04-23 13:48:10",1,2,0
"51570422","not as described , paneer is taste less , and did not  provide the salad as mentioned ",1,"2018-04-16 09:29:09",2,1,0
"34703386","pathetic food quality...received undercooked food twice....once when I ordered and the second time when they send the food for replacement.....
will never order food from this restaurant again....
n no refund....",1,"2018-04-13 20:45:11",4,3,0
"53237482","Good ",4,"2018-04-12 13:04:58",1,0,0
"23762","Stale smelly chicken. ",1,"2018-04-10 14:45:45",1,123,0
"33556684","Quality of paneer is bad",1,"2018-04-09 08:19:25",9,3,0
"33141821","no butter. Spicy Dalmakhni.",2,"2018-04-08 14:30:40",1,0,0
"44908034","Awesome food great quantity, loved it ",5,"2018-04-05 17:56:18",4,17,0
"2638644","I ordered Egg paratha & lacha paratha. Taste is very bad. Will never order from this restaurant again.",1,"2018-04-04 15:39:55",8,1,0
"40213351","Quantity of the curry was not sufficent enough as shown in the menu.Rotis were extra in quantity than what was shown in the menu.Curries didnt have sufficent gravy in them..Really dissapointed",1,"2018-04-03 22:18:10",1,7,0
"52087944","Gud",4,"2018-04-03 11:22:09",2,2,0
"52246831","curd was quite sour",3,"2018-04-03 10:49:26",2,1,0
"35733175","The delivery serving is pathetic!
I recommend people to stay away from this restaurant as my order was never delivered and at last I had to cancel it.
It showed me 60 minutes to deliver and I kept my patience level stable and when it was 10 minutes to deliver I was expecting a call from the delivery executive as they always call for the location guidance.
I texted Zomato to look into the matter and they got in touch with the restaurant and assured me that the food will be delivered in 10-15 minutes.
I kept calm and waited, little did I know that the delivery executive is about to leave the restaurant after 20 minutes and it was already 40 minutes late.
I waited around 1 hour 45 minutes for my order and these people don’t even care to answer the phone calls, apparently after trying a lot my call was answered by the restaurant and they asked me my last 4 digits of the order number and I provided that and they say sorry sir we don’t see any order from your side.
It crossed all the limits and I lost my patience.
I suggest the management to take the delivery seriously and deliver on time and answer phone calls.",1,"2018-04-02 09:53:01",57,1011,0
"52699966","Didn't reach my expectations",2,"2018-04-01 16:03:36",1,1,0
"47901276","Good ",5,"2018-04-01 12:00:56",4,1,0
"30079212","bad service from both Zomato and rest",1,"2018-03-29 13:09:55",8,4,0
"37703377","delivery was 40 min. late",3,"2018-03-28 14:26:25",2,7,0
"44572020","Poor delivery services ",1,"2018-03-28 13:54:29",2,1,0
"49977011","ordered food is different than delivered, the restaurant is totally unresponsive",1,"2018-03-27 13:06:57",5,1,0
"35459657","Order not delivered , delivery person not able to understand location ",1,"2018-03-24 12:11:24",7,34,0
"35079579","Hard as rock parathas, no curd on pickle included and delivery was well beyond the delivery time - abt 40 mins past scheduled time",1,"2018-03-24 10:18:26",7,20,0
"51793993","Paratha is not that good...chiken is ok",3,"2018-03-23 10:45:08",4,16,0
"30079212","worst food..it was smelly...I ordered something and they gave something else...and when contacted they started telling lies..",1,"2018-03-21 13:09:32",8,4,0
"30907872","The food was stale and the pepper chicken was smelly .and I fell sick after eating the food .would not recommend to anyone ",1,"2018-03-19 22:23:15",4,1,0
"31024059","but the lachha paratha was very thick",3,"2018-03-19 07:49:07",1,0,0
"31731675","very poor .
really pissed off with the food .
prantha are not well cooked.",1,"2018-03-18 15:54:46",4,5,0
"51137604","too late to deliver",2,"2018-03-18 13:04:17",6,0,0
"32712430","There North indian thali is one of the best I had. Amazing dal makhni and superb paneer!! Definitely going to order again👍🏻 The packaging was superb however the delivery took about 40-50 minutes!",4,"2018-03-14 14:29:53",3,0,0
"16118671","Worst ever..PLEASE DON'T GO WITH THIS RESTAURANT to order your meal. This is the worst restaurant I have ever ordered food. Firstly the order came after 2 hours (even after repeatedly calling them) and secondly, I ordered paneer parantha's which didn't have any paneer in them. Paid whole price for only paranthas.",1,"2018-03-09 18:54:04",7,50,0
"31965741","Good packing but we ordered thali with dal makhani and shahi paneer instead, we got chole with Dal Tadka.And unable to contact the restaurant.",1,"2018-03-09 16:01:58",27,35,0
"3087786","I ordered meal, which was delivered after 2 hours. N guess what i received only 1 curry and rice. Isn't that funny?? Nor the zomato suuport was reachable nor the restaurant. Recommend people not to order from here.",1,"2018-03-01 11:43:20",3,206,0
"43644658","Just ordered dinner - dal makhni combo. Dal was  spoilt, smelling bad. rotis were undercooked. Really unfortunate because it looked so good.  Sad way to end a day. ",2,"2018-02-26 22:15:22",3,4,0
"30436522","We ordered paranthas and namkeen lassi. So in the name of paranthas we got fat rotis, no sign of aloo or gobi or anything else for that matter. In the name of namkeen lassi we received jal jeera. Not at all happy with the food.",1,"2018-02-24 20:43:54",27,45,0
